bill_id,term,session,title,summary,approp_bill,commem
SB5328,2023_2024,2023_2024,AN ACT Relating to public safety employees' retirement plan membership for public safety telecommunicators;,Concerning public safety employees' retirement plan membership for public safety telecommunicators.,0,0
SB5329,2023_2024,2023_2024,AN ACT Relating to fees at campuses other than the main campus;,Addressing fees at campuses other than the main campus.,0,0
SB5330,2023_2024,2023_2024,AN ACT Relating to the Washington pesticide application act;,Concerning the Washington pesticide application act.,0,0
SB5331,2023_2024,2023_2024,AN ACT Relating to job search requirements for unemployment insurance benefits;,Concerning job search requirements for unemployment insurance benefits.,0,0
SB5332,2023_2024,2023_2024,AN ACT Relating to prohibiting locating homeless encampments near schools and early learning facilities;,Prohibiting locating homeless encampments near schools and early learning facilities.,0,0
SB5333,2023_2024,2023_2024,AN ACT Relating to creating the state sport special license plate;,Creating the state sport special license plate.,0,1
SB5334,2023_2024,2023_2024,AN ACT Relating to providing a local government option for the funding of essential affordable housing programs;,Providing a local government option for the funding of essential affordable housing programs.,0,0
SB5335,2023_2024,2023_2024,"AN ACT Relating to health care financing and development of the Washington health trust to ensure that all Washington residents can enroll in nonprofit health insurance coverage providing an essential set of health benefits, including medical, dental, vision, and prescription drug benefits;",Developing the Washington health trust.,0,0
ESB5336,2023_2024,2023_2024,AN ACT Relating to population criteria for the main street trust fund tax credit;,Concerning population criteria for the main street trust fund tax credit. (REVISED FOR ENGROSSED: Concerning the main street trust fund tax credit.),0,0
SB5337,2023_2024,2023_2024,AN ACT Relating to exempting the sale and leaseback of property by a seller from the residential landlord-tenant act when the seller agrees to a written lease at closing;,Exempting the sale and leaseback of property by a seller from the residential landlord-tenant act when the seller agrees to a written lease at closing.,0,0
SB5338,2023_2024,2023_2024,AN ACT Relating to a review of the state's essential health benefits;,Reviewing the state's essential health benefits.,0,0
SB5339,2023_2024,2023_2024,AN ACT Relating to providing free school meals for all;,Providing free school meals for all.,0,0
ESB5340,2023_2024,2023_2024,AN ACT Relating to limits on the sale and possession of retail cannabis products;,Regarding limits on the sale and possession of retail cannabis products.,0,0
ESB5341,2023_2024,2023_2024,AN ACT Relating to creating a location-based branding and promotion program for Washington food and agricultural products;,Creating a location-based branding and promotion program for Washington food and agricultural products. (REVISED FOR ENGROSSED: Creating a location-based promotion program for Washington food and agricultural products.),0,0
SB5342,2023_2024,2023_2024,AN ACT Relating to transit agencies' ability to enter into interlocal agreements for procurement;,Concerning transit agencies' ability to enter into interlocal agreements for procurement.,0,0
SB5343,2023_2024,2023_2024,AN ACT Relating to reducing costs and increasing efficiency in school construction through the use of modifiable standard school construction plans;,Reducing costs and increasing efficiency in school construction.,0,0
ESB5344,2023_2024,2023_2024,AN ACT Relating to a public school revolving fund;,Establishing a public school revolving fund. (REVISED FOR ENGROSSED: Establishing a school modernization loan program.),0,0
SB5345,2023_2024,2023_2024,AN ACT Relating to exempting certain public school buildings from the state energy performance standard;,Exempting certain public school buildings from the state energy performance standard.,0,0
SB5346,2023_2024,2023_2024,AN ACT Relating to encouraging the use of student art in school construction;,Encouraging the use of student art in school construction.,0,0
SB5347,2023_2024,2023_2024,AN ACT Relating to access to abstract driving records;,Concerning access to abstract driving records.,0,0
SB5348,2023_2024,2023_2024,AN ACT Relating to warehouse distribution centers;,Concerning warehouse distribution centers.,0,0
SB5349,2023_2024,2023_2024,AN ACT Relating to repealing some postretirement employment restrictions;,Repealing some postretirement employment restrictions.,0,0
SB5350,2023_2024,2023_2024,AN ACT Relating to providing a benefit increase to certain retirees of the public employees' retirement system plan 1 and the teachers' retirement system plan 1;,Providing a benefit increase to certain retirees of the public employees' retirement system plan 1 and the teachers' retirement system plan 1.,0,0
SB5351,2023_2024,2023_2024,"AN ACT Relating to the collection, sharing, and selling of consumer health data;","Addressing the collection, sharing, and selling of consumer health data.",0,0
ESB5352,2023_2024,2023_2024,AN ACT Relating to vehicular pursuits;,Concerning vehicular pursuits.,0,0
SB5353,2023_2024,2023_2024,AN ACT Relating to the voluntary stewardship program;,Concerning the voluntary stewardship program.,0,0
SB5354,2023_2024,2023_2024,AN ACT Relating to aligning social worker licensing requirements with national standards and requirements for other mental health professionals;,Aligning social worker licensing requirements.,0,0
ESB5355,2023_2024,2023_2024,AN ACT Relating to mandating instruction on sex trafficking prevention and identification for students in grades seven through 12;,Mandating instruction on sex trafficking prevention and identification for students in grades seven through 12.,0,0
SB5356,2023_2024,2023_2024,"AN ACT Relating to establishing guidelines for government procurement and use of automated decision systems in order to protect consumers, improve transparency, and create more market predictability;","Establishing guidelines for government procurement and use of automated decision systems in order to protect consumers, improve transparency, and create more market predictability.",0,0
SB5357,2023_2024,2023_2024,AN ACT Relating to establishing limitations on detached accessory dwelling units outside urban growth areas;,Establishing limitations on detached accessory dwelling units outside urban growth areas.,0,0
SB5358,2023_2024,2023_2024,AN ACT Relating to expanding veterans' services and programs;,Expanding veterans' services and programs.,0,0
SB5359,2023_2024,2023_2024,AN ACT Relating to establishing a responsible state spending limit with excess revenues dedicated to property tax relief;,Establishing a responsible state spending limit with excess revenues dedicated to property tax relief.,0,0
SB5360,2023_2024,2023_2024,AN ACT Relating to vehicle combinations that may be operated on public highways;,Concerning vehicle combinations that may be operated on public highways.,0,0
SB5361,2023_2024,2023_2024,AN ACT Relating to incentivizing cities and counties to increase employment of commissioned law enforcement officers;,Incentivizing cities and counties to increase employment of commissioned law enforcement officers.,0,0
SB5362,2023_2024,2023_2024,AN ACT Relating to advancing the due date for the department of ecology's report on the effects of the clean fuels program;,Advancing the due date for the department of ecology's report on the effects of the clean fuels program.,0,0
ESB5363,2023_2024,2023_2024,AN ACT Relating to cannabis retailer advertising;,Concerning cannabis retailer advertising.,0,0
SB5364,2023_2024,2023_2024,AN ACT Relating to increasing housing options through lot splitting;,Increasing housing options through lot splitting.,0,0
SB5365,2023_2024,2023_2024,"AN ACT Relating to the purchase, use, and possession of vapor and tobacco products by minors;",Preventing use of vapor and tobacco products by minors.,0,0
SB5366,2023_2024,2023_2024,AN ACT Relating to preventing utility shutoffs for nonpayment during extreme heat;,Preventing utility shutoffs for nonpayment during extreme heat.,0,0
SB5367,2023_2024,2023_2024,AN ACT Relating to the regulation of products containing THC;,Concerning the regulation of products containing THC.,0,0
SB5368,2023_2024,2023_2024,AN ACT Relating to establishing equitable access to the workers' compensation stay-at-work program by allowing employers to offer off-site light duty return to work opportunities to injured workers;,Expanding access to the workers' compensation stay-at-work program through off-site light duty return to work opportunities.,0,0
SB5369,2023_2024,2023_2024,AN ACT Relating to reassessing standards for polychlorinated biphenyls in consumer products;,Reassessing standards for polychlorinated biphenyls in consumer products.,0,0
SB5370,2023_2024,2023_2024,AN ACT Relating to adult protective services;,Concerning adult protective services.,0,0
SB5371,2023_2024,2023_2024,AN ACT Relating to protecting southern resident orcas from vessels;,Protecting southern resident orcas from vessels.,0,0
SB5372,2023_2024,2023_2024,AN ACT Relating to authorizing the department of natural resources to create and manage a trust land transfer program;,Authorizing the department of natural resources to create and manage a trust land transfer program.,0,0
SB5373,2023_2024,2023_2024,AN ACT Relating to requiring health carriers to reimburse advanced registered nurse practitioners and physician assistants at the same rate as physicians for the same services;,"Requiring equal reimbursement for advanced registered nurse practitioners, physician assistants, and physicians.",0,0
SB5374,2023_2024,2023_2024,AN ACT Relating to the adoption of county critical area ordinances by cities;,Concerning the adoption of county critical area ordinances by cities.,0,0
SB5375,2023_2024,2023_2024,AN ACT Relating to taxation of low-proof beverages;,Concerning taxation of low-proof beverages.,0,0
SB5376,2023_2024,2023_2024,AN ACT Relating to the sale of cannabis waste;,Allowing the sale of cannabis waste.,0,0
SB5377,2023_2024,2023_2024,AN ACT Relating to cannabis license ownership;,Concerning cannabis license ownership.,0,0
SB5378,2023_2024,2023_2024,"AN ACT Relating to requiring voter education within jurisdictions engaged in changing the method of selecting candidates during a primary or removing a primary as the result of employing a single event election process in a general election including a new cause of action, and reversion of the candidate selection processes when necessary;",Concerning voter education.,0,0
SB5379,2023_2024,2023_2024,AN ACT Relating to supporting innovation at associate development organizations;,Supporting innovation at associate development organizations.,0,0
SB5380,2023_2024,2023_2024,AN ACT Relating to clean energy siting;,Concerning clean energy siting.,0,0
SB5381,2023_2024,2023_2024,AN ACT Relating to letters of recommendation or congratulations sent by legislators;,Concerning letters of recommendation or congratulations sent by legislators.,0,0
SB5382,2023_2024,2023_2024,AN ACT Relating to off-duty employment of fish and wildlife officers;,Concerning off-duty employment of fish and wildlife officers.,0,0
SB5383,2023_2024,2023_2024,AN ACT Relating to pedestrians crossing and moving along roadways;,Concerning pedestrians crossing and moving along roadways.,0,0
SB5384,2023_2024,2023_2024,AN ACT Relating to the Walla Walla water 2050 plan;,Concerning the Walla Walla water 2050 plan.,0,0
SB5385,2023_2024,2023_2024,AN ACT Relating to work performed by institutions of higher education;,Concerning work performed by institutions of higher education.,0,0
SB5386,2023_2024,2023_2024,AN ACT Relating to reducing administrative complexity by increasing transparency of revenue flows for activities funded by document recording fees;,Reducing administrative complexity by increasing transparency of revenue flows for activities funded by document recording fees.,0,0
SB5387,2023_2024,2023_2024,AN ACT Relating to homeowner and renter tax relief;,Concerning property tax relief for homeowners and renters.,0,0
SB5388,2023_2024,2023_2024,AN ACT Relating to improving diversity in clinical trials;,Concerning improving diversity in clinical trials.,0,0
SB5389,2023_2024,2023_2024,AN ACT Relating to the practice of optometry;,Concerning the practice of optometry.,0,0
SB5390,2023_2024,2023_2024,AN ACT Relating to establishing a programmatic safe harbor agreement on forestlands;,Establishing a programmatic safe harbor agreement on forestlands.,0,0
SB5391,2023_2024,2023_2024,"AN ACT Relating to the modeling, measurement, and reporting of embodied carbon emission reductions from structural building products in state-funded projects;","Modeling, measurement, and reporting embodied carbon emission reductions from structural building products in state-funded projects.",0,0
SB5392,2023_2024,2023_2024,AN ACT Relating to overpayments for certain matters;,Concerning overpayments for certain matters.,0,0
SB5393,2023_2024,2023_2024,AN ACT Relating to addressing affordability through health care provider contracting;,Addressing affordability through health care provider contracting.,0,0
SB5394,2023_2024,2023_2024,AN ACT Relating to malpractice insurance for international medical graduate supervisors;,Concerning malpractice insurance for international medical graduate supervisors.,0,0
SB5395,2023_2024,2023_2024,"AN ACT Relating to increasing the real estate technology fee dedicated to the maintenance and operation of property tax and real estate excise tax electronic processing, reporting, and revaluation systems;","Increasing the real estate technology fee dedicated to the maintenance and operation of property tax and real estate excise tax electronic processing, reporting, and revaluation systems.",0,0
SB5396,2023_2024,2023_2024,AN ACT Relating to cost sharing for diagnostic and supplemental breast examinations;,Concerning cost sharing for diagnostic and supplemental breast examinations.,0,0
SB5397,2023_2024,2023_2024,"AN ACT Relating to preserving public benefit payments to people in the care of the department of children, youth, and families;","Preserving public benefit payments to people in the care of the department of children, youth, and families.",0,0
SB5398,2023_2024,2023_2024,AN ACT Relating to domestic violence funding allocation;,Concerning domestic violence funding allocation.,0,0
SB5399,2023_2024,2023_2024,AN ACT Relating to future listing right purchase contracts;,Providing for future listing right purchase contracts.,0,0
SB5400,2023_2024,2023_2024,AN ACT Relating to actions by health professions disciplining authorities against license applicants and license holders for providing reproductive health care services or gender affirming treatment;,Concerning actions by health professions disciplining authorities against license applicants and license holders.,0,0
SB5401,2023_2024,2023_2024,AN ACT Relating to modifying the operation of motorcycles on roadways laned for traffic;,Modifying the operation of motorcycles on roadways laned for traffic.,0,0
SB5402,2023_2024,2023_2024,AN ACT Relating to authorizing public transportation benefit areas to become limited authority Washington law enforcement agencies;,Authorizing public transportation benefit areas to become limited authority Washington law enforcement agencies.,0,0
SB5403,2023_2024,2023_2024,AN ACT Relating to establishing school district depreciation subfunds for the purposes of preventative maintenance;,Establishing school district depreciation subfunds for the purposes of preventative maintenance.,0,0
SB5404,2023_2024,2023_2024,AN ACT Relating to increasing cannabis revenue distributions to local governments;,Increasing cannabis revenue distributions to local governments.,0,0
SB5405,2023_2024,2023_2024,AN ACT Relating to modifying the liquor and cannabis board's subpoena authority relating to cannabis investigations;,Modifying the liquor and cannabis board's subpoena authority.,0,0
SB5406,2023_2024,2023_2024,AN ACT Relating to clarifying ambiguities in statutory provisions administered by the department of revenue relating to periodic adjustments;,Clarifying ambiguities in statutory provisions administered by the department of revenue relating to periodic adjustments.,0,0
SB5407,2023_2024,2023_2024,AN ACT Relating to the administration of property taxes;,Concerning the administration of property taxes.,0,0
SB5408,2023_2024,2023_2024,AN ACT Relating to establishing the ninth grade success grant program;,Establishing the ninth grade success grant program.,0,0
SB5409,2023_2024,2023_2024,AN ACT Relating to requiring voter identifier numbers to match driver's license or identicard numbers;,Requiring voter identifier numbers to match driver's license or identicard numbers.,0,0
SB5410,2023_2024,2023_2024,AN ACT Relating to establishing a task force of the geoduck comanagers to identify harvest opportunities to promote tribal treaty rights to geoduck and enhance state geoduck harvest opportunities;,Establishing a task force of the geoduck comanagers to identify harvest opportunities to promote tribal treaty rights to geoduck and enhance state geoduck harvest opportunities.,0,0
SB5411,2023_2024,2023_2024,AN ACT Relating to addressing a shortage of primary care services by increasing the scope of practice of naturopathic physicians;,Increasing the scope of practice of naturopathic physicians.,0,0
SB5412,2023_2024,2023_2024,"AN ACT Relating to reducing local governments' land use permitting workloads, by ensuring objective and timely design review for housing and other land use proposals within cities and counties and allowing proposed housing within urban growth boundaries to rely on environmental reviews completed at the comprehensive planning level;",Reducing local governments' land use permitting workloads.,0,0
SB5413,2023_2024,2023_2024,"AN ACT Relating to housing for essential needs and aged, blind, and disabled assistance programs;","Concerning housing for essential needs and aged, blind, and disabled assistance programs.",0,0
SB5414,2023_2024,2023_2024,AN ACT Relating to providing voters with information regarding elections law violations within the voters' pamphlet;,Providing voters with information regarding elections law violations within the voters' pamphlet.,0,0
SB5415,2023_2024,2023_2024,AN ACT Relating to public defense services for persons committed as not guilty by reason of insanity;,Concerning public defense services for persons committed as not guilty by reason of insanity.,0,0
SB5416,2023_2024,2023_2024,AN ACT Relating to compelling the state building code council to expand residential building code classifications;,Compelling the state building code council to expand residential building code classifications.,0,0
SB5417,2023_2024,2023_2024,AN ACT Relating to protecting the rights of workers exercising their right to refrain from attending meetings or listening to their employer's speech on political or religious matters;,Protecting the rights of workers to refrain from attending meetings or listening to their employer's speech on political or religious matters.,0,0
SB5418,2023_2024,2023_2024,AN ACT Relating to expanding the definition of public work;,Expanding the definition of public work.,0,0
SB5419,2023_2024,2023_2024,AN ACT Relating to removing the requirement that the Washington state institute of public policy conduct an outcome evaluation of case aides who provide short-term relief for certain foster families;,Removing a Washington state institute of public policy outcome evaluation requirement.,0,0
SB5420,2023_2024,2023_2024,AN ACT Relating to participating in insurance plans and contracts by separated plan 2 members of certain retirement systems;,Concerning participating in insurance plans and contracts by separated plan 2 members of certain retirement systems.,0,0
SB5421,2023_2024,2023_2024,AN ACT Relating to exempting benefit enrollment information collected and maintained by the health care authority from public inspection and copying under the public records act;,Exempting benefit enrollment information collected and maintained by the health care authority from public inspection and copying under the public records act.,0,0
SB5422,2023_2024,2023_2024,AN ACT Relating to providing access to behavioral health services to children using licensed clinicians colocated within the school;,Providing access to behavioral health services to children using licensed clinicians colocated within the school.,0,0
SB5423,2023_2024,2023_2024,AN ACT Relating to eligibility for working connections child care benefits for persons participating in registered apprenticeships;,Providing eligibility for working connections child care benefits.,0,0
SB5424,2023_2024,2023_2024,AN ACT Relating to flexible work for general and limited authority Washington peace officers;,Concerning flexible work for general and limited authority Washington peace officers.,0,0
SB5425,2023_2024,2023_2024,AN ACT Relating to fire protection sprinkler system contractors;,Concerning fire protection sprinkler system contractors.,0,0
SB5426,2023_2024,2023_2024,AN ACT Relating to implementing the family connections program;,Implementing the family connections program.,0,0
SB5427,2023_2024,2023_2024,"AN ACT Relating to supporting people who have been targeted or affected by hate crimes and bias incidents by establishing a reporting hotline, tracking hate crimes and bias incidents, and creating a compensation program and assistance fund;",Concerning people who have been targeted or affected by hate crimes and bias incidents.,0,0
SB5428,2023_2024,2023_2024,"AN ACT Relating to modifying state procurement procedures for competitive, sole source, convenience, and emergency goods and services contracts;","Modifying state procurement procedures for competitive, sole source, convenience, and emergency goods and services contracts.",0,0
SB5429,2023_2024,2023_2024,AN ACT Relating to a motor carrier's ability to access restroom facilities required by rules authorized under chapter 49.17 RCW;,Concerning a motor carrier’s ability to access restroom facilities required by rules authorized under chapter 49.17 RCW.,0,0
SB5430,2023_2024,2023_2024,AN ACT Relating to providing support for low-income novice drivers to receive driver training;,Providing support for low-income novice drivers to receive driver training.,0,0
SB5431,2023_2024,2023_2024,AN ACT Relating to requiring and funding the purchase of zero emission school buses;,Requiring and funding the purchase of zero emission school buses.,0,0
SB5432,2023_2024,2023_2024,AN ACT Relating to the privacy of lottery players;,Concerning the privacy of lottery players.,0,0
SB5433,2023_2024,2023_2024,AN ACT Relating to derelict aquatic structures;,Concerning the removal of derelict aquatic structures and restoration of aquatic lands.,0,0
SB5434,2023_2024,2023_2024,AN ACT Relating to the jurisdiction of juvenile court;,Concerning the jurisdiction of juvenile court.,0,0
SB5435,2023_2024,2023_2024,AN ACT Relating to residential rent increases under the residential landlord-tenant act and the manufactured/mobile home landlord-tenant act;,Concerning residential rent increases under the residential landlord-tenant act and the manufactured/mobile home landlord-tenant act.,0,0
SB5436,2023_2024,2023_2024,AN ACT Relating to transfers of firearms to museums and historical societies;,Concerning transfers of firearms to museums and historical societies.,0,0
SB5437,2023_2024,2023_2024,AN ACT Relating to vacancies of the governing body of special purpose districts;,Concerning vacancies of the governing body of special purpose districts.,0,0
SB5438,2023_2024,2023_2024,AN ACT Relating to facilitating supportive relationships with family and significant individuals within the behavioral health system;,Facilitating supportive relationships with family and significant individuals within the behavioral health system.,0,0
SB5439,2023_2024,2023_2024,AN ACT Relating to livestock identification;,Concerning livestock identification.,0,0
SB5440,2023_2024,2023_2024,AN ACT Relating to providing timely competency evaluations and restoration services to persons suffering from behavioral health disorders within the framework of the forensic mental health care system consistent with the requirements agreed to in the Trueblood settlement agreement;,Providing timely competency evaluations and restoration services to persons suffering from behavioral health disorders.,0,0
SB5441,2023_2024,2023_2024,"AN ACT Relating to promoting and supporting the development and adoption of school district curricula that is diverse, equitable, and inclusive;","Promoting the adoption of school district curricula that is diverse, equitable, and inclusive.",0,0
SB5442,2023_2024,2023_2024,AN ACT Relating to enrichment funding for charter public schools;,Providing enrichment funding for charter public schools.,0,0
SB5443,2023_2024,2023_2024,AN ACT Relating to lien priority of mortgages and deeds of trust;,Concerning lien priority of mortgages and deeds of trust.,0,0
SB5444,2023_2024,2023_2024,AN ACT Relating to firearm sensitive places;,Concerning firearm sensitive places.,0,0
SB5445,2023_2024,2023_2024,AN ACT Relating to cost-sharing fairness;,Concerning cost-sharing fairness.,0,0
SB5446,2023_2024,2023_2024,AN ACT Relating to the restoration of local government authority to regulate firearms by adopting ordinances or regulations relating to firearms that are in addition to or more restrictive than the requirements of state law;,Concerning local government authority to regulate firearms.,0,0
