bill_id,term,session,title,summary,approp_bill,commem
HB1703,2023_2024,2023_2024,AN ACT Relating to imposing local property tax levies wholly credited against the state property tax to provide support and services for veterans' assistance and for persons with developmental disabilities or mental health needs;,Imposing local property tax levies wholly credited against the state property tax to provide support and services for veterans' assistance and for persons with developmental disabilities or mental health needs.,0,0
HB1704,2023_2024,2023_2024,AN ACT Relating to reducing the state sales and use tax rate;,Reducing the state sales and use tax rate.,0,0
HB1705,2023_2024,2023_2024,AN ACT Relating to stormwater control facilities and county jurisdiction;,Concerning stormwater control facilities and county jurisdiction.,0,0
HB1706,2023_2024,2023_2024,"AN ACT Relating to the operation, authorization, and permitting of microenterprise home kitchens;","Concerning the operation, authorization, and permitting of microenterprise home kitchens.",0,0
HB1707,2023_2024,2023_2024,AN ACT Relating to bingo conducted by bona fide charitable or nonprofit organizations;,Concerning bingo conducted by bona fide charitable or nonprofit organizations.,0,0
HB1708,2023_2024,2023_2024,AN ACT Relating to requiring each ballot to have a unique serial number that permits a voter to view their voted ballot through an online portal;,Requiring each ballot to have a unique serial number that permits a voter to view their voted ballot through an online portal.,0,0
HB1709,2023_2024,2023_2024,AN ACT Relating to housing programs administered by the department of commerce;,Concerning housing programs administered by the department of commerce.,0,0
HB1710,2023_2024,2023_2024,AN ACT Relating to using COVID-19 relief funding on high quality tutoring and rigorous extended learning programs;,Using COVID-19 relief funding on high quality tutoring and rigorous extended learning programs.,0,0
HB1711,2023_2024,2023_2024,AN ACT Relating to providing a sales and use tax exemption related to internet and telecommunications infrastructure projects involving a federally recognized Indian tribe;,Providing a sales and use tax exemption related to internet and telecommunications infrastructure projects involving a federally recognized Indian tribe.,0,0
HB1712,2023_2024,2023_2024,AN ACT Relating to protecting workers displaced as a result of finfish aquaculture facility closures;,Protecting workers displaced due to finfish aquaculture facility closure.,0,0
HB1713,2023_2024,2023_2024,AN ACT Relating to increasing access to health care services in rural and underserved areas of the state;,Increasing access to health care services in rural and underserved areas of the state.,0,0
EHB1714,2023_2024,2023_2024,AN ACT Relating to allowing school districts to apply for financial literacy education professional development grants for three or fewer school years;,Allowing school districts to apply for financial literacy education professional development grants.,0,0
HB1715,2023_2024,2023_2024,AN ACT Relating to enacting comprehensive protections for victims of domestic violence and other violence involving family members or intimate partners;,Enacting comprehensive protections for victims of domestic violence and other violence involving family members or intimate partners.,0,0
HB1716,2023_2024,2023_2024,AN ACT Relating to supporting employers providing child care assistance to employees by establishing a business and occupation tax credit for businesses and requiring the department of revenue to provide a report to the legislature;,Supporting employers providing child care assistance to employees by establishing a business and occupation tax credit for businesses and requiring the department of revenue to provide a report to the legislature.,0,0
HB1717,2023_2024,2023_2024,AN ACT Relating to supporting innovation at associate development organizations;,Supporting innovation at associate development organizations.,0,0
HB1718,2023_2024,2023_2024,"AN ACT Relating to creating the ""parks Rx"" health and wellness pilot programs;","Creating the ""parks Rx"" health and wellness pilot programs.",0,0
HB1719,2023_2024,2023_2024,AN ACT Relating to modifying the hours of operation for the Interstate 405 express toll lanes and high occupancy vehicle lanes;,Modifying the hours of operation for the Interstate 405 express toll lanes and high occupancy vehicle lanes.,0,0
HB1720,2023_2024,2023_2024,"AN ACT Relating to the protection and restoration of riparian areas through the establishment of a fully voluntary, regionally focused riparian grant program designed to improve the ecological functions of critical riparian management zones;","Concerning the protection and restoration of riparian areas through the establishment of a fully voluntary, regionally focused riparian grant program designed to improve the ecological functions of critical riparian management zones.",0,0
HB1721,2023_2024,2023_2024,AN ACT Relating to skill center class size;,Concerning skill center class size.,0,0
HB1722,2023_2024,2023_2024,AN ACT Relating to compensation for tow truck operators for keeping the public roadways clear;,Addressing compensation for tow truck operators for keeping the public roadways clear.,0,0
HB1723,2023_2024,2023_2024,AN ACT Relating to equity and environmental justice in the growth management act;,Concerning equity and environmental justice in the growth management act.,0,0
HB1724,2023_2024,2023_2024,AN ACT Relating to increasing the trained behavioral health workforce;,Increasing the trained behavioral health workforce.,0,0
HB1725,2023_2024,2023_2024,AN ACT Relating to increased access to insulin for individuals under the age of 21;,Increasing access to insulin for individuals under the age of 21.,0,0
HB1726,2023_2024,2023_2024,AN ACT Relating to the director of fire protection's administration and reimbursement of fire service-related training programs;,Concerning the director of fire protection's administration and reimbursement of fire service-related training programs.,0,0
HB1727,2023_2024,2023_2024,AN ACT Relating to ensuring fairness and consistency for Washington state businesses by leveling the playing field on transaction fees for regulated entities in Washington who process electronic payments;,Ensuring fairness and consistency for Washington state businesses by leveling the playing field on transaction fees.,0,0
HB1728,2023_2024,2023_2024,AN ACT Relating to creating a statewide resiliency program;,Creating a statewide resiliency program.,0,0
HB1729,2023_2024,2023_2024,"AN ACT Relating to creating and expanding tax incentives for the research, development, production, and sale of hydrogen fuel products in Washington state;","Creating and expanding tax incentives for the research, development, production, and sale of hydrogen fuel products in Washington state.",0,0
HB1730,2023_2024,2023_2024,AN ACT Relating to allowing youth ages 18 and older to work in establishments traditionally classified as off-limits to persons under the age of 21 in certain specific and limited circumstances;,Allowing people 18 years of age or older to work in certain 21 year and older establishments.,0,0
HB1731,2023_2024,2023_2024,AN ACT Relating to complimentary liquor by short-term rental operators;,Concerning complimentary liquor by short-term rental operators.,0,0
HB1732,2023_2024,2023_2024,AN ACT Relating to changing the inflation adjustment index for state salary allocations to schools;,Changing the inflation adjustment index for state salary allocations to schools.,0,0
HB1733,2023_2024,2023_2024,AN ACT Relating to degrees in nursing;,Accessing degrees in nursing.,0,0
HB1734,2023_2024,2023_2024,AN ACT Relating to ensuring adequate notice is provided to local communities when the department of social and health services contracts with a housing provider for individuals qualifying for a less restrictive alternative placement;,Providing notice regarding less restrictive alternative placement contracting.,0,0
HB1735,2023_2024,2023_2024,AN ACT Relating to adding net ecological gain as a voluntary element of comprehensive plans adopted under the growth management act;,Adding net ecological gain as a voluntary element of comprehensive plans under the growth management act.,0,0
HB1736,2023_2024,2023_2024,AN ACT Relating to requiring the department of licensing to collect vehicle odometer readings at the time of original vehicle registration and registration renewal;,Requiring the department of licensing to collect vehicle odometer readings at the time of original vehicle registration and registration renewal.,0,0
HB1737,2023_2024,2023_2024,AN ACT Relating to enacting the reconciliation act;,Enacting the reconciliation act.,0,0
HB1738,2023_2024,2023_2024,AN ACT Relating to the state universal communication services program;,Concerning the state universal communication services program.,0,0
HB1739,2023_2024,2023_2024,AN ACT Relating to instruction for child care providers;,Concerning instruction for child care providers.,0,0
HB1740,2023_2024,2023_2024,"AN ACT Relating to eligibility, enrollment, and compensation of small forestland owners volunteering for participation in the forestry riparian easement program;","Concerning eligibility, enrollment, and compensation of small forestland owners volunteering for participation in the forestry riparian easement program.",0,0
HB1741,2023_2024,2023_2024,"AN ACT Relating to increased prototypical school formulas to support student health, well-being, and educational outcomes;","Increasing prototypical school formulas to support student health, well-being, and educational outcomes.",0,0
HB1742,2023_2024,2023_2024,"AN ACT Relating to nontax statutes administered by the department of revenue by modifying provisions of the unclaimed property and business licensing service programs concerning penalty waivers, the department of revenue's express settlement authority, and making technical corrections;",Concerning nontax statutes administered by the department of revenue.,0,0
HB1743,2023_2024,2023_2024,AN ACT Relating to expanding employee ownership;,Concerning employee ownership.,0,0
HB1744,2023_2024,2023_2024,AN ACT Relating to clarifying the responsibilities and accountability for the effective delivery and oversight of public education services to charter school students;,Clarifying the responsibilities and accountability for the effective delivery and oversight of public education services to charter school students.,0,0
HB1745,2023_2024,2023_2024,AN ACT Relating to improving diversity in clinical trials;,Improving diversity in clinical trials.,0,0
HB1746,2023_2024,2023_2024,AN ACT Relating to a state broadband map;,Concerning a state broadband map.,0,0
HB1747,2023_2024,2023_2024,AN ACT Relating to seismic safety in Washington public schools;,Concerning seismic safety in Washington public schools.,0,0
HB1748,2023_2024,2023_2024,"AN ACT Relating to providing enhanced payment to low volume, small rural hospitals;","Providing enhanced payment to low volume, small rural hospitals.",0,0
HB1749,2023_2024,2023_2024,AN ACT Relating to promoting instruction in public schools about the historical and cultural contributions of Filipino Americans;,Promoting instruction in public schools about the historical and cultural contributions of Filipino Americans.,0,0
HB1750,2023_2024,2023_2024,AN ACT Relating to establishing Yori's law to promote education around water safety and drowning prevention;,Promoting water safety education.,0,0
HB1751,2023_2024,2023_2024,AN ACT Relating to siting of sex offender and sexually violent predator facilities;,Concerning siting of sex offender and sexually violent predator facilities.,0,0
HB1752,2023_2024,2023_2024,AN ACT Relating to modifying the application of the annual consumptive quantity calculation to change applications related to certain water rights held by the United States bureau of reclamation;,Modifying the application of the annual consumptive quantity calculation to change applications related to certain water rights held by the United States bureau of reclamation.,0,0
HB1753,2023_2024,2023_2024,AN ACT Relating to changing certain notice provisions in the derelict vessel removal program;,Changing certain notice provisions in the derelict vessel removal program.,0,0
HB1754,2023_2024,2023_2024,"AN ACT Relating to evaluating the performance of the department of children, youth, and families in delivering child welfare services;","Evaluating the performance of the department of children, youth, and families in delivering child welfare services.",0,0
HB1755,2023_2024,2023_2024,AN ACT Relating to establishing the democracy voucher program for contributions to state legislative candidates;,Establishing the democracy voucher program for contributions to state legislative candidates.,0,0
HB1756,2023_2024,2023_2024,"AN ACT Relating to supporting clean energy through tax changes that increase revenue to local governments, schools, and impacted communities;","Supporting clean energy through tax changes that increase revenue to local governments, schools, and impacted communities.",0,0
2EHB1757,2023_2024,2023_2024,AN ACT Relating to providing a sales and use tax remittance to qualified farmers;,Providing a sales and use tax remittance to qualified farmers.,0,0
HB1758,2023_2024,2023_2024,AN ACT Relating to permitting for certain hatchery maintenance activities;,Concerning permitting for certain hatchery maintenance activities.,0,0
HB1759,2023_2024,2023_2024,AN ACT Relating to establishing January of each year as Chinese American month;,Establishing Chinese American month.,0,0
HB1760,2023_2024,2023_2024,"AN ACT Relating to civil actions alleging violation of the right to be free from discrimination because of the presence of any sensory, mental, or physical disability or the use of a trained dog guide or service animal by a person with a disability;","Concerning civil actions alleging violation of the right to be free from discrimination because of the presence of any sensory, mental, or physical disability or the use of a trained dog guide or service animal by a person with a disability.",0,0
HB1761,2023_2024,2023_2024,AN ACT Relating to increasing the personal property tax exemption;,Increasing the personal property tax exemption.,0,0
HB1762,2023_2024,2023_2024,AN ACT Relating to protecting employees of warehouses;,Protecting warehouse employees.,0,0
HB1763,2023_2024,2023_2024,AN ACT Relating to ensuring completion of conditional scholarship obligations and reducing penalties for excusable incomplete obligations;,Ensuring completion of conditional scholarship obligations and reducing penalties for excusable incomplete obligations.,0,0
HB1764,2023_2024,2023_2024,AN ACT Relating to establishing a method of valuing asphalt and aggregate used in public road construction for purposes of taxation;,Establishing a method of valuing asphalt and aggregate used in public road construction for purposes of taxation.,0,0
HB1765,2023_2024,2023_2024,AN ACT Relating to special occasion liquor licenses for not-for-profit societies or organizations;,Concerning special occasion liquor licenses.,0,0
HB1766,2023_2024,2023_2024,AN ACT Relating to the creation of a hope card program;,Creation of a hope card program.,0,0
HB1767,2023_2024,2023_2024,AN ACT Relating to promoting economic development by strengthening the role of the department of commerce in monitoring and providing technical assistance related to federal funding opportunities;,Concerning the role of the department of commerce in monitoring and providing technical assistance related to federal funding opportunities.,0,0
HB1768,2023_2024,2023_2024,AN ACT Relating to exempting certain sales of electricity to qualifying green businesses from the public utilities tax;,Exempting certain sales of electricity to qualifying green businesses from the public utilities tax.,0,0
HB1769,2023_2024,2023_2024,AN ACT Relating to juvenile records;,Concerning juvenile records.,0,0
HB1770,2023_2024,2023_2024,AN ACT Relating to increasing the seriousness level of the crime of unlawful possession of a firearm;,Increasing the seriousness level of the crime of unlawful possession of a firearm.,0,0
HB1771,2023_2024,2023_2024,AN ACT Relating to relocation assistance for tenants of closed or converted manufactured/mobile home parks;,Concerning relocation assistance for tenants of closed or converted manufactured/mobile home parks.,0,0
HB1772,2023_2024,2023_2024,"AN ACT Relating to prohibiting the manufacture, importation, and sale of products that combine alcohol and tetrahydrocannabinol;",Prohibiting products that combine alcohol and tetrahydrocannabinol.,0,0
HB1773,2023_2024,2023_2024,AN ACT Relating to the prohibition of competitor objections to new apprenticeship program applications and approvals;,Prohibiting competitor objections to new apprenticeship programs.,0,0
HB1774,2023_2024,2023_2024,AN ACT Relating to public employee salary surveys;,Concerning public employee salary surveys.,0,0
HB1775,2023_2024,2023_2024,AN ACT Relating to limiting liability for salmon recovery projects performed by regional fisheries enhancement groups;,Limiting liability for salmon recovery projects performed by regional fisheries enhancement groups.,0,0
HB1776,2023_2024,2023_2024,AN ACT Relating to requiring coverage for applied behavior analysis;,Requiring coverage for applied behavior analysis.,0,0
HB1777,2023_2024,2023_2024,AN ACT Relating to authorizing the use of performance-based contracting for energy services and equipment;,Authorizing the use of performance-based contracting for energy services and equipment.,0,0
HB1778,2023_2024,2023_2024,AN ACT Relating to economic resilience planning;,Concerning economic resilience planning.,0,0
HB1779,2023_2024,2023_2024,AN ACT Relating to reducing toxic air pollution that threatens human health;,Reducing toxic air pollution that threatens human health.,0,0
HB1780,2023_2024,2023_2024,AN ACT Relating to addressing unintended consequences of the climate commitment act;,Addressing unintended consequences of the climate commitment act.,0,0
HB1781,2023_2024,2023_2024,AN ACT Relating to modifying boater safety and education requirements;,Modifying boater safety and education requirements.,0,0
EHB1782,2023_2024,2023_2024,AN ACT Relating to the operating and maintenance deficit of the Wahkiakum county ferry;,Addressing the operating and maintenance deficit of the Wahkiakum county ferry.,0,0
HB1783,2023_2024,2023_2024,AN ACT Relating to supporting economic development in distressed areas through hiring of grant writers;,Supporting economic development in distressed areas through hiring of grant writers.,0,0
HB1784,2023_2024,2023_2024,AN ACT Relating to addressing hunger relief;,Concerning hunger relief.,0,0
HB1785,2023_2024,2023_2024,AN ACT Relating to establishing COVID-19 as an occupational disease;,Establishing COVID-19 as an occupational disease.,0,0
HB1786,2023_2024,2023_2024,AN ACT Relating to special use permits for milk product haulers;,Concerning special use permits for milk product haulers.,0,0
HB1787,2023_2024,2023_2024,AN ACT Relating to the planning and implementation of infrastructure to facilitate the transport and delivery of goods;,Concerning the planning and implementation of infrastructure to facilitate the transport and delivery of goods.,0,0
HB1788,2023_2024,2023_2024,AN ACT Relating to greater consistency in the provision of health care services for minors under the age of 17;,Concerning greater consistency in the provision of health care services for minors under the age of 17.,0,0
HB1789,2023_2024,2023_2024,AN ACT Relating to expanding revenue generation and economic opportunities from natural climate solutions and ecosystem services;,Expanding revenue generation and economic opportunities from natural climate solutions and ecosystem services.,0,0
HB1790,2023_2024,2023_2024,AN ACT Relating to expanding and improving the social equity in cannabis program;,Expanding and improving the social equity in cannabis program.,0,0
HB1791,2023_2024,2023_2024,AN ACT Relating to studying the need for increased commercial aviation services;,Studying the need for increased commercial aviation services.,0,0
HB1792,2023_2024,2023_2024,AN ACT Relating to modifying timelines and other initial procedural actions in a water rights adjudication;,Modifying timelines and other initial procedural actions in a water rights adjudication.,0,0
HB1793,2023_2024,2023_2024,AN ACT Relating to funding digital equity by imposing a tax on certain wireless devices;,Funding digital equity by imposing a tax on certain wireless devices.,0,0
HB1794,2023_2024,2023_2024,AN ACT Relating to research and development incentives and growing Washington's economy for the long-term;,Concerning research and development incentives and growing Washington's economy for the long-term.,0,0
HB1795,2023_2024,2023_2024,AN ACT Relating to making the estate tax more progressive;,Making the estate tax more progressive.,0,0
HB1796,2023_2024,2023_2024,AN ACT Relating to property tax exemptions for certain mobile homes and manufactured homes;,Concerning property tax exemptions for certain mobile homes and manufactured homes.,0,0
EHB1797,2023_2024,2023_2024,AN ACT Relating to residential real estate appraisers being allowed to complete real property evaluations;,Concerning residential real estate appraisers being allowed to complete real property evaluations. (REVISED FOR PASSED LEGISLATURE: Concerning real property appraisers.),0,0
HB1798,2023_2024,2023_2024,AN ACT Relating to allowed earned release time for certain offenses and enhancements;,Concerning allowed earned release time for certain offenses and enhancements.,0,0
HB1799,2023_2024,2023_2024,AN ACT Relating to the registration of business entities that qualify as data brokers;,Concerning the registration of business entities that qualify as data brokers.,0,0
HB1800,2023_2024,2023_2024,AN ACT Relating to criminal penalties and restitution for graffiti;,Concerning criminal penalties and restitution for graffiti.,0,0
HB1801,2023_2024,2023_2024,AN ACT Relating to eliminating COVID-19 vaccine requirements for new or prospective employees of state agencies;,Eliminating COVID-19 vaccine requirements for new or prospective employees of state agencies.,0,0
HB1802,2023_2024,2023_2024,"AN ACT Relating to minors in possession of alcohol, cannabis, or controlled substances;","Concerning minors in possession of alcohol, cannabis, or controlled substances.",0,0
HB1803,2023_2024,2023_2024,AN ACT Relating to creating an endorsement to the beer and/or wine specialty shop license;,Creating an endorsement to the beer and/or wine specialty shop license.,0,0
HB1804,2023_2024,2023_2024,"AN ACT Relating to eligibility for participation in the public employees' benefits board for retired or disabled employees of counties, municipalities, and other political subdivisions;","Concerning eligibility for participation in the public employees' benefits board for retired or disabled employees of counties, municipalities, and other political subdivisions.",0,0
HB1805,2023_2024,2023_2024,AN ACT Relating to making robbery in the second degree a most serious offense under certain circumstances;,Making robbery in the second degree a most serious offense under certain circumstances.,0,0
HB1806,2023_2024,2023_2024,AN ACT Relating to an exclave community small business relief program;,Creating an exclave community small business relief program.,0,0
HB1807,2023_2024,2023_2024,AN ACT Relating to speed safety camera systems on state highways;,Concerning speed safety camera systems on state highways.,0,0
HB1808,2023_2024,2023_2024,AN ACT Relating to proceedings to preclude establishment of parentage when a parent alleges that a person committed a sexual assault that resulted in the parent becoming pregnant and subsequently giving birth to a child;,Proceedings to preclude establishment of parentage when a parent alleges that a person committed a sexual assault that resulted in the parent becoming pregnant and subsequently giving birth to a child.,0,0
HB1809,2023_2024,2023_2024,AN ACT Relating to modifying the definition of food and food ingredients to include food required to be cooked by the consumer prior to consumption;,Modifying the definition of food and food ingredients to include food required to be cooked by the consumer prior to consumption.,0,0
HB1810,2023_2024,2023_2024,AN ACT Relating to providing rental assistance to manufactured/mobile home park tenants;,Providing rental assistance to manufactured/mobile home park tenants.,0,0
HB1811,2023_2024,2023_2024,AN ACT Relating to reasonable exceptions to insurance rates for consumers whose credit information is influenced by extraordinary life circumstances;,Concerning reasonable exceptions to insurance rates for consumers whose credit information is influenced by extraordinary life circumstances.,0,0
EHB1812,2023_2024,2023_2024,AN ACT Relating to continuing the business and occupation tax deduction  for federal funds received from a medicaid transformation or demonstration project or medicaid quality improvement program or standard;,Continuing the business and occupation tax deduction  for federal funds received from a medicaid transformation or demonstration project or medicaid quality improvement program or standard.,0,0
HB1813,2023_2024,2023_2024,AN ACT Relating to establishing a moratorium on the siting and use of secure community transition facilities pending recommendations of a joint legislative work group;,Establishing a moratorium on the siting and use of secure community transition facilities.,0,0
