bill_id,term,session,title,long_title,subjects,commem
HB0168,2023_2024,135,Enact Ohio Adult Use Act; levy a tax,"To amend sections 109.572, 2925.02, 2925.03, 2925.04, 2925.11, 2925.12, 2925.14, 2925.36, 2925.38, 3796.01, 3796.02, 3796.03, 3796.032, 3796.05, 3796.06, 3796.061, 3796.07, 3796.08, 3796.09, 3796.10, 3796.11, 3796.12, 3796.13, 3796.14, 3796.15, 3796.16, 3796.17, 3796.18, 3796.19, 3796.20, 3796.21, 3796.22, 3796.23, 3796.24, 3796.27, 3796.28, 3796.29, 3796.30, 4123.34, 4510.17, 4729.24, 4729.75, 4729.772, 4729.80, 4729.84, 4729.85, 4729.86, 4731.30, 4731.301, 4776.01, 5739.01, 5739.02, 5739.021, 5739.023, 5739.026, 5739.21, 5741.01, 5741.02, 5741.021, 5741.022, 5741.023, and 5741.03; to enact sections 2953.40, 3796.32, 3796.35, 3796.99, 4743.11, and 5739.214; and to repeal sections 2925.141, 3796.021, 3796.031, 3796.04, 4729.771, and 4731.302 of the Revised Code to enact the Ohio Adult Use Act and to levy a tax.","Commerce; Crimes, Corrections, and Law Enforcement : Crime and Punishment; Health and Human Services",0
HB0169,2023_2024,135,Regards tanning by minors; physician titles,"To amend sections 4713.50, 4713.51, 4713.64, 4731.14, and 4731.34 of the Revised Code to prohibit the provision of sun lamp tanning services to individuals under age 18 and to make changes regarding the titles that may be used by physicians.",Health and Human Services : Public Health; Occupational Licensing and Regulation,0
HB0170,2023_2024,135,Enact Extreme Risk Protection Order Act,"To amend sections 109.57, 2923.125, 2923.128, 2923.1213, and 2923.13 and to enact sections 2923.26, 2923.27, 2923.28, 2923.29, 2923.30, and 2923.99 of the Revised Code to enact the Extreme Risk Protection Order Act to allow family members, household members, and law enforcement officers to obtain a court order that temporarily restricts a person's access to firearms if that person poses a danger to themselves or others.","Courts and Civil Law : Courts; Crimes, Corrections, and Law Enforcement : Crime and Punishment; Crimes, Corrections, and Law Enforcement : Firearms; Crimes, Corrections, and Law Enforcement : Law Enforcement",0
HB0171,2023_2024,135,Include certain instruction in social studies model curriculum,"To amend section 3301.079 of the Revised Code to include instruction on the migration, experiences, and contributions of a range of communities in the social studies model curriculum.",Education; Education : Primary and Secondary Education,0
HB0172,2023_2024,135,"Regards electronic estate planning, health care documents","To amend sections 147.051, 147.591, 317.32, 1337.11, 1337.12, 1337.22, 1337.25, 1345.01, 2107.01, 2107.03, 2107.07, 2107.17, 2107.24, 2107.27, 2107.29, 2107.30, 2107.31, 2107.33, 2107.60, 2107.63, 2129.05, 2133.01, 2133.02, 5302.22, 5817.01, and 5817.05 and to enact sections 1337.121 and 2107.031 of the Revised Code to expand the laws on wills, declarations or living wills, durable powers of attorney for health care, powers of attorney, and transfer on death designation affidavits by providing for their execution electronically.",Commerce : Consumer Finance; Courts and Civil Law : Wills and Estates; Courts and Civil Law : Courts,0
HB0173,2023_2024,135,Designate May as Older Ohioans Month,"To enact section 5.2410 of the Revised Code to designate the month of May as ""Older Ohioans Month.""",Special Designations,1
HB0174,2023_2024,135,Establish and operate the Ohio Health Care Plan,"To amend section 109.02 and to enact sections 3920.01, 3920.02, 3920.03, 3920.04, 3920.05, 3920.06, 3920.07, 3920.08, 3920.09, 3920.10, 3920.11, 3920.12, 3920.13, 3920.14, 3920.15, 3920.21, 3920.22, 3920.23, 3920.24, 3920.25, 3920.26, 3920.27, 3920.28, 3920.31, 3920.32, and 3920.33 of the Revised Code  to establish and operate the Ohio Health Care Plan to provide universal health care coverage to all Ohio residents.",Commerce : Insurance; Health and Human Services : Health Care; Health and Human Services : Public Health,0
HB0175,2023_2024,135,Enact the Keep Every Home Safe Act,"To amend sections 5502.63, 5747.08, and 5747.98 and to enact sections 2923.1215, 2923.1216, 5502.621, and 5747.74 of the Revised Code to require secure storage of firearms, to authorize an income tax credit for the purchase of firearm storage and locking devices, to name this act the Keep Every Home Safe Act, and to make an appropriation.","Crimes, Corrections, and Law Enforcement; Crimes, Corrections, and Law Enforcement : Firearms; Taxation",0
HB0176,2023_2024,135,Revise the Ohio Carpenters license plate,"To amend sections 4501.21 and 4503.53 of the Revised Code to revise the ""Ohio Carpenters"" license plate.",Special Designations; Transportation : Motor Vehicles; Transportation : Vehicle Registration and Titling,1
HB0177,2023_2024,135,Prohibit certain health insurance cost-sharing practices,To amend section 1751.12 and to enact sections 3923.811 and 3959.21 of the Revised Code to prohibit certain health insurance cost-sharing practices.,Commerce : Insurance; Health and Human Services : Health Care,0
HB0178,2023_2024,135,Enact Creating a Respectful and Open World for Natural Hair Act,"To amend sections 3314.03, 3326.11, and 3328.24 and to enact section 3319.48 of the Revised Code to enact the Creating a Respectful and Open World for Natural Hair (CROWN) Act to prohibit discrimination by a public school against an individual based on hair texture and protective hair styles and to amend the version of section 3314.03 of the Revised Code that is scheduled to take effect January 1, 2025, to continue the changes on and after that effective date.",Commerce : Consumer Finance; Courts and Civil Law : Civil Law; Education; Education : Primary and Secondary Education; Employment; Housing and Real Property; State and Local Government,0
HB0179,2023_2024,135,Regards vicarious liability in tort actions; statutes of repose,To amend section 2305.15 and to enact section 2307.241 of the Revised Code relative to vicarious liability in tort actions and to provide that the tolling of the limitations period during the defendant's absence or concealment does not apply to statutes of repose.,Courts and Civil Law; Courts and Civil Law : Civil Law,0
HB0180,2023_2024,135,"Prohibit municipal, charter county curfew except in certain cases",To enact section 9.09 of the Revised Code to prohibit a municipal corporation or charter county from imposing a curfew except in certain cases.,"Crimes, Corrections, and Law Enforcement : Crime and Punishment; Crimes, Corrections, and Law Enforcement : Law Enforcement; State and Local Government : Local Government",0
HB0181,2023_2024,135,"Regards recorded instruments, powers of attorney, judgment liens","To amend sections 317.13, 317.32, 317.321, 317.36, 1113.13, 1337.04, 2329.02, 4513.61, 4513.62, 4513.63, 4513.64, 4513.66, 4749.01, and 5323.02 and to enact section 5301.234 of the Revised Code to make various changes regarding recorded instruments, powers of attorney, judgment liens, mortgage subrogation, law enforcement towing laws, and state stock banks, and to make an appropriation.",Housing and Real Property; Public Safety; State and Local Government : Local Government; Transportation : Motor Vehicles; Transportation : Vehicle Registration and Titling,0
HB0182,2023_2024,135,Regards precomputed consumer installment loans,"To amend sections 1321.632, 1321.68, and 1321.99 of the Revised Code regarding precomputed consumer installment loan acceleration and conversion, interest rates, refinance charges, and bona fide errors.",Commerce : Consumer Finance; Commerce : Financial Institutions; Occupational Licensing and Regulation,0
HB0183,2023_2024,135,"Regards single-sex bathroom access in schools, universities","To amend sections 3314.03 and 3326.11 and to enact sections 3319.90 and 3345.90 of the Revised Code to enact the Protect All Students Act regarding single-sex bathroom access in primary and secondary schools and institutions of higher education and to amend the version of section 3314.03 of the Revised Code that is scheduled to take effect January 1, 2025, to continue the changes on and after that date.",Education; Education : Higher Education; Education : Primary and Secondary Education,0
HB0184,2023_2024,135,Regards charitable solicitations,"To amend sections 1716.01, 1716.07, 1716.08, 1716.14, and 1716.15 and to enact section 1716.06 of the Revised Code regarding charitable solicitations.",Commerce,0
HB0185,2023_2024,135,Enact the Airspace Protection Act,"To amend sections 4561.01, 4561.021, 4561.05, 4561.06, 4561.08, 4561.09, 4561.11, 4561.12, 4561.14, 4561.15, 4561.31, 4561.32, 4561.33, 4561.34, 4561.341, 4561.35, 4561.36, 4561.37, 4561.38, 4561.39, 4561.99, 4563.01, 4563.03, 4563.031, 4563.032, 4563.04, 4563.05, 4563.06, 4563.07, 4563.08, 4563.09, 4563.10, 4563.11, 4563.12, 4563.13, 4563.16, 4563.18, 4563.20, 4563.21, and 4906.10; to enact section 4561.40; and to repeal section 4561.30 of the Revised Code to make changes to the laws regarding navigable airspace and to name this act the Airspace Protection Act.",State and Local Government; Transportation; Transportation : Air and Rail Transport,0
HB0186,2023_2024,135,Exempt sales of firearm safety devices from sales and use tax,"To amend sections 5739.01, 5739.02, 5739.03, and 5739.17 of the Revised Code to exempt from sales and use tax sales of firearm safety devices.","Crimes, Corrections, and Law Enforcement : Firearms; Taxation",0
HB0187,2023_2024,135,Modify procedures to conduct property tax sales-assessment study,"To amend sections 323.152, 323.153, 323.156, 2506.01, 4503.065, 4503.066, 4503.068, 5713.01, 5713.03, 5715.012, 5715.19, 5715.24, 5715.25, 5715.251, 5715.26, and 5717.01 of the Revised Code to make changes to the law governing real property valuation and tax complaints, to temporarily modify the computation of the homestead exemption, to abate property taxes on certain municipal and community improvement corporation property, to make an appropriation, and to declare an emergency.",Taxation; Courts and Civil Law; Housing and Real Property,0
HB0188,2023_2024,135,Recognize National Nursing Assistants Week,To enact section 5.267 of the Revised Code to recognize Ohio Nursing Assistants Week.,Health and Human Services,1
HB0189,2023_2024,135,Exempt from taxation the sale of certain firearms and ammunition,"To amend sections 107.036, 5739.02, 5747.98, and 5751.98 and to enact sections 122.97, 122.971, 122.972, 122.973, 122.974, and 122.975 of the Revised Code to exempt from the sales and use tax the sale of certain firearms and ammunition and to authorize nonrefundable tax credits for small arms and ammunition manufacturers.","Crimes, Corrections, and Law Enforcement : Firearms; Taxation",0
HB0190,2023_2024,135,Designate Black Maternal Health Week,"To enact section 5.2471 of the Revised Code to designate the week of April 11 to April 17 as ""Black Maternal Health Week.""",Health and Human Services : Public Health; Special Designations : Observances,1
HB0191,2023_2024,135,Revise the law regarding bail,"To amend sections 2743.70, 2903.212, 2903.213, 2907.41, 2919.251, 2937.40, 2949.02, 2949.04, 2949.093, 2953.03, and 2953.09 and to enact section 2937.011 of the Revised Code to make changes regarding bail and to declare an emergency.","Crimes, Corrections, and Law Enforcement",0
HB0192,2023_2024,135,Regards Treasurer of State; electronic payment of taxes,"To amend sections 113.05, 113.11, 113.12, 113.40, 113.41, 113.60, 125.30, 125.901, 126.06, 127.14, 129.06, 129.09, 131.01, 135.01, 135.02, 135.04, 135.05, 135.06, 135.08, 135.10, 135.12, 135.14, 135.142, 135.143, 135.15, 135.182, 135.31, 135.35, 135.45, 135.46, 135.47, 718.01, 1111.04, 1112.12, 1315.54, 1345.01, 1501.10, 1503.05, 1509.07, 1509.225, 1514.04, 1514.05, 1521.061, 1548.06, 1733.04, 1733.24, 1735.03, 2109.37, 2109.372, 2109.44, 3314.50, 3366.05, 3737.945, 3903.73, 3905.32, 3916.01, 3925.26, 4141.241, 4505.06, 4509.101, 4509.45, 4509.62, 4509.63, 4509.65, 4509.67, 4710.03, 4749.01, 4763.13, 5725.17, 5725.22, 5727.25, 5727.31, 5727.311, 5727.42, 5727.47, 5727.53, 5727.81, 5727.811, 5727.82, 5727.83, 5733.022, 5735.03, 5735.062, 5739.031, 5739.032, 5739.07, 5743.05, 5743.051, 5743.15, 5745.03, 5745.04, 5745.041, 5747.059, 5747.07, 5747.072, 5747.42, 5747.44, 5747.451, 5815.26, and 5815.37; to amend, for the purpose of adopting a new section number as indicated in parentheses, section 113.41 (125.903); to enact new sections 135.61, 135.62, 135.63, 135.64, 135.65, and 135.66 and sections 113.22, 135.621, 135.622, 135.623, 135.624, 135.625, 169.053, and 1501.04; and to repeal sections 113.061, 113.07, 129.02, 129.03, 129.08, 129.10, 129.11, 129.12, 129.13, 129.14, 129.15, 129.16, 129.18, 129.19, 129.20, 129.72, 129.73, 129.74, 129.75, 129.76, 135.101, 135.102, 135.103, 135.104, 135.105, 135.106, 135.61, 135.62, 135.63, 135.64, 135.65, 135.66, 135.67, 135.68, 135.69, 135.70, 135.71, 135.72, 135.73, 135.74, 135.75, 135.76, 135.77, 135.771, 135.772, 135.773, 135.774, 135.78, 135.79, 135.791, 135.792, 135.793, 135.794, 135.795, 135.796, 135.81, 135.82, 135.83, 135.84, 135.85, 135.86, 135.87, 135.91, 135.92, 135.93, 135.94, 135.95, 135.96, 135.97, 144.01, 144.02, 144.03, 144.04, 144.05, 144.06, and 144.07 of the Revised Code regarding the Treasurer of State and the electronic payment of taxes.",State and Local Government : State Government; Taxation,0
HB0193,2023_2024,135,Regards biosolid lagoons and biodigestion facilities,"To amend sections 303.21, 303.211, 519.21, 519.211, and 5713.30 and to enact sections 303.215, 519.215, 6111.0311, 6111.452, 6111.453, and 6111.454 of the Revised Code to establish procedures and requirements governing biosolid lagoons and biodigestion facilities, including granting county and township zoning authority over those lagoons and facilities, and to modify the CAUV eligibility requirements for certain land used to produce biofuels.",Agriculture; Agriculture : Fertilizers and Pesticides; Environment and Natural Resources; Environment and Natural Resources : Air and Water Pollution Control; Environment and Natural Resources : Waste Disposal; State and Local Government : Local Government; State and Local Government : State Government; Taxation,0
HB0194,2023_2024,135,Authorize private vendor contract for specialty license plates,"To amend sections 4503.038, 4503.19, and 5502.68 and to enact sections 4503.261 and 4503.262 of the Revised Code to authorize a contract with a private vendor for the issuance of specialty license plates.","Transportation; Transportation : Highways, Roads, and Bridges; Transportation : Motor Vehicles; Transportation : Vehicle Registration and Titling",0
HB0195,2023_2024,135,Create an adaptive mobility dealer license,"To amend sections 4501.01, 4503.44, 4517.01, 4517.02, and 4517.03 and to enact section 4517.041 of the Revised Code to create an adaptive mobility dealer license.",Commerce; Health and Human Services : Mental Health and Disabilities; Occupational Licensing and Regulation; Public Safety; State and Local Government; Transportation; Transportation : Motor Vehicles; Transportation : Vehicle Registration and Titling,0
HB0196,2023_2024,135,Change maximum periods of community control sanctions,"To amend sections 2929.15, 2929.20, 2929.25, 2951.02, and 2951.07 of the Revised Code to change the maximum periods of community control sanctions authorized for felonies and misdemeanors and to modify the confinement sanctions authorized for a technical violation of community control sanction conditions.","Courts and Civil Law : Courts; Crimes, Corrections, and Law Enforcement : Crime and Punishment; Crimes, Corrections, and Law Enforcement : Prisons",0
HB0197,2023_2024,135,Establish community solar pilot and solar development programs,"To amend sections 4928.01 and 4928.02 and to enact sections 1.66, 4934.01, 4934.011, 4934.04, 4934.05, 4934.06, 4934.07, 4934.08, 4934.09, 4934.10, 4934.11, 4934.12, 4934.13, 4934.14, 4934.15, 4934.16, 4934.17, 4934.19, 4934.20, 4934.21, 4934.22, 4934.23, 4934.25, and 4934.27 of the Revised Code to establish the community solar pilot program and the solar development program.",Utilities  : Electric Utilities,0
HB0198,2023_2024,135,Designate Counseling Awareness Month,"To enact section 5.2320 of the Revised Code to designate April as ""Counseling Awareness Month.""",Health and Human Services : Mental Health and Disabilities; Special Designations : Observances,1
HB0199,2023_2024,135,Modify computation of the personal income tax joint filer credit,To amend section 5747.05 of the Revised Code to modify the computation of the personal income tax joint filer credit.,Taxation,0
HB0200,2023_2024,135,Modify tax: income subject to other state pass-through entity tax,"To amend sections 5747.01, 5747.05, 5747.11, and 5747.13 of the Revised Code to modify the income tax treatment of income subject to other states' pass-through entity taxes.",Taxation,0
HB0201,2023_2024,135,Prohibit sale restrictions on motor vehicle based on power source,"To amend sections 4929.16, 4929.161, 4929.162, 4929.163, and 4929.165 and to enact section 3704.20 of the Revised Code to prohibit a state agency, county, or township from restricting the sale or use of a motor vehicle based on the energy source used to power the motor vehicle; to prohibit a state agency from adopting the California emissions standards for motor vehicles; and to change the requirements for natural gas company infrastructure development riders and economic development projects.",Commerce; Environment and Natural Resources; Environment and Natural Resources : Air and Water Pollution Control; Transportation : Motor Vehicles,0
HB0202,2023_2024,135,Designate Specialist Dennis Alan Combs Memorial Highway,"To enact section 5534.644 of the Revised Code to designate a portion of United States Route 62 in Canton as the ""Specialist Dennis Alan Combs Memorial Highway.""",Special Designations; Special Designations : Memorial Highways and Bridges; Transportation,1
HB0203,2023_2024,135,Require private construction project owner timely pay contractors,To amend section 4113.61 of the Revised Code to require owners of private construction projects to timely pay contractors.,Commerce; Courts and Civil Law; Housing and Real Property,0
HB0204,2023_2024,135,Designate Arab American Heritage Month,"To enact section 5.266 of the Revised Code to designate April as ""Arab American Heritage Month.""",Special Designations,1
HB0205,2023_2024,135,Enact the High Hazard Training Certification (HHTC) Act,"To amend sections 121.083 and 121.084 and to enact sections 4145.01, 4145.02, 4145.03, 4145.04, 4145.05, 4145.06, 4145.07, 4145.08, 4145.09, 4145.10, 4145.11, and 4145.12 of the Revised Code to enact the Protect Ohio Workers Act regarding construction services performed under a contract at a stationary source.",Commerce; Employment,0
HB0206,2023_2024,135,Regards public school expulsion for actions dangerous to others,"To amend sections 3313.66, 3313.661, and 3319.324 of the Revised Code with respect to the expulsion of a student from a public school for actions that endanger the health and safety of other students or school employees.",Education; Education : Primary and Secondary Education,0
HB0207,2023_2024,135
","To amend sections 993.01, 3749.01, 3749.02, 3749.03, 3749.04, and 3749.07 and to enact section 993.11 of the Revised Code to designate the regulatory responsibilities regarding special use pools.",Agriculture; Agriculture : Amusement Rides; Health and Human Services : Public Health,0
HB0208,2023_2024,135,Require political party registration to vote in party's primary,"To amend sections 3501.01, 3503.09, 3503.10, 3503.11, 3503.14, 3503.15, 3503.16, 3503.19, 3503.20, 3503.23, 3503.28, 3505.181, 3509.02, 3509.04, 3509.07, 3509.08, 3513.041, 3513.05, 3513.07, 3513.18, 3513.19, 3513.191, 3513.257, 3517.012, 3517.013, and 3599.12; to enact section 3503.071; and to repeal sections 3513.192 and 3513.20 of the Revised Code to require an elector to register as a member of a political party in order to participate in that party's primary election.",Elections,0
HB0209,2023_2024,135,Create Ohio Society Daughters of American Revolution plate,"To amend section 4501.21 and to enact section 4503.766 of the Revised Code to create the ""Ohio Society Daughters of the American Revolution"" license plate.",Public Safety; Special Designations; Transportation; Transportation : Motor Vehicles; Transportation : Vehicle Registration and Titling,1
HB0210,2023_2024,135,Require political party registration to vote in party's primary,"To amend sections 3501.01, 3503.09, 3503.10, 3503.11, 3503.14, 3503.15, 3503.16, 3503.19, 3503.20, 3503.23, 3503.28, 3505.181, 3509.02, 3509.04, 3509.07, 3509.08, 3513.041, 3513.05, 3513.07, 3513.18, 3513.19, 3513.191, 3513.257, 3517.012, 3517.013, and 3599.12; to enact section 3503.071; and to repeal sections 3513.192 and 3513.20 of the Revised Code to require an elector to register as a member of a political party by a certain deadline in order to participate in that party's primary election.",Elections,0
HB0211,2023_2024,135,Enact the Free to Speak Act,To amend section 121.22 of the Revised Code to name this act the Free to Speak Act and to require a public body to permit members of the public to comment or testify about matters of public concern before the public body at its public meeting.,State and Local Government; State and Local Government : Public Officials and Employees; State and Local Government : Public Records,0,"enacting free speech law
HB0212,2023_2024,135,Enact the Ohio Property Protection Act,"To amend sections 319.202, 2105.16, and 5323.02 and to enact section 5301.256 of the Revised Code to prohibit foreign adversaries and certain businesses from owning real property in Ohio and to name this act the Ohio Property Protection Act.",Housing and Real Property,0
HB0213,2023_2024,135,Create Purdue University license plate,"To amend section 4501.21 and to enact section 4503.520 of the Revised Code to create the ""Purdue University"" license plate.",Special Designations; Transportation : Motor Vehicles; Transportation : Vehicle Registration and Titling,1
HB0214,2023_2024,135,Regards public school staff member professional duties,"To amend sections 3314.03, 3326.11, and 3328.24 and to enact sections 3319.614 and 3320.04 of the Revised Code to enact the ""Religious Expression Days"" or ""R.E.D."" Act to require each public school to adopt a policy that reasonably accommodates the sincerely held religious beliefs and practices of students; to require each public school to adopt a policy regarding certain expectations related to the performance of staff member professional duties; and to amend the version of section 3314.03 of the Revised Code that is scheduled to take effect January 1, 2025, to continue the changes on and after that effective date.",Education; Education : Primary and Secondary Education,0
HB0215,2023_2024,135,Modify qualifications of certain county engineers,To amend section 315.02 of the Revised Code to modify the qualifications of county engineers in certain counties.,Elections; State and Local Government : Local Government,0
HB0216,2023_2024,135,Require Dept of Ed develop bullying policy investigation process,"To amend section 3313.666 of the Revised Code to require the Department of Education to develop a process for requesting an investigation of a school's compliance with its policy prohibiting harassment, intimidation, or bullying.",Education; Education : Primary and Secondary Education,0
HB0217,2023_2024,135,"Require trigger locks be attached, provided with firearms sales",To amend section 2923.25 of the Revised Code to require that gun trigger locks be attached and provided with firearms sales by federally licensed firearms dealers.,"Commerce; Crimes, Corrections, and Law Enforcement : Firearms; Crimes, Corrections, and Law Enforcement : Law Enforcement; Crimes, Corrections, and Law Enforcement : Crime and Punishment",0
HB0218,2023_2024,135,Restore local authority to generally regulate firearm conduct,To repeal section 9.68 of the Revised Code to restore local authority to generally regulate firearms-related conduct.,"Crimes, Corrections, and Law Enforcement : Firearms; State and Local Government; State and Local Government : Local Government",0
HB0219,2023_2024,135,Regards the College Credit Plus Program,"To amend sections 3302.03, 3365.03, 3365.04, 3365.05, 3365.07, 3365.071, and 3365.11 and to enact sections 3365.072 and 3365.14 of the Revised Code regarding the College Credit Plus Program.",Education; Education : Higher Education; Education : Primary and Secondary Education,0
HB0220,2023_2024,135,Prohibit certain conversion therapy for minors,"To enact sections 4723.93, 4731.45, 4732.34, 4743.11, 4757.46, and 4758.73 of the Revised Code to prohibit certain licensed health care professionals from engaging in conversion therapy for minor patients.",Health and Human Services : Health Care; Health and Human Services : Mental Health and Disabilities; Occupational Licensing and Regulation,0
HB0221,2023_2024,135,Expand postconviction relief for DNA showing actual innocence,To amend sections 2953.21 and 2953.23 of the Revised Code to expand the availability of postconviction relief based on DNA testing showing actual innocence.,"Courts and Civil Law; Courts and Civil Law : Courts; Crimes, Corrections, and Law Enforcement; Crimes, Corrections, and Law Enforcement : Crime and Punishment",0
HB0222,2023_2024,135,"Create ""Continue Your Story"" specialty license plate","To amend section 4501.21 and to enact section 4503.4912 of the Revised Code to create the ""Continue Your Story"" specialty license plate.",Health and Human Services : Mental Health and Disabilities; Public Safety; Special Designations; Transportation; Transportation : Motor Vehicles; Transportation : Vehicle Registration and Titling,1
