bill_id,term,session,title,long_title,subjects,commem
SB0060,2023_2024,135,License certified mental health assistants,"To amend sections 2305.234, 2305.51, 2925.01, 2925.02, 2925.03, 2925.11, 2925.12, 2925.14, 2925.23, 2925.36, 2925.55, 2925.56, 2929.42, 3701.048, 3701.74, 3709.161, 3715.50, 3715.501, 3715.502, 3715.503, 3715.872, 3719.06, 3719.064, 3719.121, 3719.13, 3719.81, 4729.01, 4729.51, 4731.051, 4731.07, 4731.071, 4731.22, 4731.224, 4731.24, 4731.25, 4731.251, 4734.99, 4743.09, 4765.51, 4769.01, 4776.01, 5123.47, 5164.95, and 5903.12 and to enact sections 4772.01, 4772.02, 4772.03, 4772.04, 4772.041, 4772.05, 4772.06, 4772.07, 4772.08, 4772.081, 4772.082, 4772.09, 4772.091, 4772.092, 4772.10, 4772.11, 4772.12, 4772.13, 4772.14, 4772.15, 4772.19, 4772.20, 4772.201, 4772.202, 4772.203, 4772.21, 4772.22, 4772.23, 4772.24, 4772.25, 4772.26, 4772.27, 4772.28, and 4772.99 of the Revised Code to license certified mental health assistants.",Health and Human Services : Health Care; Health and Human Services : Mental Health and Disabilities; Health and Human Services : Substance Abuse & Addiction; Occupational Licensing and Regulation,0
SB0061,2023_2024,135,Cap cost sharing for prescription insulin drugs,To enact section 3902.63 of the Revised Code to cap cost sharing for prescription insulin drugs.,Commerce : Insurance; Health and Human Services : Health Care,0
SB0062,2023_2024,135,Designate Rutherford B. Hayes Day,"To enact section 5.2316 of the Revised Code to designate October 4 as ""Rutherford B. Hayes Day.""",Special Designations,1
SB0063,2023_2024,135,Require plaintiff in asbestos claim to file specified disclosures,To enact section 2307.931 of the Revised Code to require a plaintiff in a tort action alleging an asbestos claim to file specified disclosures.,Courts and Civil Law; Courts and Civil Law : Civil Law; Health and Human Services,0
SB0064,2023_2024,135,Expand Ohio National Guard Scholarship Program,To amend section 5919.34 of the Revised Code to expand the Ohio National Guard Scholarship Program.,Education; Education : Higher Education; Military and Veterans,0
SB0065,2023_2024,135,Designate Judge Nathaniel R. Jones Day,"To enact section 5.295 of the Revised Code to designate May 13 as ""Judge Nathaniel R. Jones Day.""",Special Designations,1
SB0066,2023_2024,135,Require schools to transmit student's records within 5 days,"To amend sections 3314.03, 3326.11, and 3328.24 and to enact section 3319.324 of the Revised Code to require public and private schools to transmit a transferred student's records within five school days.",Education; Education : Primary and Secondary Education,0
SB0067,2023_2024,135,Regards State Fire Code and Building Code,"To amend section 3737.83 and to enact section 3781.062 of the Revised Code relating to the State Fire Code and Building Code and to amend the version of section 3737.83 of the Revised Code that is scheduled to take effect December 29, 2023, to continue the provisions of this act on and after that effective date.",Commerce; Housing and Real Property : Building and Fire Codes,0
SB0068,2023_2024,135,Regards debt adjusting,"To amend sections 9.45, 2925.01, 4710.01, 4710.02, 4710.03, 4710.04, 4712.01, and 4712.99; to amend, for the purpose of adopting new section numbers as indicated in parentheses, sections 4710.01 (4712.50), 4710.02 (4712.51), 4710.03 (4712.52), and 4710.04 (4712.53); to enact sections 4712.502, 4712.54, and 4712.55; and to repeal section 4710.99 of the Revised Code regarding debt adjusting.",Commerce : Consumer Finance; Occupational Licensing and Regulation,0
SB0069,2023_2024,135,Designate Ohio Doula Awareness Week,To enact section 5.2316 of the Revised Code to designate the week including March 22nd as Ohio Doula Awareness Week.,Special Designations,1
SB0070,2023_2024,135,Designate Hindu Heritage Month,To enact section 5.54 of the Revised Code to designate October as Hindu Heritage Month.,Special Designations,1
SB0071,2023_2024,135,Enact Data Analysis Transparency Archive (DATA) Act,"To amend sections 3503.13, 3503.15, and 3505.31 and to enact sections 111.11, 3503.151, 3503.152, and 3503.153 of the Revised Code to enact the Data Analysis Transparency Archive (DATA) Act to establish the Office of Data Analytics and Archives in the Office of the Secretary of State and to modify requirements for the Statewide Voter Registration Database and other election records.",Elections; State and Local Government : Public Records; State and Local Government : State Government,0
SB0072,2023_2024,135,Require public utilities provide security systems at substations,To enact section 4933.30 of the Revised Code to require public utilities to provide twenty-four hour security systems at substations.,"Crimes, Corrections, and Law Enforcement; Utilities",0
SB0073,2023_2024,135,Enact the Digital Fair Repair Act,"To enact sections 1350.01, 1350.011, 1350.02, 1350.03, 1350.04, and 1350.05 of the Revised Code to enact the Digital Fair Repair Act.",Commerce,0
SB0074,2023_2024,135,Regards Treasurer of State and electronic payment of taxes,"To amend sections 113.05, 113.11, 113.12, 113.40, 113.41, 113.60, 125.30, 125.901, 126.06, 127.14, 129.06, 129.09, 131.01, 135.01, 135.02, 135.04, 135.05, 135.06, 135.08, 135.10, 135.12, 135.14, 135.142, 135.143, 135.15, 135.182, 135.31, 135.35, 135.45, 135.46, 135.47, 718.01, 1111.04, 1112.12, 1315.54, 1345.01, 1501.10, 1503.05, 1509.07, 1509.225, 1514.04, 1514.05, 1521.061, 1548.06, 1733.04, 1733.24, 1735.03, 2109.37, 2109.372, 2109.44, 3314.50, 3366.05, 3737.945, 3903.73, 3905.32, 3916.01, 3925.26, 4141.241, 4505.06, 4509.101, 4509.45, 4509.62, 4509.63, 4509.65, 4509.67, 4710.03, 4749.01, 4763.13, 5725.17, 5725.22, 5727.25, 5727.31, 5727.311, 5727.42, 5727.47, 5727.53, 5727.81, 5727.811, 5727.82, 5727.83, 5733.022, 5735.03, 5735.062, 5739.031, 5739.032, 5739.07, 5743.05, 5743.051, 5743.15, 5745.03, 5745.04, 5745.041, 5747.059, 5747.07, 5747.072, 5747.42, 5747.44, 5747.451, 5815.26, and 5815.37; to amend, for the purpose of adopting a new section number as indicated in parentheses, section 113.41 (125.903); to enact new sections 135.61, 135.62, 135.63, 135.64, 135.65, and 135.66 and sections 113.22, 135.621, 135.622, 135.623, 135.624, 135.625, 169.053, and 1501.04; and to repeal sections 113.061, 113.07, 129.02, 129.03, 129.08, 129.10, 129.11, 129.12, 129.13, 129.14, 129.15, 129.16, 129.18, 129.19, 129.20, 129.72, 129.73, 129.74, 129.75, 129.76, 135.101, 135.102, 135.103, 135.104, 135.105, 135.106, 135.61, 135.62, 135.63, 135.64, 135.65, 135.66, 135.67, 135.68, 135.69, 135.70, 135.71, 135.72, 135.73, 135.74, 135.75, 135.76, 135.77, 135.771, 135.772, 135.773, 135.774, 135.78, 135.79, 135.791, 135.792, 135.793, 135.794, 135.795, 135.796, 135.81, 135.82, 135.83, 135.84, 135.85, 135.86, 135.87, 135.91, 135.92, 135.93, 135.94, 135.95, 135.96, 135.97, 144.01, 144.02, 144.03, 144.04, 144.05, 144.06, and 144.07 of the Revised Code regarding the Treasurer of State and the electronic payment of taxes.",State and Local Government : State Government; Taxation,0
SB0075,2023_2024,135,Regards municipal creation of joint economic development district,To amend section 715.72 of the Revised Code to allow two or more municipalities to create a joint economic development district without involving a township.,Economic Development; State and Local Government : Local Government; Taxation,0
SB0076,2023_2024,135,Levy a tax on certain high-volume landlords,"To amend sections 113.061, 131.02, 319.202, 715.013, 4303.26, 5703.052, 5703.053, 5703.19, 5703.263, 5703.50, 5703.70, 5703.77, 5703.90, 5725.26, and 5751.051 and to enact sections 5747.081, 5755.01, 5755.011, 5755.02, 5755.03, 5755.04, 5755.05, 5755.051, 5755.052, 5755.06, 5755.07, and 5755.99 of the Revised Code to levy a tax on certain high-volume landlords.",Courts and Civil Law : Courts; Housing and Real Property; Housing and Real Property : Real Estate Transactions; Taxation,0
SB0077,2023_2024,135,Regulate the practices of roofing contractors,"To amend sections 4722.01, 4722.03, 4722.06, 4722.07, and 4722.08 and to enact sections 4722.20, 4722.21, 4722.22, 4722.23, 4722.24, and 4722.25 of the Revised Code to regulate the practices of roofing contractors and the terms of their contracts.",Commerce; Housing and Real Property; Occupational Licensing and Regulation,0
SB0078,2023_2024,135,Restore local authority to regulate firearms-related conduct,To repeal section 9.68 of the Revised Code to restore local authority to generally regulate firearms-related conduct.,"Crimes, Corrections, and Law Enforcement; State and Local Government",0
SB0079,2023_2024,135,Regards dropout prevention and recovery community schools,"To amend section 3314.017 and to enact sections 3301.0727, 3314.381, and 3314.382 of the Revised Code regarding dropout prevention and recovery community schools",Education; Education : Primary and Secondary Education,0
SB0080,2023_2024,135,Solicit research on COVID-19 and myocarditis relationship,To solicit research on the relationship between COVID-19 and myocarditis and to make an appropriation.,Health and Human Services : Public Health,0
SB0081,2023_2024,135,Authorize certain nurses to sign hospital patient documents,"To amend sections 3905.471, 4723.021, 4723.06, 4723.28, and 4723.431; to enact new section 4723.35 and sections 4723.351, 4723.436, and 4730.204; and to repeal section 4723.35 of the Revised Code to authorize certain advanced practice registered nurses and physician assistants to sign documents related to psychiatric inpatients; to revise the law governing the Board of Nursing's monitoring of impaired practitioners; and to modify the law governing insurance navigators and to amend the version of section 4723.431 of the Revised Code that is scheduled to take effect on September 30, 2024, to continue the changes to that section on and after that date.",Health and Human Services : Health Care; Occupational Licensing and Regulation,0
SB0082,2023_2024,135,Allow certain retailers to retain a portion of state sales taxes,To amend sections 5739.12 and 5739.99 and to enact section 5739.28 of the Revised Code to allow certain tax-exempt retailers to retain a portion of state sales taxes to fund employment services.,Employment : Workforce Development; Taxation,0
SB0083,2023_2024,135,Enact Ohio Higher Education Enhancement Act,"To amend sections 3335.02, 3337.01, 3339.01, 3341.02, 3343.02, 3344.01, 3345.45, 3350.10, 3352.01, 3356.01, 3359.01, 3361.01, 3362.01, and 3364.01; to enact new section 3333.045 and sections 1715.551, 3345.029, 3345.0216, 3345.0217, 3345.0218, 3345.0219, 3345.382, 3345.451, 3345.452, 3345.453, 3345.454, 3345.455, 3345.456, 3345.591, 3345.80, and 3345.87; and to repeal section 3333.045 of the Revised Code to enact the Ohio Higher Education Enhancement Act regarding the operation of state institutions of higher education, and to revise the Uniform Prudent Management of Institutional Funds Act.",Education; Education : Higher Education,0
SB0084,2023_2024,135,Require emotional intelligence training for peace officers,To amend sections 109.71 and 109.79 and to enact section 109.7411 of the Revised Code to require training on emotional intelligence for peace officers.,"Crimes, Corrections, and Law Enforcement : Law Enforcement",0
SB0085,2023_2024,135,Expand eligibility for county sewer discounted rates,To amend section 6117.02 of the Revised Code to expand eligibility for county sewer discounted rates or charges.,State and Local Government : Local Government; Utilities,0
SB0086,2023_2024,135,Regards surgical smoke,To enact sections 3702.3012 and 3727.25 of the Revised Code regarding surgical smoke.,Health and Human Services : Health Care,0
SB0087,2023_2024,135,Establish the day of each general election as a legal holiday,"To amend sections 1.14, 5.20, 124.19, 325.19, 511.10, 1345.21, 3313.63, and 3319.087 of the Revised Code to establish the day of each general election as a legal holiday for which government employees receive paid leave.",Elections; State and Local Government,0
SB0088,2023_2024,135,Expand offense of aggravated menacing for utility workers,"To amend section 2903.21 of the Revised Code to expand the offense of aggravated menacing to prohibit threatening a utility worker, cable operator worker, or broadband worker with intent to obstruct the operation of a utility.","Crimes, Corrections, and Law Enforcement; Crimes, Corrections, and Law Enforcement : Crime and Punishment; Utilities",0
SB0089,2023_2024,135,Enter the Cosmetology Licensure Compact,To amend section 4713.37 and to enact sections 4713.33 and 4713.331 of the Revised Code to enter into the Cosmetology Licensure Compact.,Occupational Licensing and Regulation,0
SB0090,2023_2024,135,Enter the Social Work Licensure Compact,To enact sections 4757.52 and 4757.521 of the Revised Code to enter into the Social Work Licensure Compact.,Occupational Licensing and Regulation; State and Local Government : State Government,0
SB0091,2023_2024,135,"Regards fraud, waste, and abuse of public funds","To amend sections 4113.52 and 5705.41 of the Revised Code regarding fraud, waste, and abuse of public funds and to prohibit the expenditure of local tax revenues upon a vote of residents or without an appropriation.","Crimes, Corrections, and Law Enforcement : Crime and Punishment; State and Local Government",0
SB0092,2023_2024,135,Allow special election to be held in August for certain purposes,To amend section 3505.10 of the Revised Code to modify the deadline for a political party to certify its nominees for President and Vice-President to the Secretary of State.,Elections,0
SB0093,2023_2024,135,Regards doula services,"To enact sections 4723.89, 4723.90, 5120.658, and 5164.071 of the Revised Code regarding doula services.","Crimes, Corrections, and Law Enforcement : Prisons; Health and Human Services : Health Care; Health and Human Services : Medicaid; Occupational Licensing and Regulation",0
SB0094,2023_2024,135,"Regards the Treasurer of State, recorded instruments, liens, etc.","To amend sections 317.13, 317.32, 317.36, 1113.13, 1317.07, 1337.04, 1901.261, 1907.261, 2303.081, 2303.201, 2329.02, 3735.671, 4301.17, 4301.171, 4303.041, 4303.184, 4399.15, 4505.104, 4505.13, 4511.01, 4513.61, 4513.62, 4513.63, 4513.64, 4513.65, 4513.66, 4513.69, 4517.261, and 5323.02; to enact new section 135.032 and sections 1901.313, 1907.202, 3320.05, 3320.06, 3320.07, 3320.08, 3333.0419, 3333.80, 3333.801, 3345.0210, and 5301.234; and to repeal sections 135.032, 135.321, and 4505.131 of the Revised Code and to amend Sections 381.10, 381.220, 381.525, 381.565, and 413.10 of H.B. 33 of the 135th General Assembly to make various changes regarding recorded instruments, powers of attorney, judgment liens, mortgage subrogation, law enforcement towing laws, state stock banks, liquor control laws, motor vehicle sales and leases, designation of public depositories, community reinvestment areas, motor vehicle certificates of title, and higher education cost and aid disclosure forms; to provide for the electronic filing of pleadings or documents in courts of common pleas except a probate or juvenile court; in municipal courts, and in county courts, to permit an elected clerk to disburse funds for the computerization of the clerk's office without the court's authorization; to permit municipal and county courts to increase the maximum amount of their additional fees from ten dollars to twenty dollars to cover the computerization of the clerk's office; to enact the ""CAMPUS"" Act regarding the prevention of harassment and intimidation at institutions of higher education; to establish campus safety and community programs; to provide additional funding to support responsibilities of the Chancellor of Higher Education related to educator preparation programs and the science of reading; and to make appropriations.",Commerce : Securities; Housing and Real Property : Real Estate Transactions; State and Local Government; State and Local Government : Local Government; State and Local Government : State Government; Transportation,0
SB0095,2023_2024,135,Authorize the operation of remote dispensing pharmacies,"To amend sections 4729.285, 4729.45, and 4729.921 and to enact sections 3959.22 and 4729.554 of the Revised Code related to remote dispensing pharmacies and other changes to the pharmacy law.",Health and Human Services : Health Care; Occupational Licensing and Regulation,0
SB0096,2023_2024,135,Allow employers to post certain labor law notices on internet,"To amend sections 4109.08, 4111.09, 4112.07, 4115.07, 4123.54, 4123.83, and 4167.11 of the Revised Code to allow employers to post certain labor law notices on the internet.",Commerce; Employment; Employment : Workers' Compensation; Public Safety; State and Local Government : Public Officials and Employees,0
SB0097,2023_2024,135,Designate Representative Kris Jordan Memorial Highway,"To enact section 5534.503 of the Revised Code to designate a portion of State Route 36 in Delaware County as the ""Representative Kris Jordan Memorial Highway.""",Special Designations; Special Designations : Memorial Highways and Bridges; Transportation,1
SB0098,2023_2024,135,"Address fraudulent business filings, related documents","To amend sections 109.71, 109.73, 109.75, 109.79, 109.801, 1345.02, 1701.07, 1702.06, 1702.59, 1703.041, 1703.15, 1703.29, 1706.09, 1729.11, 1746.04, 1747.03, 1776.07, 1782.04, 1785.06, 1901.123, 1907.143, 2923.126, 3505.06, 3729.05, 4505.061, 4519.56, 4519.69, 5709.084, and 5709.121 and to enact sections 109.7481, 109.774, 111.242, and 111.243 of the Revised Code to address fraudulent business filings, deceptive mailings, reinstatement of canceled business entities, and addresses of statutory agents, and to make changes regarding property taxation, fire investigator firearms, acting or assigned judge reimbursements, common pleas clerk of court duties, recreational vehicle park and camp operation licenses, and state ballot numbering.",Commerce; Taxation,0
SB0099,2023_2024,135,Enact Sarah's Law regarding seizure action plans,"To amend sections 3313.713, 3314.03, 3326.11, and 3328.24 of the Revised Code to enact Sarah's Law to require public and chartered nonpublic schools to create a seizure action plan for each student with a seizure disorder.",Education : Primary and Secondary Education; Health and Human Services : Health Care,0
SB0100,2023_2024,135,Prohibit installing tracking device or app without consent,To enact section 2903.216 of the Revised Code to generally prohibit a person from knowingly installing a tracking device or application on another person's property without the other person's consent or failing to remove or ensure removal of such a device or application from another person's property if the other person gave consent and subsequently revokes it.,"Crimes, Corrections, and Law Enforcement : Crime and Punishment; Public Safety; Transportation : Motor Vehicles",0
SB0101,2023_2024,135,Abolish death penalty; modify juror challenges in certain cases,"To amend sections 9.07, 120.03, 120.041, 120.06, 120.14, 120.16, 120.18, 120.24, 120.26, 120.28, 120.33, 120.34, 149.43, 149.436, 1901.183, 2152.13, 2152.67, 2301.20, 2307.60, 2317.02, 2701.07, 2743.51, 2901.02, 2909.24, 2929.02, 2929.13, 2929.14, 2929.61, 2930.19, 2937.222, 2941.021, 2941.14, 2941.148, 2941.401, 2941.43, 2941.51, 2945.06, 2945.10, 2945.13, 2945.21, 2945.25, 2945.33, 2945.38, 2949.02, 2949.03, 2953.02, 2953.07, 2953.08, 2953.09, 2953.10, 2953.21, 2953.23, 2953.71, 2953.72, 2953.73, 2953.81, 2967.05, 2967.12, 2967.13, 2967.193, 2967.194, 2971.03, 2971.07, 5120.113, 5120.53, 5120.61, 5139.04, and 5919.16 and to repeal sections 109.97, 120.35, 2725.19, 2929.021, 2929.022, 2929.023, 2929.024, 2929.025, 2929.03, 2929.04, 2929.05, 2929.06, 2945.20, 2947.08, 2949.21, 2949.22, 2949.221, 2949.222, 2949.24, 2949.25, 2949.26, 2949.27, 2949.28, 2949.29, 2949.31, and 2967.08 of the Revised Code to abolish the death penalty and to modify the number of jurors that may be challenged in cases where a defendant may be sentenced to life imprisonment.","Crimes, Corrections, and Law Enforcement; Crimes, Corrections, and Law Enforcement : Crime and Punishment",0
SB0102,2023_2024,135,"Regards public utilities, competitive electric and gas services","To amend sections 4903.083, 4905.491, 4909.04, 4909.05, 4909.052, 4909.06, 4909.15, 4909.156, 4909.18, 4909.19, 4909.42, 4909.43, 4928.01, 4928.08, 4928.14, 4928.141, 4928.144, 4928.148, 4928.17, 4928.20, 4928.23, 4928.231, 4928.232, 4928.54, 4928.542, 4928.64, 4929.161, 4929.163, and 4929.20; to enact new sections 4928.142 and 4928.143 and sections 4903.101, 4905.131, 4905.321, 4905.331, 4909.041, 4909.042, 4909.173, 4909.174, 4909.175, 4909.177, 4909.178, 4909.181, 4909.46, 4928.101, 4928.102, 4928.147, 4928.149, 4928.1410, 4928.171, and 4929.221; and to repeal sections 4928.142, 4928.143, 4928.581, 4928.582, and 4928.583 of the Revised Code regarding public utilities and competitive retail electric and natural gas services.",Utilities; Utilities  : Electric Utilities; Utilities  : Gas Utilities,0
SB0103,2023_2024,135,Regards sales of kratom products,"To amend sections 3715.01, 3715.99, 3717.01, and 3717.99 and to enact sections 3715.026 and 3717.34 of the Revised Code regarding sales of kratom products.","Agriculture; Crimes, Corrections, and Law Enforcement; Crimes, Corrections, and Law Enforcement : Crime and Punishment; Environment and Natural Resources",0
SB0104,2023_2024,135,Regards the College Credit Plus Program,"To amend sections 3302.03, 3314.03, 3326.11, 3365.03, 3365.04, 3365.05, 3365.11, and 3365.15 and to enact sections 3319.90, 3345.90, and 3365.14 of the Revised Code regarding the College Credit Plus Program and to enact the Protect All Students Act regarding single-sex bathroom access in primary and secondary schools and institutions of higher education.",Education; Education : Higher Education; Education : Primary and Secondary Education,0
SB0105,2023_2024,135,Regards ADAMH boards; recovery housing residences,"To amend sections 340.01, 340.02, 340.022, 340.03, 340.032, 340.033, 340.034, 340.035, 340.036, 340.04, 340.30, 5119.01, 5119.36, 5119.363, 5119.48, 5119.61, 5119.90, 5119.99, and 5160.45; to enact sections 5119.39, 5119.391, 5119.392, 5119.393, 5119.394, 5119.395, 5119.396, and 5119.397; and to repeal sections 340.20 and 3720.041 of the Revised Code regarding the composition of boards of alcohol, drug addiction, and mental health services; the authority of the boards; and the requirements for operation of recovery housing residences.",Health and Human Services : Mental Health and Disabilities; Health and Human Services : Substance Abuse & Addiction; State and Local Government : Local Government; Health and Human Services : Medicaid,0
SB0106,2023_2024,135,Regards workers' comp coverage for certain exposure testing,"To amend sections 2929.14, 2941.1414, 4123.026, and 4123.651 of the Revised Code regarding workers' compensation coverage for testing when certain medical professionals are exposed to chemical substances or bodily fluids in the course of employment and regarding medical release forms for workers' compensation claims.",Employment : Workers' Compensation,0
SB0107,2023_2024,135,Create Porsche Club license plate,"To amend section 4501.21 and to enact section 4503.585 of the Revised Code to create the ""Porsche Club"" license plate.","Transportation; Transportation : Highways, Roads, and Bridges; Transportation : Motor Vehicles",0
SB0108,2023_2024,135,Establish and regulate scholars residential centers,To enact section 5103.021 of the Revised Code to establish and regulate scholars residential centers.,Juvenile and Family Law; Juvenile and Family Law : Child Welfare; Juvenile and Family Law : Foster Care,0
SB0109,2023_2024,135,"Regards sex offenses, State Medical Board regulated persons","To amend sections 149.43, 2105.062, 2305.111, 2907.01, 2907.02, 2907.03, 2907.06, 2907.17, 2907.18, 2921.22, 2929.42, 2950.01, 2950.151, 2971.01, 3107.07, 3109.50, 3111.04, 4730.25, 4730.26, 4730.32, 4730.99, 4731.22, 4731.224, 4731.99, 4759.05, 4759.07, 4759.99, 4760.13, 4760.14, 4760.16, 4760.99, 4761.03, 4761.09, 4761.14, 4761.99, 4762.13, 4762.14, 4762.16, 4762.99, 4774.13, 4774.14, 4774.16, 4774.99, 4778.14, 4778.18, and 4778.99 and to enact sections 4731.2210, 4759.14, and 4778.171 of the Revised Code regarding sex offenses and individuals regulated by the State Medical Board and to amend the version of section 2305.111 of the Revised Code that is scheduled to take effect October 12, 2028, to continue the change on and after that date.","Crimes, Corrections, and Law Enforcement; Crimes, Corrections, and Law Enforcement : Crime and Punishment; Crimes, Corrections, and Law Enforcement : Sex Offenses; Health and Human Services : Health Care; Occupational Licensing and Regulation; State and Local Government : Public Records",0
SB0110,2023_2024,135,Designate Sgt. Anthony Kress Vinnedge Memorial Highway,"To enact section 5534.877 of the Revised Code to designate a portion of State Route 129 in Butler County as the ""Sgt. Anthony Kress Vinnedge Memorial Highway.""",Special Designations; Special Designations : Memorial Highways and Bridges; Transportation,1
SB0111,2023_2024,135,Establish Urban Farmer Youth Initiative Pilot Program,"To amend sections 3781.06, 3781.061, and 5713.30 of the Revised Code relating to temporary greenhouses and building codes, to establish the Urban Farmer Youth Initiative Pilot Program, to codify certain property tax requirements for agricultural land, and to make an appropriation.",Agriculture; Education; Education : Higher Education; Education : Primary and Secondary Education; Finance and Appropriations; Housing and Real Property : Building and Fire Codes; Taxation,0
