bill_id,term,session,title,shortTitle,commem
SF0136,2023_2024,2023-RS,AN ACT relating to taxation; decreasing the property tax assessment rate for the all other property class as specified; and providing for an effective date.,Property tax relief-assessment rate reduction,0
SF0137,2023_2024,2023-RS,AN ACT relating to planning and zoning; requiring subdividers to construct and pay costs for perimeter fences as specified; specifying requirements for perimeter fences for subdivisions; specifying financial responsibility for maintaining perimeter fences; requiring the inclusion of perimeter fence information in subdivision permit applications; repealing conflicting provisions; and providing for an effective date.,Subdivisions-fencing requirements,0
SF0138,2023_2024,2023-RS,AN ACT relating to labor and employment; reducing the maximum length of unemployment benefits; renaming the unemployment insurance commission; specifying applicability; providing an appropriation; and providing for an effective date.,Unemployment insurance coverage period and reporting,0
SF0139,2023_2024,2023-RS,AN ACT relating to crimes and offenses; expanding the offense of unlawful use of a credit card to include a charge card and debit card; providing definitions; providing penalties; and providing for an effective date.,Unlawful use of a charge card or debit card,0
SF0140,2023_2024,2023-RS,AN ACT relating to public health and safety; providing for the use of alternative refrigerants as specified; providing for regulations as specified; and providing for an effective date.,Building code requirements-refrigerants,0
SF0141,2023_2024,2023-RS,AN ACT relating to county roads; increasing the county budgeted amount and state matching contribution to the University of Wyoming's transportation technology transfer center program; allocating amounts for gravel county roads; conforming and correcting county and city funding provisions; providing an appropriation; and providing for an effective date.,Transportation technology transfer center program funding,0
SF0142,2023_2024,2023-RS,AN ACT relating to public utilities; providing requirements for the capture and use of carbon dioxide from coal-fired electric generation facilities; requiring public utilities to offer coal-fired electric generation facilities for sale for purposes of carbon capture for enhanced oil and gas recovery; specifying requirements for the sale of byproducts from carbon dioxide streams; specifying purposes; seeking to identify already incurred liabilities for decommissioning and cleanup of coal-fired electric generation facilities as specified; specifying intent for the reduction of waste of carbon dioxide; providing penalties for violations; providing definitions; making conforming amendments; requiring rulemaking; requiring studies; requiring reports; specifying applicability; and providing for an effective date.,Carbon capture and sequestration,0
SF0143,2023_2024,2023-RS,AN ACT relating to education; creating the Wyoming Freedom Scholarship Act; authorizing education savings accounts; specifying legal proceedings; creating an account; providing for a transfer of funds to the account; providing for the use and administration of education savings accounts for education; providing powers and duties of the state treasurer; providing rulemaking authority; specifying that a qualified school is not an agent of the state or federal government; establishing an oversight committee; making conforming amendments; authorizing a temporary committee as specified; providing an appropriation; and providing for effective dates.,Wyoming freedom scholarship act-2,0
SF0144,2023_2024,2023-RS,AN ACT relating to public health and safety; prohibiting physicians from performing procedures for children related to gender transitioning and gender reassignment; providing an exception; providing that gender transitioning and reassignment procedures are grounds for suspension or revocation of a physician's or health care provider's license; prohibiting insurance coverage for children for gender transitioning and reassignment procedures; providing definitions; specifying applicability; requiring rulemaking; and providing for effective dates.,Chloe's law-children gender change prohibition,0
SF0145,2023_2024,2023-RS,"AN ACT relating to public funds; repealing accounts and subaccounts as specified; amending appropriations, loan authority, distributions and transfers of funds as specified; amending local government audit withholding requirements; modifying the distribution of revenues as specified; authorizing specified state permanent fund reserve accounts to maintain larger balances; requiring certifications before specified investment activities; providing for the transfer of funds to specified reserve accounts; requiring the repayment of transferred funds as specified; providing that balances in specified reserve accounts are intended to be inviolate; removing encumbrances on specified reserve accounts; repealing a guarantee for the school foundation program account; defining legislative intent for future appropriations and budget requests; providing legislative findings; providing for the transfer from and reversion of funds to the repealed accounts and subaccounts; making conforming amendments; repealing obsolete language; requiring reports; and providing for effective dates.",State budgeting and reserves,0
SF0146,2023_2024,2023-RS,AN ACT relating to state funded capital construction; creating accounts; authorizing the inclusion of construction contract provisions related to inflation; providing definitions; providing appropriations for purposes related to state funded capital construction; providing for capital construction grants for purposes of economic development; making appropriations subject to terms and conditions as specified; providing matching funds for specified projects; authorizing the expenditure of prior appropriations as specified; providing for the reversion of funds; creating a task force; authorizing the purchase of land for future construction; providing for interfund borrowing; providing for reports; and providing for an effective date.,State funded capital construction,0
SF0147,2023_2024,2023-RS,AN ACT relating to public works and contracts; prohibiting governmental entities from including specified terms related to labor organization agreements in construction related contracts and grants; providing exemptions; and providing for an effective date.,Government contracts-labor organization,0
SF0148,2023_2024,2023-RS,AN ACT relating to weapons; clarifying the applicability of the preemption of firearms regulation by the state as specified; and providing for an effective date.,Preemption of local firearms regulation,0
SF0149,2023_2024,2023-RS,AN ACT relating to weapons; authorizing and providing for the issuance of an enhanced concealed carry permit as specified; requiring notification to other states; requiring rulemaking; and providing for effective dates.,Enhanced concealed carry permit for improved reciprocity,0
SF0150,2023_2024,2023-RS,AN ACT relating to weapons; allowing for concealed carry on the grounds of the state capitol as specified; providing that a section is contingent upon passage of a separate bill; and providing for effective dates.,Capitol carry,0
SF0151,2023_2024,2023-RS,AN ACT relating to the insurance code; prohibiting specified actions by pharmacy benefit managers; allowing individuals to choose in network retail pharmacies as specified; providing definitions; excluding certain claims as specified; amending a definition; requiring pharmacy benefit managers to provide contact information as specified; amending the process for when a maximum allowable cost appeal is denied; requiring pharmacy benefit managers to allow pharmacies to file appeals in electronic batch formats; requiring pharmacy benefit managers to reimburse pharmacies as specified; authorizing pharmacies to decline to provide pharmacy services as specified; making conforming amendments; requiring rulemaking; providing appropriations; and providing for effective dates.,Wyoming prescription drug transparency act,0
SF0152,2023_2024,2023-RS,AN ACT relating to criminal history records; clarifying that criminal history record information shall be disseminated to the board of occupational therapy as specified; and providing for an effective date.,Occupational therapist criminal history,0
SF0153,2023_2024,2023-RS,AN ACT relating to elections; requiring post-election ballot audits; changing the time absentee ballots may be distributed to applicants before the election; requiring that electronic voting systems have an air gap; providing that election records and returns be transported in a sealed and locked container as specified; providing definitions; providing an appropriation; and providing for an effective date.,Election security,0
SF0154,2023_2024,2023-RS,AN ACT relating to the Wyoming energy authority; amending the purposes of the Wyoming energy authority to include the construction and expansion of oil and gas refineries in Wyoming; specifying that the energy authority may finance refinery projects in Wyoming as specified; and providing for an effective date.,Energy authority project financing-refineries,0
SF0155,2023_2024,2023-RS,AN ACT relating to school finance; restricting expenditure of funds generated by the education resource block grant model for teacher resources as specified; requiring data collection; requiring reporting; requiring a study; and providing for an effective date.,Education-teacher resources,0
SF0156,2023_2024,2023-RS,AN ACT relating to oil and gas; specifying that oil and gas operators must negotiate with mineral owners in good faith; and providing for an effective date.,Oil and gas forced pooling-good faith negotiations,0
SF0157,2023_2024,2023-RS,AN ACT relating to weed and pest control; clarifying that the Eastern Shoshone and Northern Arapaho tribes may apply for participation in specified emergency insect management programs; requiring coordination with weed and pest control districts for emergency programs; and providing for an effective date.,Weed and pest mitigation-tribal inclusion-2,0
SF0158,2023_2024,2023-RS,AN ACT relating to public employees; increasing employee and employer contributions in the public employee retirement plan; requiring the increased employee contributions to be paid through a reduction in cash salary of the employee as specified; removing archaic language; providing appropriations; and providing for an effective date.,Public employee retirement plan-contributions,0
SF0159,2023_2024,2023-RS,AN ACT relating to the administration of government; requiring parties to state contracts to certify that they do not engage in boycotting or discrimination as specified; providing definitions; providing legislative findings; specifying applicability; and providing for an effective date.,Stop ESG-Eliminate economic boycott act,0
SF0160,2023_2024,2023-RS,AN ACT relating to highways; creating a highway tolling program; granting powers to the transportation commission; defining duties of the transportation commission and the department of transportation; granting tolling authority for Interstate 80; providing for the review of tolling plans; creating an account; granting bonding authority; requiring accounting and reporting; authorizing loans from the state highway fund; providing rulemaking authority; allowing assistance between state agencies; and providing for an effective date.,Tolling authority for I-80,0
SF0161,2023_2024,2023-RS,AN ACT relating to domestic relations; providing findings; repealing a statute authorizing the establishment of grandparents' visitation rights; making conforming amendments; specifying applicability; and providing for an effective date.,Parental rights-repealing conflicting statute,0
SF0162,2023_2024,2023-RS,AN ACT relating to education; requiring state and county health officers to grant waivers to immunization requirements for K-12 students upon request; requiring state and county health officers to grant mask mandate waivers for K-12 students upon request; and providing for an effective date.,Grace Smith Medical Freedom Act,0
SF0163,2023_2024,2023-RS,AN ACT relating to elections; providing that an elector shall declare or change political party affiliation prior to the first day on which primary election nomination applications may be filed; and providing for an effective date.,Election integrity-primary elections,0
SF0164,2023_2024,2023-RS,AN ACT relating to cities and towns; amending requirements for contracts for public improvements for municipalities; amending requirements for the purchase or trade of property by cities and towns; amending the guarantees required for public improvement contracts; specifying applicability; and providing for an effective date.,Public improvement contract requirements-amendments,0
SF0165,2023_2024,2023-RS,AN ACT relating to education; authorizing the department of education to contract with a telehealth counseling provider to offer services to public school students; requiring reporting; requiring confidentiality; providing an appropriation; and providing for an effective date.,Mental health telehealth pilot program,0
SF0166,2023_2024,2023-RS,AN ACT relating to the administration of government; providing legislative findings; providing an appropriation for the purpose of constructing a border wall along the southwest land border as specified; providing an appropriation to aid other states in transporting non-citizens of the United States to sanctuary cities located in other states; and providing for an effective date.,Border wall and sanctuary city transport,0
SF0167,2023_2024,2023-RS,AN ACT relating to domestic violence protection; authorizing parties to remotely attend hearings for orders of protection as specified; and providing for an effective date.,Domestic violence protection hearings-remote appearance,0
SF0168,2023_2024,2023-RS,AN ACT relating to certification of teachers; modifying the duties of the professional teaching standards board; creating an alternative teacher certificate for K-12 teachers; establishing requirements for alternative certification; and providing for an effective date.,Alternative teaching certificate,0
SF0169,2023_2024,2023-RS,AN ACT relating to the administration of government; creating the state shooting complex development and oversight task force; providing duties of the task force; requiring reports; creating the state shooting complex account; providing appropriations; and providing for an effective date.,State shooting complex task force,0
SF0170,2023_2024,2023-RS,AN ACT relating to water; specifying the storage of water for drought contingency and compact compliance as an additional beneficial use of water; providing conforming amendments; and providing for an effective date.,Specifying additional beneficial uses of water,0
SF0171,2023_2024,2023-RS,"AN ACT relating to banks, banking and finance; providing legislative findings; prohibiting disclosure or use of protected information relating to firearms and ammunition sales as specified; prohibiting discrimination related to firearm sales codes as specified; providing exceptions; providing requirements for disclosure; authorizing civil actions; providing definitions; and providing for an effective date.",Wyoming second amendment financial privacy act,0
SF0172,2023_2024,2023-RS,"AN ACT relating to the administration of government; specifying requirements for the hiring and retention of investment managers, trustees and fiduciaries who invest state funds as specified; specifying proxy voting requirements for investment managers, trustees and fiduciaries who invest state funds; providing definitions; making conforming amendments; specifying applicability; and providing for an effective date.",Stop ESG-State funds fiduciary duty act,0
SF0173,2023_2024,2023-RS,"AN ACT relating to banks, banking and finance; modifying requirements for approval of applications for proposed financial institutions with similar names to existing financial institutions; and providing for an effective date.",Financial institutions-similar names,0
SF0174,2023_2024,2023-RS,AN ACT relating to charter schools; creating the Wyoming charter school authorizing board; modifying the duties of the state superintendent of public instruction; defining terms; revising the process for approval and renewal of charter schools; modifying the requirements for the operation of converted charter schools; modifying funding of charter schools; making conforming amendments; repealing provisions; requiring reporting; and providing for an effective date.,Wyoming charter school authorizing board,0
SF0175,2023_2024,2023-RS,"AN ACT relating to education; requiring school districts to adopt a policy on hazing in addition to policies on harassment, intimidation or bullying; requiring the University of Wyoming and the community colleges to adopt policies on hazing; and providing for an effective date.",Hazing,0
SF0176,2023_2024,2023-RS,"AN ACT relating to counties; authorizing two (2) or more existing solid waste disposal districts to consolidate; specifying procedures, terms and conditions for the consolidation of solid waste disposal districts; making conforming amendments; and providing for an effective date.",Solid waste disposal districts-consolidation,0
SF0177,2023_2024,2023-RS,AN ACT relating to crimes and offenses; repealing an educational and library exception to the offense of promoting obscenity; and providing for an effective date.,Promoting obscenity-educational exception repeal,0
SF0178,2023_2024,2023-RS,"AN ACT relating to game and fish; providing for mountain lion pursuit seasons; providing for a special management permit for a mountain lion pursuit as specified; specifying the use of dogs to hunt, kill or pursue mountain lions; providing a penalty; requiring rulemaking; and providing for effective dates.",Mountain lion pursuit seasons,0
SF0179,2023_2024,2023-RS,AN ACT relating to the protection of constitutional rights; making legislative findings; declaring legislative authority; prohibiting the implementation or enforcement of a red flag gun seizure; preempting local law; providing definitions; providing for a civil action; providing a penalty; waiving sovereign immunity; authorizing attorney's fees; authorizing the attorney general to initiate a civil action; and providing for an effective date.,Anti-red flag gun seizure act,0
SF0180,2023_2024,2023-RS,AN ACT relating to crimes and offenses; providing an exception to the offenses of criminal trespass and game and fish trespass regarding incidental contact associated with crossing two (2) adjacent parcels as specified; and providing for an effective date.,Corner crossing-trespass exception,0
SF0181,2023_2024,2023-RS,AN ACT relating to crimes and offenses; amending the offense of drug-induced homicide as specified; and providing for an effective date.,Drug induced homicide,0
SF0182,2023_2024,2023-RS,AN ACT relating to the University of Wyoming; creating the Wyoming firearms research center oversight commission; specifying membership and duties of the commission; providing appropriations; and providing for an effective date.,Wyoming firearms research center oversight commission-2,0
SF0183,2023_2024,2023-RS,AN ACT relating to crimes and offenses; amending the crime of strangulation of a household member as specified; and providing for an effective date.,Strangulation of a household  member-amendments,0
HB0001,2023_2024,2024-RS,"AN ACT to make appropriations for the fiscal biennium commencing July 1, 2024 and ending June 30, 2026; providing definitions; providing for appropriations and transfers of funds for the period of the budget and for the remainder of the current biennium ending June 30, 2024 as specified; providing for carryover of certain funds beyond the biennium as specified; providing for employee positions as specified; providing for duties, terms and conditions and other requirements relating to appropriations for the remainder of the current biennium ending June 30, 2024 and the period of the budget as specified; providing for position and other budgetary limitations; authorizing rulemaking; authorizing a charter school; providing appropriations for purposes related to state funded capital construction; creating accounts; amending existing law by redirecting revenues for the period of the budget; making conforming amendments; amending and repealing prior appropriations; providing for reports related to appropriations; continuing an account; amending and repealing prior appropriations of COVID-19 relief funds; specifying conditions on the appropriation and expenditure of COVID-19 relief funds; and providing for effective dates.",General government appropriations,0
HB0002,2023_2024,2024-RS,AN ACT relating to game and fish; increasing nonresident fishing license fees; and providing for an effective date.,Nonresident fishing license fee increase,0
HB0003,2023_2024,2024-RS,AN ACT relating to taxation; establishing a tax exemption for long-term homeowners; providing a penalty for false claims; providing a sunset date; and providing for an effective date.,Property tax exemption for long-term homeowners,0
HB0004,2023_2024,2024-RS,AN ACT relating to property tax; amending qualifications for the property tax refund program; amending qualifications for the county optional property tax refund program; amending the maximum refund under the property tax refund program; requiring audits; providing appropriations; and providing for an effective date.,Property tax refund program,0
HB0005,2023_2024,2024-RS,AN ACT relating to public health and safety; requiring the department of health to pay behavioral health services claims as specified; requiring the department of health to collect information regarding payment of behavioral health services claims; requiring a report; amending definitions; providing a sunset date; and providing for an effective date.,Behavioral health redesign amendments,0
HB0006,2023_2024,2024-RS,AN ACT relating to highways; creating a penalty for violating signs and markers for closures to light and high profile vehicles; requiring fines imposed to be paid by the driver of the vehicle at the time of the violation; specifying that a violation of a closure to light and high profile vehicles disqualifies a person from driving a commercial vehicle as specified; providing that a violation of a closure to light and high profile vehicles may result in a mandatory revocation or suspension of a license or nonresident operating privilege as specified; and providing for an effective date.,Light and high profile vehicle closures,0
HB0007,2023_2024,2024-RS,AN ACT relating to taxation and revenue; amending the collection of and process for alternative fuel taxes; providing a per kilowatt hour license tax on electricity used to propel an electric vehicle; amending the taxation method for alternative fuel tax; amending and providing definitions; imposing an annual decal fee for plug-in hybrid vehicles; making conforming amendments; repealing obsolete provisions; requiring rulemaking; and providing for effective dates.,Alternative fuel tax-electricity amendments,0
HB0008,2023_2024,2024-RS,AN ACT relating to motor vehicles; specifying that a driver who has attained eighteen (18) years of age may receive a hazardous materials endorsement for a commercial driver's license; requiring rulemaking; and providing for effective dates.,Commercial driver license-hazardous materials endorsement,0
HB0009,2023_2024,2024-RS,AN ACT relating to taxation and revenue; amending the deadline for providing fuel tax return and license information when requested by the department of transportation; specifying applicability; and providing for an effective date.,Fuel tax-licensee information deadline,0
HB0010,2023_2024,2024-RS,AN ACT relating to state lands; authorizing the director of the office of state lands and investments to grant state land lessees additional time to renew their leases; and providing for an effective date.,Grace period-state land lease renewals,0
HB0011,2023_2024,2024-RS,AN ACT relating to state lands; removing specific types of payments for land lease payments; amending the process for how state land lease payments are made; providing that state land lease renewals and rental payments are considered filed on the date the renewal or rental is postmarked; and providing for an effective date.,State land lease amendments,0
HB0012,2023_2024,2024-RS,"AN ACT relating to agriculture, livestock and other animals; repealing the Wyoming Dairy Marketing Act of 1971; and providing for an effective date.",Wyoming dairy marketing act-repeal,0
HB0013,2023_2024,2024-RS,AN ACT relating to public health and safety; exempting flow-through pools from the public pool and spa health and safety act; providing definitions; and providing for an effective date.,Flow-through pools-exemption,0
HB0014,2023_2024,2024-RS,AN ACT relating to the insurance code; requiring health insurers and contracted utilization review entities to follow prior authorization regulations as specified; providing definitions; requiring rulemaking; and providing for effective dates.,Prior authorization regulations,0
HB0015,2023_2024,2024-RS,AN ACT relating to health insurance; specifying a time limit to seek reimbursement for health insurance overpayments; and providing for an effective date.,Health insurance-reimbursement of overpayments,0
HB0016,2023_2024,2024-RS,AN ACT relating to state lands; removing an inconsistent legal description of the Sutton state archaeological site; and providing for an effective date.,Sutton state archaeological site-legal description,0
