bill_id,term,session,title,shortTitle,commem
HB0149,2023_2024,2024-RS,AN ACT relating to motor vehicles; increasing penalties for failing to stop where an accident involves serious bodily injury or death; adding a knowledge requirement for specified failing to stop offenses; providing clarifying amendments; providing definitions; specifying applicability; and providing for an effective date.,Hit and run-responsibility and penalties,0
HB0150,2023_2024,2024-RS,AN ACT relating to public health and safety; requiring rules enacted during public health emergencies to provide exemptions for religious assembly as specified; providing for enforcement and remedies; authorizing a cause of action; providing exceptions to the Wyoming Governmental Claims Act; and providing for an effective date.,Protecting religious assembly in states of emergency act,0
HB0151,2023_2024,2024-RS,AN ACT relating to consumer protection; prohibiting records and discrimination based on a firearms code as specified; providing definitions; providing for enforcement; specifying applicability; and providing for an effective date.,Firearms merchant category code-prohibition,0
HB0152,2023_2024,2024-RS,AN ACT relating to crimes and offenses; prohibiting sex offenders from accessing or residing near child care facilities as specified; providing exceptions; providing a definition; and providing for an effective date.,Sex offenders-child care facilities,0
HB0153,2023_2024,2024-RS,AN ACT relating to criminal procedure; prohibiting specified sex offenders from eligibility for relief from registration; specifying applicability; and providing for an effective date.,Sex offender registration requirements,0
HB0154,2023_2024,2024-RS,AN ACT relating to trade and commerce; amending the Wyoming Consumer Rental-Purchase Agreement Act as specified; amending licensing requirements; providing for digital agreements; providing definitions; providing limitations; allowing for the inspection of records; requiring rulemaking; and providing for effective dates.,Consumer Rental Purchase Agreement Act-amendments,0
HB0155,2023_2024,2024-RS,AN ACT relating to safety for a newborn child; providing grants for safe haven providers to purchase newborn safety devices as specified; providing a definition; requiring rulemaking; providing an appropriation; and providing for effective dates.,Newborn safety device funding for safe haven providers,0
HB0156,2023_2024,2024-RS,AN ACT relating to children; establishing a conclusive presumption for court determinations of the best interests of the child; providing a definition; specifying applicability; and providing for an effective date.,Best interests of a child-gender affirming treatments,0
HB0157,2023_2024,2024-RS,AN ACT relating to taxation; clarifying that rules related to establishing fair market value for property taxes shall be consistent with the statutory definition of fair market value; and providing for an effective date.,Use of full fair market value in taxation,0
HB0158,2023_2024,2024-RS,AN ACT relating to the administration of government; requiring legislative approval of a refugee resettlement plan; providing for assignment of a refugee resettlement plan to a legislative committee; requiring public hearings; requiring reports; and providing for an effective date.,Refugee resettlement plan accountability,0
HB0159,2023_2024,2024-RS,AN ACT relating to trade and commerce; prohibiting compensation for advising or assisting a person on veterans benefits matters except as permitted under federal law; providing limitations; providing definitions; providing for enforcement and penalties; specifying applicability; and providing for an effective date.,Prohibition on unauthorized fees-veterans benefits,0
HB0160,2023_2024,2024-RS,AN ACT relating to the protection of constitutional rights; declaring legislative authority; prohibiting the implementation or enforcement of an extreme risk protection order; preempting local law; providing definitions; and providing for an effective date.,Protect Firearms Rights Act,0
HB0161,2023_2024,2024-RS,"AN ACT relating to county commissioners; amending the selection requirements for district judges to fill a vacancy on a board of county commissioners, any other county elective office or a vacancy in the office of a member of the state legislature as specified; specifying duties of a county central committee; specifying applicability; and providing for an effective date.",Appointment by judge for vacancies in office-amendments,0
HB0162,2023_2024,2024-RS,"AN ACT relating to city, county, state and local powers; repealing the option for the governing body of an agency to hold executive sessions to consider the appointment of a public officer, professional person or employee; specifying applicability; and providing for an effective date.",Public meetings-executive sessions amendment,0
HB0163,2023_2024,2024-RS,"AN ACT relating to the administration of government; requiring government entities to adopt policies for the collection, access, security and use of personal data as specified; requiring specific personal data policies; providing definitions; and providing for effective dates.",Data privacy-government entities,0
HB0164,2023_2024,2024-RS,AN ACT relating to alcoholic beverages; clarifying that certain food products that are made with or that are infused with alcohol are not alcoholic beverages; making conforming changes; and providing for an effective date.,Alcohol infused foods,0
HB0165,2023_2024,2024-RS,"AN ACT relating to state lands; requiring a study on the feasibility of an access point permitting system for commercial fishing activities; requiring a report; requiring the joint travel, recreation, wildlife and cultural resources interim committee to review the report and sponsor legislation as necessary; and providing for an effective date.",Access points on state lands-study,0
HB0166,2023_2024,2024-RS,AN ACT relating to education; authorizing education savings accounts; creating the Wyoming education savings accounts expenditure account; providing for a transfer of funds to the Wyoming education savings accounts expenditure account; providing for the use and administration of education savings accounts for education; specifying duties of the state superintendent of public instruction; providing rulemaking authority; making conforming amendments; providing appropriations; authorizing full-time positions; and providing for effective dates.,Education savings accounts-1,0
HB0167,2023_2024,2024-RS,AN ACT relating to the administration of government; providing legislative findings; establishing a process by which the state of Wyoming may enter an order of nullification to nullify unconstitutional federal actions; authorizing petitions for seeking nullification; specifying duties of the secretary of state and legislative leadership; authorizing rulemaking; and providing for an effective date.,Restoring state sovereignty through nullification,0
HB0168,2023_2024,2024-RS,"AN ACT relating to property, conveyances and security transactions; prohibiting ownership of agricultural land by nonresident aliens, foreign businesses and foreign governments as specified; providing exceptions; requiring registration of agricultural lands; requiring reports; providing a penalty; providing for the escheat of agricultural lands as specified; providing definitions; requiring rulemaking; specifying applicability; and providing for effective dates.",Foreign ownership of Wyoming agricultural lands,0
HB0169,2023_2024,2024-RS,AN ACT relating to the legislature; continuing the mental health and vulnerable adult task force; specifying members and duties of the task force; requiring reports; providing a termination date for the task force; providing an appropriation; and providing for an effective date.,Mental health and vulnerable adult task force,0
HB0170,2023_2024,2024-RS,"AN ACT relating to administrative procedure; providing for the preparation of statements of estimated regulatory costs of an agency rule; specifying the information required for a statement of estimated regulatory costs; providing for proposed regulatory alternatives to an agency rule; requiring agencies to consider alternatives to mitigate impacts on small businesses, counties, cities and towns; providing for challenges to an agency rule as specified; providing a definition; specifying applicability; and providing for an effective date.",Administrative procedure-regulatory costs,0
HB0171,2023_2024,2024-RS,AN ACT relating to state lands; requiring the submittal of an application for any proposed land exchange to the board of land commissioners; requiring the board to provide public notice for any proposed land exchange; requiring rulemaking; specifying applicability; and providing for effective dates.,State land exchanges-public notice,0
HB0172,2023_2024,2024-RS,AN ACT relating to highways; designating Wyoming state highway 24 as the Purple Heart Memorial Trail; requiring signage; and providing for an effective date.,Purple Heart Memorial Trail,1
HB0173,2023_2024,2024-RS,AN ACT relating to pharmacy benefit managers; amending provisions related to pharmacies and in network retail pharmacies; requiring rulemaking; specifying applicability; and providing for effective dates.,Pharmacy benefit manager amendments,0
HB0174,2023_2024,2024-RS,AN ACT relating to labor and employment; implementing voluntary paid family and medical leave insurance for Wyoming employees as specified; specifying qualifying events; providing a timeline for implementation; requiring the selection of an insurance carrier; requiring rulemaking; and providing for effective dates.,Paid family and medical leave,0
HB0175,2023_2024,2024-RS,AN ACT relating to criminal history records for volunteers in K-12 public schools; authorizing school districts to request fingerprints to obtain criminal histories for volunteers as specified; authorizing school districts to receive criminal histories for volunteers as specified; and providing for an effective date.,Criminal history for volunteers in K-12 public schools,0
HB0176,2023_2024,2024-RS,AN ACT relating to crimes and criminal procedure; amending requirements for the restoration of rights as specified; repealing a misdemeanor offense of possession of a firearm by a nonviolent felon; removing the loss of firearms rights by convicted felons under state law; and providing for an effective date.,Restoration of civil rights-amendments,0
HB0177,2023_2024,2024-RS,"AN ACT relating to corporations, partnerships and associations; the administration of government; prohibiting natural asset companies from operating in Wyoming as specified; prohibiting conservation easements from utilizing natural asset companies as specified; prohibiting the state treasurer from investing in natural asset companies; providing definitions; and providing for an effective date.",Natural asset companies prohibition,0
HB0178,2023_2024,2024-RS,AN ACT relating to religious freedom; creating the Religious Freedom Restoration Act; providing definitions; limiting specified governmental actions that burden religious freedom; authorizing claims and defenses against governmental action that burden religious freedom; providing exceptions; and providing for an effective date.,Religious Freedom Restoration Act,0
HB0179,2023_2024,2024-RS,"AN ACT relating to criminal procedure; amending the definition of peace officer to clarify and expand the scope of authority for park rangers, superintendents and assistant superintendents; making conforming amendments; and providing for an effective date.",State park peace officers-definition and scope of authority,0
HB0180,2023_2024,2024-RS,AN ACT relating to controlled substances; amending the procedures and requirements for the forfeiture and seizure of property under the Wyoming Controlled Substances Act; providing definitions; requiring reporting; making conforming amendments; repealing conflicting provisions; specifying applicability; and providing for an effective date.,Freedom from government seizure act,0
HB0181,2023_2024,2024-RS,AN ACT relating to inquests; repealing coroner authority to hold inquests; making conforming amendments; repealing conflicting provisions; specifying applicability; and providing for an effective date.,Coroner's inquest-amendments,0
HB0182,2023_2024,2024-RS,AN ACT relating to trade and commerce; prohibiting the categorization of firearms and ammunition merchants separately from general merchandise or sporting goods retailers as specified; creating a penalty; and providing for an effective date.,Firearm purchase protections,0
HB0183,2023_2024,2024-RS,AN ACT relating to property; restricting foreign ownership of land and other interests in Wyoming as specified; providing definitions; requiring foreign owners to divest of land; requiring registration as specified; authorizing enforcement of ownership restrictions as specified; providing a civil penalty; requiring the inclusion of notices of foreign ownership in assessment schedules and tax statements; specifying applicability; requiring rulemaking; and providing for an effective date.,Prohibiting foreign property ownership in Wyoming,0
HB0184,2023_2024,2024-RS,AN ACT for a legislative order to prohibit enforcement of department of education rules on career and technical education program grants as specified; providing legislative findings; specifying applicability; and providing for an effective date.,Legislative order-department of education rules,0
HB0185,2023_2024,2024-RS,AN ACT relating to mine product taxes; providing an exemption for the production of crude oil and natural gas produced through enhanced oil recovery techniques and using Wyoming carbon dioxide; specifying conditions for the exemption; requiring reports; providing definitions; making conforming amendments; providing a sunset date for the exemption; and providing for an effective date.,Enhanced oil recovery-severance tax exemption,0
HB0186,2023_2024,2024-RS,AN ACT relating to public programs; making an appropriation to the 988 system trust fund account as specified; and providing for an effective date.,988 hotline-appropriation,0
HB0187,2023_2024,2024-RS,AN ACT relating to gaming; revising requirements for historic horse racing permits; and providing for an effective date.,Historic horse racing amendments,0
HB0188,2023_2024,2024-RS,AN ACT relating to the administration of government; requiring the secretary of state to establish a centralized electronic notice system; requiring preservation of notices as specified; providing for governmental entities and other persons to publish public or legal notices on the centralized electronic notice system in lieu of publication in a newspaper as specified; authorizing fees; providing definitions; making conforming amendments; requiring rulemaking; providing an appropriation; and providing for effective dates.,Centralized electronic notice system,0
HB0189,2023_2024,2024-RS,AN ACT relating to public utilities; subjecting electric generation facilities fueled by natural gas to closure and electricity sale requirements; specifying applicability; requiring rulemaking; and providing for an effective date.,Generation facility closure requirements-natural gas,0
HB0190,2023_2024,2024-RS,AN ACT relating to education; specifying procedures and requirements for school districts to provide parents notice of information regarding students and the rights of parents to make decisions regarding their children; specifying that school districts cannot prohibit parental notification and involvement in critical decisions involving students; prohibiting classroom discussion about sexual orientation or gender identity as specified; specifying training requirements for school districts; specifying procedures for resolving parent concerns and complaints; specifying duties for school district boards of trustees and the state board of education; providing for a cause of action; providing definitions; requiring rulemaking; and providing for effective dates.,Parental rights in education,0
HB0191,2023_2024,2024-RS,AN ACT relating to the emergency expenses of government; providing definitions; providing appropriations; amending and repealing prior appropriations of COVID-19 relief funds; specifying conditions on the appropriation and expenditure of COVID-19 relief funds; amending prior conditions on the reduction and prioritization of COVID-19 relief funds; providing for the reversion of unexpended and unobligated funds; authorizing emergency government programs; authorizing rulemaking; requiring reporting; specifying applicability; providing for priority of appropriations; and providing for an effective date.,American rescue plan act appropriations-amendments-3,0
HB0192,2023_2024,2024-RS,AN ACT relating to state lands; providing a perpetual easement over state and school lands for county and municipal roads; specifying requirements for easements; specifying duties for the board of land commissioners and the office of state lands and investments; making conforming amendments; providing legislative findings; requiring rulemaking; and providing for an effective date.,County and municipal roads on state lands-easements granted,0
HB0193,2023_2024,2024-RS,"AN ACT relating to cities, towns and counties; banning the implementation of immigration sanctuary policies by cities, towns and counties; providing penalties; providing definitions; and providing for an effective date.",Ban on sanctuary cities and counties,0
HB0194,2023_2024,2024-RS,AN ACT relating to education; repealing the statewide assessment system; repealing the Wyoming Accountability in Education Act; repealing obsolete provisions; making conforming amendments; requiring rulemaking; and providing for effective dates.,Statewide student assessment system-amendments,0
HB0195,2023_2024,2024-RS,AN ACT relating to the Wyoming national guard; providing legislative findings; prohibiting the release of the Wyoming national guard into active duty combat as specified; and providing for an effective date.,Defend the guard act,0
HB0196,2023_2024,2024-RS,AN ACT relating to property; providing that the policy of Wyoming is to require the federal government to exchange federal-owned lands if the federal government acquires additional property in Wyoming; requiring notice of transactions that will not include a transfer of federal-owned lands; providing for disposal of certain lands transferred to the state; and providing for an effective date.,Sales of real property to the federal government,0
HB0197,2023_2024,2024-RS,AN ACT relating to sales tax; revising provisions related to administration of the sales tax; clarifying a definition; clarifying the imposition of the tax; amending exemptions; revising reporting requirements; clarifying licensing and compliance provisions; repealing obsolete and other provisions; and providing for an effective date.,Sales tax administration revisions,0
HB0198,2023_2024,2024-RS,AN ACT relating to courts; imposing a court automation per-filing fee as specified; specifying distribution of per-filing fees; making conforming amendments; authorizing rulemaking; specifying applicability; and providing for an effective date.,Court automation fees-assessment on filings,0
HB0199,2023_2024,2024-RS,AN ACT relating to elections; providing for the counting of absentee ballots received after the date of the election as specified; modifying the time county canvassing boards shall meet; and providing for an effective date.,Election ballots,0
HB0200,2023_2024,2024-RS,"AN ACT relating to taxation and revenue; providing for an electricity generation tax as specified; specifying applicability, conditions and requirements for the electricity generation tax; specifying distribution; requiring rulemaking; providing confidentiality requirements; specifying penalties; providing a sales and use tax exemption on electricity as specified; making conforming amendments; repealing generation taxes on wind and nuclear energy; and providing for an effective date.",Electricity generation-equity and consumer protection,0
HB0201,2023_2024,2024-RS,AN ACT relating to the administration of government; requiring the state auditor to provide to the public information on payments made to vendors as specified; specifying applicability; and providing for an effective date.,State Auditor payment transparency,0
HB0202,2023_2024,2024-RS,AN ACT relating to unemployment compensation; requiring persons receiving unemployment compensation to submit to drug testing as specified; disqualifying persons who fail drug tests from unemployment benefits as specified; authorizing the crediting or refunding of employers' unemployment compensation contributions as specified; requiring rulemaking; and providing for effective dates.,Unemployment compensation-promoting a drug-free workforce,0
HB0203,2023_2024,2024-RS,AN ACT relating to taxation and revenue; establishing a property tax exemption for single family residential properties; providing a sales and use tax to provide funding to local governments due to the decrease in revenue from the property tax exemption; providing for the distribution of the sales and use tax; revising provisions related to local optional sales and use taxes; providing rulemaking authority; specifying applicability; and providing for an effective date.,Property tax reduction and replacement act,0
HB0204,2023_2024,2024-RS,AN ACT relating to food and drugs; creating a civil penalty for offenses related to specified amounts of marijuana and eliminating and amending related criminal penalties as specified; eliminating use of marijuana and possession of marijuana paraphernalia as crimes; eliminating the prohibition on practitioners prescribing marijuana; amending definitions; making conforming amendments; repealing a provision; requiring rulemaking; and providing for effective dates.,Decriminalization of cannabis,0
HB0205,2023_2024,2024-RS,"AN ACT relating to administration of the government; authorizing cities, towns and counties to enter into development agreements as specified; specifying requirements for development agreements; specifying the effect of a development agreement when unincorporated territory is incorporated into a city or town; specifying the effect of state and federal law; and providing for an effective date.",Development agreements,0
HB0206,2023_2024,2024-RS,AN ACT relating to gaming; specifying persons involved in horse racing and pari-mutuel wagering activities who shall be subject to criminal background checks; specifying rulemaking requirements for the Wyoming gaming commission; providing definitions; and providing for an effective date.,Pari-mutuel wagering activities-amendments-2,0
HB0207,2023_2024,2024-RS,AN ACT relating to game and fish; removing the lifetime restriction on the receipt of a moose or bighorn sheep license when a person was previously subject to the five year restriction for those species; making conforming amendments; specifying applicability; and providing for an effective date.,Moose and bighorn sheep hunting license-restrictions repeal,0
HB0208,2023_2024,2024-RS,AN ACT relating to mine product taxes; providing for the taxation of certain hydrogen production; specifying tax rates for different types of hydrogen production; providing for the administration of the tax; specifying applicability; and providing for an effective date.,Hydrogen severance tax,0
HB0209,2023_2024,2024-RS,"AN ACT relating to alcoholic beverages; amending the penalty for a person under the age of 21 possessing, consuming or having a measurable amount of alcohol in his body; providing for the expungement of a criminal record for a person under the age of 21 possessing, consuming or having a measurable amount of alcohol in his body; making conforming amendments; specifying applicability; and providing for an effective date.",Possession of alcohol-amendments,0
HB0210,2023_2024,2024-RS,"AN ACT relating to banks, banking and finance; repealing a provision related to disclosures on the face of checks and other instruments; repealing related definitions; making conforming amendments; and providing for an effective date.",Checking account disclosures-repeal,0
HB0211,2023_2024,2024-RS,"AN ACT relating to ad valorem taxation; establishing a rebuttable presumption in favor of acquisition value for specified real property; removing restrictions on the use, disclosure and confidentiality of sworn statements for specified real property; providing a definition; repealing an obsolete provision; requiring rulemaking; and providing for an effective date.",Property tax-acquisition value,0
HB0212,2023_2024,2024-RS,AN ACT relating to government reports; requiring state entities to include the actual values of the poverty level in any report to the public or the legislature; providing a definition; specifying applicability; and providing for an effective date.,Poverty level specificity in Wyoming law,0
HB0213,2023_2024,2024-RS,AN ACT relating to education; creating a grant program for preschool providers as specified; creating an endowment fund and an expenditure account; defining terms; specifying eligibility requirements; providing rulemaking authority; transferring funds; making conforming amendments; and providing for an effective date.,Wyoming preschool provider grants,0
HB0214,2023_2024,2024-RS,AN ACT relating to motor vehicles; repealing weight limitations on permanent registrations of a trailer; providing for the permanent registration of trailers that qualify as commercial vehicles as specified; providing a fee exemption for permanently registered trailers as specified; making conforming amendments; and providing for an effective date.,Trailer permanent registration-amendments,0
