bill_id,term,session,title,shortTitle,commem
HB0207,2023_2024,2023-RS,AN ACT relating to elections; revising provisions relating to political party affiliation changes by electors; specifying electors affiliated with a major political party shall change their affiliation to another major political party at least fourteen (14) days prior to a primary election; providing conforming amendments; and providing for an effective date.,Change in party affiliation,0
HB0208,2023_2024,2023-RS,AN ACT relating to school finance; authorizing the investment of the school foundation program reserve account in equities; amending the deposit of investment earnings into the account; and providing for an effective date.,School foundation program reserve account-investments,0
HB0209,2023_2024,2023-RS,AN ACT relating to education; amending the date of transfers from the Hathaway scholarship expenditure account to the Hathaway student scholarship reserve account; and providing for an effective date.,Hathaway scholarship accounts-transfer timing,0
HB0210,2023_2024,2023-RS,"AN ACT relating to banks, banking and finance; authorizing the state treasurer to prepare and maintain a list of financial institutions engaged in discrimination against energy companies; authorizing the state treasurer to publish the list upon vote of the board of deposits; specifying requirements for the list; requiring notice to a financial institution before being included on the list; providing opportunity for a financial institution to be removed from the list; requiring the state treasurer and state auditor to refuse to enter into a banking contract with a financial institution on the list once published; providing definitions; and providing for an effective date.",Financial institution discrimination,0
HB0211,2023_2024,2023-RS,AN ACT relating to elections; specifying the return of ballots to the county clerk; amending a related definition; and providing for an effective date.,Ballot harvesting,0
HB0212,2023_2024,2023-RS,AN ACT relating to the legislature; requiring the legislature to establish standing committees; creating the standing committee on federal review; establishing powers and duties of the federal review committee; and providing for an effective date.,Statutory standing committees-federal review,0
HB0213,2023_2024,2023-RS,AN ACT relating to ad valorem taxation; providing an exemption for the storage of energy production equipment before installation in this state; and providing for an effective date.,Energy production inventory exemption,0
HB0214,2023_2024,2023-RS,"AN ACT relating to economic development; creating the general regulatory sandbox program; authorizing limited waivers of statutes and rules under specified conditions; establishing standards and procedures for sandbox applications, operations and supervision; specifying standards for the suspension and revocation of sandbox authorization; providing definitions; requiring rulemaking; requiring reporting; and providing for effective dates.",General regulatory sandbox program,0
HB0215,2023_2024,2023-RS,AN ACT relating to property tax; providing a tax exemption for the primary residence of elderly persons and veterans; providing qualifications; providing a definition; and providing for an effective date.,Property tax exemptions-elderly and veterans,0
HB0216,2023_2024,2023-RS,"AN ACT relating to residential rental property; clarifying applicability of provisions providing duties and requirements of owners and renters of residential rental property; prohibiting certain actions by cities, towns and counties; and providing for an effective date.",Residential rental properties-applicability,0
HB0217,2023_2024,2023-RS,AN ACT relating to game and fish; replacing the term trophy game animal with large carnivore game animal; requiring rulemaking; and providing for effective dates.,Trophy game animal-change to large carnivore game animal,0
HB0218,2023_2024,2023-RS,AN ACT relating to state lands; providing legislative findings; designating the Teton county fairgrounds as the Rylee McCollum Teton county fairgrounds state historic site; specifying restrictions; and providing for an effective date.,Jackson hole rodeo and fairgrounds-state historic site,0
HB0219,2023_2024,2023-RS,AN ACT relating to elections; requiring acceptable voter identification from voters when requesting and obtaining absentee ballots; making conforming amendments; repealing conflicting provisions; and providing for an effective date.,Voter identification-ballot requests,0
HB0220,2023_2024,2023-RS,AN ACT relating to education; prohibiting sensitive materials in schools; specifying duties for the boards of trustees in school districts and the state board of education relating to sensitive materials; defining terms; making conforming amendments; requiring reports; requiring rulemaking; and providing for an effective date.,Prohibiting pornography in schools,0
HB0221,2023_2024,2023-RS,AN ACT relating to crimes and offenses; requiring the prosecution or dismissal of crimes of domestic violence as specified; requiring reports; and providing for an effective date.,Domestic violence prosecution amendments,0
HB0222,2023_2024,2023-RS,AN ACT relating to water; creating a Wyoming Colorado River advisory committee; establishing the purpose and duties of the committee; providing duties of the state engineer; authorizing a position; providing an appropriation; requiring a report; and providing for an effective date.,Colorado river advisory committee,0
HB0223,2023_2024,2023-RS,AN ACT relating to education; modifying the expenditure of revenues generated by the Wyoming education trust fund; establishing a grant program for preschool providers as specified; defining terms; specifying requirements; providing rulemaking authority; eliminating the innovative program grant program; transferring funds; making conforming amendments; repealing provisions; and providing for an effective date.,Wyoming preschool provider grants,0
HB0224,2023_2024,2023-RS,"AN ACT relating to elections; prohibiting state government officials and election officials from soliciting, taking or otherwise accepting private funds to conduct elections as specified; creating a felony; providing for imprisonment and a fine; and providing for an effective date.",Prohibition on private funds for conducting elections,0
HB0225,2023_2024,2023-RS,AN ACT relating to counties; requiring that a proposition to impose mill levies for a senior citizen service district be submitted to the resident electors every four (4) years after the election authorizing the mill levy; and providing for an effective date.,Senior citizen service districts,0
HB0226,2023_2024,2023-RS,AN ACT relating to municipal services; prohibiting municipalities from recovering past due payments for municipal services as specified; specifying applicability; and providing for an effective date.,Municipal services-recovery actions,0
HB0227,2023_2024,2023-RS,AN ACT relating to taxation and revenue; increasing the assessed value amount of the veterans' property tax annual exemption; specifying applicability; requiring rulemaking; and providing for effective dates.,Veterans' property tax exemption-amendments,0
HB0228,2023_2024,2023-RS,AN ACT relating to game and fish; specifying the development of a compensation formula for yearlings damaged by trophy game animals; and providing for an effective date.,Livestock compensation factor,0
HB0229,2023_2024,2023-RS,AN ACT relating to sales and use taxes; clarifying that the department of revenue and county treasurers may collect sales and use taxes electronically; providing an appropriation; and providing for an effective date.,Electronic payment of sales and use taxes,0
HB0230,2023_2024,2023-RS,AN ACT relating to motor vehicles; specifying time limits by which specific penalties for motor vehicle offenses may be imposed; making conforming amendments; requiring rulemaking; and providing for an effective date.,Driver license penalties-time limit for imposition,0
HB0231,2023_2024,2023-RS,AN ACT relating to the public defender; removing a requirement for federal funding to be included in calculating the state public defender budget for purposes of determining state and county shares; and providing for an effective date.,Public defender funding amendments,0
HB0232,2023_2024,2023-RS,AN ACT relating to game and fish; authorizing the Wyoming game and fish commission to regulate commercially guided fishing boats; providing definitions; amending requirements for outfitter and professional guide licenses as specified; amending membership requirements for the Wyoming state board of outfitters and professional guides; requiring a license for commercially guided fishing boats as specified; providing rulemaking authority; and providing for effective dates.,Outfitters and guides-amendments,0
HB0233,2023_2024,2023-RS,AN ACT relating to peace officers; authorizing emergency medical services providers to transport and treat injured police dogs as specified; providing definitions; providing immunity to emergency medical services providers as specified; and providing for an effective date.,Transportation and care of injured police dogs,0
HB0234,2023_2024,2023-RS,"AN ACT relating to public health and safety; allowing health care providers, health care institutions and health care payers the right to refuse to participate in or pay for health care services as specified; prohibiting discrimination; providing immunity; providing definitions; specifying applicability; requiring rulemaking; and providing for effective dates.",Medical Ethics Defense Act,0
HB0235,2023_2024,2023-RS,AN ACT relating to education; requiring school district board trustees to be sworn in and begin their official duties on the same day; and providing for an effective date.,School board members-same day swearing in and serving,0
HB0236,2023_2024,2023-RS,AN ACT relating to taxation and revenue; modifying a sales and use tax exemption on repair and replacement parts for the service of farm implements; and providing for an effective date.,Tax exemption-agricultural repair and parts,0
HB0237,2023_2024,2023-RS,AN ACT relating to alcoholic beverages; repealing the excise tax on malt beverages; making conforming amendments; and providing for an effective date.,Beer Freedom Act,0
HB0238,2023_2024,2023-RS,"AN ACT relating to wills, estates and probate; specifying fees that can be charged for publications required for determination of heirship notices; specifying applicability; and providing for an effective date.",Probate-discovered property publication requirements,0
HB0239,2023_2024,2023-RS,AN ACT relating to motor vehicles; repealing requirements on leaving a motor vehicle unattended; and providing for an effective date.,Vehicle idling-decriminalization,0
HB0240,2023_2024,2023-RS,AN ACT relating to elections; providing for the people to make appropriations; requiring the legislature to assign appropriations as specified; requiring the secretary of state to provide the number of people who voted for the office of governor in the preceding general election to a committee of applicants for an initiative or referendum upon request; and providing for effective dates.,Ballot initiative process amendments,0
HB0241,2023_2024,2023-RS,AN ACT relating to crimes and offenses; prohibiting sexual intrusion or sexual contact by a peace officer with a victim that is in custody as specified; making conforming amendments; and providing for an effective date.,Prohibiting sexual relations with persons in police custody,0
HB0242,2023_2024,2023-RS,"AN ACT relating to cities, towns and counties; prohibiting cities, towns and counties from enacting and enforcing ordinances and regulations relating to packages or containers of consumer merchandise; providing definitions; specifying applicability; and providing for an effective date.",Consumer merchandise-packaging regulation prohibitions,0
HB0243,2023_2024,2023-RS,AN ACT relating to motor vehicles; removing the requirement for use of a security agreement to perfect a security interest in a vehicle or motor vehicle; making conforming amendments; and providing for an effective date.,Perfection of security interest-required information,0
HB0244,2023_2024,2023-RS,AN ACT relating to property tax; amending who may apply for the property tax refund program; specifying the amount of the refund; revising qualifications for the refund program; providing for rulemaking; and providing for an effective date.,Property tax refund program-rental properties,0
HB0245,2023_2024,2023-RS,"AN ACT relating to children; amending the Child Protection Act, Juvenile Justice Act and Children in Need of Supervision Act to remove the mandatory requirement for courts to establish child support obligations on parents when their child is in a court ordered placement as specified; removing an employment or community service requirement; making conforming amendments; and providing for an effective date.",Court ordered placement-child support,0
HB0246,2023_2024,2023-RS,AN ACT relating to legal time; requiring the state to observe a time zone as specified; establishing a new uniform state time; repealing provisions; specifying a contingency; and providing for effective dates.,Mountain standard time-2,0
HB0247,2023_2024,2023-RS,AN ACT relating to game and fish; prohibiting the waste of edible portions of trophy game animals and possession of parts of wasted trophy game animals; prohibiting the abandonment of trophy game animal meat at a meat processing plant; and providing for an effective date.,Trophy game animals-wanton waste,0
HB0248,2023_2024,2023-RS,"AN ACT relating to vital records; clarifying that vital records include vital records contained in books; clarifying the scope, duties and responsibilities of local officials who participate in activities associated with vital records; providing and amending definitions; removing obsolete language; establishing a deadline for certifying death files; clarifying requirements for unifying marriages; requiring rulemaking; and providing for an effective date.",Vital records-amendments,0
HB0249,2023_2024,2023-RS,AN ACT relating to motor vehicles; confirming the ability of county treasurers to provide a temporary certificate of registration for online payments as specified; and providing for an effective date.,Vehicle registration verification,0
HB0250,2023_2024,2023-RS,AN ACT relating to the protection of constitutional rights; making legislative findings; declaring legislative authority; prohibiting the implementation or enforcement of an extreme risk protection order; preempting local law; providing definitions; providing a penalty; and providing for an effective date.,Stop Red Flags Act,0
HB0251,2023_2024,2023-RS,AN ACT relating to elections; requiring absentee ballots to contain an official envelope inside the inner ballot envelope; requiring absentee voters to provide identification information as specified; and providing for an effective date.,Absentee ballot return-required information,0
HB0252,2023_2024,2023-RS,AN ACT relating to trade and commerce; authorizing propane dealers to fill or refill a propane container during emergencies as specified; providing definitions; and providing for an effective date.,Regulation of propane delivery contracts,0
HB0253,2023_2024,2023-RS,"AN ACT relating to banks, banking and finance; prohibiting the use of certain codes in financial transactions as specified; and providing for effective dates.",Credit card defense act,0
HB0254,2023_2024,2023-RS,AN ACT relating to game and fish; creating and amending provisions specific to nonresident fishing; requiring nonresident fishing guides to obtain boat permit decals as specified; providing for fees; imposing penalties; requiring rulemaking; increasing fees for nonresident fishing licenses as specified; making conforming amendments; and providing for an effective date.,Nonresident anglers-regulatory modifications,0
HB0255,2023_2024,2023-RS,AN ACT relating to game and fish; allowing for the game and fish commission to designate official nonprofit partners as specified; providing requirements and obligations for official nonprofit partners; requiring rulemaking; and providing for an effective date.,Game and fish-partners,0
HB0256,2023_2024,2023-RS,AN ACT relating to property tax; providing a property tax reduction for tax year 2023; providing a sunset date; specifying applicability; and providing for an effective date.,Property tax holiday,0
HB0257,2023_2024,2023-RS,AN ACT relating to environmental quality; requiring landowner approval before the department of environmental quality or the environmental quality council approves any mine permit or reclamation plan revisions as specified; specifying applicability; and providing for an effective date.,Mine permit and reclamation plan changes-landowner approval,0
HB0258,2023_2024,2023-RS,AN ACT relating to professions and occupations; amending dentists and dental hygienists licensing statutes to include denturists; authorizing a denturist to be added to the board as specified; specifying that this act does not apply to denturitry students performing denturitry as part of their curriculum; specifying that denturists shall only perform dental laboratory work at the direction of a dentist; specifying that denturists may perform services for patients if trained to do so in a denturitry school accredited by the National Denturist Association or other approved education program and under the supervision of a dentist; amending requirements relating to permissible supervised work by specified persons; amending other laws relating to dentists and dental hygienists to include denturists as specified; requiring rulemaking; providing an appropriation; and providing for effective dates.,Denturist practice act,0
HB0259,2023_2024,2023-RS,AN ACT relating to elections; requiring a runoff election after a primary election for specified offices when no candidate receives a majority of the vote; providing the format of the runoff ballot; changing the date for primary elections; amending related dates; making conforming changes; amending election contribution laws; providing that the act is contingent upon adoption of a constitutional amendment; providing an appropriation; and providing for effective dates.,Runoff elections,0
HB0260,2023_2024,2023-RS,AN ACT relating to the University of Wyoming; creating the Wyoming firearms research center oversight commission; specifying membership and duties of the commission; providing appropriations; and providing for an effective date.,Wyoming firearms research institute oversight commission,0
HB0261,2023_2024,2023-RS,AN ACT relating to crimes and offenses; creating the offense of breach of the peace within a health care facility; providing penalties; providing a definition; and providing for an effective date.,Breach of the peace within a health care facility,0
HB0262,2023_2024,2023-RS,AN ACT relating to religious freedom; creating the Religious Freedom Restoration Act; providing definitions; limiting specified governmental actions that burden religious freedom as specified; authorizing claims and defenses against governmental action that burden religious freedom as specified; providing exceptions; and providing for an effective date.,Wyoming Religious Freedom Restoration Act,0
HB0263,2023_2024,2023-RS,AN ACT relating to criminal procedure; providing for the automatic restoration of voting rights for nonviolent felons as specified; making conforming amendments; repealing a provision; and providing for an effective date.,Restoration of voting rights-amendments,0
HB0264,2023_2024,2023-RS,AN ACT relating to the legislature; authorizing the painting of a mural in the state capitol house chamber; providing an appropriation; providing requirements; creating a selection committee; and providing for an effective date.,Mining mural,0
HB0265,2023_2024,2023-RS,AN ACT relating to public property; increasing the rate of interest that accrues on late payments for the purchase of goods and services by public entities as specified; providing for the accrual of interest on late payments for public works projects as specified; and providing for an effective date.,Public procurement late payments,0
HB0266,2023_2024,2023-RS,AN ACT relating to the administration of government; requiring legislative approval of a refugee resettlement plan; providing for assignment of a refugee resettlement plan to a legislative committee; requiring public hearings; requiring reports; and providing for an effective date.,Refugee resettlement plan accountability,0
HB0267,2023_2024,2023-RS,AN ACT relating to property; granting the state of Wyoming the right of first refusal for real property conveyances to the United States and federal agencies; specifying conditions for the purchase of property by exercising the right of first refusal; specifying duties for property owners and the board of land commissioners; providing a continuous appropriation; providing definitions; making conforming amendments; and providing for an effective date.,Conveyances to United States-right of refusal by state,0
HB0268,2023_2024,2023-RS,AN ACT relating to trade and commerce; amending the Wyoming Consumer Rental-Purchase Agreement Act as specified; amending licensing requirements; providing for digital agreements; providing a definition; providing limitations; allowing for the inspection of records; and providing for an effective date.,Wyoming Consumer Rental-Purchase Agreement Act-amendments,0
HB0269,2023_2024,2023-RS,AN ACT relating to labor and employment; authorizing hearing examiners to award appointed attorneys reimbursement for expenses and costs in contested workers compensation cases as specified; removing the requirement that attorneys only be reimbursed for a reasonable number of hours not to exceed the benefits at issue in the contested case hearing; and providing for an effective date.,Workers compensation-attorneys' expenses and costs,0
HB0270,2023_2024,2023-RS,"AN ACT relating to improvement and service districts; providing a limitation on the imposition of fees, charges, mill levies, taxes and other assessments by improvement and service districts; providing exceptions; providing a limitation on the imposition of rules, regulations and procedures by improvement and service districts; and providing for an effective date.",Improvement and service districts-limitations,0
HB0271,2023_2024,2023-RS,AN ACT relating to the University of Wyoming college of agriculture; creating the University of Wyoming college of agriculture endowment; creating accounts for the endowment; providing for distributions and transfers from the accounts to the college of agriculture; specifying authorized expenditures; requiring reporting; making conforming amendments; appropriating funds; and providing for an effective date.,College of agriculture endowment,0
HB0272,2023_2024,2023-RS,AN ACT relating to crimes and offenses; amending the offenses of prostitution and soliciting an act of prostitution to include sexual contact; and providing for an effective date.,Prostitution amendments,0
HB0273,2023_2024,2023-RS,AN ACT relating to game and fish; adding an intent requirement to the game and fish trespass statute; and providing for an effective date.,Game and fish trespass-intent,0
HB0274,2023_2024,2023-RS,"AN ACT relating to trade and commerce; prohibiting discrimination based on viewpoint, race, religion and location by interactive computer services, social media platforms and businesses as specified; providing legislative findings; specifying a breach of fiduciary duty for release or loss of private information; defining terms related to the prohibitions on discrimination; providing remedies for violations as specified; specifying applicability of prohibitions; specifying severability; and providing for an effective date.",Internet freedom-prohibiting discrimination,0
HB0275,2023_2024,2023-RS,"AN ACT relating to taxation; establishing the imposition, administration and distribution of an electric vehicle energy tax; increasing the annual decal fee for an electric vehicle; establishing an annual decal fee for a plug—in hybrid vehicle; repealing provisions made obsolete; and providing for effective dates.",Highway maintenance equity-electric vehicle metering,0
HB0276,2023_2024,2023-RS,AN ACT relating to game and fish; providing that any shed antlers and horns on state or public land are the property of the state; requiring nonresidents to obtain a conservation stamp to collect shed antlers and horns on state or public land; providing exceptions specifying fees; and providing for an effective date.,Shed antlers and horns conservation stamp,0
HB0277,2023_2024,2023-RS,"AN ACT relating to motor vehicles; confirming the ability of county treasurers to provide certificates of registration in electronic form as specified; amending requirements for the display of license plates, validation stickers and permits as specified; and providing for an effective date.",Vehicle registration e-certificate and grace period,0
HB0278,2023_2024,2023-RS,"AN ACT relating to game and fish; requiring the game and fish department, the office of state lands and investments and the department of state parks and cultural resources to update geographic information system mapping data of state-held easements and rights-of-way; providing exceptions; and providing for an effective date.",Public access easements mapping,0
HB0279,2023_2024,2023-RS,AN ACT relating to elections; requiring that acceptable voter identification be presented for a voter to obtain an absentee ballot in person; and providing for an effective date.,Voter identification requirements,0
