bill_id,session_id,bill_number,status,status_desc,status_date,title,description,committee_id,committee,last_action_date,last_action,url,state_link
1708857,2024,SB145,4,Passed,2023-03-24,"AN ACT relating to interscholastic athletics.","Amend KRS 156.070 to remove the statutory eligibility restriction for nonresident student participation in interscholastic athletics; retain eligibility authority with the agency designated to manage interscholastic athletics.",0,,2023-03-24,"signed by Governor (Acts Ch. 93)",https://legiscan.com/KY/bill/SB145/2023,https://apps.legislature.ky.gov/record/23RS/sb145.html
1709504,2024,SB146,1,Introduced,2023-02-15,"AN ACT relating to the authority of local governments and declaring an emergency.","Create a new section of KRS Chapter 65 to permit a local government to exempt a health facility or health service from the certificate of need requirement if a need is demonstrated; require an exemption to be granted for the useful lifetime of any health facility established or equipment purchased; require health services provided under KRS Chapter 205 to be eligible for reimbursement for facilities or services under an exemption; exempt pain management, long-term care, abortion facilities, and ambulance services; limit opposition to an application for certificate of need; exempt facilities granted an exemption from application consideration; EMERGENCY.",4661,"Senate Health Services",2023-02-17,"to Health Services (S)",https://legiscan.com/KY/bill/SB146/2023,https://apps.legislature.ky.gov/record/23RS/sb146.html
1709377,2024,SB147,1,Introduced,2023-02-15,"AN ACT relating to creation of the Office of Safer Communities in the Department for Public Health and making an appropriation therefor.","Amend KRS 194A.030 to place the Office of Safer Communities under the oversight of the Department for Public Health; create a new section of KRS Chapter 194A to establish the Office of Safer Communities; appropriate $3,000,000 in fiscal year 2023-2024 to fund the office; APPROPRIATION.",340,"Senate Appropriations and Revenue",2023-02-17,"to Appropriations & Revenue (S)",https://legiscan.com/KY/bill/SB147/2023,https://apps.legislature.ky.gov/record/23RS/sb147.html
1708983,2024,SB148,2,Engrossed,2023-03-13,"AN ACT establishing the Government Teleworking Task Force.","Create a new section of KRS Chapter 61 to prohibit employees of public agencies and the Administrative Office of the Courts from engaging in telework unless the Governor declares an emergency; define ""public agency"" and ""telework""; exempt certain agencies and professions; exempt employees whose primary job responsibilities require them to be away from their primary work station at least 50 percent of the time.",317,"House Committee On Committees",2023-03-15,"returned to Committee on Committees (H)",https://legiscan.com/KY/bill/SB148/2023,https://apps.legislature.ky.gov/record/23RS/sb148.html
1709189,2024,SB149,1,Introduced,2023-02-15,"AN ACT relating to patient access to pharmacy benefits.","Amend KRS 304.17A-164 to prohibit insurers, pharmacy benefit managers, and other administrators of pharmacy benefits from imposing certain requirements on health plan insureds; create a new section of Subtitle 17A of KRS Chapter 304 to establish prohibited practices for pharmacy benefit managers; create new sections of Subtitles 17C and 38A of KRS Chapter 304 to apply provisions of legislation to limited health service benefit plans, including limited health service contracts, and limited health service organizations; establish when legislation applies to health plans and contracts; provide that provisions of this Act shall be severable; EFFECTIVE, in part, January 1, 2024.",341,"Senate Banking and Insurance",2023-02-17,"to Banking & Insurance (S)",https://legiscan.com/KY/bill/SB149/2023,https://apps.legislature.ky.gov/record/23RS/sb149.html
1700608,2024,SB150,4,Passed,2023-03-29,"AN ACT relating to children.","Create a new section of KRS Chapter 158 to establish definitions; require specific parental notifications from public schools; require school districts to adopt specific procedures related to parental rights; limit authority of the Kentucky Board of Education and Kentucky Department of Education in relation to parental rights and a student's use of pronouns; prohibit district or school policies with the intent of keeping student information confidential for parents; prohibit a school district from requiring school personnel or pupils to use pronouns for students that do not conform to that student's biological sex; provide school districts and district personnel authority to seek emergency medical services for a student; provide conditions for student confidentiality; amend KRS 158.1415 to establish requirements for any public school's course, curriculum, or program on the subject of human sexuality.",0,,2023-03-29,"delivered to Secretary of State (Acts Ch. 132)",https://legiscan.com/KY/bill/SB150/2023,https://apps.legislature.ky.gov/record/23RS/sb150.html
1709596,2024,SB151,1,Introduced,2023-02-15,"AN ACT relating to medical assistance payments.","Amend KRS 205.634 to remove restriction on medical assistance payments to out-of-state health facilities or health services.",4661,"Senate Health Services",2023-02-17,"to Health Services (S)",https://legiscan.com/KY/bill/SB151/2023,https://apps.legislature.ky.gov/record/23RS/sb151.html
1711784,2024,SB152,1,Introduced,2023-02-16,"AN ACT relating to state government.","Amend KRS 18A.035 to add gender-neutral language.",348,"Senate State & Local Government",2023-02-21,"to State & Local Government (S)",https://legiscan.com/KY/bill/SB152/2023,https://apps.legislature.ky.gov/record/23RS/sb152.html
1711578,2024,SB153,4,Passed,2023-03-20,"AN ACT relating to state government.","Amend KRS 18A.070 to make a technical correction.",0,,2023-03-20,"signed by Governor (Acts Ch. 35)",https://legiscan.com/KY/bill/SB153/2023,https://apps.legislature.ky.gov/record/23RS/sb153.html
1711379,2024,SB154,1,Introduced,2023-02-16,"AN ACT relating to state government.","Amend KRS 12.100 to add a technical correction.",348,"Senate State & Local Government",2023-02-21,"to State & Local Government (S)",https://legiscan.com/KY/bill/SB154/2023,https://apps.legislature.ky.gov/record/23RS/sb154.html
1711734,2024,SB155,1,Introduced,2023-02-16,"AN ACT relating to employer liability.","Create a new section of KRS Chapter 336 to prohibit a private employer from receiving statutory liability protection if that employer institutes a mandatory workplace vaccination policy; create a civil cause of action.",4437,"Senate Economic Development, Tourism, & Labor",2023-02-21,"to Economic Development, Tourism, & Labor (S)",https://legiscan.com/KY/bill/SB155/2023,https://apps.legislature.ky.gov/record/23RS/sb155.html
1711722,2024,SB156,4,Passed,2023-03-22,"AN ACT relating to a statewide reading research center.","Amend KRS 164.0207 to establish a statewide reading research center; direct the center and the Kentucky Department of Education to establish annual goals and performance objectives; require KDE to make annual programming and funding recommendations for the center; require KDE to select the center through a competitive proposal process by July 1, 2024, for a five-year contract; amend KRS 151B.406, 151B.409, 154A.130, 156.553, 158.305, 158.792, 158.840, and 164.035 to conform; make Sections 1 through 9 of the Act take effect July 1, 2024.",0,,2023-03-22,"signed by Governor (Acts Ch. 55)",https://legiscan.com/KY/bill/SB156/2023,https://apps.legislature.ky.gov/record/23RS/sb156.html
1711669,2024,SB157,1,Introduced,2023-02-16,"AN ACT relating to the regulation of motor vehicles.","Amend KRS 186A.040 to establish insurance notification requirements and conditions for when an individual's motor vehicle registration must be revoked or a license plate surrendered; establish circumstances for when an affidavit may be submitted in lieu of proof of insurance; repeal notifications to the county attorney; require the Transportation Cabinet to prepare forms and provide a vehicle sticker under certain circumstances; prohibit towing by city, county, or local governments under certain circumstances; provide reinstatement fee; create a new section of KRS Chapter 186A to establish administrative requirements for county clerks and the Department for Vehicle Regulation; amend KRS 186A.042 to allow submission of an affidavit; require county clerks to provide a notice when processing motor vehicle registration renewals; amend KRS 186A.990 to provide penalties for failure to surrender motor vehicle license plate; amend KRS 186.180 to conform; delete fee for revocations under KRS 186.290; amend various statutes requiring proof of insurance to allow submission of an affidavit; amend KRS 304.39-080 to establish exceptions to the requirement to maintain continuous motor vehicle insurance; amend KRS 304.39-110 to require insurers to offer, upon request, 12 month policy periods; amend KRS 304.39-117 to modify requirements for evidence of compliance with minimum insurance requirements; amend KRS 304.99-060 to modify penalties; amend KRS 431.078 to create expungement rights for motor vehicle owners and operators that fail to have minimum motor vehicle insurance; make technical corrections throughout; RETROACTIVE, in part.",349,"Senate Transportation",2023-02-21,"to Transportation (S)",https://legiscan.com/KY/bill/SB157/2023,https://apps.legislature.ky.gov/record/23RS/sb157.html
1711327,2024,SB158,2,Engrossed,2023-03-07,"AN ACT relating to juvenile justice and making an appropriation therefor.","Direct the office of the Auditor of Public Accounts to enter into a contract with a third party to conduct a performance review of the Department of Juvenile Justice within the Justice and Public Safety Cabinet; establish the authority of the third-party entity and the scope of the review; APPROPRIATION.",321,"House Appropriations and Revenue",2023-03-10,"to Appropriations & Revenue (H)",https://legiscan.com/KY/bill/SB158/2023,https://apps.legislature.ky.gov/record/23RS/sb158.html
1711760,2024,SB159,1,Introduced,2023-02-16,"AN ACT relating to building codes.","Permit the use of safe refrigerant alternatives if used in equipment listed and installed in accordance with safety standards.",4317,"Senate Licensing and Occupations",2023-03-02,"to Licensing & Occupations (S)",https://legiscan.com/KY/bill/SB159/2023,https://apps.legislature.ky.gov/record/23RS/sb159.html
1711419,2024,SB160,4,Passed,2023-03-31,"AN ACT relating to STABLE Kentucky accounts.","Amend KRS 41.415 to make technical corrections and to conform; amend KRS 164A.260 to exempt moneys in a STABLE Kentucky accounts from attachment, execution, or garnishment; to require that moneys in a STABLE Kentucky account to be disregarded for the purpose of determining eligibility for or the amount of public assistance; and to require that moneys in a STABLE Kentucky account be transferred to the estate of the designated beneficiary upon the death of the designated beneficiary.",0,,2023-03-31,"signed by Governor (Acts Ch. 157)",https://legiscan.com/KY/bill/SB160/2023,https://apps.legislature.ky.gov/record/23RS/sb160.html
1711554,2024,SB161,1,Introduced,2023-02-16,"AN ACT relating to the Kentucky River Authority.","Create a new section of KRS Chapter 151 to establish definitions for KRS 151.700 to 151.730, regarding the Kentucky River Authority; amend KRS 151.710 to clarify requirements for members of the Kentucky River Authority.",337,"Senate Rules",2023-03-15,"reported favorably, 2nd reading, to Rules as a consent bill",https://legiscan.com/KY/bill/SB161/2023,https://apps.legislature.ky.gov/record/23RS/sb161.html
1711512,2024,SB162,4,Passed,2023-03-27,"AN ACT relating to public safety, making an appropriation therefor, and declaring an emergency.","Amend KRS 15A.061 to require the Justice and Public Safety Cabinet to maintain a comprehensive data system for the Department of Juvenile Justice; amend KRS 15A.305 to provide additional requirements for facilities operated under the statewide juvenile detention plan; require the Department for Medicaid Services to apply for an amendment to the submitted waiver to allow Medicaid coverage for youth incarcerated in DJJ facilities; direct the Justice and Public Safety Cabinet to promulgate regulations expediting the investigation of complaints; and require the Justice and Public Safety Cabinet to submit and implement various plans within specified time frames with reporting to the Legislative Research Commission.",0,,2023-03-27,"signed by Governor (Acts Ch. 106)",https://legiscan.com/KY/bill/SB162/2023,https://apps.legislature.ky.gov/record/23RS/sb162.html
1711524,2024,SB163,4,Passed,2023-03-29,"AN ACT relating to transportation and declaring an emergency.","Amend KRS 177.074 to require the Transportation Cabinet Secretary, upon passage of a joint resolution of the General Assembly, to direct the placement of signs denoting inclusion of an artist as an honoree on the Country Music Highway on United States Route 23; amend KRS 186.240 to identify the mottos and slogans that may appear on a standard issue motor vehicle license plate; amend KRS 186.240 (Effective January 1, 2024) to conform.",0,,2023-03-29,"became law without Governor's Signature (Acts Ch. 129)",https://legiscan.com/KY/bill/SB163/2023,https://apps.legislature.ky.gov/record/23RS/sb163.html
1713466,2024,SB164,1,Introduced,2023-02-17,"AN ACT proposing an amendment to Section 145 of the Constitution of Kentucky relating to restoration of rights.","Propose to amend Section 145 of the Constitution of Kentucky to automatically restore the voting rights of persons convicted of certain felonies upon completion of their imprisonment, probation, or parole and automatically restore their civil rights three years after completion of their imprisonment, probation, or parole; provide ballot language; submit to voters for ratification or rejection.",348,"Senate State & Local Government",2023-02-21,"to State & Local Government (S)",https://legiscan.com/KY/bill/SB164/2023,https://apps.legislature.ky.gov/record/23RS/sb164.html
1713586,2024,SB165,4,Passed,2023-03-29,"AN ACT relating to consumer loan companies.","Amend KRS 286.4-530 and 286.4-533 to modify permitted loan charges for consumer loan companies; make technical corrections.",0,,2023-03-29,"became law without Governor's Signature (Acts Ch. 123)",https://legiscan.com/KY/bill/SB165/2023,https://apps.legislature.ky.gov/record/23RS/sb165.html
1713172,2024,SB166,1,Introduced,2023-02-17,"AN ACT relating to the fiduciary duties owed to the state-administered retirement systems.","Amend KRS 21.450, 61.650, 78.790, and 161.430 to expand scope of persons owing a fiduciary duty to the respective state-administered retirement systems, provide that fiduciaries consider solely the interest of the members and beneficiaries of the retirement systems using only pecuniary factors and prohibit the consideration of or actions on nonpecuniary interests, including environmental, social, political, and ideological interests, and prohibit any contract or agreement from voiding such fiduciary duties; amend KRS 21.450, 61.650, and 78.790 to require third-party fiduciaries to acknowledge their fiduciary duties in writing; amend KRS 21.540, 61.650, 78.790, and 161.430 to require the boards of the state-administered retirement systems to adopt their own proxy guidelines, prevent the boards from following the recommendations of a proxy voting service or proxy adviser unless the proxy adviser acknowledges its fiduciary duties in writing, and require the boards to either vote their own shares or have the proxy voting service or proxy adviser voting the system's shares commit to follow the board's proxy guidelines; amend KRS 21.540, 61.645, 78.782, and 161.250 to require the quarterly reporting of proxy votes to the boards of the state-administered retirement systems; make technical changes.",348,"Senate State & Local Government",2023-02-21,"to State & Local Government (S)",https://legiscan.com/KY/bill/SB166/2023,https://apps.legislature.ky.gov/record/23RS/sb166.html
1713352,2024,SB167,1,Introduced,2023-02-17,"AN ACT relating to home incarceration.","Amend KRS 532.260 to create new requirements for eligibility to serve the remainder of a sentence under home incarceration or conditional release; require the Department of Corrections to immediately transfer a person if he or she are being held on a detainer; allow a victim or concerned citizen to appeal the decision that a person may serve the remainder of his or her sentence under home incarceration or conditional release.",345,"Senate Judiciary",2023-02-21,"to Judiciary (S)",https://legiscan.com/KY/bill/SB167/2023,https://apps.legislature.ky.gov/record/23RS/sb167.html
1713400,2024,SB168,1,Introduced,2023-02-17,"AN ACT relating to firearms.","Amend KRS 16.220 to require the destruction of confiscated firearms; amend various sections to conform.",350,"Senate Veterans, Military Affairs, & Public Protection",2023-02-21,"to Veterans, Military Affairs, & Public Protection (S)",https://legiscan.com/KY/bill/SB168/2023,https://apps.legislature.ky.gov/record/23RS/sb168.html
1713751,2024,SB169,4,Passed,2023-03-21,"AN ACT relating to public-private partnerships.","Amend KRS 65.028, relating to public-private partnerships, to redefine ""local government"" to include local school district; and grant a local board of education the authority to enter into public-private partnerships on behalf of a local school district.",0,,2023-03-21,"signed by Governor (Acts Ch. 41)",https://legiscan.com/KY/bill/SB169/2023,https://apps.legislature.ky.gov/record/23RS/sb169.html
1713653,2024,SB170,1,Introduced,2023-02-17,"AN ACT relating to pharmacy.","Amend KRS 315.010 to remove reference to protocols authorized by the Kentucky Board of Pharmacy from the definition of ""prescription drug order.""",4661,"Senate Health Services",2023-02-21,"to Health Services (S)",https://legiscan.com/KY/bill/SB170/2023,https://apps.legislature.ky.gov/record/23RS/sb170.html
1713269,2024,SB171,1,Introduced,2023-02-17,"AN ACT relating to education.","Amend KRS 156.690 to insert gender-neutral language.",343,"Senate Education",2023-02-21,"to Education (S)",https://legiscan.com/KY/bill/SB171/2023,https://apps.legislature.ky.gov/record/23RS/sb171.html
1713500,2024,SB172,1,Introduced,2023-02-17,"AN ACT relating to education.","Amend KRS 156.690 to insert gender-neutral language.",343,"Senate Education",2023-02-21,"to Education (S)",https://legiscan.com/KY/bill/SB172/2023,https://apps.legislature.ky.gov/record/23RS/sb172.html
1713417,2024,SB173,1,Introduced,2023-02-17,"AN ACT relating to education.","Amend KRS 156.690 to insert gender-neutral language.",343,"Senate Education",2023-02-21,"to Education (S)",https://legiscan.com/KY/bill/SB173/2023,https://apps.legislature.ky.gov/record/23RS/sb173.html
1717405,2024,SB174,1,Introduced,2023-02-21,"AN ACT relating to health services.","Amend KRS 216.350 to add gender-neutral language.",4661,"Senate Health Services",2023-02-23,"to Health Services (S)",https://legiscan.com/KY/bill/SB174/2023,https://apps.legislature.ky.gov/record/23RS/sb174.html
1717238,2024,SB175,1,Introduced,2023-02-21,"AN ACT relating to the Department of Revenue.","Amend KRS 131.205 to make technical corrections.",340,"Senate Appropriations and Revenue",2023-02-23,"to Appropriations & Revenue (S)",https://legiscan.com/KY/bill/SB175/2023,https://apps.legislature.ky.gov/record/23RS/sb175.html
1717123,2024,SB176,1,Introduced,2023-02-21,"AN ACT relating to economic development.","Amend KRS 154.10-040 to add gender-neutral language.",4437,"Senate Economic Development, Tourism, & Labor",2023-02-23,"to Economic Development, Tourism, & Labor (S)",https://legiscan.com/KY/bill/SB176/2023,https://apps.legislature.ky.gov/record/23RS/sb176.html
1717189,2024,SB177,1,Introduced,2023-02-21,"AN ACT relating to tourism.","Amend KRS 148.0211 to include gender-neutral pronouns.",4437,"Senate Economic Development, Tourism, & Labor",2023-02-23,"to Economic Development, Tourism, & Labor (S)",https://legiscan.com/KY/bill/SB177/2023,https://apps.legislature.ky.gov/record/23RS/sb177.html
1717220,2024,SB178,1,Introduced,2023-02-21,"AN ACT relating to military affairs.","Amend KRS 36.230 to include gender-neutral language.",350,"Senate Veterans, Military Affairs, & Public Protection",2023-02-23,"to Veterans, Military Affairs, & Public Protection (S)",https://legiscan.com/KY/bill/SB178/2023,https://apps.legislature.ky.gov/record/23RS/sb178.html
1717114,2024,SB179,1,Introduced,2023-02-21,"AN ACT relating to public protection.","Amend KRS 75.160, relating to fire chiefs, to include gender-neutral language.",350,"Senate Veterans, Military Affairs, & Public Protection",2023-02-23,"to Veterans, Military Affairs, & Public Protection (S)",https://legiscan.com/KY/bill/SB179/2023,https://apps.legislature.ky.gov/record/23RS/sb179.html
1717279,2024,SB180,1,Introduced,2023-02-21,"AN ACT relating to education.","Amend KRS 156.690 to insert gender-neutral language.",343,"Senate Education",2023-02-23,"to Education (S)",https://legiscan.com/KY/bill/SB180/2023,https://apps.legislature.ky.gov/record/23RS/sb180.html
1717254,2024,SB181,1,Introduced,2023-02-21,"AN ACT relating to education.","Amend KRS 156.690, relating to contracts for personal computers for teachers, to insert gender-neutral language.",343,"Senate Education",2023-02-23,"to Education (S)",https://legiscan.com/KY/bill/SB181/2023,https://apps.legislature.ky.gov/record/23RS/sb181.html
1717270,2024,SB182,1,Introduced,2023-02-21,"AN ACT relating to local government.","Amend KRS 67.410, relating to the fiscal court appointment of building inspectors, to make technical change.",348,"Senate State & Local Government",2023-02-23,"to State & Local Government (S)",https://legiscan.com/KY/bill/SB182/2023,https://apps.legislature.ky.gov/record/23RS/sb182.html
1717116,2024,SB183,1,Introduced,2023-02-21,"AN ACT relating to insurance.","Amend KRS 304.5-150 to include gender-neutral language.",341,"Senate Banking and Insurance",2023-02-23,"to Banking & Insurance (S)",https://legiscan.com/KY/bill/SB183/2023,https://apps.legislature.ky.gov/record/23RS/sb183.html
1717397,2024,SB184,1,Introduced,2023-02-21,"AN ACT relating to natural resources.","Amend KRS 350.028 to include gender-neutral language.",347,"Senate Natural Resources and Energy",2023-02-23,"to Natural Resources & Energy (S)",https://legiscan.com/KY/bill/SB184/2023,https://apps.legislature.ky.gov/record/23RS/sb184.html
1717494,2024,SB185,1,Introduced,2023-02-21,"AN ACT relating to agriculture.","Amend KRS 247.493 to insert gender-neutral references.",339,"Senate Agriculture",2023-02-23,"to Agriculture (S)",https://legiscan.com/KY/bill/SB185/2023,https://apps.legislature.ky.gov/record/23RS/sb185.html
1717336,2024,SB186,1,Introduced,2023-02-21,"AN ACT relating to local government.","Amend KRS 67.160 to make technical change.",348,"Senate State & Local Government",2023-02-23,"to State & Local Government (S)",https://legiscan.com/KY/bill/SB186/2023,https://apps.legislature.ky.gov/record/23RS/sb186.html
1717104,2024,SB187,1,Introduced,2023-02-21,"AN ACT relating to natural resources.","Amend KRS 151.210 to make grammatical and technical corrections, improve readability, and remove arcane language.",347,"Senate Natural Resources and Energy",2023-02-23,"to Natural Resources & Energy (S)",https://legiscan.com/KY/bill/SB187/2023,https://apps.legislature.ky.gov/record/23RS/sb187.html
1717170,2024,SB188,1,Introduced,2023-02-21,"AN ACT relating to agriculture.","Amend KRS 246.040 to make gender-neutral references.",339,"Senate Agriculture",2023-02-23,"to Agriculture (S)",https://legiscan.com/KY/bill/SB188/2023,https://apps.legislature.ky.gov/record/23RS/sb188.html
1717233,2024,SB189,1,Introduced,2023-02-21,"AN ACT relating to local government.","Amend KRS 67.170 to make technical change.",348,"Senate State & Local Government",2023-02-23,"to State & Local Government (S)",https://legiscan.com/KY/bill/SB189/2023,https://apps.legislature.ky.gov/record/23RS/sb189.html
1717472,2024,SB190,4,Passed,2023-03-27,"AN ACT relating to actions of government officials.","Amend KRS 83A.030 to establish guidelines for changing the number of legislative body members in mayor-council form of government; amend KRS 83A.040 to allow submission of resignation via electronic mail, establish effective date of resignation if none is provided by the resignation itself; amend KRS 83A.045 to require that any ordinance eliminating a nonpartisan primary or repealing an ordinance eliminating a nonpartisan primary be filed with the county clerk in the year prior to the year in which city elections are to be held; amend KRS 83A.100 to require that any redistricting be accomplished no later than November in the year preceding elections.",0,,2023-03-27,"signed by Governor (Acts Ch. 114)",https://legiscan.com/KY/bill/SB190/2023,https://apps.legislature.ky.gov/record/23RS/sb190.html
1717340,2024,SB191,1,Introduced,2023-02-21,"AN ACT relating to veterans.","Amend KRS 40.050 to include gender-neutral language.",350,"Senate Veterans, Military Affairs, & Public Protection",2023-02-23,"to Veterans, Military Affairs, & Public Protection (S)",https://legiscan.com/KY/bill/SB191/2023,https://apps.legislature.ky.gov/record/23RS/sb191.html
