bill_id,session_id,bill_number,status,status_desc,status_date,title,description,committee_id,committee,last_action_date,last_action,url,state_link
1718615,2024,HB511,1,Introduced,2023-02-22,"AN ACT relating to assisted living communities.","Amend KRS 194A.703 to require that each assisted living facility that provides basic health and health-related services and dementia care services be classified as an institutional building and require that any assisted living facility that does not provide basic health and health-related services and dementia care services be classified as a residential building; amend KRS 194A.705 to allow a certified medication aide or an unlicensed staff person who has successfully completed a medication aide training program approved by the Kentucky Board of Nursing to administer preloaded injectable insulin or oral or topical medication; amend KRS 194A.710 to establish multiple categories for assisted living community licensure and allow the Office of Inspector General to promulgate administrative regulations and issue license classifications within the bounds of the categories listed in statute; and amend KRS 194A.717 to require a licensed nurse to be available to communicate with unlicensed staff when the staff is providing delegated nursing tasks and revise the staffing on site requirements.",4799,"House Health Services",2023-02-24,"to Health Services (H)",https://legiscan.com/KY/bill/HB511/2023,https://apps.legislature.ky.gov/record/23RS/hb511.html
1718517,2024,HB512,1,Introduced,2023-02-22,"AN ACT relating to expungement.","Amend KRS 431.076 to make technical corrections.",317,"House Committee On Committees",2023-02-22,"to Committee on Committees (H)",https://legiscan.com/KY/bill/HB512/2023,https://apps.legislature.ky.gov/record/23RS/hb512.html
1718507,2024,HB513,2,Engrossed,2023-03-07,"AN ACT relating to ophthalmic dispensers.","Amend KRS 326.080 to require the license renewal fee for practicing ophthalmic dispensing to be established by the Kentucky Board of Ophthalmic Dispensers through promulgation of administrative regulation.",4317,"Senate Licensing and Occupations",2023-03-13,"to Licensing & Occupations (S)",https://legiscan.com/KY/bill/HB513/2023,https://apps.legislature.ky.gov/record/23RS/hb513.html
1718705,2024,HB514,1,Introduced,2023-02-22,"AN ACT relating to housing appropriations.","Amend KRS 198A.705 to make technical corrections.",321,"House Appropriations and Revenue",2023-02-23,"to Appropriations & Revenue (H)",https://legiscan.com/KY/bill/HB514/2023,https://apps.legislature.ky.gov/record/23RS/hb514.html
1718756,2024,HB515,1,Introduced,2023-02-22,"AN ACT relating to custody.","Amend KRS 405.020 to allow people other than parents to petition for custody of child if the parents are claimed to be unfit or have waived their superior rights to custody.",317,"House Committee On Committees",2023-02-22,"to Committee on Committees (H)",https://legiscan.com/KY/bill/HB515/2023,https://apps.legislature.ky.gov/record/23RS/hb515.html
1718541,2024,HB516,1,Introduced,2023-02-22,"AN ACT relating to the 988 suicide and crisis lifeline fund and making an appropriation therefor.","Create a new section of KRS Chapter 210 to create the 988 suicide and crisis lifeline fund; establish authorized uses for moneys in the fund; amend KRS 186.162 to add a specialized license plate for the national 988 suicide and crisis lifeline fund; APPROPRIATION.",321,"House Appropriations and Revenue",2023-02-23,"to Appropriations & Revenue (H)",https://legiscan.com/KY/bill/HB516/2023,https://apps.legislature.ky.gov/record/23RS/hb516.html
1718742,2024,HB517,1,Introduced,2023-02-22,"AN ACT relating to Tax Increment Financing District Funding.","Amend KRS 154.30-090 to make technical correction.",321,"House Appropriations and Revenue",2023-02-23,"to Appropriations & Revenue (H)",https://legiscan.com/KY/bill/HB517/2023,https://apps.legislature.ky.gov/record/23RS/hb517.html
1718697,2024,HB518,1,Introduced,2023-02-22,"AN ACT relating to reproductive privacy.","Create new sections of KRS Chapter 311 to establish reproductive rights and define terms; amend KRS 18A.225 to remove the prohibition of insurance coverage for abortion; amend KRS 39A.180 to allow the Governor to suspend statutes related to abortion during a declared emergency; amend KRS 156.496 to allow a school district to operate a family resource center that provides abortion counseling; amend KRS 205.010 to permit financial aid for an abortion; amend KRS 205.510 to include abortions or induced miscarriages as medical care; amend KRS 205.560 to allow medical aid payments for abortion; amend KRS 211.603 to allow money in the rape crisis trust fund to be used for abortion services or education; amend KRS 212.275 to allow health departments to dispense medication for an abortion; amend KRS 213.101 to remove various reporting requirements; amend various sections to remove penalties associated with performing abortions; amend various sections to conform; repeal, reenact, and amend or repeal and reenact KRS 311.783, 311.7710, 311.820, 311.990, 311.780, 311.810, 311.572, 311.591, 311.686, and 311.852 to conform; repeal KRS 15.241, 213.098, 213.172, 213.174, 213.176, 216B.0435, 216B.200, 216B.202, 216B.204, 216B.206, 216B.208, 216B.210, 304.5-160, 311.710, 311.715, 311.720, 311.723, 311.724, 311.725, 311.727, 311.728, 311.731, 311.732, 311.733, 311.735, 311.750, 311.760, 311.765, 311.770, 311.7701, 311.7702, 311.7703, 311.7704, 311.7705, 311.7706, 311.7707, 311.7708, 311.7709,, 311.7711, 311.772, 311.7731, 311.7733, 311.7734, 311.7735, 311.7737, 311.7739, 311.774, 311.7741, 311.7743, 311.781, 311.7811, 311.782, 311.784, 311.7841, 311.785, 311.786, 311.787, 311.790, 311.800, 311.821, 311.822, 311.823, 311.824, 311.825, 311.826, 311.827, 311.830, 311.992, 315.315.",317,"House Committee On Committees",2023-02-22,"to Committee on Committees (H)",https://legiscan.com/KY/bill/HB518/2023,https://apps.legislature.ky.gov/record/23RS/hb518.html
1718642,2024,HB519,4,Passed,2023-03-30,"AN ACT relating to tourist and convention commissions in counties containing a city of the first class or a consolidated local government and declaring an emergency.","Amend KRS 91A.370 to add the president and chief executive officer of the Kentucky State Fair Board to the tourist and convention commission in counties containing a city of the first class or consolidated local government; EMERGENCY.",0,,2023-03-30,"delivered to Secretary of State (Acts Ch. 143)",https://legiscan.com/KY/bill/HB519/2023,https://apps.legislature.ky.gov/record/23RS/hb519.html
1718848,2024,HB520,1,Introduced,2023-02-22,"AN ACT relating to reemployment after retirement and declaring an emergency.","Provide that any retiree of the Kentucky Employees Retirement System (KERS), County Employees Retirement System (CERS), or State Police Retirement System (SPRS), who returned to work with a KERS, CERS, or SPRS employer on or after March 6, 2020, but prior to January 1, 2023, shall only be required to observe a one month break in employment; provide that the one month break shall be retroactive to March 6, 2020, and that any KERS, CERS, or SPRS retiree whose retirement was voided but who observed the one month break during this time period shall not be required to repay any benefits the systems has determined were paid in error; EMERGENCY.",321,"House Appropriations and Revenue",2023-02-23,"to Appropriations & Revenue (H)",https://legiscan.com/KY/bill/HB520/2023,https://apps.legislature.ky.gov/record/23RS/hb520.html
1718664,2024,HB521,1,Introduced,2023-02-22,"AN ACT relating to assault in the third degree.","Amend KRS 508.025 to include an employee, independent contractor, volunteer, affiliated physician, or other medical professional of a licensed hospital to persons protected by enhanced penalties if assaulted while performing duties.",317,"House Committee On Committees",2023-02-22,"to Committee on Committees (H)",https://legiscan.com/KY/bill/HB521/2023,https://apps.legislature.ky.gov/record/23RS/hb521.html
1718590,2024,HB522,4,Passed,2023-03-31,"AN ACT relating to procurement.","Amend KRS 424.260, relating to local government contracts, to increase amount at which advertisement of bids is required from $30,000 to $40,000.",0,,2023-03-31,"signed by Governor (Acts Ch. 152)",https://legiscan.com/KY/bill/HB522/2023,https://apps.legislature.ky.gov/record/23RS/hb522.html
1718818,2024,HB523,1,Introduced,2023-02-22,"AN ACT relating to adoption.","Amend KRS 199.575 to add gender-neutral language.",317,"House Committee On Committees",2023-02-22,"to Committee on Committees (H)",https://legiscan.com/KY/bill/HB523/2023,https://apps.legislature.ky.gov/record/23RS/hb523.html
1718469,2024,HB524,1,Introduced,2023-02-22,"AN ACT relating to medical procedures.","Amend KRS 311.625 relating to medical procedures, to add gender-neutral language.",317,"House Committee On Committees",2023-02-22,"to Committee on Committees (H)",https://legiscan.com/KY/bill/HB524/2023,https://apps.legislature.ky.gov/record/23RS/hb524.html
1718500,2024,HB525,1,Introduced,2023-02-22,"AN ACT relating to the regulation of skill games and making an appropriation therefor.","Establish KRS Chapter 239 and create new sections to define terms; create the Kentucky Gaming Commission and attach it to the Public Protection Cabinet for administrative purposes; establish requirements for the commissioner and members on the commission; authorize the commission to establish and maintain an office in Frankfort; require the Auditor of Public Accountants to perform an annual audit of the commission; require the commission to promulgate administrative regulations to establish standard forms for the reporting of financial conditions, operational results, gross gaming receipts and adjusted gaming receipts, the amount of prizes paid during specific reporting periods, require periodic financial reports, require annual audits of the financial statements of all licensees regulated under this chapter; authorize the Governor to appoint an executive director; establish qualifications for an executive director of the commission; establish certification requirements for skill games; establish application requirements; authorize the commission to promulgate administrative regulations to establish criminal history checks for applicants; establish fees for initial and renewal license application fees; require decals to appear on every licensed skill game; allow the commission to grant, deny, suspend or revoke a license; allow a license to be transferable subject to the transferee's ability to satisfy all requirements; prohibit the distributor, operator, and establishment from holding multiple licenses; limit an establishment to two terminals per five hundred square feet of public floor common space; limit an establishment to five terminals overall; limit a truck stop to 10 terminals; require terminals to be placed in public floor space visible to patrons and employees; prohibit anyone under the age of 18 from playing a skill game; require an establishment to post problem gaming signage; require all gross profits from a skill game to be subject to a 6% tax; provide penalties for regulated; establish requirements for initial licensure of members on the commission; APPROPRIATION.",321,"House Appropriations and Revenue",2023-02-23,"to Appropriations & Revenue (H)",https://legiscan.com/KY/bill/HB525/2023,https://apps.legislature.ky.gov/record/23RS/hb525.html
1718450,2024,HB526,1,Introduced,2023-02-22,"AN ACT relating to licensing.","Amend KRS 312.021 to create gender-neutral language.",3478,"House Licensing, Occupations & Administrative Regulations",2023-03-02,"to Licensing, Occupations, & Administrative Regulations (H)",https://legiscan.com/KY/bill/HB526/2023,https://apps.legislature.ky.gov/record/23RS/hb526.html
1718645,2024,HB527,1,Introduced,2023-02-22,"AN ACT relating to licensing.","Amend KRS 309.081 to create gender-neutral language.",317,"House Committee On Committees",2023-02-22,"to Committee on Committees (H)",https://legiscan.com/KY/bill/HB527/2023,https://apps.legislature.ky.gov/record/23RS/hb527.html
1718797,2024,HB528,1,Introduced,2023-02-22,"AN ACT relating to coverage for substance use disorder.","Create a new section of Subtitle 17A of KRS Chapter 304 to require certain health insurance policies, plans, certificates, and contracts to provide coverage for the treatment of substance use disorder by an inpatient facility and an in-home program; create new sections of Subtitles 17C and 38A of KRS Chapter 304 and amend KRS 205.522, 205.6485, 164.2871, and 18A.225 to require limited health service benefit plans, limited health service organizations, Medicaid, the Kentucky Children's Health Insurance Program, state postsecondary institution self-insured employer group health plans, and the state employee health plan to comply with the substance use disorder treatment coverage requirement; apply provisions to policies, plans. certificates, and contracts issued or renewed on or after the effective date of the section; require the Cabinet for Health and Family Services to seek federal approval if deemed necessary; EFFECTIVE, in part, January 1, 2024.",317,"House Committee On Committees",2023-03-07,"floor amendment (1) filed",https://legiscan.com/KY/bill/HB528/2023,https://apps.legislature.ky.gov/record/23RS/hb528.html
1718471,2024,HB529,1,Introduced,2023-02-22,"AN ACT relating to school personnel.","Amend KRS 161.155 to require school districts to provide a teacher or employee leave with no loss of income or benefits for 60 school days following an assault against the teacher or employee that results in a physical injury; define the terms of the leave; require the school district to pay for mental health services of the teacher or employee's choosing during the leave period; amend KRS 158.150 to require a local board of education to adopt a policy requiring expulsion when a student physically assaults or batters school personnel; provide that the policy may permit case-by-case exceptions with the consent of the victim; permit the safety of school personnel to be a factor in issuing suspensions and expulsions of primary school students; amend KRS 158.154 to remove the requirement that a physical injury be serious to require a principal to report an assault to law enforcement; amend KRS 158.155 to require mandatory reporters to report assault, batteries, and abuse of school personnel and students on school property.",317,"House Committee On Committees",2023-02-22,"to Committee on Committees (H)",https://legiscan.com/KY/bill/HB529/2023,https://apps.legislature.ky.gov/record/23RS/hb529.html
1718677,2024,HB530,1,Introduced,2023-02-22,"AN ACT relating to workers' compensation for educators.","Create a new section of KRS Chapter 342 to set out when the psychological injuries are valid workers' compensation claims when no physical injury exists; amend KRS 342.0011 to clarify definition of ""injury"" to include psychological injuries experienced by educators.",317,"House Committee On Committees",2023-02-22,"to Committee on Committees (H)",https://legiscan.com/KY/bill/HB530/2023,https://apps.legislature.ky.gov/record/23RS/hb530.html
1718552,2024,HB531,1,Introduced,2023-02-22,"AN ACT relating to city meetings.","Amend KRS 83A.130, 83.140, and 83A.150 to require a city's legislative body to create an agenda prior to every meeting that is distributed to members of the body at least 72 hours prior to the meeting and made available to the public at the time of the meeting.",317,"House Committee On Committees",2023-02-22,"to Committee on Committees (H)",https://legiscan.com/KY/bill/HB531/2023,https://apps.legislature.ky.gov/record/23RS/hb531.html
1718771,2024,HB532,1,Introduced,2023-02-22,"AN ACT relating to electric utilities.","Create a new section of KRS Chapter 96 to require electric utilities that own and operate a municipal electric utility to establish a utility board to administer the functions of the utility; require utility rates, terms of service and customer service to be administered through rules of the board; require rates be fair, just, and reasonable and predicated on the utility cost of service; prohibit commingling of funds between the utility and other local government functions; prohibit the expenditure of utility revenues on any function other than the running of the electric utility; require anyone serving on a utility board to wait one year before serving on the municipal legislative body; require the Kentucky Public Service Commission to provide technical assistance to municipal electric utilities regarding rate setting and provide training for board members in the same manner as is provided to water district commissioners; amend KRS 42.4588 to link eligibility to funds under the Local Government Economic Development Program to compliance with establishing a board and delinking ratemaking and municipal revenue use from the political arena of the city legislative function; amend KRS 96.170 to prohibit a legislative body of a city to set rates for the electric utility; amend KRS 96.200 to prohibit the legislative body of a city from using the revenue from an electric utility for anything other than running the electric utility.",317,"House Committee On Committees",2023-02-22,"to Committee on Committees (H)",https://legiscan.com/KY/bill/HB532/2023,https://apps.legislature.ky.gov/record/23RS/hb532.html
1718782,2024,HB533,1,Introduced,2023-02-22,"AN ACT relating to state dealings with companies that engage in politically sensitive company boycotts.","Amend KRS 41.472 to add definitions for ""agricultural commodities associated company,"" ""firearms goods or services associated company,"" ""petrochemical commodities associated company,"" ""politically sensitive company boycott,"" and ""social media information company""; amend KRS 41.474 to require the Treasurer to maintain and publish lists of all financial companies that engage in any politically sensitive company boycotts; require state governmental entity divestment in financial companies that engage in politically sensitive company boycotts; amend KRS 41.480 to add definitions for ""agricultural commodities associated company,"" ""firearms goods or services associated company,"" ""petrochemical commodities associated company,"" ""politically sensitive company boycott,"" and ""social media information company""; prohibit a governmental entity from entering into a contract for goods or services with a company unless the contract has a written verification that the company does not and will not engage in any politically sensitive company boycotts; allow a company to provide written verification to the Treasurer that not engaging in a politically sensitive company boycott would violate its religious beliefs; provide that a company that has provided verified documentation of its religious beliefs shall not be advantaged or disadvantaged in the contracting process.",317,"House Committee On Committees",2023-02-22,"to Committee on Committees (H)",https://legiscan.com/KY/bill/HB533/2023,https://apps.legislature.ky.gov/record/23RS/hb533.html
1718574,2024,HB534,4,Passed,2023-03-20,"AN ACT relating to required publications.","Amend KRS 424.120 to allow legally required notices in a publication area to be published on a digital newspapers website if that digital newspaper meets certain qualifications; amend KRS 424.145 to allow a local government to publish an advertisement directing the public to its notice website on a digital newspaper website.",0,,2023-03-20,"signed by Governor (Acts Ch. 27)",https://legiscan.com/KY/bill/HB534/2023,https://apps.legislature.ky.gov/record/23RS/hb534.html
1718707,2024,HB535,4,Passed,2023-03-31,"AN ACT relating to criminal justice and making an appropriation therefor.","Amend KRS 15.280 to define ""criminal justice agency""; to require the Criminal Justice Statistical Analysis Center to collect any criminal justice data within the possession of any federal agency of the federal, state, or local government, or private entity; require the center to design a records information system; provide authorization to the center to expend any general, restricted, or federal funds to carry out its functions; APPROPRIATION.",0,,2023-03-31,"signed by Governor (Acts Ch. 153)",https://legiscan.com/KY/bill/HB535/2023,https://apps.legislature.ky.gov/record/23RS/hb535.html
1718531,2024,HB536,1,Introduced,2023-02-22,"AN ACT relating to domestic violence.","Amend KRS Chapter 209A.122 to remove requirement the the Kentucky State Police report the number of domestic violence and dating violence calls and the number of arrests in response to domestic violence calls; require the Department of Kentucky State Police to provide the number of orders of protection served and received by law enforcement agencies and number of orders of protection in LINK to the center; remove the requirement that LINK provide the center with information; remove the requirement that the Division of Kentucky State Medical Examiner's Office provide the center with information; remove the requirement that coroners provide the center with information; amend KRS 15A.190 to identify the uniform reporting form as the JC-3 form; require the Justice and Public Safety Cabinet to promulgate regulations.",327,"House Judiciary",2023-03-14,"returned to Judiciary (H)",https://legiscan.com/KY/bill/HB536/2023,https://apps.legislature.ky.gov/record/23RS/hb536.html
1718777,2024,HB537,1,Introduced,2023-02-22,"AN ACT relating to nonprofit corporations.","Amend KRS 273.303 to permit a dissolving corporation to transfer its assets to any entity engaged in for-profit activities that are substantially similar to those of the dissolving corporation subject to two certain conditions.",317,"House Committee On Committees",2023-02-22,"to Committee on Committees (H)",https://legiscan.com/KY/bill/HB537/2023,https://apps.legislature.ky.gov/record/23RS/hb537.html
1718821,2024,HB538,4,Passed,2023-03-23,"AN ACT relating to discipline of students.","Amend KRS 158.150 to require a local board of education to expel a student for at least 12 months if the student makes threats that pose a danger to other students or staff; require a local board of education to adopt a policy requiring disciplinary actions for a student who assaults other students or staff off campus property; allow a local school board to place a student in an alternative education setting in lieu of expulsion, or at the end of an expulsion; allow a teacher to remove a disruptive student from the classroom; provide that a student who is removed from a classroom three times in 30 days shall be considered chronically disruptive and may be suspended; provide that a principal may permanently remove a disruptive student from a classroom and determine the placement of the student, subject to an appeal process; require a local board of education to conduct an expulsion review process to determine whether a student's expulsion shall continue or end.",0,,2023-03-23,"signed by Governor (Acts Ch. 76)",https://legiscan.com/KY/bill/HB538/2023,https://apps.legislature.ky.gov/record/23RS/hb538.html
1718863,2024,HB539,1,Introduced,2023-02-22,"AN ACT relating to the regulation of game machines and declaring an emergency.","Amend KRS 528.010 to make technical corrections; EMERGENCY.",3478,"House Licensing, Occupations & Administrative Regulations",2023-03-07,"returned to Licensing, Occupations, & Administrative Regulations (H)",https://legiscan.com/KY/bill/HB539/2023,https://apps.legislature.ky.gov/record/23RS/hb539.html
1718519,2024,HB540,4,Passed,2023-03-24,"AN ACT relating to school safety.","Amend KRS 158.441 to include private and parochial schools; amend KRS 158.4414 to specify that private and parochial schools can enter memorandums of understanding with local law enforcement agencies or the Department of Kentucky State Police to provide school resource officers.",0,,2023-03-24,"signed by Governor (Acts Ch. 104)",https://legiscan.com/KY/bill/HB540/2023,https://apps.legislature.ky.gov/record/23RS/hb540.html
1718569,2024,HB541,1,Introduced,2023-02-22,"AN ACT relating to workforce development.","Amend KRS 341.125 to add gender-neutral language.",317,"House Committee On Committees",2023-02-22,"to Committee on Committees (H)",https://legiscan.com/KY/bill/HB541/2023,https://apps.legislature.ky.gov/record/23RS/hb541.html
1718855,2024,HB542,1,Introduced,2023-02-22,"AN ACT relating to workforce development.","Amend KRS. 343.090 to make technical corrections.",321,"House Appropriations and Revenue",2023-03-16,"recommitted to Appropriations & Revenue (H)",https://legiscan.com/KY/bill/HB542/2023,https://apps.legislature.ky.gov/record/23RS/hb542.html
1718685,2024,HB543,1,Introduced,2023-02-22,"AN ACT relating to patient medical records.","Create a new section of KRS Chapter 422 to establish standards and procedures for access to copies of patient medical records for a patient who is under the age of eighteen.",317,"House Committee On Committees",2023-02-22,"to Committee on Committees (H)",https://legiscan.com/KY/bill/HB543/2023,https://apps.legislature.ky.gov/record/23RS/hb543.html
1718537,2024,HB544,4,Passed,2023-03-23,"AN ACT relating to the regulation of hemp-derived products.","Amend KRS 199.900 relating to the Cabinet for Health and Family Services, to add gender-neutral language.",0,,2023-03-23,"signed by Governor (Acts Ch. 78)",https://legiscan.com/KY/bill/HB544/2023,https://apps.legislature.ky.gov/record/23RS/hb544.html
1718466,2024,HB545,1,Introduced,2023-02-22,"AN ACT relating to construction of statutes.","Amend KRS 446.080 to remove provision relating to the construction of statutes.",321,"House Appropriations and Revenue",2023-02-28,"to Appropriations & Revenue (H)",https://legiscan.com/KY/bill/HB545/2023,https://apps.legislature.ky.gov/record/23RS/hb545.html
