bill_id,session_id,bill_number,status,status_desc,status_date,title,description,committee_id,committee,last_action_date,last_action,url,state_link
1700715,2024,HB226,4,Passed,2023-03-22,"AN ACT relating to reorganization.","Create new sections of KRS Chapter 194A to establish the administration of behavioral health community crisis response and transfer the administration from the Department for Military Affairs to the Cabinet for Health and Family Services; repeal KRS 36.250, 36.255, 36.260, 36.265, and 36.270, related to the Kentucky Community Crisis Response Board.",0,,2023-03-22,"signed by Governor (Acts Ch. 58)",https://legiscan.com/KY/bill/HB226/2023,https://apps.legislature.ky.gov/record/23RS/hb226.html
1700741,2024,HB227,1,Introduced,2023-02-08,"AN ACT relating to school fiscal impact statements.","Create a new section of KRS Chapter 6 to establish a school fiscal impact statement to evaluate the potential costs that would be incurred by school districts and other parts of the common school system by passing certain legislation; establish the requirements and components of the statement; authorize the director of the Legislative Research Commission to implement policies and procedures necessary to produce the statements; EFFECTIVE January 1, 2025.",324,"House Education",2023-02-23,"to Education (H)",https://legiscan.com/KY/bill/HB227/2023,https://apps.legislature.ky.gov/record/23RS/hb227.html
1700666,2024,HB228,1,Introduced,2023-02-08,"AN ACT relating to criminal histories of job applicants.","Create a new section of KRS Chapter 344 to prohibit employers from considering or requiring disclosure of prior criminal history as part of the initial job application; provide that the Act may be cited as the Ban the Box - The Criminal Record Employment Discrimination Act.",317,"House Committee On Committees",2023-02-08,"to Committee on Committees (H)",https://legiscan.com/KY/bill/HB228/2023,https://apps.legislature.ky.gov/record/23RS/hb228.html
1700867,2024,HB229,1,Introduced,2023-02-08,"AN ACT relating to the taxation of feminine hygiene products.","Amend KRS 139.010 to define ""feminine hygiene products""; amend KRS 139.480 to exempt from sales and use tax the sale or purchase of feminine hygiene products; EFFECTIVE July 1, 2023.",321,"House Appropriations and Revenue",2023-02-23,"to Appropriations & Revenue (H)",https://legiscan.com/KY/bill/HB229/2023,https://apps.legislature.ky.gov/record/23RS/hb229.html
1700682,2024,HB230,2,Engrossed,2023-03-10,"AN ACT relating to voter registration.","Create a new section of KRS Chapter 116 to require the Secretary of State to quarterly issue a comprehensive status report regarding voter registration records cleanup and maintenance; establish information to be included the report.",348,"Senate State & Local Government",2023-03-13,"to State & Local Government (S)",https://legiscan.com/KY/bill/HB230/2023,https://apps.legislature.ky.gov/record/23RS/hb230.html
1702489,2024,HB231,2,Engrossed,2023-03-02,"AN ACT relating to criminal history record checks.","Create a new section of KRS Chapter 620 to allow the Department for Community Based Services to request a criminal justice agency to perform a federal name-based criminal history record check of each adult residing in a home in which a child is placed during an emergency placement; allow the Department of Kentucky State Police and the Federal Bureau of Investigation to charge a reasonable fee for processing a fingerprint-based criminal history record check.",337,"Senate Rules",2023-03-29,"reported favorably, to Rules as a consent bill",https://legiscan.com/KY/bill/HB231/2023,https://apps.legislature.ky.gov/record/23RS/hb231.html
1702497,2024,HB232,4,Passed,2023-03-17,"AN ACT relating to insurance adjusters.","Amend KRS 304.9-430 and 304.9-433 to increase the minimum financial responsibility requirements for independent, staff, and public adjuster licenses; amend the definition of ""home state""; establish requirements for public adjuster contracts with insureds; make technical corrections; create new sections of Subtitle 9 of KRS Chapter 304 to establish requirements for public adjusters relating to notice rights, inspection and investigation of claims, and conflicts of interest; establish requirements relating to funds received, accepted, or held by public adjusters; establish fee requirements for public adjusters; amend KRS 304.9-440 to establish additional penalties for public adjusters and public adjuster apprentices; provide that the commissioner may promulgate administrative regulations necessary for or as an aid to the effectuation of any provision of the Act.",0,,2023-03-17,"signed by Governor (Acts Ch. 11)",https://legiscan.com/KY/bill/HB232/2023,https://apps.legislature.ky.gov/record/23RS/hb232.html
1702542,2024,HB233,1,Introduced,2023-02-09,"AN ACT relating to maternal health disparities in perinatal care.","Amend KRS 211.680 to expand the scope of the legislative intent and findings; create new sections of KRS Chapter 211 to define terms; require licensed health facilities under KRS Chapter 216B to provide each patient with written information regarding the patient's rights and implement an evidence-based maternal health disparities program for all health providers involved in the perinatal care of patients within those facilities; require the Department for Public Health to track data on maternal death and severe morbidity.",317,"House Committee On Committees",2023-02-09,"to Committee on Committees (H)",https://legiscan.com/KY/bill/HB233/2023,https://apps.legislature.ky.gov/record/23RS/hb233.html
1702434,2024,HB234,1,Introduced,2023-02-09,"AN ACT relating to the Uniform Collaborative Law Act.","Create new Sections of KRS Chapter 403 to enact the Uniform Collaborative Law Act on the recommendation of the National Conference of Commissioners on Uniform State Laws; regulate the use of collaborative law participation agreements as a voluntary form of alternative dispute resolution; provide that the Act may be cited as the Uniform Collaborative Law Act.",317,"House Committee On Committees",2023-02-09,"to Committee on Committees (H)",https://legiscan.com/KY/bill/HB234/2023,https://apps.legislature.ky.gov/record/23RS/hb234.html
1702534,2024,HB235,1,Introduced,2023-02-09,"AN ACT relating to pornography.","Amend KRS 531.070 to remove the educational justification from the exemption of criminal prosecution for pornography.",317,"House Committee On Committees",2023-02-09,"to Committee on Committees (H)",https://legiscan.com/KY/bill/HB235/2023,https://apps.legislature.ky.gov/record/23RS/hb235.html
1702589,2024,HB236,4,Passed,2023-03-24,"AN ACT relating to the fiduciary duties owed to the state-administered retirement systems.","Amend KRS 21.450, 61.650, 78.790, and 161.430 to provide that fiduciaries shall consider the sole interest of the members and beneficiaries of the retirement systems using only pecuniary factors and prohibit the consideration of or actions on nonpecuniary interests including environmental, social, political, and ideological interests.",0,,2023-03-24,"signed by Governor (Acts Ch. 94)",https://legiscan.com/KY/bill/HB236/2023,https://apps.legislature.ky.gov/record/23RS/hb236.html
1702552,2024,HB237,4,Passed,2023-03-21,"AN ACT relating to alcoholic beverages.","Amend KRS 243.020 to allow the possession and consumption of alcoholic beverages at nonlicensed businesses within or sharing a boundary with an entertainment destination center and at licensed premises sharing a boundary with an entertainment destination center; limit the alcoholic beverages to those purchased at the entertainment destination center or at a licensee sharing a boundary with the entertainment destination center; require written permission from the entertainment destination center before the alcoholic beverages may be possessed or consumed at that place of business.",0,,2023-03-21,"signed by Governor (Acts Ch. 39)",https://legiscan.com/KY/bill/HB237/2023,https://apps.legislature.ky.gov/record/23RS/hb237.html
1702452,2024,HB238,4,Passed,2023-03-20,"AN ACT relating to anatomical gift discrimination.","Create a new section in KRS Chapter 311 to prohibit a health care provider from discriminating against an individual who has a disability based solely on the individual's disability when providing health care and other services related to an anatomical gift donation.",0,,2023-03-20,"signed by Governor (Acts Ch. 36)",https://legiscan.com/KY/bill/HB238/2023,https://apps.legislature.ky.gov/record/23RS/hb238.html
1702616,2024,HB239,1,Introduced,2023-02-09,"AN ACT relating to hospital reporting of drug overdose information.","Create a new section of KRS Chapter 216B to require a health care provider to order a quantitative and qualitative toxicology test to determine if a cause of an overdose is from an illicit drug if the person exhibits symptoms of an overdose in the health care provider's professional opinion or the person is known to the health care provider to have had previous overdose treatment; require a report of test findings to law enforcement and the coroner if the person dies while in the hospital; limit the public record of the test finding; provide immunity from civil liability for the health care provider who administers the test.",4799,"House Health Services",2023-02-24,"to Health Services (H)",https://legiscan.com/KY/bill/HB239/2023,https://apps.legislature.ky.gov/record/23RS/hb239.html
1702504,2024,HB240,1,Introduced,2023-02-09,"AN ACT relating to a tax credit for home installations.","Create a new section of KRS Chapter 141 establishing the refundable home modification tax credit, not to exceed $7,500 annually, for qualifying home installations to increase the habitability or efficiency of the residence for individuals that are age 65 or older or have a physical or mental impairment; effective for taxable years beginning on or after January 1, 2024, but before January 1, 2028; amend KRS 141.0205 to establish ordering of the credit; amend KRS 131.190 to allow information to be provided to the Legislative Research Commission.",321,"House Appropriations and Revenue",2023-02-23,"to Appropriations & Revenue (H)",https://legiscan.com/KY/bill/HB240/2023,https://apps.legislature.ky.gov/record/23RS/hb240.html
1702471,2024,HB241,4,Passed,2023-03-20,"AN ACT relating to compulsory attendance.","Amend KRS 159.030 to clarify the evidence requirements for exemption from compulsory attendance due to physical or mental conditions.",0,,2023-03-20,"signed by Governor (Acts Ch. 31)",https://legiscan.com/KY/bill/HB241/2023,https://apps.legislature.ky.gov/record/23RS/hb241.html
1702480,2024,HB242,1,Introduced,2023-02-09,"AN ACT relating to the Commission on Race and Access to Opportunity.","Amend KRS 7.200 to establish an attendance threshold for citizen members of the Commission on Race and Access to Opportunity; establish reporting requirements for appointments and reappointments.",317,"House Committee On Committees",2023-02-09,"to Committee on Committees (H)",https://legiscan.com/KY/bill/HB242/2023,https://apps.legislature.ky.gov/record/23RS/hb242.html
1704003,2024,HB243,1,Introduced,2023-02-10,"AN ACT relating to the promotion of organ and bone marrow donation.","Create a new section of KRS Chapter 141 to establish the employers' organ and bone marrow donation tax credit; amend KRS 141.0205 to provide the ordering of the credit; amend KRS 131.190 to allow disclosure of certain information on the credit to the Legislative Research Commission; declare short title to be the Living Organ and Bone Marrow Donor Assistance Act of 2023.",321,"House Appropriations and Revenue",2023-02-23,"to Appropriations & Revenue (H)",https://legiscan.com/KY/bill/HB243/2023,https://apps.legislature.ky.gov/record/23RS/hb243.html
1703620,2024,HB244,4,Passed,2023-03-31,"AN ACT relating to the Kentucky Guard Youth Challenge Program.","Create a new section of KRS Chapter 36 to establish the Kentucky Guard Youth Challenge Program; outline the purpose of the program; authorize the program to establish high schools to serve the program's students; align program with the federal National Guard Youth Challenge Program; establish the governance of the program; establish guidelines for the operation of the program; establish guidelines for the operation of the high schools operated by the program; authorize the adjutant general or designee to adopt policies for the operation of the program's schools; establish an advisory council for the program; require the adjutant general or designee to enter into a memorandum of agreement to provide for the operation of the program's schools; amend KRS 164.7874 to allow program school students to participate in KEES scholarship program; and amend KRS 164.7885 to conform.",0,,2023-03-31,"signed by Governor (Acts Ch. 151)",https://legiscan.com/KY/bill/HB244/2023,https://apps.legislature.ky.gov/record/23RS/hb244.html
1703794,2024,HB245,1,Introduced,2023-02-10,"AN ACT relating to physician assistants.","Amend KRS 311.844, relating to physician assistants, to revise continuing education requirements and to clarify that proof of completed course work in an individual's graduate program can qualify for pediatric head trauma requirements for licensure renewal; amend KRS 311.854 to modify the application requirements to be a supervising physician.",317,"House Committee On Committees",2023-02-10,"to Committee on Committees (H)",https://legiscan.com/KY/bill/HB245/2023,https://apps.legislature.ky.gov/record/23RS/hb245.html
1703594,2024,HB246,1,Introduced,2023-02-10,"AN ACT relating to childhood sexual assault or abuse.","Amend KRS 413.249 to remove the statute of limitations for civil actions arising from childhood sexual assault or abuse; require every civil action arising from childhood sexual assault or abuse to be accompanied by a motion to seal the record.",317,"House Committee On Committees",2023-02-10,"to Committee on Committees (H)",https://legiscan.com/KY/bill/HB246/2023,https://apps.legislature.ky.gov/record/23RS/hb246.html
1703873,2024,HB247,1,Introduced,2023-02-10,"AN ACT relating to legal actions.","Amend KRS 454.478 to provide that the court may enjoin the responding party from filing any additional actions if a responding party does not pay attorney's fees and costs within 60 days from final judgment of an order under KRS 454.464; provide that the court may subject a responding party to an anti-suit injunction if the court finds that the responding party is a vexatious litigant.",317,"House Committee On Committees",2023-02-10,"to Committee on Committees (H)",https://legiscan.com/KY/bill/HB247/2023,https://apps.legislature.ky.gov/record/23RS/hb247.html
1703671,2024,HB248,4,Passed,2023-03-24,"AN ACT relating to recovery housing.","Create various new sections of KRS Chapter 222 to define terms; require certification for recovery residences; establish requirements for recovery residences; direct the Cabinet for Health and Family Services to promulgate administrative regulations for the certification of recovery residences; require certain entities to refer individuals only to certified recovery residences; permit local governments to assume inspection and enforcement duties; require the Cabinet for Health and Family Services to submit an annual report on certified recovery residences; establish the recovery residence certification trust fund; establish penalties; direct the Department for Medicaid Services to seek approval to provide Medicaid coverage and reimbursement for substance use disorder recovery services provided by a certified recovery residence; APPROPRIATION.",0,,2023-03-24,"signed by Governor (Acts Ch. 85)",https://legiscan.com/KY/bill/HB248/2023,https://apps.legislature.ky.gov/record/23RS/hb248.html
1703846,2024,HB249,4,Passed,2023-03-24,"AN ACT relating to aggravating circumstances.","Amend KRS 532.025 to include the intentional killing of a child under 12 as an aggravating circumstance in cases of offenses for which the death penalty may be authorized; provide that subsection (2)(a)9. of Section 1 of this Act may be cited as Kimber's law.",0,,2023-03-24,"signed by Governor (Acts Ch. 96)",https://legiscan.com/KY/bill/HB249/2023,https://apps.legislature.ky.gov/record/23RS/hb249.html
1703950,2024,HB250,6,Failed,2023-02-16,"AN ACT proposing an amendment to Section 145 of the Constitution of Kentucky relating to persons entitled to vote.","Propose to amend Section 145 of the Constitution of Kentucky to restructure the voting restrictions relating to felons and persons with mental disabilities; ballot language; submit to voters for ratification or rejection.",0,,2023-02-16,WITHDRAWN,https://legiscan.com/KY/bill/HB250/2023,https://apps.legislature.ky.gov/record/23RS/hb250.html
1703694,2024,HB251,1,Introduced,2023-02-10,"AN ACT relating to building code violations.","Amend KRS 198B.130 to establish criteria for a violation for deviation from the Uniform State Building Code.",317,"House Committee On Committees",2023-02-10,"to Committee on Committees (H)",https://legiscan.com/KY/bill/HB251/2023,https://apps.legislature.ky.gov/record/23RS/hb251.html
1703770,2024,HB252,1,Introduced,2023-02-10,"AN ACT relating to immunity from criminal liability for health care providers.","Create a new section of KRS Chapter 311 to define ""health care provider"" and ""health services""; establish that health care providers are immune from criminal liability for harm arising from a health services-related act or omission other than gross negligence or wanton, willful, malicious, or intentional misconduct.",317,"House Committee On Committees",2023-02-10,"to Committee on Committees (H)",https://legiscan.com/KY/bill/HB252/2023,https://apps.legislature.ky.gov/record/23RS/hb252.html
1707273,2024,HB253,1,Introduced,2023-02-14,"AN ACT relating to the posting of veterans' benefits and services.","Create a new section of KRS Chapter 337 to require the Kentucky Department of Veterans' Affairs to create and distribute a veterans' benefits and services document to employers and require employers to keep copies of a veterans' benefits and services document in a conspicuous and accessible place.",317,"House Committee On Committees",2023-02-14,"to Committee on Committees (H)",https://legiscan.com/KY/bill/HB253/2023,https://apps.legislature.ky.gov/record/23RS/hb253.html
1707362,2024,HB254,1,Introduced,2023-02-14,"AN ACT relating to public contracts.","Create a new section of KRS Chapter 45A to prohibit a governmental body from entering into contracts valued at or above $100,000 with a company that has ten or more employees and discriminates against firearm entities or firearm trade associations; set forth what does and does not constitute discrimination; exempt sole proprietorships.",317,"House Committee On Committees",2023-02-14,"to Committee on Committees (H)",https://legiscan.com/KY/bill/HB254/2023,https://apps.legislature.ky.gov/record/23RS/hb254.html
1707307,2024,HB255,1,Introduced,2023-02-14,"AN ACT relating to resources for local development.","Create a new section of KRS Chapter 65 to define ""county""; grant any city or county the right to levy a restaurant tax not to exceed three percent of retail sales; require the revenue to be distributed between the tourist convention commission and taxing jurisdiction; specify uses; exempt restaurants subject to the restaurant tax from certain occupational license fees; mandate first-time tax rate levies and rate changes take effect at the beginning of a calendar month; amend 91A.400 to sunset the levy of a restaurant tax under this section; require distribution of at least 25 percent of revenues generated to the tourist and convention commission; specify uses; exempt restaurants subject to the tax from certain local occupational license fees; amend KRS 67.938, 91A.390, 91.200, 92.281, and 92.300 to conform; EFFECTIVE January 1, 2024.",317,"House Committee On Committees",2023-02-14,"to Committee on Committees (H)",https://legiscan.com/KY/bill/HB255/2023,https://apps.legislature.ky.gov/record/23RS/hb255.html
1707191,2024,HB256,6,Failed,2023-03-30,"AN ACT relating to the regulation of electronic gaming devices and making an appropriation therefor.","Establish KRS Chapter 239 and create new sections to define ""commission,"" ""control,"" ""net proceeds,"" ""electronic gaming device,"" ""location,"" ""local county government,"" ""operator,"" ""truck stop,"" ""vending machine""; create the Kentucky Gaming Commission and attach it to the Public Protection Cabinet for administrative purposes; establish requirements for the commissioner and members on the commission; authorize the commission to establish and maintain an office in Frankfort; require the Auditor of Public Accountants to perform an annual audit of the commission; require the commission to promulgate administrative regulations to establish standard forms for the reporting of financial conditions, operational results, gross gaming receipts and adjusted gaming receipts, the amount of prizes paid during specific reporting periods, require periodic financial reports, require annual audits of the financial statements of all licensees regulated under this chapter, and to define and limit the method of operation of electronic gaming devices; authorize the Governor to appoint an executive director; establish qualifications for an executive director of the commission; establish application requirements; establish requirements for operators and locations; require the owner or manager of a location to ensure that an identifying sticker is affixed to each electronic gaming device on its premises; require the sticker on electronic gaming devices to contain the license number of the operator that supplies the devices and the expiration date of the operator's license; establish local county government responsibilities; prohibit anyone under the age of 21 from playing an electronic gaming device; provide penalties for entities regulated under Sections 1 to 18 of this Act; create a noncodified section to establish requirements for initial licensure of members on the commission.",0,,2023-03-30,WITHDRAWN,https://legiscan.com/KY/bill/HB256/2023,https://apps.legislature.ky.gov/record/23RS/hb256.html
1707124,2024,HB257,2,Engrossed,2023-03-03,"AN ACT relating to donations made to the Commonwealth, making an appropriation therefor, and declaring an emergency.","Create a new section of KRS Chapter 45 to establish the Kentucky contribution trust fund and require reporting of deposits to and expenditures from the fund; amend KRS 12.270 to conform; EMERGENCY.",340,"Senate Appropriations and Revenue",2023-03-07,"to Appropriations & Revenue (S)",https://legiscan.com/KY/bill/HB257/2023,https://apps.legislature.ky.gov/record/23RS/hb257.html
1707266,2024,HB258,2,Engrossed,2023-03-02,"AN ACT relating to reports submitted to the Interim Joint Committee on Appropriations and Revenue.","Amend various sections of the Kentucky Revised Statutes to modify reporting requirements for various state agencies to the Interim Joint Committee on Appropriations and Revenue; repeal KRS 342.231, and 176.5066, relating to reports.",340,"Senate Appropriations and Revenue",2023-03-07,"to Appropriations & Revenue (S)",https://legiscan.com/KY/bill/HB258/2023,https://apps.legislature.ky.gov/record/23RS/hb258.html
1707084,2024,HB259,2,Engrossed,2023-02-24,"AN ACT relating to budget requirements.","Amend KRS 48.020 to remove the requirement that the branch budget recommendation be certified together with the budget statements; amend KRS 48.040 and 48.050 to require the certain budget documents to be submitted on or before October 1 of each odd-numbered year; amend KRS 48.110 to require each branch budget recommendation and all supporting documentation to be submitted in a form and format cooperatively developed by each respective branch of government and the General Assembly and approved by the Legislative Research Commission; amend KRS 48.120 to require the Office of State Budget Director to submit official revenue estimates made by the consensus forecasting group by December 20 of each odd-numbered year; amend KRS 48.170 to allow the standing committees of each house and interim joint committees of the Legislative Research Commission to request additional information and require the information be submitted within 14 days of the request; amend KRS 48.300, 48.810, and 48.950 to conform.",340,"Senate Appropriations and Revenue",2023-03-02,"to Appropriations & Revenue (S)",https://legiscan.com/KY/bill/HB259/2023,https://apps.legislature.ky.gov/record/23RS/hb259.html
1707406,2024,HB260,1,Introduced,2023-02-14,"AN ACT proposing an amendment to Section 170 of the Constitution of Kentucky relating to property exempt from taxation.","Propose to amend Section 170 of the Constitution of Kentucky to increase the homestead exemption to $60,000; require the homestead exemption amount to be indexed every two years; provide ballot language; submit to voters for ratification or rejection.",317,"House Committee On Committees",2023-02-14,"to Committee on Committees (H)",https://legiscan.com/KY/bill/HB260/2023,https://apps.legislature.ky.gov/record/23RS/hb260.html
