bill_id,session_id,bill_number,status,status_desc,status_date,title,description,committee_id,committee,last_action_date,last_action,url,state_link
1642024,2024,HB1,4,Passed,2023-02-17,"AN ACT relating to income taxation.","Amend KRS 141.020 to reduce the individual income tax to 4.5% for taxable years beginning January 1, 2023, and to 4% for taxable years beginning January 1, 2024.",0,,2023-02-17,"signed by Governor (Acts Ch. 3)",https://legiscan.com/KY/bill/HB1/2023,https://apps.legislature.ky.gov/record/23RS/hb1.html
1642011,2024,HB2,4,Passed,2023-02-15,"AN ACT relating to the Bowling Green Veterans Center, making an appropriation therefor, and declaring an emergency.","Provide General Fund moneys in the amount of $16,630,000 in fiscal year 2022-2023 from the Budget Reserve Trust Fund Account to the Department of Veterans' Affairs for construction of the Bowling Green Veterans Center; APPROPRIATION; EMERGENCY.",0,,2023-02-15,"signed by Governor (Acts Ch. 2)",https://legiscan.com/KY/bill/HB2/2023,https://apps.legislature.ky.gov/record/23RS/hb2.html
1698815,2024,HB3,4,Passed,2023-03-27,"AN ACT relating to juvenile justice and making an appropriation therefor.","Amend KRS 610.030 to require a report to the court of truancy cases when there is no action implemented by the response team within 90 days; require a court-designated worker to make a finding if diversion is failed due to lack of parental cooperation; allow a court to refer cases back to the court-designated worker and order parental cooperation; amend KRS 610.990 to establish penalty; amend KRS 610.265 to require children charged with serious felony offenses to be detained pending a detention hearing and to be evaluated for treatment; amend KRS 610.340 to provide that confidentiality does not apply to cases in which a child has admitted to or been adjudicated for a violent felony offense for five years; direct renovations to the Jefferson County Youth Detention Center; APPROPRIATION.",0,,2023-03-27,"signed by Governor (Acts Ch. 105)",https://legiscan.com/KY/bill/HB3/2023,https://apps.legislature.ky.gov/record/23RS/hb3.html
1704079,2024,HB4,4,Passed,2023-03-30,"AN ACT relating to merchant electric generating facilities and making an appropriation therefor.","Amend KRS 278.702 to provide that the terms of service for the ad hoc members of the Kentucky State Board on Electric Generation and Transmission Siting end when the merchant electric generating facility for which they were appointed has been constructed and has begun generating electricity for sale or its construction certificate expires; amend KRS 278.704 to lengthen the period of time that a construction certificate for a merchant electric generating facility is valid from 2 years to 3 years; include decommissioning requirements within the requirements over which local planning and zoning requirements shall have primacy; remove outdated language; amend KRS 278.706 to require that a decommissioning plan be included in an application for construction of a merchant electric generating facility; establish minimum requirements for a decommissioning plan; require as part of a decommission plan that a bond or similar security be secured to assure that the decommissioning plan is accomplished; establish requirements for how the bond is set and how the beneficiaries of the bond are to be determined; require that certain components of the decommissioning plan be incorporated into the construction certificate applicant's leases with landowners; amend KRS 278.708 to reference the transfer of the enforcement authority for mitigation measures that are conditions of application approval from the board to the Energy and Environment Cabinet; amend KRS 278.710 to include whether the decommissioning plan is complete and complies with the requirements of the Act in the criteria for approval of a construction certificate for a merchant electric generating facility; require a person that has received a construction certificate for a merchant electric generating facility file with the Energy and Environment Cabinet the copy of the bond or similar security no later than the date that construction commences for the facility; require that an updated copy of the bond or similar security be refiled at least once every 5 years thereafter; require notice to be filed with the Energy and Environment Cabinet when the construction of the merchant electric generating facility is complete and has begun producing electricity for sale; require that notice be given of any transaction involving the sale or transfer of ownership of the facility to the Energy and Environment Cabinet and local officials within 10 days of finalizing the transaction; require a person who has acquired a merchant electric generating facility to file with the Energy and Environment Cabinet written consent to assume the obligations in the decommissioning plan for the facility and to adopt or replace the required decommissioning bond; provide that the transferor of control of a merchant electric generating facility remain liable for its decommissioning obligations until the transferee completes the documentation required by the Act and the secretary of the Energy and Environment cabinet accepts it as complete; provide that application approval conditions that require approval of transfer of control shall be void and unenforceable, subject to the requirements of the section; provide that after the application for a construction certificate for a merchant electric generating facility has been approved, the bond required by the Act has been posted, the facility has been constructed, and it has begun generating electricity for sale, the secretary of the Energy and Environment Cabinet shall ensure the facility's ongoing compliance with the requirements of KRS 278.700 to 278.716 and the conditions of its construction certificate approval, including updating its decommissioning plan and bond amounts at least once every 5 years; transfer the enforcement authority for mitigation measures that are conditions of application approval from the board to the Energy and Environment Cabinet once the facility is constructed and begins generating electricity for sale; require that while the electric merchant generating facility is operational, if solar panels are removed and discarded, the discarded solar panels be removed from the site within 90 days of the completion of the work; amend KRS 278.718 to provide that an ordinance, permit, or license issued by a local government shall have primacy over the requirements of KRS 278.700 and Sections 2, 3, and 4 of this Act; amend KRS 224.10-100 to authorize the Energy and Environment Cabinet to monitor and enforce compliance of merchant electric generating entities with the requirements of the Act; authorize the Energy and Environment Cabinet to draw upon a decommissioning bond or other similar security for which it is named a beneficiary to complete an approved decommissioning plan; amend KRS 224.99-010 to give jurisdiction to the Circuit Court in any county where a merchant electric generating facility is located for actions arising from or related to certain provisions of the Act; allow for a civil penalty not to exceed $2,500 per day to be imposed for violation of the bonding and bond transfer requirements in the Act; allow for the suspension of a merchant electric generating facility's operations for failing to pay civil penalties or complying with the bonding transfer requirements of the Act; allow for the decommissioning of the facility if it is still noncompliant after 90 days of suspension of its operation; create a new section of Subchapter 10 of KRS Chapter 224 to require that if a merchant electric facility fails to complete its decommissioning plan within 18 months of ceasing to produce electricity for sale, then the cabinet shall draw upon the decommissioning bond and implement the decommissioning plan; require the Energy and Environment Cabinet within 90 days of the effective date of the Act to promulgate administrative regulations to establish the monitoring and enforcement of the bonding and bond transfer requirements of the Act; allow the Energy and Environment Cabinet to establish a fee structure to cover the costs of its enforcement responsibilities; establish the merchant electric generating facility monitoring and enforcement fund to receive the fees and penalties collected by the Energy and Environment Cabinet pursuant to their monitoring and enforcement responsibilities under the Act; require that the funds collected only be used to defray the Energy and Environment Cabinet's costs related to their monitoring and enforcement responsibilities under the Act; require that all expenses for the determination of the bond amount and for the procurement of decommissioning services by the Energy and Environment be paid by the owner of the merchant electric generating facility; APPROPRIATION.",0,,2023-03-30,"delivered to Secretary of State (Acts Ch. 140)",https://legiscan.com/KY/bill/HB4/2023,https://apps.legislature.ky.gov/record/23RS/hb4.html
1718794,2024,HB5,4,Passed,2023-03-31,"AN ACT relating to fiscal matters and declaring an emergency.","Amend KRS 132.140 to allow an exemption of the property tax on distilled spirits stored or aging in barrels located in a bonded warehouse or premises; amend KRS 141.389 to allow the distilled spirits income tax credit only to taxable years beginning prior to January 1, 2024, but allow the accumulated credit to be claimed after that date; prohibit the Department of Revenue from considering any settlement agreement between the department and any taxpayer having distilled spirits in a bonded warehouse to be null and void; allow the agreement to be renegotiated; require the renegotiated agreement to be promulgated in an administrative regulation following the renegotiation process.",0,,2023-03-31,"signed by Governor (Acts Ch. 148)",https://legiscan.com/KY/bill/HB5/2023,https://apps.legislature.ky.gov/record/23RS/hb5.html
1718808,2024,HB6,1,Introduced,2023-02-22,"AN ACT relating to peace officer certification.","Amend KRS 15.392 to include gender-neutral language.",317,"House Committee On Committees",2023-03-02,"returned to Committee on Committees (H)",https://legiscan.com/KY/bill/HB6/2023,https://apps.legislature.ky.gov/record/23RS/hb6.html
1718724,2024,HB7,1,Introduced,2023-02-22,"AN ACT relating to state government.","Amend KRS 61.101, relating to government employment, to insert gender-neutral language.",317,"House Committee On Committees",2023-03-02,"returned to Committee on Committees (H)",https://legiscan.com/KY/bill/HB7/2023,https://apps.legislature.ky.gov/record/23RS/hb7.html
1718484,2024,HB8,1,Introduced,2023-02-22,"AN ACT relating to local government.","Amend KRS 67.160 to make technical change.",317,"House Committee On Committees",2023-03-02,"returned to Committee on Committees (H)",https://legiscan.com/KY/bill/HB8/2023,https://apps.legislature.ky.gov/record/23RS/hb8.html
1718691,2024,HB9,4,Passed,2023-04-07,"AN ACT relating to economic relief for local communities of the Commonwealth and making an appropriation therefor.","Create new sections of KRS Chapter 147A to enable the Department for Local Government to enter a partnership with the Kentucky Council of Area Development Districts for create and administer the Government Resources Accelerating Needed Transformation Program; define terms; require the Department for Local Government in partnership with the Kentucky Council of Area Development Districts to create and administer the program; establish the duties of the Department for Local Government and the Kentucky Council of Area Development Districts in the implementation of the program; establish a sunset provision of December 31, 2026; establish requirements for grant applications; create a fund for the program; establish project evaluation and scoring requirements; establish program reporting requirements; cite as the Government Resources Accelerating Needed Transformation Act.",0,,2023-04-07,"signed by Governor (Acts Ch. 186)",https://legiscan.com/KY/bill/HB9/2023,https://apps.legislature.ky.gov/record/23RS/hb9.html
1642063,2024,HB10,1,Introduced,2023-01-03,"AN ACT relating to registration of professional employer organizations and declaring an emergency.","Amend KRS 336.236 to change the registration period for existing professional employer organizations as of July 14, 2022, to register with the Department of Workers' Claims by July 15, 2024; amend KRS 336.248 to require professional employer organizations to report and pay all unemployment insurance fund contributions using the state employer identification number and contribution rate of the client between the effective date of the Act and December 31, 2024; provide that after January 1, 2025, the professional employer organization shall report and pay all unemployment insurance fund contributions using the state employer identification number and contribution rate of the professional employer organization; amend KRS 336.250 to prohibit professional employer organizations from operating in Kentucky after July 15, 2024, without registering with the Department of Workers' Claims; provide that provisions in KRS 336.230 to 336.250 not amended in this Act are not changed; prohibit the Education and Labor Cabinet from requiring or enforcing certain reporting or payment for the period between July 14, 2022, and when this Act takes effect; EMERGENCY.",321,"House Appropriations and Revenue",2023-02-07,"recommitted to Appropriations & Revenue (H)",https://legiscan.com/KY/bill/HB10/2023,https://apps.legislature.ky.gov/record/23RS/hb10.html
1642194,2024,HB11,2,Engrossed,2023-01-05,"AN ACT amending the 2022-2024 Transportation Cabinet biennial budget, making an appropriation therefor, and declaring an emergency.","Amend the 2022-2024 Transportation Cabinet biennial budget to remove the $17,364,000 General Fund appropriation for the Electric Vehicle Charging Program in fiscal year 2022-2023; APPROPRIATION; EMERGENCY.",340,"Senate Appropriations and Revenue",2023-01-06,"to Appropriations & Revenue (S)",https://legiscan.com/KY/bill/HB11/2023,https://apps.legislature.ky.gov/record/23RS/hb11.html
1642040,2024,HB12,1,Introduced,2023-01-03,"AN ACT relating to operating a motor vehicle.","Amend KRS 189.292 to define "" operating a motor vehicle,"" ""stand-alone electronic device,"" and ""use""; prohibit the use of a personal communication device or stand-alone electronic device while operating a motor vehicle; exempt school bus operators who are instead subject to KRS 281A.205; set forth exceptions; amend KRS 189.294 to provide that persons under 18 years shall not use a personal communication device or stand-alone electronic device in any manner while driving; amend KRS 189.990 to set forth penalties for the violation of KRS 189.292 and 189.294; create a new section of KRS Chapter 281A to apply these provisions to commercial motor vehicle drivers; amend KRS 189.2327 to conform; provide that the Act may be cited as the Phone-Down Kentucky Act.",335,"House Transportation",2023-02-16,"to Transportation (H)",https://legiscan.com/KY/bill/HB12/2023,https://apps.legislature.ky.gov/record/23RS/hb12.html
1642170,2024,HB13,4,Passed,2023-03-29,"AN ACT relating to commercial driver's licenses.","Amend KRS 281A.175, regarding commercial driver's licenses with a school bus endorsement, to increase the time period allowed for the required physical examination from 12 to 24 months.",0,,2023-03-29,"became law without Governor's Signature (Acts Ch. 121)",https://legiscan.com/KY/bill/HB13/2023,https://apps.legislature.ky.gov/record/23RS/hb13.html
1642070,2024,HB14,1,Introduced,2023-01-03,"AN ACT relating to special license plates.","Create a new section of KRS Chapter 186 to create an EMS special license plate; limit eligibility to certain licensed EMS personnel or retirees with 20 years of service; specify that the EMS plate requires no minimum number of applications prior to production; amend KRS 186.162 to establish the fees for the EMS special license plate, including an additional contribution to the Kentucky EMS Memorial Foundation; amend KRS 186.166 to update the list of special license plates to be perpetually produced; EFFECTIVE January 1, 2024.",335,"House Transportation",2023-03-09,"to Transportation (H)",https://legiscan.com/KY/bill/HB14/2023,https://apps.legislature.ky.gov/record/23RS/hb14.html
1642220,2024,HB15,1,Introduced,2023-01-03,"AN ACT relating to family care leave.","Amend KRS 337.010 to define ""family care leave,"" ""family member,"" ""health care provider,"" ""same employer,"" and ""serious health condition""; create a new section of KRS Chapter 337 to prohibit employers from refusing to grant a qualified an employee family care leave; entitle an employee to family care leave for the birth of a child or to take care of a family member and establish parameters.",317,"House Committee On Committees",2023-01-03,"to Committee on Committees (H)",https://legiscan.com/KY/bill/HB15/2023,https://apps.legislature.ky.gov/record/23RS/hb15.html
1642023,2024,HB16,1,Introduced,2023-01-03,"AN ACT relating to health care to provide for an all-payer claims database and making an appropriation therefor.","Create a new section of KRS Chapter 194A to require the executive director of the Office of Data Analytics to establish an advisory committee to make recommendations regarding the creation and implementation of a Kentucky all-payer claims database; establish the Kentucky all-payer claims database fund; require the executive director to establish the database if certain conditions are met; set forth requirements for the database; amend KRS 194A.101 to conform; amend KRS 304.2-100 to require the commissioner of the Department of Insurance to assist in carrying out database; create a new section of Subtitle 99 of KRS Chapter 304 to require the commissioner to promulgate administrative regulations designating the assessment of a fine for persons that do not comply with reporting requirements; establish short title; permit the executive director to make an application for a grant under 42 U.S.C. sec. 247d-11; APPROPRIATION.",317,"House Committee On Committees",2023-01-03,"to Committee on Committees (H)",https://legiscan.com/KY/bill/HB16/2023,https://apps.legislature.ky.gov/record/23RS/hb16.html
1642227,2024,HB17,1,Introduced,2023-01-03,"AN ACT relating to full-day kindergarten.","Amend KRS 158.060 to remove language that allows for half-day kindergarten programs; amend KRS 157.320, 157.360, and 158.030 to conform; EFFECTIVE July 1, 2024.",321,"House Appropriations and Revenue",2023-02-09,"to Appropriations & Revenue (H)",https://legiscan.com/KY/bill/HB17/2023,https://apps.legislature.ky.gov/record/23RS/hb17.html
1641996,2024,HB18,1,Introduced,2023-01-03,"AN ACT relating to dual credit scholarships.","Amend KRS 164.786 to increase the dual credit tuition rate ceiling amount; add eligibility for high school freshmen and sophomores; expand the scholarship to include two career and technical education courses in each year of high school and four general education or career and technical education courses in any combination over the junior and senior years; amend KRS 164.787 to delete the dual credit provisions from the Work Ready Kentucky Scholarship Program; effective July 1, 2024.",321,"House Appropriations and Revenue",2023-02-22,"recommitted to Appropriations & Revenue (H)",https://legiscan.com/KY/bill/HB18/2023,https://apps.legislature.ky.gov/record/23RS/hb18.html
1642161,2024,HB19,1,Introduced,2023-01-03,"AN ACT relating to an exemption of income taxation for military pensions.","Amend KRS 141.019 to exclude all distributions from military pension plans received by retired members of the United States military and their surviving spouses or former spouses under a survivor benefit plan from income taxation for taxable years beginning on or after January 1, 2023; require reporting by the Department of Revenue; amend KRS 131.190 to conform.",321,"House Appropriations and Revenue",2023-02-23,"to Appropriations & Revenue (H)",https://legiscan.com/KY/bill/HB19/2023,https://apps.legislature.ky.gov/record/23RS/hb19.html
1642052,2024,HB20,1,Introduced,2023-01-03,"AN ACT relating to school building projects.","Amend KRS 162.070 to increase the minimum amount for advertising and bidding school building projects from $7,500 to $30,000; require reporting for contracts under $30,000; require a board of education policy on small purchase procedures that includes at least three quotes for projects greater than $7,500 and less than $30,000.",317,"House Committee On Committees",2023-01-03,"to Committee on Committees (H)",https://legiscan.com/KY/bill/HB20/2023,https://apps.legislature.ky.gov/record/23RS/hb20.html
1642226,2024,HB21,4,Passed,2023-04-07,"AN ACT relating to the Transportation Cabinet.","Amend KRS 186.412 to require the Transportation Cabinet to promulgate administrative regulations to establish procedures and forms to allow an individual without a fixed, permanent address to submit a form signed by a shelter, health care facility, or other social service agency attesting to the applicant's residence for the purpose of issuance of a renewal operator's license or an initial or renewal personal ID card and to allow use of the forms established by the cabinet to be used for application for a duplicate operator's license or personal identification card; amend KRS 186.4122 to allow a homeless minor over the age of 16 to apply for a personal identification card without a parent or guardian signature, and to retain current procedures for proving residency for homeless individuals obtaining a personal identification card until July 1, 2025, after which time these individuals will use cabinet forms; amend KRS 186.4123 to conform; amend KRS 186.531 to set the price of a personal identification card for an individual without a fixed, permanent address at $5, eliminate the fee schedule for operator's licenses and personal identification cards issued by circuit clerks, and allow the Transportation Cabinet to enter into billing arrangements with social service agencies for payment of client's fees; Section 1 EFFECTIVE July 1, 2025.",0,,2023-04-07,"signed by Governor (Acts Ch. 185)",https://legiscan.com/KY/bill/HB21/2023,https://apps.legislature.ky.gov/record/23RS/hb21.html
1642120,2024,HB22,1,Introduced,2023-01-03,"AN ACT relating to the regulation of cannabis and making an appropriation therefor.","Establish KRS Chapter 245, relating to cannabis, to administer its cultivation, processing, transportation, sale, use, taxation, and licensing; define terms; establish the Cannabis Control Board and its membership, procedures, powers, and duties; direct the board to promulgate administrative regulations for the administration and enforcement of the chapter; set up advisory committees appointed by the board; create the Department of Cannabis Control within the Public Protection Cabinet for the oversight of cannabis operations and to provide administrative support for the board; establish various one-year business licenses under the chapter; grant administrative hearings under KRS Chapter 13B to appeal a license denial or revocation; forbid an employer from discriminating against applicants or employees who use cannabis outside of working hours as long as the use does not affect job performance; prohibit a person under the age of 21 from purchasing, possessing, consuming, or using cannabis; establish a revolving account called the ""cannabis fund"" to collect cannabis licensing fees, fines, excise taxes, and any other funds; form the Social Impact Council as a public agency authorized to distribute moneys from the cannabis fund; set council membership, procedures, powers, and duties; create new sections of KRS Chapter 138 to define terms; impose an excise tax at a rate set by the Cannabis Control Board on the first sale or transfer of harvested cannabis; establish excise tax reporting, collection, and liability; amend KRS 139.472 to exempt medical cannabis and accessories from sales and use taxes; create a new section of KRS Chapter 65 to authorize local governments to levy up to a 5% license fee on the gross receipts of a retailer or microbusiness; allow overlapping local governments to agree to levy a combined license fee, with set fee amounts absent an agreement; amend KRS 2.015 to require a person to be 21 years of age or older to purchase cannabis and its products and accessories; create new sections of KRS 218A and amend KRS 218A.1421, 218A.1422, 218A.1423, and 218A.500 to exempt licensed cannabis activities from criminal marijuana offenses; create a new section of KRS Chapter 431 to allow a person to petition the court to expunge the person's misdemeanor marijuana offenses; amend KRS 431.079 to exclude the expungement petition from the certification of eligibility requirement; amend KRS 131.1815 to notify the Cannabis Control Board if a cannabis licensee is a delinquent taxpayer; amend KRS 600.020 to include cannabis offenses in the list of juvenile status offenses; amend KRS 12.020 to add the governmental entities created in KRS Chapter 245 to the list of executive branch government bodies; set initial terms for members of the Cannabis Control Board and Social Impact Council; apply the excise tax beginning on July 1, 2024, and allow cannabis sales beginning on July 1, 2025; Section 31 of Act RETROACTIVE; APPROPRIATION.",321,"House Appropriations and Revenue",2023-02-23,"to Appropriations & Revenue (H)",https://legiscan.com/KY/bill/HB22/2023,https://apps.legislature.ky.gov/record/23RS/hb22.html
