bill_id,session_id,bill_number,status,status_desc,status_date,title,description,committee_id,committee,last_action_date,last_action,url,state_link
1785374,2124,HB1111,2,Engrossed,2024-03-06,"Relative to the penalty for false reports of suspected abuse and neglect made to the division for children, youth, and families.","Relative to the penalty for false reports of suspected abuse and neglect made to the division for children, youth, and families.",0,,2024-05-02,"Inexpedient to Legislate, Motion Adopted, Voice Vote === BILL KILLED ===; 05/02/2024; Senate Journal 11",https://legiscan.com/NH/bill/HB1111/2024,https://gencourt.state.nh.us/bill_status/legacy/bs2016/bill_status.aspx?lsr=2071&sy=2024&sortoption=&txtsessionyear=2024&txtbillnumber=HB1111
1785548,2124,HB1112,1,Introduced,2023-11-28,"Relative to establishing a continuing education requirement regarding human trafficking for individuals licensed by the office of professional licensure and certification.","Relative to establishing a continuing education requirement regarding human trafficking for individuals licensed by the office of professional licensure and certification.",0,,2024-02-15,"Inexpedient to Legislate: Motion Adopted Voice Vote 02/15/2024 House Journal  5 P. 8",https://legiscan.com/NH/bill/HB1112/2024,https://gencourt.state.nh.us/bill_status/legacy/bs2016/bill_status.aspx?lsr=2072&sy=2024&sortoption=&txtsessionyear=2024&txtbillnumber=HB1112
1785637,2124,HB1113,4,Passed,2024-07-22,"Relative to shoreland septic systems.","Relative to shoreland septic systems.",0,,2024-07-22,"Signed by Governor Sununu 07/03/2024; Chapter 107; eff. 09/01/2024",https://legiscan.com/NH/bill/HB1113/2024,https://gencourt.state.nh.us/bill_status/legacy/bs2016/bill_status.aspx?lsr=2079&sy=2024&sortoption=&txtsessionyear=2024&txtbillnumber=HB1113
1785694,2124,HB1114,4,Passed,2024-07-22,"Extending the commission to investigate and analyze the environmental and public health impacts relating to releases of perfluorinated chemicals in the air, soil, and groundwater in Merrimack, Bedford, Londonderry, Hudson and Litchfield.","Extending the commission to investigate and analyze the environmental and public health impacts relating to releases of perfluorinated chemicals in the air, soil, and groundwater in Merrimack, Bedford, Londonderry, Hudson and Litchfield.",0,,2024-07-22,"Signed by Governor Sununu 07/12/2024; Chapter 187; eff. 07/12/2024",https://legiscan.com/NH/bill/HB1114/2024,https://gencourt.state.nh.us/bill_status/legacy/bs2016/bill_status.aspx?lsr=2085&sy=2024&sortoption=&txtsessionyear=2024&txtbillnumber=HB1114
1785458,2124,HB1115,2,Engrossed,2024-03-26,"Relative to the termination of tenancy at the expiration of the tenancy or lease term.","Relative to the termination of tenancy at the expiration of the tenancy or lease term.",0,,2024-04-26,"Refer to Interim Study, Motion Adopted, Voice Vote; 05/02/2024; Senate Journal 11",https://legiscan.com/NH/bill/HB1115/2024,https://gencourt.state.nh.us/bill_status/legacy/bs2016/bill_status.aspx?lsr=2089&sy=2024&sortoption=&txtsessionyear=2024&txtbillnumber=HB1115
1785486,2124,HB1116,4,Passed,2024-07-22,"Relative to certain firearms to be used for taking of game.","Relative to certain firearms to be used for taking of game.",0,,2024-07-22,"Signed by Governor Sununu 07/03/2024; Chapter 108; eff. 01/01/2025",https://legiscan.com/NH/bill/HB1116/2024,https://gencourt.state.nh.us/bill_status/legacy/bs2016/bill_status.aspx?lsr=2090&sy=2024&sortoption=&txtsessionyear=2024&txtbillnumber=HB1116
1785420,2124,HB1117,1,Introduced,2023-11-28,"Relative to creating a committee to study the protection of business operators against requests to accommodate customers with fraudulent or untrained service animals.","Relative to creating a committee to study the protection of business operators against requests to accommodate customers with fraudulent or untrained service animals.",0,,2024-09-25,"Executive Session: 10/17/2024 10:00 am Legislative Office Building 302-304",https://legiscan.com/NH/bill/HB1117/2024,https://gencourt.state.nh.us/bill_status/legacy/bs2016/bill_status.aspx?lsr=2092&sy=2024&sortoption=&txtsessionyear=2024&txtbillnumber=HB1117
1785684,2124,HB1118,2,Engrossed,2024-03-13,"Relative to the issuance of drivers' licenses for aliens temporarily residing in New Hampshire.","Relative to the issuance of drivers' licenses for aliens temporarily residing in New Hampshire.",0,,2024-05-23,"Refer to Interim Study, Motion Adopted, Voice Vote; 05/23/2024; Senate Journal 15",https://legiscan.com/NH/bill/HB1118/2024,https://gencourt.state.nh.us/bill_status/legacy/bs2016/bill_status.aspx?lsr=2525&sy=2024&sortoption=&txtsessionyear=2024&txtbillnumber=HB1118
1785721,2124,HB1119,2,Engrossed,2024-04-02,"Relative to absentee ballots.","Relative to absentee ballots.",0,,2024-05-22,"Refer to Interim Study, Motion Adopted, Voice Vote; 05/22/2024; Senate Journal 14",https://legiscan.com/NH/bill/HB1119/2024,https://gencourt.state.nh.us/bill_status/legacy/bs2016/bill_status.aspx?lsr=2533&sy=2024&sortoption=&txtsessionyear=2024&txtbillnumber=HB1119
1785508,2124,HB1120,1,Introduced,2023-11-28,"Repealing the provision that requires the reflection of municipal body votes on warrant articles.","Repealing the provision that requires the reflection of municipal body votes on warrant articles.",0,,2024-03-07,"Inexpedient to Legislate: Motion Adopted Regular Calendar 264-95 03/07/2024 House Journal  7 P. 81",https://legiscan.com/NH/bill/HB1120/2024,https://gencourt.state.nh.us/bill_status/legacy/bs2016/bill_status.aspx?lsr=2544&sy=2024&sortoption=&txtsessionyear=2024&txtbillnumber=HB1120
1785729,2124,HB1121,4,Passed,2024-07-26,"Relative to creating certain wetlands permit exemptions after a natural disaster or flooding event.","Relative to creating certain wetlands permit exemptions after a natural disaster or flooding event.",0,,2024-07-26,"Signed by Governor Sununu 07/19/2024; Chapter 219; eff. 09/17/2024",https://legiscan.com/NH/bill/HB1121/2024,https://gencourt.state.nh.us/bill_status/legacy/bs2016/bill_status.aspx?lsr=2548&sy=2024&sortoption=&txtsessionyear=2024&txtbillnumber=HB1121
1785361,2124,HB1122,4,Passed,2024-07-26,"Relative to lights on motor vehicles.","Relative to lights on motor vehicles.",0,,2024-07-26,"Signed by Governor Sununu 07/19/2024; Chapter 220; eff.09/17/2024",https://legiscan.com/NH/bill/HB1122/2024,https://gencourt.state.nh.us/bill_status/legacy/bs2016/bill_status.aspx?lsr=2560&sy=2024&sortoption=&txtsessionyear=2024&txtbillnumber=HB1122
1785676,2124,HB1123,1,Introduced,2023-11-28,"Relative to the registration of title exempt vehicles without disclosure of personal information beyond name and address.","Relative to the registration of title exempt vehicles without disclosure of personal information beyond name and address.",0,,2024-03-07,"Inexpedient to Legislate: Motion Adopted Voice Vote 03/07/2024 House Journal  7 P. 24",https://legiscan.com/NH/bill/HB1123/2024,https://gencourt.state.nh.us/bill_status/legacy/bs2016/bill_status.aspx?lsr=2576&sy=2024&sortoption=&txtsessionyear=2024&txtbillnumber=HB1123
1785582,2124,HB1124,2,Engrossed,2024-03-26,"Relative to limiting conflicts of interest for municipal board and committee members.","Relative to limiting conflicts of interest for municipal board and committee members.",0,,2024-05-22,"Refer to Interim Study, Motion Adopted, Voice Vote; 05/22/2024; Senate Journal 14",https://legiscan.com/NH/bill/HB1124/2024,https://gencourt.state.nh.us/bill_status/legacy/bs2016/bill_status.aspx?lsr=2582&sy=2024&sortoption=&txtsessionyear=2024&txtbillnumber=HB1124
1785741,2124,HB1125,4,Passed,2024-07-22,"Relative to requiring public notice and comment at all county commissioner and delegation meetings.","Relative to requiring public notice and comment at all county commissioner and delegation meetings.",0,,2024-07-22,"Signed by Governor Sununu 07/03/2024; Chapter 109; eff. 09/01/2024",https://legiscan.com/NH/bill/HB1125/2024,https://gencourt.state.nh.us/bill_status/legacy/bs2016/bill_status.aspx?lsr=2594&sy=2024&sortoption=&txtsessionyear=2024&txtbillnumber=HB1125
1785368,2124,HB1126,4,Passed,2024-07-26,"Relative to candidate requests for absentee ballot information.","Relative to candidate requests for absentee ballot information.",0,,2024-07-26,"Signed by Governor Sununu 07/19/2024; Chapter 221; eff.09/17/2024",https://legiscan.com/NH/bill/HB1126/2024,https://gencourt.state.nh.us/bill_status/legacy/bs2016/bill_status.aspx?lsr=2614&sy=2024&sortoption=&txtsessionyear=2024&txtbillnumber=HB1126
1785498,2124,HB1127,4,Passed,2024-08-07,"Relative to the revocation and suspension of drivers' licenses and to invalidating out-of-state driver's licenses issued to undocumented immigrants.","Relative to the revocation and suspension of drivers' licenses and to invalidating out-of-state driver's licenses issued to undocumented immigrants.",0,,2024-08-07,"Signed by Governor Sununu 08/02/2024; Chapter 328; eff. 01/01/2025 House Journal  16",https://legiscan.com/NH/bill/HB1127/2024,https://gencourt.state.nh.us/bill_status/legacy/bs2016/bill_status.aspx?lsr=2615&sy=2024&sortoption=&txtsessionyear=2024&txtbillnumber=HB1127
1785624,2124,HB1128,1,Introduced,2023-11-28,"Relative to the definition of a scholarship organization for purposes of the education tax credit.","Relative to the definition of a scholarship organization for purposes of the education tax credit.",0,,2024-02-22,"Indefinitely Postpone (Rep. Ladd): Motion Adopted Regular Calendar 191-187 02/22/2024 House Journal  6 P. 70",https://legiscan.com/NH/bill/HB1128/2024,https://gencourt.state.nh.us/bill_status/legacy/bs2016/bill_status.aspx?lsr=2622&sy=2024&sortoption=&txtsessionyear=2024&txtbillnumber=HB1128
1785586,2124,HB1129,4,Passed,2024-07-26,"Relative to the authority to vote by proxy in a condominium association.","Relative to the authority to vote by proxy in a condominium association.",0,,2024-07-26,"Signed by Governor Sununu 07/19/2024; Chapter 222; eff.01/15/2025",https://legiscan.com/NH/bill/HB1129/2024,https://gencourt.state.nh.us/bill_status/legacy/bs2016/bill_status.aspx?lsr=2649&sy=2024&sortoption=&txtsessionyear=2024&txtbillnumber=HB1129
1785522,2124,HB1130,1,Introduced,2023-11-28,"Establishing a commission to study the economic, legal, and sociological aspects of New Hampshire exerting its sovereign state rights.","Establishing a commission to study the economic, legal, and sociological aspects of New Hampshire exerting its sovereign state rights.",0,,2024-02-01,"Inexpedient to Legislate: Motion Adopted Voice Vote 02/01/2024 House Journal  3 P. 12",https://legiscan.com/NH/bill/HB1130/2024,https://gencourt.state.nh.us/bill_status/legacy/bs2016/bill_status.aspx?lsr=2659&sy=2024&sortoption=&txtsessionyear=2024&txtbillnumber=HB1130
1785703,2124,HB1131,4,Passed,2024-07-22,"Relative to mental health practice.","Relative to mental health practice.",0,,2024-07-22,"Signed by Governor Sununu 07/03/2024; Chapter 110; eff. 09/01/2024",https://legiscan.com/NH/bill/HB1131/2024,https://gencourt.state.nh.us/bill_status/legacy/bs2016/bill_status.aspx?lsr=2695&sy=2024&sortoption=&txtsessionyear=2024&txtbillnumber=HB1131
1785453,2124,HB1132,1,Introduced,2023-11-28,"Relative to permits for the siting of new landfills.","Relative to permits for the siting of new landfills.",0,,2024-03-07,"Inexpedient to Legislate: Motion Adopted Voice Vote 03/07/2024 House Journal  7 P. 10",https://legiscan.com/NH/bill/HB1132/2024,https://gencourt.state.nh.us/bill_status/legacy/bs2016/bill_status.aspx?lsr=2698&sy=2024&sortoption=&txtsessionyear=2024&txtbillnumber=HB1132
1785647,2124,HB1133,1,Introduced,2023-11-28,"Relative to enabling UOCAVA voters to email back completed ballots.","Relative to enabling UOCAVA voters to email back completed ballots.",0,,2024-03-14,"Inexpedient to Legislate: Motion Adopted Voice Vote 03/14/2024 House Journal  8 P. 6",https://legiscan.com/NH/bill/HB1133/2024,https://gencourt.state.nh.us/bill_status/legacy/bs2016/bill_status.aspx?lsr=2699&sy=2024&sortoption=&txtsessionyear=2024&txtbillnumber=HB1133
1785509,2124,HB1134,1,Introduced,2023-11-28,"Relative to inventory controls for paper ballots.","Relative to inventory controls for paper ballots.",0,,2024-03-14,"Inexpedient to Legislate: Motion Adopted Voice Vote 03/14/2024 House Journal  8 P. 6",https://legiscan.com/NH/bill/HB1134/2024,https://gencourt.state.nh.us/bill_status/legacy/bs2016/bill_status.aspx?lsr=2715&sy=2024&sortoption=&txtsessionyear=2024&txtbillnumber=HB1134
1785712,2124,HB1135,1,Introduced,2023-11-28,"Relative to the definition of specialty beer.","Relative to the definition of specialty beer.",0,,2024-03-28,"Inexpedient to Legislate: Motion Adopted Voice Vote 03/28/2024 House Journal  10 P. 5",https://legiscan.com/NH/bill/HB1135/2024,https://gencourt.state.nh.us/bill_status/legacy/bs2016/bill_status.aspx?lsr=2722&sy=2024&sortoption=&txtsessionyear=2024&txtbillnumber=HB1135
1785679,2124,HB1136,1,Introduced,2023-11-28,"Relative to requiring a reconciliation of votes cast and undervotes with the total of ballots cast.","Relative to requiring a reconciliation of votes cast and undervotes with the total of ballots cast.",0,,2024-03-14,"Inexpedient to Legislate: Motion Adopted Voice Vote 03/14/2024 House Journal  8 P. 6",https://legiscan.com/NH/bill/HB1136/2024,https://gencourt.state.nh.us/bill_status/legacy/bs2016/bill_status.aspx?lsr=2727&sy=2024&sortoption=&txtsessionyear=2024&txtbillnumber=HB1136
1785400,2124,HB1137,1,Introduced,2023-11-28,"Relative to trafficking offences and special restitution for human trafficking victims","Relative to trafficking offences and special restitution for human trafficking victims",0,,2024-02-08,"Inexpedient to Legislate: Motion Adopted Voice Vote 02/08/2024 House Journal  4 P. 4",https://legiscan.com/NH/bill/HB1137/2024,https://gencourt.state.nh.us/bill_status/legacy/bs2016/bill_status.aspx?lsr=2787&sy=2024&sortoption=&txtsessionyear=2024&txtbillnumber=HB1137
1785573,2124,HB1138,4,Passed,2024-06-20,"Equalizing the fines for operating an OHRV with a driver's license suspended and operating a snowmobile with a driver's license suspended.","Equalizing the fines for operating an OHRV with a driver's license suspended and operating a snowmobile with a driver's license suspended.",0,,2024-06-20,"Signed by Governor Sununu 06/14/2024; Chapter 62; eff. 1/1/2025 House Journal  16",https://legiscan.com/NH/bill/HB1138/2024,https://gencourt.state.nh.us/bill_status/legacy/bs2016/bill_status.aspx?lsr=2791&sy=2024&sortoption=&txtsessionyear=2024&txtbillnumber=HB1138
1785535,2124,HB1139,4,Passed,2024-07-22,"Relative to location of conventional septic systems relative to the seasonal high water table.","Relative to location of conventional septic systems relative to the seasonal high water table.",0,,2024-07-22,"Signed by Governor Sununu 07/03/2024; Chapter 111; eff. 09/01/2024",https://legiscan.com/NH/bill/HB1139/2024,https://gencourt.state.nh.us/bill_status/legacy/bs2016/bill_status.aspx?lsr=2806&sy=2024&sortoption=&txtsessionyear=2024&txtbillnumber=HB1139
1785531,2124,HB1140,4,Passed,2024-07-22,"Relative to requirements for homeowner installations of septic systems.","Relative to requirements for homeowner installations of septic systems.",0,,2024-07-22,"Signed by Governor Sununu 07/03/2024; Chapter 112; eff. 09/01/2024",https://legiscan.com/NH/bill/HB1140/2024,https://gencourt.state.nh.us/bill_status/legacy/bs2016/bill_status.aspx?lsr=2808&sy=2024&sortoption=&txtsessionyear=2024&txtbillnumber=HB1140
1785711,2124,HB1141,4,Passed,2024-07-22,"Relative to requirements for approval to increase load on a sewage disposal system.","Relative to requirements for approval to increase load on a sewage disposal system.",0,,2024-07-22,"Signed by Governor Sununu 07/03/2024; Chapter 113; eff. 09/01/2024",https://legiscan.com/NH/bill/HB1141/2024,https://gencourt.state.nh.us/bill_status/legacy/bs2016/bill_status.aspx?lsr=2809&sy=2024&sortoption=&txtsessionyear=2024&txtbillnumber=HB1141
1785454,2124,HB1142,2,Engrossed,2024-03-13,"Relative to eligibility for permits for the septic system designer program.","Relative to eligibility for permits for the septic system designer program.",0,,2024-05-15,"Special Order to Beginning of Calendar, Without Objection, Motion Adopted; 05/15/2024; Senate Journal 12",https://legiscan.com/NH/bill/HB1142/2024,https://gencourt.state.nh.us/bill_status/legacy/bs2016/bill_status.aspx?lsr=2811&sy=2024&sortoption=&txtsessionyear=2024&txtbillnumber=HB1142
1785465,2124,HB1143,4,Passed,2024-07-22,"Including control of cyanobacteria blooms under the New Hampshire clean lakes program.","Including control of cyanobacteria blooms under the New Hampshire clean lakes program.",0,,2024-07-22,"Signed by Governor Sununu 07/03/2024; Chapter 114; eff. 09/01/2024",https://legiscan.com/NH/bill/HB1143/2024,https://gencourt.state.nh.us/bill_status/legacy/bs2016/bill_status.aspx?lsr=2105&sy=2024&sortoption=&txtsessionyear=2024&txtbillnumber=HB1143
1785611,2124,HB1144,4,Passed,2024-07-26,"Relative to requirements for sewage disposal system information to be disclosed during real estate transactions.","Relative to requirements for sewage disposal system information to be disclosed during real estate transactions.",0,,2024-07-26,"Signed by Governor Sununu 07/19/2024; Chapter 223; eff. 09/17/2024",https://legiscan.com/NH/bill/HB1144/2024,https://gencourt.state.nh.us/bill_status/legacy/bs2016/bill_status.aspx?lsr=2807&sy=2024&sortoption=&txtsessionyear=2024&txtbillnumber=HB1144
1785552,2124,HB1145,2,Engrossed,2024-04-02,"Prohibiting the private ownership of landfills.","Prohibiting the private ownership of landfills.",0,,2024-05-15,"Special Order to Beginning of Calendar, Without Objection, Motion Adopted; 05/15/2024; Senate Journal 12",https://legiscan.com/NH/bill/HB1145/2024,https://gencourt.state.nh.us/bill_status/legacy/bs2016/bill_status.aspx?lsr=2131&sy=2024&sortoption=&txtsessionyear=2024&txtbillnumber=HB1145
1785601,2124,HB1146,2,Engrossed,2024-03-26,"Relative to the removal of a voter from the checklist.","Relative to the removal of a voter from the checklist.",0,,2024-04-18,"Refer to Interim Study, Motion Adopted, Voice Vote; 04/18/2024; Senate Journal 10",https://legiscan.com/NH/bill/HB1146/2024,https://gencourt.state.nh.us/bill_status/legacy/bs2016/bill_status.aspx?lsr=2133&sy=2024&sortoption=&txtsessionyear=2024&txtbillnumber=HB1146
1785702,2124,HB1147,1,Introduced,2023-11-28,"Relative to permissible campaign contributions by business organizations and labor unions.","Relative to permissible campaign contributions by business organizations and labor unions.",0,,2024-03-21,"Indefinitely Postpone (Rep. Berry): Motion Adopted DV 187-186 03/21/2024 House Journal  9 P. 62",https://legiscan.com/NH/bill/HB1147/2024,https://gencourt.state.nh.us/bill_status/legacy/bs2016/bill_status.aspx?lsr=2135&sy=2024&sortoption=&txtsessionyear=2024&txtbillnumber=HB1147
1785386,2124,HB1148,1,Introduced,2023-11-28,"Relative to the fish and game commission.","Relative to the fish and game commission.",0,,2024-02-22,"Refer for Interim Study: Motion Adopted Voice Vote 02/22/2024 House Journal  6 P. 12",https://legiscan.com/NH/bill/HB1148/2024,https://gencourt.state.nh.us/bill_status/legacy/bs2016/bill_status.aspx?lsr=2137&sy=2024&sortoption=&txtsessionyear=2024&txtbillnumber=HB1148
1785570,2124,HB1149,1,Introduced,2023-11-28,"Relative to domicile residency, voter registration, investigation of voter verification letters, and relative to the terms ""resident,"" ""inhabitant,"" ""residence,"" and ""residency.""","Relative to domicile residency, voter registration, investigation of voter verification letters, and relative to the terms ""resident,"" ""inhabitant,"" ""residence,"" and ""residency.""",0,,2024-03-21,"Indefinitely Postpone (Rep. Berry): Motion Adopted Regular Calendar 190-184 03/21/2024 House Journal  9 P. 63",https://legiscan.com/NH/bill/HB1149/2024,https://gencourt.state.nh.us/bill_status/legacy/bs2016/bill_status.aspx?lsr=2138&sy=2024&sortoption=&txtsessionyear=2024&txtbillnumber=HB1149
1785396,2124,HB1150,4,Passed,2024-07-26,"Relative to advertising rates for political advertising.","Relative to advertising rates for political advertising.",0,,2024-07-26,"Signed by Governor Sununu 07/19/2024; Chapter 224; eff. 09/17/2024",https://legiscan.com/NH/bill/HB1150/2024,https://gencourt.state.nh.us/bill_status/legacy/bs2016/bill_status.aspx?lsr=2139&sy=2024&sortoption=&txtsessionyear=2024&txtbillnumber=HB1150
1785629,2124,HB1151,4,Passed,2024-06-20,"Relative to the carrying of alcoholic beverages on hotel premises and monthly deposits from the liquor commission to the general fund.","Relative to the carrying of alcoholic beverages on hotel premises and monthly deposits from the liquor commission to the general fund.",0,,2024-06-20,"Signed by Governor Sununu 06/14/2024; Chapter 63; eff. 8/13/2024 House Journal  16",https://legiscan.com/NH/bill/HB1151/2024,https://gencourt.state.nh.us/bill_status/legacy/bs2016/bill_status.aspx?lsr=2141&sy=2024&sortoption=&txtsessionyear=2024&txtbillnumber=HB1151
1785370,2124,HB1152,1,Introduced,2023-11-28,"Enabling the mental health flag to be flown at the state house.","Enabling the mental health flag to be flown at the state house.",0,,2024-02-15,"Inexpedient to Legislate: Motion Adopted Voice Vote 02/15/2024 House Journal  5 P. 71",https://legiscan.com/NH/bill/HB1152/2024,https://gencourt.state.nh.us/bill_status/legacy/bs2016/bill_status.aspx?lsr=2143&sy=2024&sortoption=&txtsessionyear=2024&txtbillnumber=HB1152
1785424,2124,HB1153,1,Introduced,2023-11-28,"Relative to mandatory and elective public school curricula.","Relative to mandatory and elective public school curricula.",0,,2024-02-22,"Inexpedient to Legislate: Motion Adopted Voice Vote 02/22/2024 House Journal  6 P. 6",https://legiscan.com/NH/bill/HB1153/2024,https://gencourt.state.nh.us/bill_status/legacy/bs2016/bill_status.aspx?lsr=2154&sy=2024&sortoption=&txtsessionyear=2024&txtbillnumber=HB1153
1785426,2124,HB1154,4,Passed,2024-05-14,"Relative to property tax exemptions for certain disabled veterans.","Relative to property tax exemptions for certain disabled veterans.",0,,2024-05-14,"Signed by Governor Sununu 05/14/2024; Chapter 13; eff. 07/13/2024",https://legiscan.com/NH/bill/HB1154/2024,https://gencourt.state.nh.us/bill_status/legacy/bs2016/bill_status.aspx?lsr=2155&sy=2024&sortoption=&txtsessionyear=2024&txtbillnumber=HB1154
1785680,2124,HB1155,4,Passed,2024-06-20,"Relative to insurance coverage for living organ donors.","Relative to insurance coverage for living organ donors.",0,,2024-06-20,"Signed by Governor Sununu 06/14/2024; Chapter 64; eff. 7/1/2024 House Journal  16",https://legiscan.com/NH/bill/HB1155/2024,https://gencourt.state.nh.us/bill_status/legacy/bs2016/bill_status.aspx?lsr=2156&sy=2024&sortoption=&txtsessionyear=2024&txtbillnumber=HB1155
1785448,2124,HB1156,1,Introduced,2023-11-28,"Relative to public health, safety, and state sovereignty.","Relative to public health, safety, and state sovereignty.",0,,2024-03-14,"Lay on Table (Rep. Hoell): Motion Adopted DV 186-185 03/14/2024 House Journal  8 P. 80",https://legiscan.com/NH/bill/HB1156/2024,https://gencourt.state.nh.us/bill_status/legacy/bs2016/bill_status.aspx?lsr=2157&sy=2024&sortoption=&txtsessionyear=2024&txtbillnumber=HB1156
1785553,2124,HB1157,1,Introduced,2023-11-28,"Relative to overvoted and undervoted ballots.","Relative to overvoted and undervoted ballots.",0,,2024-03-14,"Inexpedient to Legislate: Motion Adopted Voice Vote 03/14/2024 House Journal  8 P. 6",https://legiscan.com/NH/bill/HB1157/2024,https://gencourt.state.nh.us/bill_status/legacy/bs2016/bill_status.aspx?lsr=2161&sy=2024&sortoption=&txtsessionyear=2024&txtbillnumber=HB1157
1785669,2124,HB1158,4,Passed,2024-07-26,"Relative to establishing an exception to vessel registration, defining commercial passenger vessel, and regulating written examinations and certifications for operating commercial vessels.","Relative to establishing an exception to vessel registration, defining commercial passenger vessel, and regulating written examinations and certifications for operating commercial vessels.",0,,2024-07-26,"Signed by Governor Sununu 07/19/2024; Chapter 225; eff.I. Sec 4 eff 1/1/25 II. Rem eff 9/17/24",https://legiscan.com/NH/bill/HB1158/2024,https://gencourt.state.nh.us/bill_status/legacy/bs2016/bill_status.aspx?lsr=2164&sy=2024&sortoption=&txtsessionyear=2024&txtbillnumber=HB1158
1785541,2124,HB1159,1,Introduced,2023-11-28,"Relative to toilet facilities provided by restaurants and other food establishments.","Relative to toilet facilities provided by restaurants and other food establishments.",0,,2024-03-28,"Inexpedient to Legislate: Motion Adopted Voice Vote 03/28/2024 House Journal  10 P. 7",https://legiscan.com/NH/bill/HB1159/2024,https://gencourt.state.nh.us/bill_status/legacy/bs2016/bill_status.aspx?lsr=2165&sy=2024&sortoption=&txtsessionyear=2024&txtbillnumber=HB1159
1785366,2124,HB1160,4,Passed,2024-06-20,"Relative to school assessments of statewide academic areas.","Relative to school assessments of statewide academic areas.",0,,2024-06-20,"Signed by Governor Sununu 06/14/2024; Chapter 65; eff. 8/13/2024 House Journal  16",https://legiscan.com/NH/bill/HB1160/2024,https://gencourt.state.nh.us/bill_status/legacy/bs2016/bill_status.aspx?lsr=2094&sy=2024&sortoption=&txtsessionyear=2024&txtbillnumber=HB1160
1785415,2124,HB1161,4,Passed,2024-06-20,"Relative to use of the public school infrastructure fund for energy efficient school buses.","Relative to use of the public school infrastructure fund for energy efficient school buses.",0,,2024-06-20,"Signed by Governor Sununu 06/14/2024; Chapter 66; eff. 8/13/2024 House Journal  16",https://legiscan.com/NH/bill/HB1161/2024,https://gencourt.state.nh.us/bill_status/legacy/bs2016/bill_status.aspx?lsr=2097&sy=2024&sortoption=&txtsessionyear=2024&txtbillnumber=HB1161
