bill_id,session_id,bill_number,status,status_desc,status_date,title,description,committee_id,committee,last_action_date,last_action,url,state_link
1793148,2124,SB267,2,Engrossed,2023-03-21,"Requiring the commissioner of the department of environmental services to consider ""cumulative impacts analysis"" in rules and statutes.","Requiring the commissioner of the department of environmental services to consider ""cumulative impacts analysis"" in rules and statutes.",0,,2024-01-04,"Inexpedient to Legislate: Motion Adopted DV 189-188 01/04/2024 House Journal  2 P. 4",https://legiscan.com/NH/bill/SB267/2024,https://gencourt.state.nh.us/bill_status/legacy/bs2016/bill_status.aspx?lsr=950&sy=2024&sortoption=&txtsessionyear=2024&txtbillnumber=SB267
1793453,2124,SB300,1,Introduced,2023-12-04,"Relative to education and training standards for voluntarily certified heating equipment installers and heating equipment service personnel.","Relative to education and training standards for voluntarily certified heating equipment installers and heating equipment service personnel.",0,,2024-02-21,"Inexpedient to Legislate, Motion Adopted, Voice Vote === BILL KILLED ===; 02/21/2024; Senate Journal 5",https://legiscan.com/NH/bill/SB300/2024,https://gencourt.state.nh.us/bill_status/legacy/bs2016/bill_status.aspx?lsr=2986&sy=2024&sortoption=&txtsessionyear=2024&txtbillnumber=SB300
1793593,2124,SB301,2,Engrossed,2024-04-02,"Relative to establishing a committee to study the possibility of placing a desalination plant in New Hampshire.","Relative to establishing a committee to study the possibility of placing a desalination plant in New Hampshire.",0,,2024-05-02,"Inexpedient to Legislate: Motion Adopted Voice Vote 05/02/2024 House Journal  12 P. 17",https://legiscan.com/NH/bill/SB301/2024,https://gencourt.state.nh.us/bill_status/legacy/bs2016/bill_status.aspx?lsr=2884&sy=2024&sortoption=&txtsessionyear=2024&txtbillnumber=SB301
1793049,2124,SB302,4,Passed,2024-07-10,"Adding an additional exemption from the regulation of physicians and surgeons.","Adding an additional exemption from the regulation of physicians and surgeons.",0,,2024-07-10,"Signed by the Governor on 07/03/2024; Chapter 0145; Effective 07/03/2024",https://legiscan.com/NH/bill/SB302/2024,https://gencourt.state.nh.us/bill_status/legacy/bs2016/bill_status.aspx?lsr=2817&sy=2024&sortoption=&txtsessionyear=2024&txtbillnumber=SB302
1793258,2124,SB303,4,Passed,2024-06-20,"Relative to the use of renewable energy funds by the department of energy.","Relative to the use of renewable energy funds by the department of energy.",0,,2024-06-20,"Signed by the Governor on 06/14/2024; Chapter 0079; Effective 06/14/2024",https://legiscan.com/NH/bill/SB303/2024,https://gencourt.state.nh.us/bill_status/legacy/bs2016/bill_status.aspx?lsr=2861&sy=2024&sortoption=&txtsessionyear=2024&txtbillnumber=SB303
1793444,2124,SB304,1,Introduced,2023-12-06,"Creating a cause of action for medical injuries resulting from the administration or prescription of gender transition surgery, cross-sex hormones, or puberty-blocking drugs and providing protections for individuals who receive medical detransitioning.","Creating a cause of action for medical injuries resulting from the administration or prescription of gender transition surgery, cross-sex hormones, or puberty-blocking drugs and providing protections for individuals who receive medical detransitioning.",0,,2024-04-05,"Refer to Interim Study, Motion Adopted, Voice Vote; 04/05/2024; Senate Journal 8",https://legiscan.com/NH/bill/SB304/2024,https://gencourt.state.nh.us/bill_status/legacy/bs2016/bill_status.aspx?lsr=2871&sy=2024&sortoption=&txtsessionyear=2024&txtbillnumber=SB304
1793422,2124,SB305,1,Introduced,2023-12-06,"Relative to allowing wholesalers of cigarettes to retain tax revenue collected for each package of cigarettes with tax stamps sold.","Relative to allowing wholesalers of cigarettes to retain tax revenue collected for each package of cigarettes with tax stamps sold.",0,,2024-02-08,"Pending Motion Ought to Pass; 02/08/2024; Senate Journal 3",https://legiscan.com/NH/bill/SB305/2024,https://gencourt.state.nh.us/bill_status/legacy/bs2016/bill_status.aspx?lsr=2876&sy=2024&sortoption=&txtsessionyear=2024&txtbillnumber=SB305
1792963,2124,SB306,4,Passed,2024-08-30,"Relative to manufactured housing rulemaking authority.","Relative to manufactured housing rulemaking authority.",0,,2024-08-30,"II. Remainder Effective 10/22/2024",https://legiscan.com/NH/bill/SB306/2024,https://gencourt.state.nh.us/bill_status/legacy/bs2016/bill_status.aspx?lsr=2974&sy=2024&sortoption=&txtsessionyear=2024&txtbillnumber=SB306
1793508,2124,SB307,1,Introduced,2023-12-06,"Relative to electric transmission service agreements.","Relative to electric transmission service agreements.",0,,2024-04-05,"Pending Motion OT3rdg; 04/05/2024; Senate Journal 8",https://legiscan.com/NH/bill/SB307/2024,https://gencourt.state.nh.us/bill_status/legacy/bs2016/bill_status.aspx?lsr=2983&sy=2024&sortoption=&txtsessionyear=2024&txtbillnumber=SB307
1793426,2124,SB308,1,Introduced,2023-12-08,"Relative to the state minimum hourly rate.","Relative to the state minimum hourly rate.",0,,2024-03-21,"Inexpedient to Legislate, Regular Calendar 14Y-10N, Motion Adopted === BILL KILLED ===; 03/21/2024; Senate Journal 7",https://legiscan.com/NH/bill/SB308/2024,https://gencourt.state.nh.us/bill_status/legacy/bs2016/bill_status.aspx?lsr=3067&sy=2024&sortoption=&txtsessionyear=2024&txtbillnumber=SB308
1793203,2124,SB309,1,Introduced,2023-12-08,"Relative to the vesting period for members of the state retirement system.","Relative to the vesting period for members of the state retirement system.",0,,2024-04-11,"Pending Motion Interim Study; 04/11/2024; Senate Journal 9",https://legiscan.com/NH/bill/SB309/2024,https://gencourt.state.nh.us/bill_status/legacy/bs2016/bill_status.aspx?lsr=3092&sy=2024&sortoption=&txtsessionyear=2024&txtbillnumber=SB309
1792659,2124,SB310,4,Passed,2024-07-30,"Relative to bear registration, federal duck stamps, and the transport of out of state lobsters and crabs.","Relative to bear registration, federal duck stamps, and the transport of out of state lobsters and crabs.",0,,2024-07-30,"Signed by the Governor on 07/26/2024; Chapter 0276; Effective 09/24/2024",https://legiscan.com/NH/bill/SB310/2024,https://gencourt.state.nh.us/bill_status/legacy/bs2016/bill_status.aspx?lsr=2922&sy=2024&sortoption=&txtsessionyear=2024&txtbillnumber=SB310
1793461,2124,SB311,4,Passed,2024-07-30,"Relative to property tax offset for the town of Hampstead and making an appropriation therefor.","Relative to property tax offset for the town of Hampstead and making an appropriation therefor.",0,,2024-07-30,"Law Without Signature 07/27/2024; Chapter 0316; Effective 07/01/2024; Art 44, Pt II, NH Constitution",https://legiscan.com/NH/bill/SB311/2024,https://gencourt.state.nh.us/bill_status/legacy/bs2016/bill_status.aspx?lsr=2923&sy=2024&sortoption=&txtsessionyear=2024&txtbillnumber=SB311
1792954,2124,SB312,4,Passed,2024-07-10,"Relative to third party liability in Medicaid.","Relative to third party liability in Medicaid.",0,,2024-07-10,"Signed by the Governor on 07/03/2024; Chapter 0146; Effective 07/01/2024",https://legiscan.com/NH/bill/SB312/2024,https://gencourt.state.nh.us/bill_status/legacy/bs2016/bill_status.aspx?lsr=2924&sy=2024&sortoption=&txtsessionyear=2024&txtbillnumber=SB312
1793009,2124,SB313,4,Passed,2024-05-14,"Relative to the delivery of the mittimus in a criminal case.","Relative to the delivery of the mittimus in a criminal case.",0,,2024-05-14,"Signed by the Governor on 05/14/2024; Chapter 0014; Effective 01/01/2025",https://legiscan.com/NH/bill/SB313/2024,https://gencourt.state.nh.us/bill_status/legacy/bs2016/bill_status.aspx?lsr=2925&sy=2024&sortoption=&txtsessionyear=2024&txtbillnumber=SB313
1792784,2124,SB314,4,Passed,2024-06-03,"Relative to pre-trial competency evaluations.","Relative to pre-trial competency evaluations.",0,,2024-06-03,"Signed by the Governor on 05/31/2024; Chapter 0035; Effective 01/01/2025",https://legiscan.com/NH/bill/SB314/2024,https://gencourt.state.nh.us/bill_status/legacy/bs2016/bill_status.aspx?lsr=2926&sy=2024&sortoption=&txtsessionyear=2024&txtbillnumber=SB314
1792975,2124,SB315,4,Passed,2024-07-10,"Relative to law enforcement agency reporting on information concerning bias crimes.","Relative to law enforcement agency reporting on information concerning bias crimes.",0,,2024-07-10,"Signed by the Governor on 07/03/2024; Chapter 0147; Effective 09/01/2024",https://legiscan.com/NH/bill/SB315/2024,https://gencourt.state.nh.us/bill_status/legacy/bs2016/bill_status.aspx?lsr=2927&sy=2024&sortoption=&txtsessionyear=2024&txtbillnumber=SB315
1793029,2124,SB316,2,Engrossed,2024-03-12,"Establishing a penalty for a person who transports fentanyl class drugs into New Hampshire with the intent to distribute.","Establishing a penalty for a person who transports fentanyl class drugs into New Hampshire with the intent to distribute.",0,,2024-05-02,"Inexpedient to Legislate: Motion Adopted Voice Vote 05/02/2024 House Journal  12 P. 33",https://legiscan.com/NH/bill/SB316/2024,https://gencourt.state.nh.us/bill_status/legacy/bs2016/bill_status.aspx?lsr=2928&sy=2024&sortoption=&txtsessionyear=2024&txtbillnumber=SB316
1793591,2124,SB317,4,Passed,2024-03-14,"Relative to establishing a New Hampshire-Ireland trade council.","Relative to establishing a New Hampshire-Ireland trade council.",0,,2024-03-14,"Signed by the Governor on 03/12/2024; Chapter 0006; Effective 05/11/2024",https://legiscan.com/NH/bill/SB317/2024,https://gencourt.state.nh.us/bill_status/legacy/bs2016/bill_status.aspx?lsr=3017&sy=2024&sortoption=&txtsessionyear=2024&txtbillnumber=SB317
1792799,2124,SB318,5,Vetoed,2024-07-30,"Converting the manufactured housing installations standards board and the board of examiners of nursing home administrators into advisory boards, and creating a new advisory board named the advisory board of massage therapists, reflexologists, structural integrators, and Asian bodywork therapists.","Converting the manufactured housing installations standards board and the board of examiners of nursing home administrators into advisory boards, and creating a new advisory board named the advisory board of massage therapists, reflexologists, structural integrators, and Asian bodywork therapists.",0,,2024-07-30,"Vetoed by Governor 07/26/2024",https://legiscan.com/NH/bill/SB318/2024,https://gencourt.state.nh.us/bill_status/legacy/bs2016/bill_status.aspx?lsr=2929&sy=2024&sortoption=&txtsessionyear=2024&txtbillnumber=SB318
1793352,2124,SB319,1,Introduced,2023-12-08,"Relative to vaccine and pharmaceutical products purchased, promoted, or distributed by the state and its political subdivisions.","Relative to vaccine and pharmaceutical products purchased, promoted, or distributed by the state and its political subdivisions.",0,,2024-02-08,"Refer to Interim Study, Motion Adopted, Voice Vote; 02/08/2024; Senate Journal 3",https://legiscan.com/NH/bill/SB319/2024,https://gencourt.state.nh.us/bill_status/legacy/bs2016/bill_status.aspx?lsr=2930&sy=2024&sortoption=&txtsessionyear=2024&txtbillnumber=SB319
1793006,2124,SB320,1,Introduced,2023-12-08,"Requiring the public utilities commission to establish a gas and electric performance incentive mechanism.","Requiring the public utilities commission to establish a gas and electric performance incentive mechanism.",0,,2024-02-15,"Refer to Interim Study, Motion Adopted, Voice Vote; 02/15/2024; Senate Journal 4",https://legiscan.com/NH/bill/SB320/2024,https://gencourt.state.nh.us/bill_status/legacy/bs2016/bill_status.aspx?lsr=2931&sy=2024&sortoption=&txtsessionyear=2024&txtbillnumber=SB320
1793225,2124,SB321,2,Engrossed,2024-04-02,"Relative to the release of a defendant pending trial.","Relative to the release of a defendant pending trial.",0,,2024-09-12,"Executive Session: 09/19/2024 01:00 pm Legislative Office Building 202-204",https://legiscan.com/NH/bill/SB321/2024,https://gencourt.state.nh.us/bill_status/legacy/bs2016/bill_status.aspx?lsr=2932&sy=2024&sortoption=&txtsessionyear=2024&txtbillnumber=SB321
1792817,2124,SB322,4,Passed,2024-05-14,"Relative to licenses to carry and immunity for law enforcement officers issuing certain firearms licenses.","Relative to licenses to carry and immunity for law enforcement officers issuing certain firearms licenses.",0,,2024-05-14,"Signed by the Governor on 05/14/2024; Chapter 0015; Effective 07/13/2024",https://legiscan.com/NH/bill/SB322/2024,https://gencourt.state.nh.us/bill_status/legacy/bs2016/bill_status.aspx?lsr=2933&sy=2024&sortoption=&txtsessionyear=2024&txtbillnumber=SB322
1793123,2124,SB323,1,Introduced,2023-12-08,"Relative to the definition of salon.","Relative to the definition of salon.",0,,2024-01-18,"Inexpedient to Legislate, Motion Adopted, Voice Vote === BILL KILLED ===; 01/18/2024; Senate Journal 2",https://legiscan.com/NH/bill/SB323/2024,https://gencourt.state.nh.us/bill_status/legacy/bs2016/bill_status.aspx?lsr=2934&sy=2024&sortoption=&txtsessionyear=2024&txtbillnumber=SB323
1792992,2124,SB324,4,Passed,2024-07-30,"Relative to lottery license renewal notices.","Relative to lottery license renewal notices.",0,,2024-07-30,"Signed by the Governor on 07/26/2024; Chapter 0277; Effective 01/01/2025",https://legiscan.com/NH/bill/SB324/2024,https://gencourt.state.nh.us/bill_status/legacy/bs2016/bill_status.aspx?lsr=2935&sy=2024&sortoption=&txtsessionyear=2024&txtbillnumber=SB324
1793605,2124,SB325,2,Engrossed,2024-02-29,"Establishing a committee to study the issue of insurance appraiser licensing.","Establishing a committee to study the issue of insurance appraiser licensing.",0,,2024-05-23,"Inexpedient to Legislate: Motion Adopted Voice Vote 05/23/2024 House Journal  14 P. 3",https://legiscan.com/NH/bill/SB325/2024,https://gencourt.state.nh.us/bill_status/legacy/bs2016/bill_status.aspx?lsr=2936&sy=2024&sortoption=&txtsessionyear=2024&txtbillnumber=SB325
1793480,2124,SB326,1,Introduced,2023-12-08,"Relative to the adjudication of lottery infractions.","Relative to the adjudication of lottery infractions.",0,,2024-02-08,"Refer to Interim Study, Motion Adopted, Voice Vote; 02/08/2024; Senate Journal 3",https://legiscan.com/NH/bill/SB326/2024,https://gencourt.state.nh.us/bill_status/legacy/bs2016/bill_status.aspx?lsr=2937&sy=2024&sortoption=&txtsessionyear=2024&txtbillnumber=SB326
1793377,2124,SB327,4,Passed,2024-07-30,"Providing penalties for the assault or harassment of sports officials.","Providing penalties for the assault or harassment of sports officials.",0,,2024-07-30,"Signed by the Governor on 07/26/2024; Chapter 0278; Effective 01/01/2025",https://legiscan.com/NH/bill/SB327/2024,https://gencourt.state.nh.us/bill_status/legacy/bs2016/bill_status.aspx?lsr=2938&sy=2024&sortoption=&txtsessionyear=2024&txtbillnumber=SB327
1793478,2124,SB328,1,Introduced,2023-12-08,"Relative to deceptive ticket sale practices.","Relative to deceptive ticket sale practices.",0,,2024-04-11,"Pending Motion OT3rdg; 04/11/2024; Senate Journal 9",https://legiscan.com/NH/bill/SB328/2024,https://gencourt.state.nh.us/bill_status/legacy/bs2016/bill_status.aspx?lsr=2939&sy=2024&sortoption=&txtsessionyear=2024&txtbillnumber=SB328
1792808,2124,SB329,4,Passed,2024-06-20,"Relative to background checks of certain persons associated with solid waste management.","Relative to background checks of certain persons associated with solid waste management.",0,,2024-06-20,"Signed by the Governor on 06/14/2024; Chapter 0080; Effective 08/13/2024",https://legiscan.com/NH/bill/SB329/2024,https://gencourt.state.nh.us/bill_status/legacy/bs2016/bill_status.aspx?lsr=2940&sy=2024&sortoption=&txtsessionyear=2024&txtbillnumber=SB329
1793051,2124,SB330,4,Passed,2024-07-10,"Relative to allowing the ability to work from home to count toward unemployment benefits eligibility.","Relative to allowing the ability to work from home to count toward unemployment benefits eligibility.",0,,2024-07-10,"Signed by the Governor on 07/03/2024; Chapter 0148; Effective 07/03/2024",https://legiscan.com/NH/bill/SB330/2024,https://gencourt.state.nh.us/bill_status/legacy/bs2016/bill_status.aspx?lsr=2816&sy=2024&sortoption=&txtsessionyear=2024&txtbillnumber=SB330
1793080,2124,SB331,4,Passed,2024-07-30,"Relative to certain historic commemorations.","Relative to certain historic commemorations.",0,,2024-07-30,"Signed by the Governor on 07/26/2024; Chapter 0279; Effective 07/26/2024",https://legiscan.com/NH/bill/SB331/2024,https://gencourt.state.nh.us/bill_status/legacy/bs2016/bill_status.aspx?lsr=2829&sy=2024&sortoption=&txtsessionyear=2024&txtbillnumber=SB331
1793622,2124,SB332,2,Engrossed,2024-02-29,"Limiting re-disclosure of consumer reports requested in connection with a credit transaction involving an extension of credit secured by real estate.","Limiting re-disclosure of consumer reports requested in connection with a credit transaction involving an extension of credit secured by real estate.",0,,2024-09-25,"Executive Session: 10/17/2024 10:00 am Legislative Office Building 302-304",https://legiscan.com/NH/bill/SB332/2024,https://gencourt.state.nh.us/bill_status/legacy/bs2016/bill_status.aspx?lsr=2831&sy=2024&sortoption=&txtsessionyear=2024&txtbillnumber=SB332
1793021,2124,SB333,4,Passed,2024-07-10,"Relative to access to financial services for minors in legal custody or guardianship and relative to the board of directors of mutual banks and mutual holding companies.","Relative to access to financial services for minors in legal custody or guardianship and relative to the board of directors of mutual banks and mutual holding companies.",0,,2024-07-10,"II. Remainder Effective 07/03/2024",https://legiscan.com/NH/bill/SB333/2024,https://gencourt.state.nh.us/bill_status/legacy/bs2016/bill_status.aspx?lsr=2839&sy=2024&sortoption=&txtsessionyear=2024&txtbillnumber=SB333
1793530,2124,SB334,4,Passed,2024-07-10,"Relative to providing for the issuance of bonds and other obligations by the business finance authority of the state of New Hampshire to finance student loans.","Relative to providing for the issuance of bonds and other obligations by the business finance authority of the state of New Hampshire to finance student loans.",0,,2024-07-10,"Signed by the Governor on 07/03/2024; Chapter 0150; Effective 09/01/2024",https://legiscan.com/NH/bill/SB334/2024,https://gencourt.state.nh.us/bill_status/legacy/bs2016/bill_status.aspx?lsr=2845&sy=2024&sortoption=&txtsessionyear=2024&txtbillnumber=SB334
1792802,2124,SB335,1,Introduced,2023-12-11,"Relative to alcohol packaging.","Relative to alcohol packaging.",0,,2024-03-21,"Pending Motion Ought to Pass; 03/21/2024; Senate Journal 7",https://legiscan.com/NH/bill/SB335/2024,https://gencourt.state.nh.us/bill_status/legacy/bs2016/bill_status.aspx?lsr=2846&sy=2024&sortoption=&txtsessionyear=2024&txtbillnumber=SB335
1793366,2124,SB336,1,Introduced,2023-12-11,"Relative to misrepresentation by public employees.","Relative to misrepresentation by public employees.",0,,2024-02-08,"Refer to Interim Study, Motion Adopted, Voice Vote; 02/08/2024; Senate Journal 3",https://legiscan.com/NH/bill/SB336/2024,https://gencourt.state.nh.us/bill_status/legacy/bs2016/bill_status.aspx?lsr=2819&sy=2024&sortoption=&txtsessionyear=2024&txtbillnumber=SB336
1792843,2124,SB337,4,Passed,2024-07-30,"Relative to doula and lactation service provider certification.","Relative to doula and lactation service provider certification.",0,,2024-07-30,"Signed by the Governor on 07/26/2024; Chapter 0280; Effective 07/01/2024",https://legiscan.com/NH/bill/SB337/2024,https://gencourt.state.nh.us/bill_status/legacy/bs2016/bill_status.aspx?lsr=2820&sy=2024&sortoption=&txtsessionyear=2024&txtbillnumber=SB337
1793603,2124,SB338,4,Passed,2024-07-30,"Relative to the education professional standards board.","Relative to the education professional standards board.",0,,2024-07-30,"Signed by the Governor on 07/26/2024; Chapter 0281; Effective 09/24/2024",https://legiscan.com/NH/bill/SB338/2024,https://gencourt.state.nh.us/bill_status/legacy/bs2016/bill_status.aspx?lsr=2813&sy=2024&sortoption=&txtsessionyear=2024&txtbillnumber=SB338
1792943,2124,SB339,2,Engrossed,2024-02-29,"Relative to repealing the graduation requirement regarding Free Application for Federal Student Aid (FAFSA) applications.","Relative to repealing the graduation requirement regarding Free Application for Federal Student Aid (FAFSA) applications.",0,,2024-05-02,"Inexpedient to Legislate: Motion Adopted Voice Vote 05/02/2024 House Journal  12 P. 8",https://legiscan.com/NH/bill/SB339/2024,https://gencourt.state.nh.us/bill_status/legacy/bs2016/bill_status.aspx?lsr=2814&sy=2024&sortoption=&txtsessionyear=2024&txtbillnumber=SB339
1793550,2124,SB340,4,Passed,2024-08-07,"Relative to communication between parents and school districts regarding special education, special education reporting requirements, and the office of the advocate for special education.","Relative to communication between parents and school districts regarding special education, special education reporting requirements, and the office of the advocate for special education.",0,,2024-08-07,"Signed by the Governor on 08/02/2024; Chapter 351; Effective 10/01/2024",https://legiscan.com/NH/bill/SB340/2024,https://gencourt.state.nh.us/bill_status/legacy/bs2016/bill_status.aspx?lsr=2815&sy=2024&sortoption=&txtsessionyear=2024&txtbillnumber=SB340
1792908,2124,SB341,2,Engrossed,2024-04-10,"Relative to mandatory disclosure by school district employees to parents.","Relative to mandatory disclosure by school district employees to parents.",0,,2024-05-02,"Indefinitely Postpone (Rep. Wilhelm): Motion Adopted Regular Calendar 185-176 05/02/2024 House Journal  12 P. 42",https://legiscan.com/NH/bill/SB341/2024,https://gencourt.state.nh.us/bill_status/legacy/bs2016/bill_status.aspx?lsr=2832&sy=2024&sortoption=&txtsessionyear=2024&txtbillnumber=SB341
1792743,2124,SB342,1,Introduced,2023-12-11,"Relative to school building aid funding.","Relative to school building aid funding.",0,,2024-04-05,"Pending Motion OT3rdg; 04/05/2024; Senate Journal 8",https://legiscan.com/NH/bill/SB342/2024,https://gencourt.state.nh.us/bill_status/legacy/bs2016/bill_status.aspx?lsr=2835&sy=2024&sortoption=&txtsessionyear=2024&txtbillnumber=SB342
1792650,2124,SB343,1,Introduced,2023-12-11,"Relative to school based health services.","Relative to school based health services.",0,,2024-01-18,"Pending Motion Interim Study; 01/18/2024; Senate Journal 2",https://legiscan.com/NH/bill/SB343/2024,https://gencourt.state.nh.us/bill_status/legacy/bs2016/bill_status.aspx?lsr=2849&sy=2024&sortoption=&txtsessionyear=2024&txtbillnumber=SB343
1793060,2124,SB344,4,Passed,2024-05-14,"Relative to declarations of candidacy for president of the United States.","Relative to declarations of candidacy for president of the United States.",0,,2024-05-14,"Signed by the Governor on 05/14/2024; Chapter 0016; Effective 07/13/2024",https://legiscan.com/NH/bill/SB344/2024,https://gencourt.state.nh.us/bill_status/legacy/bs2016/bill_status.aspx?lsr=2822&sy=2024&sortoption=&txtsessionyear=2024&txtbillnumber=SB344
1793585,2124,SB345,2,Engrossed,2024-02-29,"Relative to state park fees for state residents.","Relative to state park fees for state residents.",0,,2024-08-27,"Executive Session: 09/25/2024 11:30 am Legislative Office Building 305",https://legiscan.com/NH/bill/SB345/2024,https://gencourt.state.nh.us/bill_status/legacy/bs2016/bill_status.aspx?lsr=2823&sy=2024&sortoption=&txtsessionyear=2024&txtbillnumber=SB345
1793578,2124,SB346,1,Introduced,2023-12-11,"Prohibiting the use of dogs while hunting coyotes.","Prohibiting the use of dogs while hunting coyotes.",0,,2024-02-15,"Pending Motion Inexpedient to Legislate; 02/15/2024; Senate Journal 4",https://legiscan.com/NH/bill/SB346/2024,https://gencourt.state.nh.us/bill_status/legacy/bs2016/bill_status.aspx?lsr=2830&sy=2024&sortoption=&txtsessionyear=2024&txtbillnumber=SB346
1793334,2124,SB347,2,Engrossed,2024-02-29,"Relative to infrastructure appropriations for reimbursement to the city of Laconia.","Relative to infrastructure appropriations for reimbursement to the city of Laconia.",0,,2024-05-23,"Inexpedient to Legislate: Motion Adopted Voice Vote 05/23/2024 House Journal  14 P. 36",https://legiscan.com/NH/bill/SB347/2024,https://gencourt.state.nh.us/bill_status/legacy/bs2016/bill_status.aspx?lsr=2836&sy=2024&sortoption=&txtsessionyear=2024&txtbillnumber=SB347
1793516,2124,SB348,1,Introduced,2023-12-11,"Relative to emergency crop relief.","Relative to emergency crop relief.",0,,2024-02-21,"Refer to Interim Study, Motion Adopted, Voice Vote; 02/21/2024; Senate Journal 5",https://legiscan.com/NH/bill/SB348/2024,https://gencourt.state.nh.us/bill_status/legacy/bs2016/bill_status.aspx?lsr=2851&sy=2024&sortoption=&txtsessionyear=2024&txtbillnumber=SB348
1793220,2124,SB349,2,Engrossed,2024-03-12,"Establishing a committee to study voluntary home visiting services for families withnewborns, infants, and young children.","Establishing a committee to study voluntary home visiting services for families withnewborns, infants, and young children.",0,,2024-05-30,"Sen. Birdsell Moved Nonconcur with the House Amendment, Motion Adopted, Voice Vote; 05/30/2024; Senate Journal 16",https://legiscan.com/NH/bill/SB349/2024,https://gencourt.state.nh.us/bill_status/legacy/bs2016/bill_status.aspx?lsr=2821&sy=2024&sortoption=&txtsessionyear=2024&txtbillnumber=SB349
