bill_id,session_id,bill_number,status,status_desc,status_date,title,description,committee_id,committee,last_action_date,last_action,url,state_link
1792655,2124,HB1468,4,Passed,2024-07-22,"Directing the department of transportation to develop a Conway Branch rail line master plan.","Directing the department of transportation to develop a Conway Branch rail line master plan.",0,,2024-07-22,"Signed by Governor Sununu 07/03/2024; Chapter 137; eff. 07/01/2024",https://legiscan.com/NH/bill/HB1468/2024,https://gencourt.state.nh.us/bill_status/legacy/bs2016/bill_status.aspx?lsr=2794&sy=2024&sortoption=&txtsessionyear=2024&txtbillnumber=HB1468
1793063,2124,HB1469,4,Passed,2024-07-30,"Relative to the retention of individualized education program records.","Relative to the retention of individualized education program records.",0,,2024-07-30,"Signed by Governor Sununu 07/26/2024; Chapter 268; eff. 09/24/2024",https://legiscan.com/NH/bill/HB1469/2024,https://gencourt.state.nh.us/bill_status/legacy/bs2016/bill_status.aspx?lsr=2783&sy=2024&sortoption=&txtsessionyear=2024&txtbillnumber=HB1469
1793298,2124,HB1470,1,Introduced,2023-12-11,"Establishing a committee to study the feasibility and impact of tax credits and other incentives to increase the availability of low-income housing and workforce housing.","Establishing a committee to study the feasibility and impact of tax credits and other incentives to increase the availability of low-income housing and workforce housing.",0,,2024-03-21,"Indefinitely Postpone (Rep. Sweeney): Motion Adopted Regular Calendar 164-162 03/21/2024 House Journal  9 P. 124",https://legiscan.com/NH/bill/HB1470/2024,https://gencourt.state.nh.us/bill_status/legacy/bs2016/bill_status.aspx?lsr=2775&sy=2024&sortoption=&txtsessionyear=2024&txtbillnumber=HB1470
1792803,2124,HB1471,1,Introduced,2023-12-11,"Declaring the total solar eclipse a school holiday.","Declaring the total solar eclipse a school holiday.",0,,2024-02-08,"Inexpedient to Legislate: Motion Adopted Voice Vote 02/08/2024 House Journal  4 P. 6",https://legiscan.com/NH/bill/HB1471/2024,https://gencourt.state.nh.us/bill_status/legacy/bs2016/bill_status.aspx?lsr=2765&sy=2024&sortoption=&txtsessionyear=2024&txtbillnumber=HB1471
1793558,2124,HB1472,1,Introduced,2023-12-11,"Relative to rebates of energy efficiency funds for electric vehicles.","Relative to rebates of energy efficiency funds for electric vehicles.",0,,2024-02-22,"Reconsider HB1472 (Rep. Sweeney): Motion Failed Regular Calendar 187-192 02/22/2024 House Journal  6 P. 86",https://legiscan.com/NH/bill/HB1472/2024,https://gencourt.state.nh.us/bill_status/legacy/bs2016/bill_status.aspx?lsr=2764&sy=2024&sortoption=&txtsessionyear=2024&txtbillnumber=HB1472
1793608,2124,HB1473,1,Introduced,2023-12-11,"Relative to social-emotional learning in public schools.","Relative to social-emotional learning in public schools.",0,,2024-03-07,"Inexpedient to Legislate: Motion Adopted Voice Vote 03/07/2024 House Journal  7 P. 9",https://legiscan.com/NH/bill/HB1473/2024,https://gencourt.state.nh.us/bill_status/legacy/bs2016/bill_status.aspx?lsr=2621&sy=2024&sortoption=&txtsessionyear=2024&txtbillnumber=HB1473
1792759,2124,HB1474,4,Passed,2024-07-26,"Relative to the commission on Native American affairs.","Relative to the commission on Native American affairs.",0,,2024-07-26,"Signed by Governor Sununu 07/19/2024; Chapter 244; eff.09/17/2024",https://legiscan.com/NH/bill/HB1474/2024,https://gencourt.state.nh.us/bill_status/legacy/bs2016/bill_status.aspx?lsr=2754&sy=2024&sortoption=&txtsessionyear=2024&txtbillnumber=HB1474
1793296,2124,HB1475,1,Introduced,2023-12-11,"Relative to preventing strategic lawsuits against public participation.","Relative to preventing strategic lawsuits against public participation.",0,,2024-03-07,"Inexpedient to Legislate: Motion Adopted Voice Vote 03/07/2024 House Journal  7 P. 17",https://legiscan.com/NH/bill/HB1475/2024,https://gencourt.state.nh.us/bill_status/legacy/bs2016/bill_status.aspx?lsr=2610&sy=2024&sortoption=&txtsessionyear=2024&txtbillnumber=HB1475
1792713,2124,HB1476,1,Introduced,2023-12-11,"Relative to charter school memorandums of understanding.","Relative to charter school memorandums of understanding.",0,,2024-03-28,"Lay HB1476 on Table (Rep. Sweeney): Motion Adopted DV 191-182 03/28/2024 House Journal  10 P. 128",https://legiscan.com/NH/bill/HB1476/2024,https://gencourt.state.nh.us/bill_status/legacy/bs2016/bill_status.aspx?lsr=2789&sy=2024&sortoption=&txtsessionyear=2024&txtbillnumber=HB1476
1793005,2124,HB1477,1,Introduced,2023-12-11,"Relative to environmental surety bonds for businesses that pose a significant risk to the state's natural resources.","Relative to environmental surety bonds for businesses that pose a significant risk to the state's natural resources.",0,,2024-02-08,"Inexpedient to Legislate: Motion Adopted Voice Vote 02/08/2024 House Journal  4 P. 13",https://legiscan.com/NH/bill/HB1477/2024,https://gencourt.state.nh.us/bill_status/legacy/bs2016/bill_status.aspx?lsr=2630&sy=2024&sortoption=&txtsessionyear=2024&txtbillnumber=HB1477
1793237,2124,HB1478,1,Introduced,2023-12-11,"Prohibiting a person from membership on the school board and select board concurrently.","Prohibiting a person from membership on the school board and select board concurrently.",0,,2024-03-07,"Inexpedient to Legislate: Motion Adopted Voice Vote 03/07/2024 House Journal  7 P. 21",https://legiscan.com/NH/bill/HB1478/2024,https://gencourt.state.nh.us/bill_status/legacy/bs2016/bill_status.aspx?lsr=2776&sy=2024&sortoption=&txtsessionyear=2024&txtbillnumber=HB1478
1792761,2124,HB1479,1,Introduced,2023-12-11,"Relative to prohibiting the use of federal, state, or local funds for lobbying activities.","Relative to prohibiting the use of federal, state, or local funds for lobbying activities.",0,,2024-03-21,"Indefinitely Postpone (Rep. Maggiore): Motion Adopted Regular Calendar 211-129 03/21/2024 House Journal  9 P. 109",https://legiscan.com/NH/bill/HB1479/2024,https://gencourt.state.nh.us/bill_status/legacy/bs2016/bill_status.aspx?lsr=2781&sy=2024&sortoption=&txtsessionyear=2024&txtbillnumber=HB1479
1792841,2124,HB1480,4,Passed,2024-06-20,"Relative to alternative dispute resolution within individualized education programs.","Relative to alternative dispute resolution within individualized education programs.",0,,2024-06-20,"Signed by Governor Sununu 06/14/2024; Chapter 75; eff. 8/13/2024 House Journal  16",https://legiscan.com/NH/bill/HB1480/2024,https://gencourt.state.nh.us/bill_status/legacy/bs2016/bill_status.aspx?lsr=2785&sy=2024&sortoption=&txtsessionyear=2024&txtbillnumber=HB1480
1792703,2124,HB1481,1,Introduced,2023-12-11,"Relative to appointments to fill vacancies to at large cooperative school board seats.","Relative to appointments to fill vacancies to at large cooperative school board seats.",0,,2024-09-11,"Executive Session: 10/03/2024 10:30 am Legislative Office Building 205-207",https://legiscan.com/NH/bill/HB1481/2024,https://gencourt.state.nh.us/bill_status/legacy/bs2016/bill_status.aspx?lsr=2795&sy=2024&sortoption=&txtsessionyear=2024&txtbillnumber=HB1481
1792969,2124,HB1482,1,Introduced,2023-12-11,"Relative to the sale of human blood and organs.","Relative to the sale of human blood and organs.",0,,2024-03-07,"Lay HB1482 on Table (Rep. W. MacDonald): Motion Adopted DV 326-38 03/07/2024 House Journal  7 P. 65",https://legiscan.com/NH/bill/HB1482/2024,https://gencourt.state.nh.us/bill_status/legacy/bs2016/bill_status.aspx?lsr=2770&sy=2024&sortoption=&txtsessionyear=2024&txtbillnumber=HB1482
1793374,2124,HB1483,1,Introduced,2023-12-11,"Allowing subdivision regulations concerning water supply.","Allowing subdivision regulations concerning water supply.",0,,2024-08-27,"Executive Session: 09/25/2024 11:30 am Legislative Office Building 305",https://legiscan.com/NH/bill/HB1483/2024,https://gencourt.state.nh.us/bill_status/legacy/bs2016/bill_status.aspx?lsr=2768&sy=2024&sortoption=&txtsessionyear=2024&txtbillnumber=HB1483
1792722,2124,HB1484,1,Introduced,2023-12-11,"Relative to current use taxation for certain forested lands.","Relative to current use taxation for certain forested lands.",0,,2024-02-15,"Inexpedient to Legislate: Motion Adopted Voice Vote 02/15/2024 House Journal  5 P. 17",https://legiscan.com/NH/bill/HB1484/2024,https://gencourt.state.nh.us/bill_status/legacy/bs2016/bill_status.aspx?lsr=2759&sy=2024&sortoption=&txtsessionyear=2024&txtbillnumber=HB1484
1792649,2124,HB1485,1,Introduced,2023-12-11,"Establishing a committee to study the totality of circumstances surrounding the COVID-19 epidemic.","Establishing a committee to study the totality of circumstances surrounding the COVID-19 epidemic.",0,,2024-09-18,"Executive Session: 10/17/2024 10:30 am Legislative Office Building 206-208",https://legiscan.com/NH/bill/HB1485/2024,https://gencourt.state.nh.us/bill_status/legacy/bs2016/bill_status.aspx?lsr=2779&sy=2024&sortoption=&txtsessionyear=2024&txtbillnumber=HB1485
1793325,2124,HB1486,1,Introduced,2023-12-11,"Relative to proxy carbon pricing in state procurement.","Relative to proxy carbon pricing in state procurement.",0,,2024-03-21,"Inexpedient to Legislate: Motion Adopted Voice Vote 03/21/2024 House Journal  9 P. 7",https://legiscan.com/NH/bill/HB1486/2024,https://gencourt.state.nh.us/bill_status/legacy/bs2016/bill_status.aspx?lsr=2732&sy=2024&sortoption=&txtsessionyear=2024&txtbillnumber=HB1486
1793375,2124,HB1487,1,Introduced,2023-12-11,"Relative to the health effects of 5G technology.","Relative to the health effects of 5G technology.",0,,2024-02-15,"Inexpedient to Legislate: Motion Adopted Voice Vote 02/15/2024 House Journal  5 P. 16",https://legiscan.com/NH/bill/HB1487/2024,https://gencourt.state.nh.us/bill_status/legacy/bs2016/bill_status.aspx?lsr=2710&sy=2024&sortoption=&txtsessionyear=2024&txtbillnumber=HB1487
1792810,2124,HB1488,1,Introduced,2023-12-11,"Relative to hazard mitigation funding.","Relative to hazard mitigation funding.",0,,2024-09-25,"Executive Session: 10/15/2024 10:00 am Legislative Office Building 201",https://legiscan.com/NH/bill/HB1488/2024,https://gencourt.state.nh.us/bill_status/legacy/bs2016/bill_status.aspx?lsr=2707&sy=2024&sortoption=&txtsessionyear=2024&txtbillnumber=HB1488
1793216,2124,HB1489,1,Introduced,2023-12-11,"Relative to town and school ballot recount appeals.","Relative to town and school ballot recount appeals.",0,,2024-02-01,"Inexpedient to Legislate: Motion Adopted Voice Vote 02/01/2024 House Journal  3 P. 9",https://legiscan.com/NH/bill/HB1489/2024,https://gencourt.state.nh.us/bill_status/legacy/bs2016/bill_status.aspx?lsr=2721&sy=2024&sortoption=&txtsessionyear=2024&txtbillnumber=HB1489
1793456,2124,HB1490,4,Passed,2024-07-22,"Relative to the solid waste management act.","Relative to the solid waste management act.",0,,2024-07-22,"Signed by Governor Sununu 07/12/2024; Chapter 199; eff. 09/10/2024",https://legiscan.com/NH/bill/HB1490/2024,https://gencourt.state.nh.us/bill_status/legacy/bs2016/bill_status.aspx?lsr=2702&sy=2024&sortoption=&txtsessionyear=2024&txtbillnumber=HB1490
1793475,2124,HB1491,1,Introduced,2023-12-11,"Prohibiting the repricing of heating fuel subsequent to a concluded sale.","Prohibiting the repricing of heating fuel subsequent to a concluded sale.",0,,2024-03-28,"Inexpedient to Legislate: Motion Adopted Voice Vote 03/28/2024 House Journal  10 P. 16",https://legiscan.com/NH/bill/HB1491/2024,https://gencourt.state.nh.us/bill_status/legacy/bs2016/bill_status.aspx?lsr=2737&sy=2024&sortoption=&txtsessionyear=2024&txtbillnumber=HB1491
1792762,2124,HB1492,1,Introduced,2023-12-11,"Relative to the rate and exemptions of the interest and dividends tax.","Relative to the rate and exemptions of the interest and dividends tax.",0,,2024-08-14,"Executive Session: 09/17/2024 10:30 am Legislative Office Building 202-204",https://legiscan.com/NH/bill/HB1492/2024,https://gencourt.state.nh.us/bill_status/legacy/bs2016/bill_status.aspx?lsr=2762&sy=2024&sortoption=&txtsessionyear=2024&txtbillnumber=HB1492
1793302,2124,HB1493,1,Introduced,2023-12-11,"Relative to the powers and duties of cooperative school district budget committees.","Relative to the powers and duties of cooperative school district budget committees.",0,,2024-09-11,"Executive Session: 10/03/2024 10:30 am Legislative Office Building 205-207",https://legiscan.com/NH/bill/HB1493/2024,https://gencourt.state.nh.us/bill_status/legacy/bs2016/bill_status.aspx?lsr=2780&sy=2024&sortoption=&txtsessionyear=2024&txtbillnumber=HB1493
1793027,2124,HB1494,4,Passed,2024-07-22,"Relative to OHRVs.","Relative to OHRVs.",0,,2024-07-22,"Signed by Governor Sununu 07/12/2024; Chapter 200; eff. 01/01/2025",https://legiscan.com/NH/bill/HB1494/2024,https://gencourt.state.nh.us/bill_status/legacy/bs2016/bill_status.aspx?lsr=2744&sy=2024&sortoption=&txtsessionyear=2024&txtbillnumber=HB1494
1793107,2124,HB1495,1,Introduced,2023-12-11,"Making provisions for the prospective of all legislative acts on a sliding scale based on the vote count when passed by the house of representatives.","Making provisions for the prospective of all legislative acts on a sliding scale based on the vote count when passed by the house of representatives.",0,,2024-02-08,"Inexpedient to Legislate: Motion Adopted Voice Vote 02/08/2024 House Journal  4 P. 11",https://legiscan.com/NH/bill/HB1495/2024,https://gencourt.state.nh.us/bill_status/legacy/bs2016/bill_status.aspx?lsr=2740&sy=2024&sortoption=&txtsessionyear=2024&txtbillnumber=HB1495
1792804,2124,HB1496,1,Introduced,2023-12-11,"Relative to the state's duty to protect children in public schools.","Relative to the state's duty to protect children in public schools.",0,,2024-03-07,"Inexpedient to Legislate: Motion Adopted Voice Vote 03/07/2024 House Journal  7 P. 9",https://legiscan.com/NH/bill/HB1496/2024,https://gencourt.state.nh.us/bill_status/legacy/bs2016/bill_status.aspx?lsr=2778&sy=2024&sortoption=&txtsessionyear=2024&txtbillnumber=HB1496
1793104,2124,HB1497,1,Introduced,2023-12-11,"Restricting trial courts in criminal matters from imposing certain sentences following a plea bargain.","Restricting trial courts in criminal matters from imposing certain sentences following a plea bargain.",0,,2024-03-21,"Inexpedient to Legislate: Motion Adopted Voice Vote 03/21/2024 House Journal  9 P. 10",https://legiscan.com/NH/bill/HB1497/2024,https://gencourt.state.nh.us/bill_status/legacy/bs2016/bill_status.aspx?lsr=2777&sy=2024&sortoption=&txtsessionyear=2024&txtbillnumber=HB1497
1792667,2124,HB1498,1,Introduced,2023-12-11,"Establishing a state short term rental registry.","Establishing a state short term rental registry.",0,,2024-03-28,"Inexpedient to Legislate: Motion Adopted Voice Vote 03/28/2024 House Journal  10 P. 16",https://legiscan.com/NH/bill/HB1498/2024,https://gencourt.state.nh.us/bill_status/legacy/bs2016/bill_status.aspx?lsr=2774&sy=2024&sortoption=&txtsessionyear=2024&txtbillnumber=HB1498
1792793,2124,HB1499,4,Passed,2024-07-30,"Establishing a committee to study the civilian clean energy, community resilience, and conservation corps, and establishing a committee to study the child protection act.","Establishing a committee to study the civilian clean energy, community resilience, and conservation corps, and establishing a committee to study the child protection act.",0,,2024-07-30,"Signed by Governor Sununu 07/26/2024; Chapter 269; eff. 07/26/2024",https://legiscan.com/NH/bill/HB1499/2024,https://gencourt.state.nh.us/bill_status/legacy/bs2016/bill_status.aspx?lsr=2757&sy=2024&sortoption=&txtsessionyear=2024&txtbillnumber=HB1499
1793284,2124,HB1500,1,Introduced,2023-12-11,"Relative to prohibiting the unlawful distribution of misleading synthetic media.","Relative to prohibiting the unlawful distribution of misleading synthetic media.",0,,2024-09-12,"Executive Session: 09/19/2024 01:00 pm Legislative Office Building 202-204",https://legiscan.com/NH/bill/HB1500/2024,https://gencourt.state.nh.us/bill_status/legacy/bs2016/bill_status.aspx?lsr=2743&sy=2024&sortoption=&txtsessionyear=2024&txtbillnumber=HB1500
1793145,2124,HB1501,1,Introduced,2023-12-11,"Repealing the requirement to register dogs annually.","Repealing the requirement to register dogs annually.",0,,2024-03-28,"Inexpedient to Legislate: Motion Adopted Voice Vote 03/28/2024 House Journal  10 P. 23",https://legiscan.com/NH/bill/HB1501/2024,https://gencourt.state.nh.us/bill_status/legacy/bs2016/bill_status.aspx?lsr=2731&sy=2024&sortoption=&txtsessionyear=2024&txtbillnumber=HB1501
1793351,2124,HB1502,1,Introduced,2023-12-11,"Relative to alcohol-related offenses and prohibitions.","Relative to alcohol-related offenses and prohibitions.",0,,2024-02-22,"Inexpedient to Legislate: Motion Adopted Voice Vote 02/22/2024 House Journal  6 P. 5",https://legiscan.com/NH/bill/HB1502/2024,https://gencourt.state.nh.us/bill_status/legacy/bs2016/bill_status.aspx?lsr=2714&sy=2024&sortoption=&txtsessionyear=2024&txtbillnumber=HB1502
1793230,2124,HB1503,1,Introduced,2023-12-11,"Relative to the definition of wetlands.","Relative to the definition of wetlands.",0,,2024-03-28,"Inexpedient to Legislate: Motion Adopted Voice Vote 03/28/2024 House Journal  10 P. 94",https://legiscan.com/NH/bill/HB1503/2024,https://gencourt.state.nh.us/bill_status/legacy/bs2016/bill_status.aspx?lsr=2748&sy=2024&sortoption=&txtsessionyear=2024&txtbillnumber=HB1503
1793405,2124,HB1504,2,Engrossed,2024-04-02,"Relative to architectural paint recycling.","Relative to architectural paint recycling.",0,,2024-05-15,"Special Order to Beginning of Calendar, Without Objection, Motion Adopted; 05/15/2024; Senate Journal 12",https://legiscan.com/NH/bill/HB1504/2024,https://gencourt.state.nh.us/bill_status/legacy/bs2016/bill_status.aspx?lsr=2720&sy=2024&sortoption=&txtsessionyear=2024&txtbillnumber=HB1504
1793415,2124,HB1505,1,Introduced,2023-12-11,"Establishing an animal abuse offender registry.","Establishing an animal abuse offender registry.",0,,2024-03-21,"Inexpedient to Legislate: Motion Adopted Voice Vote 03/21/2024 House Journal  9 P. 4",https://legiscan.com/NH/bill/HB1505/2024,https://gencourt.state.nh.us/bill_status/legacy/bs2016/bill_status.aspx?lsr=2756&sy=2024&sortoption=&txtsessionyear=2024&txtbillnumber=HB1505
1793213,2124,HB1506,1,Introduced,2023-12-11,"Relative to required votes to approve issuance of bonds.","Relative to required votes to approve issuance of bonds.",0,,2024-03-21,"Inexpedient to Legislate: Motion Adopted Voice Vote 03/21/2024 House Journal  9 P. 17",https://legiscan.com/NH/bill/HB1506/2024,https://gencourt.state.nh.us/bill_status/legacy/bs2016/bill_status.aspx?lsr=2606&sy=2024&sortoption=&txtsessionyear=2024&txtbillnumber=HB1506
1792717,2124,HB1507,1,Introduced,2023-12-11,"Relative to innovative financial services","Relative to innovative financial services",0,,2024-09-25,"Executive Session: 10/17/2024 10:00 am Legislative Office Building 302-304",https://legiscan.com/NH/bill/HB1507/2024,https://gencourt.state.nh.us/bill_status/legacy/bs2016/bill_status.aspx?lsr=2735&sy=2024&sortoption=&txtsessionyear=2024&txtbillnumber=HB1507
1792991,2124,HB1508,1,Introduced,2023-12-11,"Requiring fiber optic communications service providers to prioritize service restoration for public safety and public health organizations.","Requiring fiber optic communications service providers to prioritize service restoration for public safety and public health organizations.",0,,2024-02-15,"Refer for Interim Study: Motion Adopted Voice Vote 02/15/2024 House Journal  5 P. 16",https://legiscan.com/NH/bill/HB1508/2024,https://gencourt.state.nh.us/bill_status/legacy/bs2016/bill_status.aspx?lsr=2625&sy=2024&sortoption=&txtsessionyear=2024&txtbillnumber=HB1508
1792652,2124,HB1509,1,Introduced,2023-12-11,"Prohibiting spending of special education moneys for any other purpose and requiring reporting of fund balances to the school board.","Prohibiting spending of special education moneys for any other purpose and requiring reporting of fund balances to the school board.",0,,2024-09-11,"Executive Session: 10/03/2024 10:30 am Legislative Office Building 205-207",https://legiscan.com/NH/bill/HB1509/2024,https://gencourt.state.nh.us/bill_status/legacy/bs2016/bill_status.aspx?lsr=2728&sy=2024&sortoption=&txtsessionyear=2024&txtbillnumber=HB1509
1792904,2124,HB1510,1,Introduced,2023-12-11,"Establishing a commission to identify barriers to and solutions for electric vehicle sales and use.","Establishing a commission to identify barriers to and solutions for electric vehicle sales and use.",0,,2024-03-07,"Inexpedient to Legislate: Motion Adopted Voice Vote 03/07/2024 House Journal  7 P. 88",https://legiscan.com/NH/bill/HB1510/2024,https://gencourt.state.nh.us/bill_status/legacy/bs2016/bill_status.aspx?lsr=2612&sy=2024&sortoption=&txtsessionyear=2024&txtbillnumber=HB1510
1792887,2124,HB1511,4,Passed,2024-07-22,"Relative to liability for children with disabilities in certain court ordered placements or episodes of treatment.","Relative to liability for children with disabilities in certain court ordered placements or episodes of treatment.",0,,2024-07-22,"Signed by Governor Sununu 07/03/2024; Chapter 138; eff. 07/01/2024",https://legiscan.com/NH/bill/HB1511/2024,https://gencourt.state.nh.us/bill_status/legacy/bs2016/bill_status.aspx?lsr=2400&sy=2024&sortoption=&txtsessionyear=2024&txtbillnumber=HB1511
1792700,2124,HB1512,1,Introduced,2023-12-11,"Limiting education freedom account funding to budgeted amounts.","Limiting education freedom account funding to budgeted amounts.",0,,2024-03-14,"Indefinitely Postpone (Rep. Sweeney): Motion Adopted Regular Calendar 187-185 03/14/2024 House Journal  8 P. 42",https://legiscan.com/NH/bill/HB1512/2024,https://gencourt.state.nh.us/bill_status/legacy/bs2016/bill_status.aspx?lsr=2284&sy=2024&sortoption=&txtsessionyear=2024&txtbillnumber=HB1512
1792948,2124,HB1513,1,Introduced,2023-12-11,"Relative to the board of directors of the Pease development authority.","Relative to the board of directors of the Pease development authority.",0,,2024-03-28,"Inexpedient to Legislate: Motion Adopted Voice Vote 03/28/2024 House Journal  10 P. 94",https://legiscan.com/NH/bill/HB1513/2024,https://gencourt.state.nh.us/bill_status/legacy/bs2016/bill_status.aspx?lsr=2749&sy=2024&sortoption=&txtsessionyear=2024&txtbillnumber=HB1513
1793539,2124,HB1514,1,Introduced,2023-12-11,"Relative to excess funds paid to municipalities for the use of school districts.","Relative to excess funds paid to municipalities for the use of school districts.",0,,2024-08-14,"Executive Session: 09/17/2024 10:30 am Legislative Office Building 202-204",https://legiscan.com/NH/bill/HB1514/2024,https://gencourt.state.nh.us/bill_status/legacy/bs2016/bill_status.aspx?lsr=2245&sy=2024&sortoption=&txtsessionyear=2024&txtbillnumber=HB1514
1793032,2124,HB1515,1,Introduced,2023-12-11,"Relative to the meals and rooms tax rate.","Relative to the meals and rooms tax rate.",0,,2024-02-22,"Inexpedient to Legislate: Motion Adopted Voice Vote 02/22/2024 House Journal  6 P. 20",https://legiscan.com/NH/bill/HB1515/2024,https://gencourt.state.nh.us/bill_status/legacy/bs2016/bill_status.aspx?lsr=2176&sy=2024&sortoption=&txtsessionyear=2024&txtbillnumber=HB1515
1793152,2124,HB1516,1,Introduced,2023-12-11,"Relative to enrollment in public schools by children of school district employees.","Relative to enrollment in public schools by children of school district employees.",0,,2024-09-11,"Executive Session: 10/03/2024 10:30 am Legislative Office Building 205-207",https://legiscan.com/NH/bill/HB1516/2024,https://gencourt.state.nh.us/bill_status/legacy/bs2016/bill_status.aspx?lsr=2243&sy=2024&sortoption=&txtsessionyear=2024&txtbillnumber=HB1516
1793098,2124,HB1517,1,Introduced,2023-12-11,"Relative to the statewide education property tax and excess revenue from games of chance.","Relative to the statewide education property tax and excess revenue from games of chance.",0,,2024-03-21,"Inexpedient to Legislate: Motion Adopted Voice Vote 03/21/2024 House Journal  9 P. 19",https://legiscan.com/NH/bill/HB1517/2024,https://gencourt.state.nh.us/bill_status/legacy/bs2016/bill_status.aspx?lsr=2064&sy=2024&sortoption=&txtsessionyear=2024&txtbillnumber=HB1517
1793606,2124,HB1518,1,Introduced,2023-12-11,"Relative to the legislative ethics committee.","Relative to the legislative ethics committee.",0,,2024-03-07,"Inexpedient to Legislate: Motion Adopted Voice Vote 03/07/2024 House Journal  7 P. 20",https://legiscan.com/NH/bill/HB1518/2024,https://gencourt.state.nh.us/bill_status/legacy/bs2016/bill_status.aspx?lsr=2706&sy=2024&sortoption=&txtsessionyear=2024&txtbillnumber=HB1518
1792868,2124,HB1519,1,Introduced,2023-12-11,"Relative to a minor's available work hours.","Relative to a minor's available work hours.",0,,2024-03-21,"Inexpedient to Legislate: Motion Adopted Voice Vote 03/21/2024 House Journal  9 P. 12",https://legiscan.com/NH/bill/HB1519/2024,https://gencourt.state.nh.us/bill_status/legacy/bs2016/bill_status.aspx?lsr=2671&sy=2024&sortoption=&txtsessionyear=2024&txtbillnumber=HB1519
1793077,2124,HB1520,1,Introduced,2023-12-11,"Establishing a family assistance car ownership pilot program in the department of health and human services.","Establishing a family assistance car ownership pilot program in the department of health and human services.",0,,2024-02-01,"Inexpedient to Legislate: Motion Adopted Voice Vote 02/01/2024 House Journal  3 P. 20",https://legiscan.com/NH/bill/HB1520/2024,https://gencourt.state.nh.us/bill_status/legacy/bs2016/bill_status.aspx?lsr=2642&sy=2024&sortoption=&txtsessionyear=2024&txtbillnumber=HB1520
1793525,2124,HB1521,2,Engrossed,2024-04-02,"Relative to recovery houses.","Relative to recovery houses.",0,,2024-06-07,"Conference Committee Report: Not Filed House Journal  15",https://legiscan.com/NH/bill/HB1521/2024,https://gencourt.state.nh.us/bill_status/legacy/bs2016/bill_status.aspx?lsr=2609&sy=2024&sortoption=&txtsessionyear=2024&txtbillnumber=HB1521
