bill_id,session_id,bill_number,status,status_desc,status_date,title,description,committee_id,committee,last_action_date,last_action,url,state_link
1445608,1781,HB1479,4,Passed,2021-03-02,"An Act For The National Park College Supplemental Appropriation.","An Act For The National Park College Supplemental Appropriation.",0,,2021-03-02,"Notification that HB1479 is now Act 240",https://legiscan.com/AR/bill/HB1479/2021,https://www.arkleg.state.ar.us/Bills/Detail?tbType=&id=hb1479&ddBienniumSession=2021%2F2021R
1445492,1781,HB1480,4,Passed,2021-03-22,"To Amend Arkansas Law Concerning Cabinet-level Department Secretaries; And To Require The Secretary Of A Cabinet-level Department To Provide A Report To The Legislative Council.","To Amend Arkansas Law Concerning Cabinet-level Department Secretaries; And To Require The Secretary Of A Cabinet-level Department To Provide A Report To The Legislative Council.",0,,2021-03-22,"Notification that HB1480 is now Act 413",https://legiscan.com/AR/bill/HB1480/2021,https://www.arkleg.state.ar.us/Bills/Detail?tbType=&id=hb1480&ddBienniumSession=2021%2F2021R
1444953,1781,HB1481,4,Passed,2021-03-02,"An Act For The Phillips Community College Of The University Of Arkansas Supplemental Appropriation.","An Act For The Phillips Community College Of The University Of Arkansas Supplemental Appropriation.",0,,2021-03-02,"Notification that HB1481 is now Act 239",https://legiscan.com/AR/bill/HB1481/2021,https://www.arkleg.state.ar.us/Bills/Detail?tbType=&id=hb1481&ddBienniumSession=2021%2F2021R
1445116,1781,HB1482,4,Passed,2021-03-02,"An Act For The Henderson State University Supplemental Appropriation.","An Act For The Henderson State University Supplemental Appropriation.",0,,2021-03-02,"Notification that HB1482 is now Act 238",https://legiscan.com/AR/bill/HB1482/2021,https://www.arkleg.state.ar.us/Bills/Detail?tbType=&id=hb1482&ddBienniumSession=2021%2F2021R
1445428,1781,HB1483,4,Passed,2021-03-02,"An Act For The University Of Arkansas - Pulaski Technical College Supplemental Appropriation.","An Act For The University Of Arkansas - Pulaski Technical College Supplemental Appropriation.",0,,2021-03-02,"Notification that HB1483 is now Act 237",https://legiscan.com/AR/bill/HB1483/2021,https://www.arkleg.state.ar.us/Bills/Detail?tbType=&id=hb1483&ddBienniumSession=2021%2F2021R
1444982,1781,HB1484,4,Passed,2021-03-02,"An Act For The North Arkansas College Supplemental Appropriation.","An Act For The North Arkansas College Supplemental Appropriation.",0,,2021-03-02,"Notification that HB1484 is now Act 236",https://legiscan.com/AR/bill/HB1484/2021,https://www.arkleg.state.ar.us/Bills/Detail?tbType=&id=hb1484&ddBienniumSession=2021%2F2021R
1445621,1781,HB1485,4,Passed,2021-03-02,"An Act For The University Of Arkansas At Little Rock Supplemental Appropriation.","An Act For The University Of Arkansas At Little Rock Supplemental Appropriation.",0,,2021-03-02,"Notification that HB1485 is now Act 235",https://legiscan.com/AR/bill/HB1485/2021,https://www.arkleg.state.ar.us/Bills/Detail?tbType=&id=hb1485&ddBienniumSession=2021%2F2021R
1445390,1781,HB1486,6,Failed,2021-10-15,"Concerning The Possession Or Storage Of A Person&#x27;s Firearm When A Person Leaves His Or Her Firearm Inside Of His Or Her Car In His Or Her Employer&#x27;s Parking Lot.","Concerning The Possession Or Storage Of A Person&#x27;s Firearm When A Person Leaves His Or Her Firearm Inside Of His Or Her Car In His Or Her Employer&#x27;s Parking Lot.",0,,2021-10-15,"Died in House Committee at Sine Die Adjournment",https://legiscan.com/AR/bill/HB1486/2021,https://www.arkleg.state.ar.us/Bills/Detail?tbType=&id=hb1486&ddBienniumSession=2021%2F2021R
1445089,1781,HB1487,4,Passed,2021-04-05,"Concerning Business Liability For A Person Exposed To Coronavirus 2019 (covid-19); And To Declare An Emergency.","Concerning Business Liability For A Person Exposed To Coronavirus 2019 (covid-19); And To Declare An Emergency.",0,,2021-04-05,"Notification that HB1487 is now Act 559",https://legiscan.com/AR/bill/HB1487/2021,https://www.arkleg.state.ar.us/Bills/Detail?tbType=&id=hb1487&ddBienniumSession=2021%2F2021R
1445469,1781,HB1488,4,Passed,2021-03-15,"To Amend Certain Provisions Of Arkansas Code That Resulted From Initiated Act 4 Of 1948; To Clarify The Workers&#x27; Compensation Law; And To Declare An Emergency.","To Amend Certain Provisions Of Arkansas Code That Resulted From Initiated Act 4 Of 1948; To Clarify The Workers&#x27; Compensation Law; And To Declare An Emergency.",0,,2021-03-15,"Notification that HB1488 is now Act 353",https://legiscan.com/AR/bill/HB1488/2021,https://www.arkleg.state.ar.us/Bills/Detail?tbType=&id=hb1488&ddBienniumSession=2021%2F2021R
1445517,1781,HB1489,4,Passed,2021-03-02,"An Act For The Arkansas Tech University Supplemental Appropriation.","An Act For The Arkansas Tech University Supplemental Appropriation.",0,,2021-03-02,"Notification that HB1489 is now Act 234",https://legiscan.com/AR/bill/HB1489/2021,https://www.arkleg.state.ar.us/Bills/Detail?tbType=&id=hb1489&ddBienniumSession=2021%2F2021R
1445651,1781,HB1490,4,Passed,2021-03-02,"An Act For The University Of Arkansas Community College At Hope-texarkana Supplemental Appropriation.","An Act For The University Of Arkansas Community College At Hope-texarkana Supplemental Appropriation.",0,,2021-03-02,"Notification that HB1490 is now Act 233",https://legiscan.com/AR/bill/HB1490/2021,https://www.arkleg.state.ar.us/Bills/Detail?tbType=&id=hb1490&ddBienniumSession=2021%2F2021R
1445446,1781,HB1491,4,Passed,2021-03-02,"An Act For The Southern Arkansas University Supplemental Appropriation.","An Act For The Southern Arkansas University Supplemental Appropriation.",0,,2021-03-02,"Notification that HB1491 is now Act 232",https://legiscan.com/AR/bill/HB1491/2021,https://www.arkleg.state.ar.us/Bills/Detail?tbType=&id=hb1491&ddBienniumSession=2021%2F2021R
1445736,1781,HB1492,4,Passed,2021-03-02,"An Act For The Arkansas State University - Mountain Home Supplemental Appropriation.","An Act For The Arkansas State University - Mountain Home Supplemental Appropriation.",0,,2021-03-02,"Notification that HB1492 is now Act 231",https://legiscan.com/AR/bill/HB1492/2021,https://www.arkleg.state.ar.us/Bills/Detail?tbType=&id=hb1492&ddBienniumSession=2021%2F2021R
1445102,1781,HB1493,4,Passed,2021-03-02,"An Act For The University Of Arkansas Community College At Rich Mountain Supplemental Appropriation.","An Act For The University Of Arkansas Community College At Rich Mountain Supplemental Appropriation.",0,,2021-03-02,"Notification that HB1493 is now Act 230",https://legiscan.com/AR/bill/HB1493/2021,https://www.arkleg.state.ar.us/Bills/Detail?tbType=&id=hb1493&ddBienniumSession=2021%2F2021R
1445271,1781,HB1494,4,Passed,2021-03-02,"An Act For The Ozarka College Supplemental Appropriation.","An Act For The Ozarka College Supplemental Appropriation.",0,,2021-03-02,"Notification that HB1494 is now Act 229",https://legiscan.com/AR/bill/HB1494/2021,https://www.arkleg.state.ar.us/Bills/Detail?tbType=&id=hb1494&ddBienniumSession=2021%2F2021R
1446177,1781,HB1495,6,Failed,2021-10-15,"To Amend The Law Concerning Load Limits For A Vehicle Transporting Certain Raw Materials And Logs; And To Declare An Emergency. ","To Amend The Law Concerning Load Limits For A Vehicle Transporting Certain Raw Materials And Logs; And To Declare An Emergency. ",0,,2021-10-15,"Died on House Calendar at Sine Die Adjournment",https://legiscan.com/AR/bill/HB1495/2021,https://www.arkleg.state.ar.us/Bills/Detail?tbType=&id=hb1495&ddBienniumSession=2021%2F2021R
1446088,1781,HB1496,4,Passed,2021-03-15,"To Specify Terms Regarding Termination And Buyout Agreements That A Contract For Employment For A President And Chancellor Of A State-supported Institution Of Higher Education Shall Include.","To Specify Terms Regarding Termination And Buyout Agreements That A Contract For Employment For A President And Chancellor Of A State-supported Institution Of Higher Education Shall Include.",0,,2021-03-15,"Notification that HB1496 is now Act 352",https://legiscan.com/AR/bill/HB1496/2021,https://www.arkleg.state.ar.us/Bills/Detail?tbType=&id=hb1496&ddBienniumSession=2021%2F2021R
1446804,1781,HB1497,4,Passed,2021-04-21,"Expanding The Permitted Use Of A Certified Facility Dog For Vulnerable Witnesses.","Expanding The Permitted Use Of A Certified Facility Dog For Vulnerable Witnesses.",0,,2021-04-21,"Notification that HB1497 is now Act 824",https://legiscan.com/AR/bill/HB1497/2021,https://www.arkleg.state.ar.us/Bills/Detail?tbType=&id=hb1497&ddBienniumSession=2021%2F2021R
1446444,1781,HB1498,6,Failed,2021-10-15,"Concerning The Civil Enforcement Of Certain Causes Of Action Against A Long-term Care Facility By A Resident Of That Facility.","Concerning The Civil Enforcement Of Certain Causes Of Action Against A Long-term Care Facility By A Resident Of That Facility.",0,,2021-10-15,"Died in House Committee at Sine Die Adjournment",https://legiscan.com/AR/bill/HB1498/2021,https://www.arkleg.state.ar.us/Bills/Detail?tbType=&id=hb1498&ddBienniumSession=2021%2F2021R
1459375,1781,HB1499,4,Passed,2021-04-28,"To Amend The Law Concerning The Arkansas Child Abuse/rape/domestic Violence Commission; Concerning Notice Of Severe Maltreatment Reports; And Concerning Certain Annual Reports Submitted By The Administrative Office Of The Courts.","To Amend The Law Concerning The Arkansas Child Abuse/rape/domestic Violence Commission; Concerning Notice Of Severe Maltreatment Reports; And Concerning Certain Annual Reports Submitted By The Administrative Office Of The Courts.",0,,2021-04-28,"Notification that HB1499 is now Act 975",https://legiscan.com/AR/bill/HB1499/2021,https://www.arkleg.state.ar.us/Bills/Detail?tbType=&id=hb1499&ddBienniumSession=2021%2F2021R
1459486,1781,HB1500,6,Failed,2021-10-15,"To Amend The Law Concerning The Property Tax Exemption For Disabled Veterans, Their Surviving Spouses, And Their Minor Dependent Children; And To Clarify The Requirements To Establish Eligibility For The Exemption.","To Amend The Law Concerning The Property Tax Exemption For Disabled Veterans, Their Surviving Spouses, And Their Minor Dependent Children; And To Clarify The Requirements To Establish Eligibility For The Exemption.",0,,2021-10-15,"Died in House Committee at Sine Die Adjournment",https://legiscan.com/AR/bill/HB1500/2021,https://www.arkleg.state.ar.us/Bills/Detail?tbType=&id=hb1500&ddBienniumSession=2021%2F2021R
1459522,1781,HB1501,4,Passed,2021-04-01,"To Amend The Source Of Funding That May Be Used To Manage, Maintain, And Operate A Multidistrict Vocational Center Under Certain Circumstances.","To Amend The Source Of Funding That May Be Used To Manage, Maintain, And Operate A Multidistrict Vocational Center Under Certain Circumstances.",0,,2021-04-01,"Notification that HB1501 is now Act 507",https://legiscan.com/AR/bill/HB1501/2021,https://www.arkleg.state.ar.us/Bills/Detail?tbType=&id=hb1501&ddBienniumSession=2021%2F2021R
1459449,1781,HB1502,4,Passed,2021-04-13,"To Require That Clear Face Mask Coverings Be Worn By Certain Persons If Interacting With An Individual Who Is Deaf Or Hard Of Hearing During Certain Disaster Emergencies.","To Require That Clear Face Mask Coverings Be Worn By Certain Persons If Interacting With An Individual Who Is Deaf Or Hard Of Hearing During Certain Disaster Emergencies.",0,,2021-04-13,"Notification that HB1502 is now Act 697",https://legiscan.com/AR/bill/HB1502/2021,https://www.arkleg.state.ar.us/Bills/Detail?tbType=&id=hb1502&ddBienniumSession=2021%2F2021R
1459558,1781,HB1503,4,Passed,2021-03-02,"An Act For The Arkansas Northeastern College Supplemental Appropriation.","An Act For The Arkansas Northeastern College Supplemental Appropriation.",0,,2021-03-02,"Notification that HB1503 is now Act 228",https://legiscan.com/AR/bill/HB1503/2021,https://www.arkleg.state.ar.us/Bills/Detail?tbType=&id=hb1503&ddBienniumSession=2021%2F2021R
1459413,1781,HB1504,4,Passed,2021-03-02,"An Act For The Black River Technical College Supplemental Appropriation.","An Act For The Black River Technical College Supplemental Appropriation.",0,,2021-03-02,"Notification that HB1504 is now Act 227",https://legiscan.com/AR/bill/HB1504/2021,https://www.arkleg.state.ar.us/Bills/Detail?tbType=&id=hb1504&ddBienniumSession=2021%2F2021R
1459871,1781,HB1505,4,Passed,2021-04-05,"To Amend The Law Concerning The Penalty For A Driver Who Fails To Remain At The Scene Of An Accident That Results In Death Or Personal Injury.","To Amend The Law Concerning The Penalty For A Driver Who Fails To Remain At The Scene Of An Accident That Results In Death Or Personal Injury.",0,,2021-04-05,"Notification that HB1505 is now Act 558",https://legiscan.com/AR/bill/HB1505/2021,https://www.arkleg.state.ar.us/Bills/Detail?tbType=&id=hb1505&ddBienniumSession=2021%2F2021R
1459682,1781,HB1506,4,Passed,2021-03-15,"Prohibiting The Use Of A Hoax Bomb.","Prohibiting The Use Of A Hoax Bomb.",0,,2021-03-15,"Notification that HB1506 is now Act 351",https://legiscan.com/AR/bill/HB1506/2021,https://www.arkleg.state.ar.us/Bills/Detail?tbType=&id=hb1506&ddBienniumSession=2021%2F2021R
1460226,1781,HB1507,4,Passed,2021-04-01,"Concerning A Sex Offender&#x27;s Ability To Reside With A Minor.","Concerning A Sex Offender&#x27;s Ability To Reside With A Minor.",0,,2021-04-01,"Notification that HB1507 is now Act 499",https://legiscan.com/AR/bill/HB1507/2021,https://www.arkleg.state.ar.us/Bills/Detail?tbType=&id=hb1507&ddBienniumSession=2021%2F2021R
1459702,1781,HB1508,4,Passed,2021-04-29,"Concerning Riot Offenses And Public Demonstration Offenses; Concerning Offenses Committed Against First Responders; Concerning Public And Private Property Offenses; And Concerning Procedures Upon Arrest.","Concerning Riot Offenses And Public Demonstration Offenses; Concerning Offenses Committed Against First Responders; Concerning Public And Private Property Offenses; And Concerning Procedures Upon Arrest.",0,,2021-04-29,"Notification that HB1508 is now Act 1014",https://legiscan.com/AR/bill/HB1508/2021,https://www.arkleg.state.ar.us/Bills/Detail?tbType=&id=hb1508&ddBienniumSession=2021%2F2021R
1459589,1781,HB1509,4,Passed,2021-04-27,"To Amend The Arkansas Tax-deferred Tuition Savings Program Act; To Adopt Recent Changes Contained In The Internal Revenue Code; And To Change The Name Of The Program.","To Amend The Arkansas Tax-deferred Tuition Savings Program Act; To Adopt Recent Changes Contained In The Internal Revenue Code; And To Change The Name Of The Program.",0,,2021-04-27,"Notification that HB1509 is now Act 966",https://legiscan.com/AR/bill/HB1509/2021,https://www.arkleg.state.ar.us/Bills/Detail?tbType=&id=hb1509&ddBienniumSession=2021%2F2021R
1459661,1781,HB1510,4,Passed,2021-04-08,"To Require A School District Board Of Directors And Local Law Enforcement Agency To Adopt A Memorandum Of Understanding Governing School Resource Officers; And To Require School Resource Officers Complete Specialized Training.","To Require A School District Board Of Directors And Local Law Enforcement Agency To Adopt A Memorandum Of Understanding Governing School Resource Officers; And To Require School Resource Officers Complete Specialized Training.",0,,2021-04-08,"Notification that HB1510 is now Act 622",https://legiscan.com/AR/bill/HB1510/2021,https://www.arkleg.state.ar.us/Bills/Detail?tbType=&id=hb1510&ddBienniumSession=2021%2F2021R
1459842,1781,HB1511,4,Passed,2021-04-01,"Concerning Victim Impact Panel Attendance Required For Persons Who Commit Alcohol-related Offenses.","Concerning Victim Impact Panel Attendance Required For Persons Who Commit Alcohol-related Offenses.",0,,2021-04-01,"Notification that HB1511 is now Act 500",https://legiscan.com/AR/bill/HB1511/2021,https://www.arkleg.state.ar.us/Bills/Detail?tbType=&id=hb1511&ddBienniumSession=2021%2F2021R
1459919,1781,HB1512,4,Passed,2021-03-23,"To Promote Work In The Supplemental Nutrition Assistance Program.","To Promote Work In The Supplemental Nutrition Assistance Program.",0,,2021-03-23,"Notification that HB1512 is now Act 419",https://legiscan.com/AR/bill/HB1512/2021,https://www.arkleg.state.ar.us/Bills/Detail?tbType=&id=hb1512&ddBienniumSession=2021%2F2021R
1460165,1781,HB1513,4,Passed,2021-04-22,"To Create An Income Tax Credit For Retired Law Enforcement Officers Who Work Cold Cases For The Division Of Arkansas State Police.","To Create An Income Tax Credit For Retired Law Enforcement Officers Who Work Cold Cases For The Division Of Arkansas State Police.",0,,2021-04-22,"Notification that HB1513 is now Act 841",https://legiscan.com/AR/bill/HB1513/2021,https://www.arkleg.state.ar.us/Bills/Detail?tbType=&id=hb1513&ddBienniumSession=2021%2F2021R
1459774,1781,HB1514,4,Passed,2021-04-19,"To Prohibit A Data Company From Preventing Authorized Access By A Public Entity To The Public Entity&#x27;s Data.","To Prohibit A Data Company From Preventing Authorized Access By A Public Entity To The Public Entity&#x27;s Data.",0,,2021-04-19,"Notification that HB1514 is now Act 763",https://legiscan.com/AR/bill/HB1514/2021,https://www.arkleg.state.ar.us/Bills/Detail?tbType=&id=hb1514&ddBienniumSession=2021%2F2021R
1459898,1781,HB1515,4,Passed,2021-04-01,"To Amend The Medicaid Provider-led Organized Care Act; And To Prohibit Ownership Interest In More Than One (1) Risk-based Provider Organization.","To Amend The Medicaid Provider-led Organized Care Act; And To Prohibit Ownership Interest In More Than One (1) Risk-based Provider Organization.",0,,2021-04-01,"Notification that HB1515 is now Act 508",https://legiscan.com/AR/bill/HB1515/2021,https://www.arkleg.state.ar.us/Bills/Detail?tbType=&id=hb1515&ddBienniumSession=2021%2F2021R
1459801,1781,HB1516,4,Passed,2021-04-06,"Permitting A Law Enforcement Officer To Transport A Person In Crisis To A Sobering Center.","Permitting A Law Enforcement Officer To Transport A Person In Crisis To A Sobering Center.",0,,2021-04-06,"Notification that HB1516 is now Act 587",https://legiscan.com/AR/bill/HB1516/2021,https://www.arkleg.state.ar.us/Bills/Detail?tbType=&id=hb1516&ddBienniumSession=2021%2F2021R
1460188,1781,HB1517,6,Failed,2021-10-15,"To Create The Voter Integrity And Voter Registration Modernization Act Of 2021; To Allow Electronic Voter Registration; To Amend Arkansas Constitution, Amendment 51; And To Amend The Duties Of The Secretary Of State.","To Create The Voter Integrity And Voter Registration Modernization Act Of 2021; To Allow Electronic Voter Registration; To Amend Arkansas Constitution, Amendment 51; And To Amend The Duties Of The Secretary Of State.",0,,2021-10-15,"Died on Senate Calendar at Sine Die adjournment.",https://legiscan.com/AR/bill/HB1517/2021,https://www.arkleg.state.ar.us/Bills/Detail?tbType=&id=hb1517&ddBienniumSession=2021%2F2021R
1459990,1781,HB1518,4,Passed,2021-04-20,"To Amend The Law Concerning The Creation Of A Trust; And To Amend The Law Concerning A Power Of Attorney As It Relates To The Creation And Validity Of A Trust.","To Amend The Law Concerning The Creation Of A Trust; And To Amend The Law Concerning A Power Of Attorney As It Relates To The Creation And Validity Of A Trust.",0,,2021-04-20,"Notification that HB1518 is now Act 804",https://legiscan.com/AR/bill/HB1518/2021,https://www.arkleg.state.ar.us/Bills/Detail?tbType=&id=hb1518&ddBienniumSession=2021%2F2021R
1460139,1781,HB1519,4,Passed,2021-04-01,"To Amend The Petroleum Storage Tank Trust Fund Act; And To Increase The Balance Of The Petroleum Storage Tank Trust Fund Requiring A Reduction In The Petroleum Environmental Assurance Fee.","To Amend The Petroleum Storage Tank Trust Fund Act; And To Increase The Balance Of The Petroleum Storage Tank Trust Fund Requiring A Reduction In The Petroleum Environmental Assurance Fee.",0,,2021-04-01,"Notification that HB1519 is now Act 509",https://legiscan.com/AR/bill/HB1519/2021,https://www.arkleg.state.ar.us/Bills/Detail?tbType=&id=hb1519&ddBienniumSession=2021%2F2021R
1459946,1781,HB1520,4,Passed,2021-04-19,"To Amend The Arkansas Code Concerning Occupational Criminal Background Checks; And To Ensure That Licensees Who Were Licensed Prior To The Enactment Of Acts 2019, No. 990, Are Allowed To Maintain Their Licenses.","To Amend The Arkansas Code Concerning Occupational Criminal Background Checks; And To Ensure That Licensees Who Were Licensed Prior To The Enactment Of Acts 2019, No. 990, Are Allowed To Maintain Their Licenses.",0,,2021-04-19,"Notification that HB1520 is now Act 762",https://legiscan.com/AR/bill/HB1520/2021,https://www.arkleg.state.ar.us/Bills/Detail?tbType=&id=hb1520&ddBienniumSession=2021%2F2021R
1460207,1781,HB1521,4,Passed,2021-04-01,"To Codify Executive Orders 20-18 And 20-34 To Ensure Healthcare Professionals Are Equipped With The Tools Necessary To Combat Covid-19; And To Declare An Emergency.","To Codify Executive Orders 20-18 And 20-34 To Ensure Healthcare Professionals Are Equipped With The Tools Necessary To Combat Covid-19; And To Declare An Emergency.",0,,2021-04-01,"Notification that HB1521 is now Act 510",https://legiscan.com/AR/bill/HB1521/2021,https://www.arkleg.state.ar.us/Bills/Detail?tbType=&id=hb1521&ddBienniumSession=2021%2F2021R
1460437,1781,HB1522,4,Passed,2021-03-23,"To Amend Arkansas Election Law; To Amend Election Law Concerning Misdemeanor Offenses; And To Create A Misdemeanor Offense For False Statements By Candidates.","To Amend Arkansas Election Law; To Amend Election Law Concerning Misdemeanor Offenses; And To Create A Misdemeanor Offense For False Statements By Candidates.",0,,2021-03-23,"Notification that HB1522 is now Act 416",https://legiscan.com/AR/bill/HB1522/2021,https://www.arkleg.state.ar.us/Bills/Detail?tbType=&id=hb1522&ddBienniumSession=2021%2F2021R
1460453,1781,HB1523,6,Failed,2021-10-15,"To Be Known As The &quot;arkansas Equal Justice Under The Law Act Of 2021&quot;.","To Be Known As The &quot;arkansas Equal Justice Under The Law Act Of 2021&quot;.",0,,2021-10-15,"Died in House Committee at Sine Die Adjournment",https://legiscan.com/AR/bill/HB1523/2021,https://www.arkleg.state.ar.us/Bills/Detail?tbType=&id=hb1523&ddBienniumSession=2021%2F2021R
1460321,1781,HB1524,6,Failed,2021-10-15,"To Amend The Law Concerning The Operation Of A Railroad Train; To Require A Railroad Train Standard Crew Size For Class I Railroad Train Operations Within The State; And To Declare An Emergency.","To Amend The Law Concerning The Operation Of A Railroad Train; To Require A Railroad Train Standard Crew Size For Class I Railroad Train Operations Within The State; And To Declare An Emergency.",0,,2021-10-15,"Died in House Committee at Sine Die Adjournment",https://legiscan.com/AR/bill/HB1524/2021,https://www.arkleg.state.ar.us/Bills/Detail?tbType=&id=hb1524&ddBienniumSession=2021%2F2021R
1460280,1781,HB1525,4,Passed,2021-04-30,"Concerning The Unlawful Possession, Transportation, And Use Of Medical Marijuana.","Concerning The Unlawful Possession, Transportation, And Use Of Medical Marijuana.",0,,2021-04-30,"Notification that HB1525 is now Act 1062",https://legiscan.com/AR/bill/HB1525/2021,https://www.arkleg.state.ar.us/Bills/Detail?tbType=&id=hb1525&ddBienniumSession=2021%2F2021R
1460914,1781,HB1526,6,Failed,2021-10-15,"Concerning The Defense Of A Person With The Use Of Physical Force Or Deadly Physical Force.","Concerning The Defense Of A Person With The Use Of Physical Force Or Deadly Physical Force.",0,,2021-10-15,"Died in House Committee at Sine Die Adjournment",https://legiscan.com/AR/bill/HB1526/2021,https://www.arkleg.state.ar.us/Bills/Detail?tbType=&id=hb1526&ddBienniumSession=2021%2F2021R
1461240,1781,HB1527,4,Passed,2021-03-17,"Concerning Personnel And Salaries For Employees Of The Department Of Arkansas State Police.","Concerning Personnel And Salaries For Employees Of The Department Of Arkansas State Police.",0,,2021-03-17,"Notification that HB1527 is now Act 398",https://legiscan.com/AR/bill/HB1527/2021,https://www.arkleg.state.ar.us/Bills/Detail?tbType=&id=hb1527&ddBienniumSession=2021%2F2021R
1461496,1781,HB1528,4,Passed,2021-04-23,"An Act For The Department Of Human Services - Division Of Developmental Disabilities Services Capital Improvement Appropriation.","An Act For The Department Of Human Services - Division Of Developmental Disabilities Services Capital Improvement Appropriation.",0,,2021-04-23,"Notification that HB1528 is now Act 869",https://legiscan.com/AR/bill/HB1528/2021,https://www.arkleg.state.ar.us/Bills/Detail?tbType=&id=hb1528&ddBienniumSession=2021%2F2021R
1461815,1781,HB1529,4,Passed,2021-04-23,"An Act For The Department Of Energy And Environment - Division Of Environmental Quality Development And Enhancement Appropriation.","An Act For The Department Of Energy And Environment - Division Of Environmental Quality Development And Enhancement Appropriation.",0,,2021-04-23,"Notification that HB1529 is now Act 868",https://legiscan.com/AR/bill/HB1529/2021,https://www.arkleg.state.ar.us/Bills/Detail?tbType=&id=hb1529&ddBienniumSession=2021%2F2021R
1461470,1781,HB1530,6,Failed,2021-10-15,"To Amend Arkansas Law Concerning Campaign Finance; And To Amend The Law Concerning Surplus Campaign Funds.","To Amend Arkansas Law Concerning Campaign Finance; And To Amend The Law Concerning Surplus Campaign Funds.",0,,2021-10-15,"Died in House Committee at Sine Die Adjournment",https://legiscan.com/AR/bill/HB1530/2021,https://www.arkleg.state.ar.us/Bills/Detail?tbType=&id=hb1530&ddBienniumSession=2021%2F2021R
1461457,1781,HB1531,4,Passed,2021-04-23,"An Act For The Department Of Public Safety Development And Enhancement Appropriation.","An Act For The Department Of Public Safety Development And Enhancement Appropriation.",0,,2021-04-23,"Notification that HB1531 is now Act 867",https://legiscan.com/AR/bill/HB1531/2021,https://www.arkleg.state.ar.us/Bills/Detail?tbType=&id=hb1531&ddBienniumSession=2021%2F2021R
