bill_id,session_id,bill_number,status,status_desc,status_date,title,description,committee_id,committee,last_action_date,last_action,url,state_link
1442177,1781,SB306,4,Passed,2021-04-13,"Permitting A Concealed Handgun Licensee To Carry A Concealed Handgun In A Municipally Owned Or Maintained Park.","Permitting A Concealed Handgun Licensee To Carry A Concealed Handgun In A Municipally Owned Or Maintained Park.",0,,2021-04-13,"Notification that SB306 is now Act 638",https://legiscan.com/AR/bill/SB306/2021,https://www.arkleg.state.ar.us/Bills/Detail?tbType=&id=sb306&ddBienniumSession=2021%2F2021R
1442105,1781,SB307,4,Passed,2021-04-19,"Concerning The Penalties For The Offense Of Fleeing In A Vehicle Or Conveyance.","Concerning The Penalties For The Offense Of Fleeing In A Vehicle Or Conveyance.",0,,2021-04-19,"Notification that SB307 is now Act 722",https://legiscan.com/AR/bill/SB307/2021,https://www.arkleg.state.ar.us/Bills/Detail?tbType=&id=sb307&ddBienniumSession=2021%2F2021R
1442399,1781,SB308,4,Passed,2021-04-13,"Requiring The State To Offer A Victim Of Sexual Assault The Choice To Require The Person Accused Of Committing A Sexual Assault On The Victim To Take An Hiv Test.","Requiring The State To Offer A Victim Of Sexual Assault The Choice To Require The Person Accused Of Committing A Sexual Assault On The Victim To Take An Hiv Test.",0,,2021-04-13,"Notification that SB308 is now Act 653",https://legiscan.com/AR/bill/SB308/2021,https://www.arkleg.state.ar.us/Bills/Detail?tbType=&id=sb308&ddBienniumSession=2021%2F2021R
1442450,1781,SB309,4,Passed,2021-04-21,"To Amend The Requirements For Coverage For Colorectal Cancer Screening.","To Amend The Requirements For Coverage For Colorectal Cancer Screening.",0,,2021-04-21,"Notification that SB309 is now Act 779",https://legiscan.com/AR/bill/SB309/2021,https://www.arkleg.state.ar.us/Bills/Detail?tbType=&id=sb309&ddBienniumSession=2021%2F2021R
1442702,1781,SB310,6,Failed,2021-10-15,"An Act For The Black River Technical College Supplemental Appropriation.","An Act For The Black River Technical College Supplemental Appropriation.",0,,2021-10-15,"Died in Senate Committee at Sine Die adjournment.",https://legiscan.com/AR/bill/SB310/2021,https://www.arkleg.state.ar.us/Bills/Detail?tbType=&id=sb310&ddBienniumSession=2021%2F2021R
1443605,1781,SB311,4,Passed,2021-03-15,"Concerning Probation And Parole; And Concerning Technical Violations And Length Of Sanctions.","Concerning Probation And Parole; And Concerning Technical Violations And Length Of Sanctions.",0,,2021-03-15,"Notification that SB311 is now Act 327",https://legiscan.com/AR/bill/SB311/2021,https://www.arkleg.state.ar.us/Bills/Detail?tbType=&id=sb311&ddBienniumSession=2021%2F2021R
1445226,1781,SB312,4,Passed,2021-04-30,"To Amend The Law Concerning Ownership And Possession Of Real Property.","To Amend The Law Concerning Ownership And Possession Of Real Property.",0,,2021-04-30,"Notification that SB312 is now Act 1046",https://legiscan.com/AR/bill/SB312/2021,https://www.arkleg.state.ar.us/Bills/Detail?tbType=&id=sb312&ddBienniumSession=2021%2F2021R
1445600,1781,SB313,4,Passed,2021-03-29,"To Transfer The Great River Road Division Into The Tourism Division Of The Department Of Parks, Heritage, And Tourism.","To Transfer The Great River Road Division Into The Tourism Division Of The Department Of Parks, Heritage, And Tourism.",0,,2021-03-29,"Notification that SB313 is now Act 495",https://legiscan.com/AR/bill/SB313/2021,https://www.arkleg.state.ar.us/Bills/Detail?tbType=&id=sb313&ddBienniumSession=2021%2F2021R
1445455,1781,SB314,6,Failed,2021-10-15,"To Establish The Conditions Under Which A Public School District Shall Be Returned To Local Control.","To Establish The Conditions Under Which A Public School District Shall Be Returned To Local Control.",0,,2021-10-15,"Sine Die adjournment",https://legiscan.com/AR/bill/SB314/2021,https://www.arkleg.state.ar.us/Bills/Detail?tbType=&id=sb314&ddBienniumSession=2021%2F2021R
1445052,1781,SB315,6,Failed,2021-10-15,"Concerning The Arkansas Court Security Act; To Address Courts That Lack Proper Security; To Create The Court Security Fee.","Concerning The Arkansas Court Security Act; To Address Courts That Lack Proper Security; To Create The Court Security Fee.",0,,2021-10-15,"Died in Senate Committee at Sine Die adjournment.",https://legiscan.com/AR/bill/SB315/2021,https://www.arkleg.state.ar.us/Bills/Detail?tbType=&id=sb315&ddBienniumSession=2021%2F2021R
1445143,1781,SB316,4,Passed,2021-03-08,"An Act For The Southeast Arkansas College Supplemental Appropriation.","An Act For The Southeast Arkansas College Supplemental Appropriation.",0,,2021-03-08,"Notification that SB316 is now Act 291",https://legiscan.com/AR/bill/SB316/2021,https://www.arkleg.state.ar.us/Bills/Detail?tbType=&id=sb316&ddBienniumSession=2021%2F2021R
1445349,1781,SB317,4,Passed,2021-03-08,"An Act For The University Of Arkansas At Monticello Supplemental Appropriation.","An Act For The University Of Arkansas At Monticello Supplemental Appropriation.",0,,2021-03-08,"Notification that SB317 is now Act 292",https://legiscan.com/AR/bill/SB317/2021,https://www.arkleg.state.ar.us/Bills/Detail?tbType=&id=sb317&ddBienniumSession=2021%2F2021R
1445281,1781,SB318,4,Passed,2021-03-08,"An Act For The South Arkansas Community College Supplemental Appropriation.","An Act For The South Arkansas Community College Supplemental Appropriation.",0,,2021-03-08,"Notification that SB318 is now Act 293",https://legiscan.com/AR/bill/SB318/2021,https://www.arkleg.state.ar.us/Bills/Detail?tbType=&id=sb318&ddBienniumSession=2021%2F2021R
1445542,1781,SB319,4,Passed,2021-03-08,"An Act For The University Of Arkansas - System And Various Divisions Supplemental Appropriation.","An Act For The University Of Arkansas - System And Various Divisions Supplemental Appropriation.",0,,2021-03-08,"Notification that SB319 is now Act 294",https://legiscan.com/AR/bill/SB319/2021,https://www.arkleg.state.ar.us/Bills/Detail?tbType=&id=sb319&ddBienniumSession=2021%2F2021R
1445073,1781,SB320,4,Passed,2021-03-08,"An Act For The University Of Arkansas At Pine Bluff Supplemental Appropriation.","An Act For The University Of Arkansas At Pine Bluff Supplemental Appropriation.",0,,2021-03-08,"Notification that SB320 is now Act 295",https://legiscan.com/AR/bill/SB320/2021,https://www.arkleg.state.ar.us/Bills/Detail?tbType=&id=sb320&ddBienniumSession=2021%2F2021R
1445679,1781,SB321,4,Passed,2021-03-08,"An Act For The University Of Arkansas For Medical Sciences Supplemental Appropriation.","An Act For The University Of Arkansas For Medical Sciences Supplemental Appropriation.",0,,2021-03-08,"Notification that SB321 is now Act 296",https://legiscan.com/AR/bill/SB321/2021,https://www.arkleg.state.ar.us/Bills/Detail?tbType=&id=sb321&ddBienniumSession=2021%2F2021R
1445327,1781,SB322,4,Passed,2021-03-08,"An Act For The Arkansas State University - Newport Supplemental Appropriation.","An Act For The Arkansas State University - Newport Supplemental Appropriation.",0,,2021-03-08,"Notification that SB322 is now Act 297",https://legiscan.com/AR/bill/SB322/2021,https://www.arkleg.state.ar.us/Bills/Detail?tbType=&id=sb322&ddBienniumSession=2021%2F2021R
1445239,1781,SB323,4,Passed,2021-03-08,"An Act For The University Of Arkansas At Fayetteville Supplemental Appropriation.","An Act For The University Of Arkansas At Fayetteville Supplemental Appropriation.",0,,2021-03-08,"Notification that SB323 is now Act 298",https://legiscan.com/AR/bill/SB323/2021,https://www.arkleg.state.ar.us/Bills/Detail?tbType=&id=sb323&ddBienniumSession=2021%2F2021R
1445009,1781,SB324,4,Passed,2021-03-08,"An Act For The University Of Arkansas Community College At Batesville Supplemental Appropriation.","An Act For The University Of Arkansas Community College At Batesville Supplemental Appropriation.",0,,2021-03-08,"Notification that SB324 is now Act 299",https://legiscan.com/AR/bill/SB324/2021,https://www.arkleg.state.ar.us/Bills/Detail?tbType=&id=sb324&ddBienniumSession=2021%2F2021R
1445417,1781,SB325,4,Passed,2021-03-08,"An Act For The Arkansas State University Supplemental Appropriation.","An Act For The Arkansas State University Supplemental Appropriation.",0,,2021-03-08,"Notification that SB325 is now Act 300",https://legiscan.com/AR/bill/SB325/2021,https://www.arkleg.state.ar.us/Bills/Detail?tbType=&id=sb325&ddBienniumSession=2021%2F2021R
1445746,1781,SB326,4,Passed,2021-03-08,"An Act For The University Of Central Arkansas Supplemental Appropriation.","An Act For The University Of Central Arkansas Supplemental Appropriation.",0,,2021-03-08,"Notification that SB326 is now Act 301",https://legiscan.com/AR/bill/SB326/2021,https://www.arkleg.state.ar.us/Bills/Detail?tbType=&id=sb326&ddBienniumSession=2021%2F2021R
1445664,1781,SB327,4,Passed,2021-03-08,"An Act For The Arkansas State University - Beebe Supplemental Appropriation.","An Act For The Arkansas State University - Beebe Supplemental Appropriation.",0,,2021-03-08,"Notification that SB327 is now Act 302",https://legiscan.com/AR/bill/SB327/2021,https://www.arkleg.state.ar.us/Bills/Detail?tbType=&id=sb327&ddBienniumSession=2021%2F2021R
1445366,1781,SB328,4,Passed,2021-03-08,"An Act For The Sau-tech Supplemental Appropriation.","An Act For The Sau-tech Supplemental Appropriation.",0,,2021-03-08,"Notification that SB328 is now Act 303",https://legiscan.com/AR/bill/SB328/2021,https://www.arkleg.state.ar.us/Bills/Detail?tbType=&id=sb328&ddBienniumSession=2021%2F2021R
1445501,1781,SB329,4,Passed,2021-03-08,"An Act For The Arkansas State University Three Rivers Supplemental Appropriation.","An Act For The Arkansas State University Three Rivers Supplemental Appropriation.",0,,2021-03-08,"Notification that SB329 is now Act 304",https://legiscan.com/AR/bill/SB329/2021,https://www.arkleg.state.ar.us/Bills/Detail?tbType=&id=sb329&ddBienniumSession=2021%2F2021R
1445172,1781,SB330,4,Passed,2021-03-08,"An Act For The University Of Arkansas Community College At Morrilton Supplemental Appropriation.","An Act For The University Of Arkansas Community College At Morrilton Supplemental Appropriation.",0,,2021-03-08,"Notification that SB330 is now Act 305",https://legiscan.com/AR/bill/SB330/2021,https://www.arkleg.state.ar.us/Bills/Detail?tbType=&id=sb330&ddBienniumSession=2021%2F2021R
1445024,1781,SB331,4,Passed,2021-03-15,"An Act For The Black River Technical College Supplemental Appropriation.","An Act For The Black River Technical College Supplemental Appropriation.",0,,2021-03-15,"Notification that SB331 is now Act 336",https://legiscan.com/AR/bill/SB331/2021,https://www.arkleg.state.ar.us/Bills/Detail?tbType=&id=sb331&ddBienniumSession=2021%2F2021R
1445723,1781,SB332,6,Failed,2021-10-15,"To Establish The Public Health Readiness Act.","To Establish The Public Health Readiness Act.",0,,2021-10-15,"Sine Die adjournment",https://legiscan.com/AR/bill/SB332/2021,https://www.arkleg.state.ar.us/Bills/Detail?tbType=&id=sb332&ddBienniumSession=2021%2F2021R
1446222,1781,SB333,4,Passed,2021-04-05,"To Amend The Law Concerning The Lawful Display Of A License Plate; And To Create An Exception Allowing Certain Devices To Obscure A License Plate.","To Amend The Law Concerning The Lawful Display Of A License Plate; And To Create An Exception Allowing Certain Devices To Obscure A License Plate.",0,,2021-04-05,"Notification that SB333 is now Act 538",https://legiscan.com/AR/bill/SB333/2021,https://www.arkleg.state.ar.us/Bills/Detail?tbType=&id=sb333&ddBienniumSession=2021%2F2021R
1446759,1781,SB334,4,Passed,2021-04-29,"To Amend The Law Concerning The Use Of Eminent Domain By A State Agency; And To Add New Definitions Under Eminent Domain. ","To Amend The Law Concerning The Use Of Eminent Domain By A State Agency; And To Add New Definitions Under Eminent Domain. ",0,,2021-04-29,"Notification that SB334 is now Act 945",https://legiscan.com/AR/bill/SB334/2021,https://www.arkleg.state.ar.us/Bills/Detail?tbType=&id=sb334&ddBienniumSession=2021%2F2021R
1446133,1781,SB335,6,Failed,2021-10-15,"To Amend The Law Concerning The Use Of Eminent Domain By A Local Government; And To Add New Definitions Under Eminent Domain. ","To Amend The Law Concerning The Use Of Eminent Domain By A Local Government; And To Add New Definitions Under Eminent Domain. ",0,,2021-10-15,"Died in House Committee at Sine Die Adjournment",https://legiscan.com/AR/bill/SB335/2021,https://www.arkleg.state.ar.us/Bills/Detail?tbType=&id=sb335&ddBienniumSession=2021%2F2021R
1459339,1781,SB336,4,Passed,2021-05-03,"To Create An Exemption From The Sales And Use Tax For Coins, Currency, And Bullion.","To Create An Exemption From The Sales And Use Tax For Coins, Currency, And Bullion.",0,,2021-05-03,"Notification that SB336 is now Act 1109",https://legiscan.com/AR/bill/SB336/2021,https://www.arkleg.state.ar.us/Bills/Detail?tbType=&id=sb336&ddBienniumSession=2021%2F2021R
1459752,1781,SB337,6,Failed,2021-10-15,"An Act To Reinstate The Border City Tax Rate For Cigarettes And Other Tobacco Products.","An Act To Reinstate The Border City Tax Rate For Cigarettes And Other Tobacco Products.",0,,2021-10-15,"Sine Die adjournment",https://legiscan.com/AR/bill/SB337/2021,https://www.arkleg.state.ar.us/Bills/Detail?tbType=&id=sb337&ddBienniumSession=2021%2F2021R
1459731,1781,SB338,4,Passed,2021-03-17,"To Amend The Arkansas Tobacco Products Tax Act Of 1977; And To Provide A Grace Period For Certain Circumstances At A Permitted Business Location.","To Amend The Arkansas Tobacco Products Tax Act Of 1977; And To Provide A Grace Period For Certain Circumstances At A Permitted Business Location.",0,,2021-03-17,"Notification that SB338 is now Act 386",https://legiscan.com/AR/bill/SB338/2021,https://www.arkleg.state.ar.us/Bills/Detail?tbType=&id=sb338&ddBienniumSession=2021%2F2021R
1460068,1781,SB339,4,Passed,2021-04-14,"To Authorize Certain Permit Holders To Sell Alcoholic Beverages Directly To Consumers To Be Consumed Off-premises Or Delivered To The Consumer At A Location Off-premises.","To Authorize Certain Permit Holders To Sell Alcoholic Beverages Directly To Consumers To Be Consumed Off-premises Or Delivered To The Consumer At A Location Off-premises.",0,,2021-04-14,"Notification that SB339 is now Act 703",https://legiscan.com/AR/bill/SB339/2021,https://www.arkleg.state.ar.us/Bills/Detail?tbType=&id=sb339&ddBienniumSession=2021%2F2021R
1460092,1781,SB340,4,Passed,2021-04-30,"To Regulate The Witnessing Of Certain Documents By A Notary Public; To Allow For Remote Witnessing Of Certain Documents By A Notary Public; And To Declare An Emergency.","To Regulate The Witnessing Of Certain Documents By A Notary Public; To Allow For Remote Witnessing Of Certain Documents By A Notary Public; And To Declare An Emergency.",0,,2021-04-30,"Notification that SB340 is now Act 1047",https://legiscan.com/AR/bill/SB340/2021,https://www.arkleg.state.ar.us/Bills/Detail?tbType=&id=sb340&ddBienniumSession=2021%2F2021R
1459612,1781,SB341,4,Passed,2021-04-12,"To Amend The Law Concerning Public Employees; And To Prohibit Collective Bargaining.","To Amend The Law Concerning Public Employees; And To Prohibit Collective Bargaining.",0,,2021-04-12,"Notification that SB341 is now Act 612",https://legiscan.com/AR/bill/SB341/2021,https://www.arkleg.state.ar.us/Bills/Detail?tbType=&id=sb341&ddBienniumSession=2021%2F2021R
1460113,1781,SB342,6,Failed,2021-10-15,"Concerning The Ability Of A Person Who Had And Was Successfully Treated For A Mental Illness In The Past To Apply For And Possess A License To Carry A Concealed Handgun.","Concerning The Ability Of A Person Who Had And Was Successfully Treated For A Mental Illness In The Past To Apply For And Possess A License To Carry A Concealed Handgun.",0,,2021-10-15,"Died in Senate Committee at Sine Die adjournment.",https://legiscan.com/AR/bill/SB342/2021,https://www.arkleg.state.ar.us/Bills/Detail?tbType=&id=sb342&ddBienniumSession=2021%2F2021R
1460017,1781,SB343,6,Failed,2021-10-15,"Restoring A Person&#x27;s Right To Possess A Firearm Under State Law After A Certain Period Of Time After The Person&#x27;s Conviction For A Nonviolent Felony Offense.","Restoring A Person&#x27;s Right To Possess A Firearm Under State Law After A Certain Period Of Time After The Person&#x27;s Conviction For A Nonviolent Felony Offense.",0,,2021-10-15,"Died in Senate Committee at Sine Die adjournment.",https://legiscan.com/AR/bill/SB343/2021,https://www.arkleg.state.ar.us/Bills/Detail?tbType=&id=sb343&ddBienniumSession=2021%2F2021R
1459968,1781,SB344,4,Passed,2021-03-29,"To Add An Exception From Nursing Licensure To Allow Employees Of A City Or County Detention Center To Draw And Measure Glucagon Or Insulin For A Person Who Is Incarcerated Or In Custody.","To Add An Exception From Nursing Licensure To Allow Employees Of A City Or County Detention Center To Draw And Measure Glucagon Or Insulin For A Person Who Is Incarcerated Or In Custody.",0,,2021-03-29,"Notification that SB344 is now Act 439",https://legiscan.com/AR/bill/SB344/2021,https://www.arkleg.state.ar.us/Bills/Detail?tbType=&id=sb344&ddBienniumSession=2021%2F2021R
1459822,1781,SB345,4,Passed,2021-03-29,"To Amend The Higher Education Uniform Classification And Compensation Act; And To Declare An Emergency. ","To Amend The Higher Education Uniform Classification And Compensation Act; And To Declare An Emergency. ",0,,2021-03-29,"Notification that SB345 is now Act 496",https://legiscan.com/AR/bill/SB345/2021,https://www.arkleg.state.ar.us/Bills/Detail?tbType=&id=sb345&ddBienniumSession=2021%2F2021R
1460040,1781,SB346,4,Passed,2021-04-21,"Concerning The Use Of Audio Media, Visual Media, And Audiovisual Media By Law Enforcement Agencies, Dispatch Centers, Public Safety Answering Points, Jails, And Detention Centers.","Concerning The Use Of Audio Media, Visual Media, And Audiovisual Media By Law Enforcement Agencies, Dispatch Centers, Public Safety Answering Points, Jails, And Detention Centers.",0,,2021-04-21,"Notification that SB346 is now Act 778",https://legiscan.com/AR/bill/SB346/2021,https://www.arkleg.state.ar.us/Bills/Detail?tbType=&id=sb346&ddBienniumSession=2021%2F2021R
1460356,1781,SB347,6,Failed,2021-10-15,"To Create The Vulnerable Child Protection Act; And To Prohibit Gender Reassignment Services For Minors.","To Create The Vulnerable Child Protection Act; And To Prohibit Gender Reassignment Services For Minors.",0,,2021-10-15,"Died in Senate Committee at Sine Die adjournment.",https://legiscan.com/AR/bill/SB347/2021,https://www.arkleg.state.ar.us/Bills/Detail?tbType=&id=sb347&ddBienniumSession=2021%2F2021R
1460340,1781,SB348,6,Failed,2021-10-15,"To Create The Education Ombudsman Division Within The Division Of Elementary And Secondary Education.","To Create The Education Ombudsman Division Within The Division Of Elementary And Secondary Education.",0,,2021-10-15,"Died in Senate Committee at Sine Die adjournment.",https://legiscan.com/AR/bill/SB348/2021,https://www.arkleg.state.ar.us/Bills/Detail?tbType=&id=sb348&ddBienniumSession=2021%2F2021R
1460247,1781,SB349,4,Passed,2021-04-08,"To Adjust Funding For Public Schools That Offer Certain Types Of Reading Practices, Interventions, And Curriculum Not Aligned With The Science Of Reading; And To Create The Education Ombudsman.","To Adjust Funding For Public Schools That Offer Certain Types Of Reading Practices, Interventions, And Curriculum Not Aligned With The Science Of Reading; And To Create The Education Ombudsman.",0,,2021-04-08,"Notification that SB349 is now Act 606",https://legiscan.com/AR/bill/SB349/2021,https://www.arkleg.state.ar.us/Bills/Detail?tbType=&id=sb349&ddBienniumSession=2021%2F2021R
1460382,1781,SB350,6,Failed,2021-10-15,"To Amend Certain Requirements For And The Solicitation And Award Procedure For Certain Public Works Projects For Arkansas State Parks.","To Amend Certain Requirements For And The Solicitation And Award Procedure For Certain Public Works Projects For Arkansas State Parks.",0,,2021-10-15,"Sine Die adjournment",https://legiscan.com/AR/bill/SB350/2021,https://www.arkleg.state.ar.us/Bills/Detail?tbType=&id=sb350&ddBienniumSession=2021%2F2021R
1460262,1781,SB351,6,Failed,2021-10-15,"To Regulate Peer-to-peer Car-sharing Programs; And To Create The Peer-to-peer Car-sharing Program Act.","To Regulate Peer-to-peer Car-sharing Programs; And To Create The Peer-to-peer Car-sharing Program Act.",0,,2021-10-15,"Died in Senate Committee at Sine Die adjournment.",https://legiscan.com/AR/bill/SB351/2021,https://www.arkleg.state.ar.us/Bills/Detail?tbType=&id=sb351&ddBienniumSession=2021%2F2021R
1460416,1781,SB352,4,Passed,2021-04-05,"To Amend The Law Concerning The Capitol Zoning District Commission; And Concerning The Appeal Process Of A Capitol Zoning District Commission Action.","To Amend The Law Concerning The Capitol Zoning District Commission; And Concerning The Appeal Process Of A Capitol Zoning District Commission Action.",0,,2021-04-05,"Notification that SB352 is now Act 534",https://legiscan.com/AR/bill/SB352/2021,https://www.arkleg.state.ar.us/Bills/Detail?tbType=&id=sb352&ddBienniumSession=2021%2F2021R
1460401,1781,SB353,4,Passed,2021-04-30,"To Encourage The Collection Of All Outstanding Restitution, Fines, Fees, And Court Costs Owed By Incarcerated Persons; To Create A Task Force; And To Declare An Emergency.","To Encourage The Collection Of All Outstanding Restitution, Fines, Fees, And Court Costs Owed By Incarcerated Persons; To Create A Task Force; And To Declare An Emergency.",0,,2021-04-30,"Notification that SB353 is now Act 1048",https://legiscan.com/AR/bill/SB353/2021,https://www.arkleg.state.ar.us/Bills/Detail?tbType=&id=sb353&ddBienniumSession=2021%2F2021R
1461131,1781,SB354,4,Passed,2021-03-29,"To Create The Fairness In Women&#x27;s Sports Act.","To Create The Fairness In Women&#x27;s Sports Act.",0,,2021-03-29,"Notification that SB354 is now Act 461",https://legiscan.com/AR/bill/SB354/2021,https://www.arkleg.state.ar.us/Bills/Detail?tbType=&id=sb354&ddBienniumSession=2021%2F2021R
1461024,1781,SB355,4,Passed,2021-04-26,"To Allow A Lottery Winner To Remain Confidential.","To Allow A Lottery Winner To Remain Confidential.",0,,2021-04-26,"Notification that SB355 is now Act 889",https://legiscan.com/AR/bill/SB355/2021,https://www.arkleg.state.ar.us/Bills/Detail?tbType=&id=sb355&ddBienniumSession=2021%2F2021R
1461432,1781,SB356,6,Failed,2021-10-15,"To Amend The Law Governing The Income Tax Credit For Waste Reduction, Reuse, Or Recycling Equipment; And To Amend The Definition Of &#x201c;qualified Specialty Steel Products Manufacturing Facility&#x201d;.","To Amend The Law Governing The Income Tax Credit For Waste Reduction, Reuse, Or Recycling Equipment; And To Amend The Definition Of &#x201c;qualified Specialty Steel Products Manufacturing Facility&#x201d;.",0,,2021-10-15,"Sine Die adjournment",https://legiscan.com/AR/bill/SB356/2021,https://www.arkleg.state.ar.us/Bills/Detail?tbType=&id=sb356&ddBienniumSession=2021%2F2021R
1461638,1781,SB357,4,Passed,2021-03-29,"Repealing A Statute Prohibiting The Possession Of A Firearm In Certain Locations; And Making Technical Corrections.","Repealing A Statute Prohibiting The Possession Of A Firearm In Certain Locations; And Making Technical Corrections.",0,,2021-03-29,"Notification that SB357 is now Act 433",https://legiscan.com/AR/bill/SB357/2021,https://www.arkleg.state.ar.us/Bills/Detail?tbType=&id=sb357&ddBienniumSession=2021%2F2021R
1461664,1781,SB358,6,Failed,2021-10-15,"To Amend The Law Concerning The Sale Of State Land; To Establish A Process To Sell State Land; To Amend The Law Concerning The Sale Of Land Owned By An Institution Of Higher Education; And To Declare An Emergency. ","To Amend The Law Concerning The Sale Of State Land; To Establish A Process To Sell State Land; To Amend The Law Concerning The Sale Of Land Owned By An Institution Of Higher Education; And To Declare An Emergency. ",0,,2021-10-15,"Died in Senate Committee at Sine Die adjournment.",https://legiscan.com/AR/bill/SB358/2021,https://www.arkleg.state.ar.us/Bills/Detail?tbType=&id=sb358&ddBienniumSession=2021%2F2021R
1461802,1781,SB359,4,Passed,2021-04-26,"An Act For The Arkansas Public Defender Commission Development And Enhancement Appropriation.","An Act For The Arkansas Public Defender Commission Development And Enhancement Appropriation.",0,,2021-04-26,"Notification that SB359 is now Act 844",https://legiscan.com/AR/bill/SB359/2021,https://www.arkleg.state.ar.us/Bills/Detail?tbType=&id=sb359&ddBienniumSession=2021%2F2021R
1461381,1781,SB360,4,Passed,2021-04-26,"An Act For The Department Of Education - Division Of Higher Education And Northwest Technical Institute Development And Enhancement Appropriation.","An Act For The Department Of Education - Division Of Higher Education And Northwest Technical Institute Development And Enhancement Appropriation.",0,,2021-04-26,"Notification that SB360 is now Act 845",https://legiscan.com/AR/bill/SB360/2021,https://www.arkleg.state.ar.us/Bills/Detail?tbType=&id=sb360&ddBienniumSession=2021%2F2021R
1461729,1781,SB361,4,Passed,2021-04-26,"An Act For The Department Of Finance And Administration Development And Enhancement Appropriation.","An Act For The Department Of Finance And Administration Development And Enhancement Appropriation.",0,,2021-04-26,"Notification that SB361 is now Act 846",https://legiscan.com/AR/bill/SB361/2021,https://www.arkleg.state.ar.us/Bills/Detail?tbType=&id=sb361&ddBienniumSession=2021%2F2021R
1461820,1781,SB362,4,Passed,2021-04-26,"An Act For The Institutions Of Higher Education Development And Enhancement Appropriation.","An Act For The Institutions Of Higher Education Development And Enhancement Appropriation.",0,,2021-04-26,"Notification that SB362 is now Act 847",https://legiscan.com/AR/bill/SB362/2021,https://www.arkleg.state.ar.us/Bills/Detail?tbType=&id=sb362&ddBienniumSession=2021%2F2021R
