bill_id,session_id,bill_number,status,status_desc,status_date,title,description,committee_id,committee,last_action_date,last_action,url,state_link
1523382,1781,HB1960,6,Failed,2021-10-15,"An Act To Amend Arkansas Law Concerning The Congressional Districts Of Arkansas.","An Act To Amend Arkansas Law Concerning The Congressional Districts Of Arkansas.",0,,2021-10-15,"Died in House Committee at Sine Die Adjournment",https://legiscan.com/AR/bill/HB1960/2021,https://www.arkleg.state.ar.us/Bills/Detail?tbType=&id=hb1960&ddBienniumSession=2021%2F2021R
1524414,1781,HB1961,1,Introduced,2021-09-15,"To Amend Arkansas Law Concerning The Establishment Of The Four Congressional Districts.","To Amend Arkansas Law Concerning The Establishment Of The Four Congressional Districts.",0,,2021-09-30,"WITHDRAWN BY AUTHOR",https://legiscan.com/AR/bill/HB1961/2021,https://www.arkleg.state.ar.us/Bills/Detail?tbType=&id=hb1961&ddBienniumSession=2021%2F2021R
1524407,1781,HB1962,6,Failed,2021-10-15,"Concerning The Congressional Districts Of Arkansas.","Concerning The Congressional Districts Of Arkansas.",0,,2021-10-15,"Died in House Committee at Sine Die Adjournment",https://legiscan.com/AR/bill/HB1962/2021,https://www.arkleg.state.ar.us/Bills/Detail?tbType=&id=hb1962&ddBienniumSession=2021%2F2021R
1524416,1781,HB1963,6,Failed,2021-10-15,"To Establish The Congressional Districts In Arkansas; And To Declare An Emergency. ","To Establish The Congressional Districts In Arkansas; And To Declare An Emergency. ",0,,2021-10-15,"Died in House Committee at Sine Die Adjournment",https://legiscan.com/AR/bill/HB1963/2021,https://www.arkleg.state.ar.us/Bills/Detail?tbType=&id=hb1963&ddBienniumSession=2021%2F2021R
1524405,1781,HB1964,6,Failed,2021-10-15,"To Establish The Congressional Districts In Arkansas Based Upon The Most Recent Federal Decennial Census Data; And To Declare An Emergency. ","To Establish The Congressional Districts In Arkansas Based Upon The Most Recent Federal Decennial Census Data; And To Declare An Emergency. ",0,,2021-10-15,"Died in House Committee at Sine Die Adjournment",https://legiscan.com/AR/bill/HB1964/2021,https://www.arkleg.state.ar.us/Bills/Detail?tbType=&id=hb1964&ddBienniumSession=2021%2F2021R
1524413,1781,HB1965,6,Failed,2021-10-15,"To Identify And Define The Congressional Districts For 2021-2030; And To Declare An Emergency. ","To Identify And Define The Congressional Districts For 2021-2030; And To Declare An Emergency. ",0,,2021-10-15,"Died in House Committee at Sine Die Adjournment",https://legiscan.com/AR/bill/HB1965/2021,https://www.arkleg.state.ar.us/Bills/Detail?tbType=&id=hb1965&ddBienniumSession=2021%2F2021R
1524459,1781,HB1966,6,Failed,2021-10-15,"To Establish The Four (4) Congressional Districts In Arkansas For 2021-2030; And To Declare An Emergency. ","To Establish The Four (4) Congressional Districts In Arkansas For 2021-2030; And To Declare An Emergency. ",0,,2021-10-15,"Died in House Committee at Sine Die Adjournment",https://legiscan.com/AR/bill/HB1966/2021,https://www.arkleg.state.ar.us/Bills/Detail?tbType=&id=hb1966&ddBienniumSession=2021%2F2021R
1525042,1781,HB1967,6,Failed,2021-10-15,"To Reduce The Income Tax Levied On Individuals, Trusts, And Estates From Five And Nine-tenths Percent (5.9%) To Four And Nine-tenths Percent (4.9%).","To Reduce The Income Tax Levied On Individuals, Trusts, And Estates From Five And Nine-tenths Percent (5.9%) To Four And Nine-tenths Percent (4.9%).",0,,2021-10-15,"Died in House at Sine Die Adjournment",https://legiscan.com/AR/bill/HB1967/2021,https://www.arkleg.state.ar.us/Bills/Detail?tbType=&id=hb1967&ddBienniumSession=2021%2F2021R
1525036,1781,HB1968,6,Failed,2021-10-15,"To Amend The Four (4) Congressional Districts Of Arkansas Based On The Most Recent Federal Decennial Census Data; And To Declare An Emergency.","To Amend The Four (4) Congressional Districts Of Arkansas Based On The Most Recent Federal Decennial Census Data; And To Declare An Emergency.",0,,2021-10-15,"Died in House Committee at Sine Die Adjournment",https://legiscan.com/AR/bill/HB1968/2021,https://www.arkleg.state.ar.us/Bills/Detail?tbType=&id=hb1968&ddBienniumSession=2021%2F2021R
1525016,1781,HB1969,6,Failed,2021-10-15,"To Amend Arkansas Law Concerning The Four (4) United States Congressional Districts Of Arkansas; And To Declare An Emergency.","To Amend Arkansas Law Concerning The Four (4) United States Congressional Districts Of Arkansas; And To Declare An Emergency.",0,,2021-10-15,"Died in House Committee at Sine Die Adjournment",https://legiscan.com/AR/bill/HB1969/2021,https://www.arkleg.state.ar.us/Bills/Detail?tbType=&id=hb1969&ddBienniumSession=2021%2F2021R
1525053,1781,HB1970,6,Failed,2021-10-15,"To Establish The 2021-2030 Congressional Districts In Arkansas; And To Declare An Emergency. ","To Establish The 2021-2030 Congressional Districts In Arkansas; And To Declare An Emergency. ",0,,2021-10-15,"Died in House Committee at Sine Die Adjournment",https://legiscan.com/AR/bill/HB1970/2021,https://www.arkleg.state.ar.us/Bills/Detail?tbType=&id=hb1970&ddBienniumSession=2021%2F2021R
1525052,1781,HB1971,6,Failed,2021-10-15,"Regarding The Establishment Of The Four (4) Congressional District Boundaries In Arkansas; And To Declare An Emergency.","Regarding The Establishment Of The Four (4) Congressional District Boundaries In Arkansas; And To Declare An Emergency.",0,,2021-10-15,"Died in House Committee at Sine Die Adjournment",https://legiscan.com/AR/bill/HB1971/2021,https://www.arkleg.state.ar.us/Bills/Detail?tbType=&id=hb1971&ddBienniumSession=2021%2F2021R
1525034,1781,HB1972,6,Failed,2021-10-15,"To Address Mandates Related To Coronavirus 2019 (covid-19); To Provide Exemptions For Employees From Mandates Related To Coronavirus 2019 (covid-19); And To Declare An Emergency.","To Address Mandates Related To Coronavirus 2019 (covid-19); To Provide Exemptions For Employees From Mandates Related To Coronavirus 2019 (covid-19); And To Declare An Emergency.",0,,2021-10-15,"Died in House at Sine Die Adjournment",https://legiscan.com/AR/bill/HB1972/2021,https://www.arkleg.state.ar.us/Bills/Detail?tbType=&id=hb1972&ddBienniumSession=2021%2F2021R
1525018,1781,HB1973,6,Failed,2021-10-15,"To Establish A Right Of Privacy Concerning Coronavirus 2019 (covid-19) Vaccination Status; To Establish A Grant Program From Covid-19 Relief Funds Or American Rescue Plan Act Of 2021 Funds; And To Declare An Emergency.","To Establish A Right Of Privacy Concerning Coronavirus 2019 (covid-19) Vaccination Status; To Establish A Grant Program From Covid-19 Relief Funds Or American Rescue Plan Act Of 2021 Funds; And To Declare An Emergency.",0,,2021-10-15,"Died in House Committee at Sine Die Adjournment",https://legiscan.com/AR/bill/HB1973/2021,https://www.arkleg.state.ar.us/Bills/Detail?tbType=&id=hb1973&ddBienniumSession=2021%2F2021R
1525028,1781,HB1974,1,Introduced,2021-09-29,"To Authorize The Governor To Require Use Of Certain Protections In Schools If Certain Requirements Are Met; To Allow A Parent Or Legal Guardian To Opt Out Of Certain Protections; And To Declare An Emergency.","To Authorize The Governor To Require Use Of Certain Protections In Schools If Certain Requirements Are Met; To Allow A Parent Or Legal Guardian To Opt Out Of Certain Protections; And To Declare An Emergency.",0,,2021-10-04,"WITHDRAWN BY AUTHOR",https://legiscan.com/AR/bill/HB1974/2021,https://www.arkleg.state.ar.us/Bills/Detail?tbType=&id=hb1974&ddBienniumSession=2021%2F2021R
1525024,1781,HB1975,6,Failed,2021-10-15,"Concerning The Effect Of Minority Population On School District Elections; And To Declare An Emergency.","Concerning The Effect Of Minority Population On School District Elections; And To Declare An Emergency.",0,,2021-10-15,"Died in House at Sine Die Adjournment",https://legiscan.com/AR/bill/HB1975/2021,https://www.arkleg.state.ar.us/Bills/Detail?tbType=&id=hb1975&ddBienniumSession=2021%2F2021R
1525056,1781,HB1976,6,Failed,2021-10-15,"Regarding The Establishment Of The Geographical Boundaries Of The Four (4) Congressional Districts Of Arkansas; And To Declare An Emergency.","Regarding The Establishment Of The Geographical Boundaries Of The Four (4) Congressional Districts Of Arkansas; And To Declare An Emergency.",0,,2021-10-15,"Died in House Committee at Sine Die Adjournment",https://legiscan.com/AR/bill/HB1976/2021,https://www.arkleg.state.ar.us/Bills/Detail?tbType=&id=hb1976&ddBienniumSession=2021%2F2021R
1525032,1781,HB1977,4,Passed,2021-10-13,"To Provide Employee Exemptions From Federal Mandates And Employer Mandates Related To Coronavirus 2019 (covid-19); And To Declare An Emergency.","To Provide Employee Exemptions From Federal Mandates And Employer Mandates Related To Coronavirus 2019 (covid-19); And To Declare An Emergency.",0,,2021-10-13,"Notification that HB1977 is now Act 1113",https://legiscan.com/AR/bill/HB1977/2021,https://www.arkleg.state.ar.us/Bills/Detail?tbType=&id=hb1977&ddBienniumSession=2021%2F2021R
1525037,1781,HB1978,6,Failed,2021-10-15,"To Establish The Geographic Boundaries Of The Four (4) United States Congressional Districts In Arkansas For 2021-2030; And To Declare An Emergency. ","To Establish The Geographic Boundaries Of The Four (4) United States Congressional Districts In Arkansas For 2021-2030; And To Declare An Emergency. ",0,,2021-10-15,"Died in House Committee at Sine Die Adjournment",https://legiscan.com/AR/bill/HB1978/2021,https://www.arkleg.state.ar.us/Bills/Detail?tbType=&id=hb1978&ddBienniumSession=2021%2F2021R
1525252,1781,HB1979,1,Introduced,2021-10-04,"To Amend Arkansas Law Concerning The United States Congressional District Boundaries For The State Of Arkansas.","To Amend Arkansas Law Concerning The United States Congressional District Boundaries For The State Of Arkansas.",0,,2021-10-05,"WITHDRAWN BY AUTHOR",https://legiscan.com/AR/bill/HB1979/2021,https://www.arkleg.state.ar.us/Bills/Detail?tbType=&id=hb1979&ddBienniumSession=2021%2F2021R
1525302,1781,HB1980,6,Failed,2021-10-15,"To Identify And Define The Four (4) United States Congressional Districts Of Arkansas For 2021-2030; And To Declare An Emergency. ","To Identify And Define The Four (4) United States Congressional Districts Of Arkansas For 2021-2030; And To Declare An Emergency. ",0,,2021-10-15,"Died in House Committee at Sine Die Adjournment",https://legiscan.com/AR/bill/HB1980/2021,https://www.arkleg.state.ar.us/Bills/Detail?tbType=&id=hb1980&ddBienniumSession=2021%2F2021R
1525278,1781,HB1981,6,Failed,2021-10-15,"To Amend Arkansas Law Concerning The United States Congressional District Boundaries For The State Of Arkansas.","To Amend Arkansas Law Concerning The United States Congressional District Boundaries For The State Of Arkansas.",0,,2021-10-15,"Died in House Committee at Sine Die Adjournment",https://legiscan.com/AR/bill/HB1981/2021,https://www.arkleg.state.ar.us/Bills/Detail?tbType=&id=hb1981&ddBienniumSession=2021%2F2021R
1525303,1781,HB1982,4,Passed,2021-10-13,"Concerning The Definition Of The Four (4) United States Congressional Districts Of Arkansas; And To Declare An Emergency. ","Concerning The Definition Of The Four (4) United States Congressional Districts Of Arkansas; And To Declare An Emergency. ",0,,2021-10-13,"Notification that HB1982 is now Act 1114",https://legiscan.com/AR/bill/HB1982/2021,https://www.arkleg.state.ar.us/Bills/Detail?tbType=&id=hb1982&ddBienniumSession=2021%2F2021R
1525307,1781,HB1983,6,Failed,2021-10-15,"To Identify The Four (4) United States Congressional Districts Of Arkansas Based On The Most Recent Federal Decennial Census Data; And To Declare An Emergency.","To Identify The Four (4) United States Congressional Districts Of Arkansas Based On The Most Recent Federal Decennial Census Data; And To Declare An Emergency.",0,,2021-10-15,"Died in House Committee at Sine Die Adjournment",https://legiscan.com/AR/bill/HB1983/2021,https://www.arkleg.state.ar.us/Bills/Detail?tbType=&id=hb1983&ddBienniumSession=2021%2F2021R
1399920,1781,HR1001,1,Introduced,2021-01-11,"To Adopt The Rules Of The House Of Representatives Of The Ninety-third General Assembly.","To Adopt The Rules Of The House Of Representatives Of The Ninety-third General Assembly.",0,,2021-01-14,"READ AND ADOPTED.",https://legiscan.com/AR/bill/HR1001/2021,https://www.arkleg.state.ar.us/Bills/Detail?tbType=&id=hr1001&ddBienniumSession=2021%2F2021R
1383025,1781,HR1002,1,Introduced,2020-11-18,"To Urge The Activation Of Closed Captioning On Television Monitors In Public Venues.","To Urge The Activation Of Closed Captioning On Television Monitors In Public Venues.",0,,2021-01-26,"READ AND ADOPTED.",https://legiscan.com/AR/bill/HR1002/2021,https://www.arkleg.state.ar.us/Bills/Detail?tbType=&id=hr1002&ddBienniumSession=2021%2F2021R
1391862,1781,HR1003,6,Failed,2021-10-15,"To Amend The Rules Of The House Of Representatives Of The Ninety-third General Assembly.","To Amend The Rules Of The House Of Representatives Of The Ninety-third General Assembly.",0,,2021-10-15,"Died in House Committee at Sine Die Adjournment",https://legiscan.com/AR/bill/HR1003/2021,https://www.arkleg.state.ar.us/Bills/Detail?tbType=&id=hr1003&ddBienniumSession=2021%2F2021R
1399372,1781,HR1004,1,Introduced,2021-01-11,"To Commend Former Representative J.r. Rogers For His Work In Creating The Rock &#x27;n&#x27; Roll Highway 67. ","To Commend Former Representative J.r. Rogers For His Work In Creating The Rock &#x27;n&#x27; Roll Highway 67. ",0,,2021-01-25,"READ AND ADOPTED.",https://legiscan.com/AR/bill/HR1004/2021,https://www.arkleg.state.ar.us/Bills/Detail?tbType=&id=hr1004&ddBienniumSession=2021%2F2021R
1400192,1781,HR1005,1,Introduced,2021-01-11,"To Adopt Emergency Rules For The House Of Representatives Of The Ninety-third General Assembly.","To Adopt Emergency Rules For The House Of Representatives Of The Ninety-third General Assembly.",0,,2021-01-14,"READ AND ADOPTED.",https://legiscan.com/AR/bill/HR1005/2021,https://www.arkleg.state.ar.us/Bills/Detail?tbType=&id=hr1005&ddBienniumSession=2021%2F2021R
1399798,1781,HR1006,1,Introduced,2021-01-11,"To Adopt Rules Of Procedure For Committees Of The House Of Representatives Of The Ninety-third General Assembly Of The State Of Arkansas.","To Adopt Rules Of Procedure For Committees Of The House Of Representatives Of The Ninety-third General Assembly Of The State Of Arkansas.",0,,2021-01-14,"READ AND ADOPTED.",https://legiscan.com/AR/bill/HR1006/2021,https://www.arkleg.state.ar.us/Bills/Detail?tbType=&id=hr1006&ddBienniumSession=2021%2F2021R
1415728,1781,HR1007,1,Introduced,2021-01-21,"To Commend Eddie Schmeckenbecher.","To Commend Eddie Schmeckenbecher.",0,,2021-02-02,"READ AND ADOPTED.",https://legiscan.com/AR/bill/HR1007/2021,https://www.arkleg.state.ar.us/Bills/Detail?tbType=&id=hr1007&ddBienniumSession=2021%2F2021R
1416893,1781,HR1008,2,Engrossed,2021-02-03,"To Congratulate The Cabot School District And The Schools Within The District On Being Named Purple Star Schools. ","To Congratulate The Cabot School District And The Schools Within The District On Being Named Purple Star Schools. ",0,,2021-02-10,"READ AND ADOPTED.",https://legiscan.com/AR/bill/HR1008/2021,https://www.arkleg.state.ar.us/Bills/Detail?tbType=&id=hr1008&ddBienniumSession=2021%2F2021R
1420953,1781,HR1009,1,Introduced,2021-01-25,"To Commend Arkansas School Nurses For Their Dedication And Commitment To Creating A Healthy And Safe Learning Environment For Students Even In Times Of Crisis.","To Commend Arkansas School Nurses For Their Dedication And Commitment To Creating A Healthy And Safe Learning Environment For Students Even In Times Of Crisis.",0,,2021-02-01,"READ AND ADOPTED.",https://legiscan.com/AR/bill/HR1009/2021,https://www.arkleg.state.ar.us/Bills/Detail?tbType=&id=hr1009&ddBienniumSession=2021%2F2021R
1433838,1781,HR1010,1,Introduced,2021-02-02,"To Commend Susanna Post For Being Selected As The 2021 Arkansas Teacher Of The Year. ","To Commend Susanna Post For Being Selected As The 2021 Arkansas Teacher Of The Year. ",0,,2021-02-08,"READ AND ADOPTED.",https://legiscan.com/AR/bill/HR1010/2021,https://www.arkleg.state.ar.us/Bills/Detail?tbType=&id=hr1010&ddBienniumSession=2021%2F2021R
1459636,1781,HR1011,6,Failed,2021-10-15,"To Study The Feasibility Of Reestablishing The Relationship Between The People Of The Cherokee Nation West And The United States Government. ","To Study The Feasibility Of Reestablishing The Relationship Between The People Of The Cherokee Nation West And The United States Government. ",0,,2021-10-15,"Died in House Committee at Sine Die Adjournment",https://legiscan.com/AR/bill/HR1011/2021,https://www.arkleg.state.ar.us/Bills/Detail?tbType=&id=hr1011&ddBienniumSession=2021%2F2021R
1463482,1781,HR1012,1,Introduced,2021-02-24,"To Recognize The Need To Designate The Museum Located On The Former Eaker Air Force Base The &quot;national Cold War Center&quot;.","To Recognize The Need To Designate The Museum Located On The Former Eaker Air Force Base The &quot;national Cold War Center&quot;.",0,,2021-03-02,"READ AND ADOPTED.",https://legiscan.com/AR/bill/HR1012/2021,https://www.arkleg.state.ar.us/Bills/Detail?tbType=&id=hr1012&ddBienniumSession=2021%2F2021R
1469811,1781,HR1013,1,Introduced,2021-03-01,"To Proclaim March 2021 American Red Cross Month In Arkansas.","To Proclaim March 2021 American Red Cross Month In Arkansas.",0,,2021-03-09,"READ AND ADOPTED.",https://legiscan.com/AR/bill/HR1013/2021,https://www.arkleg.state.ar.us/Bills/Detail?tbType=&id=hr1013&ddBienniumSession=2021%2F2021R
1470006,1781,HR1014,1,Introduced,2021-03-01,"To Commemorate The One Hundredth Anniversary Of Hot Springs National Park And To Proclaim March 4, 2021, As Hot Springs National Park Day.","To Commemorate The One Hundredth Anniversary Of Hot Springs National Park And To Proclaim March 4, 2021, As Hot Springs National Park Day.",0,,2021-03-04,"READ AND ADOPTED.",https://legiscan.com/AR/bill/HR1014/2021,https://www.arkleg.state.ar.us/Bills/Detail?tbType=&id=hr1014&ddBienniumSession=2021%2F2021R
1471443,1781,HR1015,1,Introduced,2021-03-02,"To Commemorate The One Hundredth Anniversary Of The Discovery Of Oil In South Arkansas.","To Commemorate The One Hundredth Anniversary Of The Discovery Of Oil In South Arkansas.",0,,2021-03-11,"READ AND ADOPTED.",https://legiscan.com/AR/bill/HR1015/2021,https://www.arkleg.state.ar.us/Bills/Detail?tbType=&id=hr1015&ddBienniumSession=2021%2F2021R
1473837,1781,HR1016,1,Introduced,2021-03-04,"Calling Upon The Members Of The House Of Representatives To Respect And Honor Civil Discourse In The Interest Of Uniting The Citizens Of Our State And Nation. ","Calling Upon The Members Of The House Of Representatives To Respect And Honor Civil Discourse In The Interest Of Uniting The Citizens Of Our State And Nation. ",0,,2021-03-18,"READ AND ADOPTED.",https://legiscan.com/AR/bill/HR1016/2021,https://www.arkleg.state.ar.us/Bills/Detail?tbType=&id=hr1016&ddBienniumSession=2021%2F2021R
1475375,1781,HR1017,1,Introduced,2021-03-08,"To Designate &#x201c;stars Of Life Day&#x201d; And To Recognize The Accomplishments Of Certain Emergency Medical Professionals.","To Designate &#x201c;stars Of Life Day&#x201d; And To Recognize The Accomplishments Of Certain Emergency Medical Professionals.",0,,2021-03-10,"READ AND ADOPTED.",https://legiscan.com/AR/bill/HR1017/2021,https://www.arkleg.state.ar.us/Bills/Detail?tbType=&id=hr1017&ddBienniumSession=2021%2F2021R
1475308,1781,HR1018,1,Introduced,2021-03-08,"To Protect The Welfare Of Children By Keeping This Promise To Arkansas&#x2019;s Children.","To Protect The Welfare Of Children By Keeping This Promise To Arkansas&#x2019;s Children.",0,,2021-04-01,"READ AND ADOPTED.",https://legiscan.com/AR/bill/HR1018/2021,https://www.arkleg.state.ar.us/Bills/Detail?tbType=&id=hr1018&ddBienniumSession=2021%2F2021R
1483182,1781,HR1019,1,Introduced,2021-03-16,"To Encourage And Promote Residential Swimming Pool Safety Awareness To Reduce Preventable Accidental Drowning Deaths Of Children Who Are Under Five (5) Years Of Age In Residential Swimming Pools.","To Encourage And Promote Residential Swimming Pool Safety Awareness To Reduce Preventable Accidental Drowning Deaths Of Children Who Are Under Five (5) Years Of Age In Residential Swimming Pools.",0,,2021-04-05,"READ AND ADOPTED.",https://legiscan.com/AR/bill/HR1019/2021,https://www.arkleg.state.ar.us/Bills/Detail?tbType=&id=hr1019&ddBienniumSession=2021%2F2021R
1483356,1781,HR1020,1,Introduced,2021-03-16,"To Recognize The Positive Impact Of The Arkansas 4-h Program On Our Youth And To Celebrate The One-hundred-twelfth Anniversary Of The Program. ","To Recognize The Positive Impact Of The Arkansas 4-h Program On Our Youth And To Celebrate The One-hundred-twelfth Anniversary Of The Program. ",0,,2021-03-23,"READ AND ADOPTED.",https://legiscan.com/AR/bill/HR1020/2021,https://www.arkleg.state.ar.us/Bills/Detail?tbType=&id=hr1020&ddBienniumSession=2021%2F2021R
1483121,1781,HR1021,1,Introduced,2021-03-16,"To Recognize And Celebrate Thirty-five (35) Years Of Homeschooling In The State Of Arkansas. ","To Recognize And Celebrate Thirty-five (35) Years Of Homeschooling In The State Of Arkansas. ",0,,2021-03-23,"READ AND ADOPTED.",https://legiscan.com/AR/bill/HR1021/2021,https://www.arkleg.state.ar.us/Bills/Detail?tbType=&id=hr1021&ddBienniumSession=2021%2F2021R
1484906,1781,HR1022,1,Introduced,2021-03-18,"To Remember And Honor The Legacy Of Mattie Whyte Woodridge For Her Role In Creating Teacher Appreciation Week.","To Remember And Honor The Legacy Of Mattie Whyte Woodridge For Her Role In Creating Teacher Appreciation Week.",0,,2021-03-31,"READ AND ADOPTED.",https://legiscan.com/AR/bill/HR1022/2021,https://www.arkleg.state.ar.us/Bills/Detail?tbType=&id=hr1022&ddBienniumSession=2021%2F2021R
1489497,1781,HR1023,1,Introduced,2021-03-29,"To Recognize The North Little Rock Boys Basketball Team As The Class 6a State Champions.","To Recognize The North Little Rock Boys Basketball Team As The Class 6a State Champions.",0,,2021-04-01,"READ AND ADOPTED.",https://legiscan.com/AR/bill/HR1023/2021,https://www.arkleg.state.ar.us/Bills/Detail?tbType=&id=hr1023&ddBienniumSession=2021%2F2021R
1489686,1781,HR1024,1,Introduced,2021-03-30,"To Proclaim April 2021 As Autism Awareness And Acceptance Month In Arkansas.","To Proclaim April 2021 As Autism Awareness And Acceptance Month In Arkansas.",0,,2021-04-05,"READ AND ADOPTED.",https://legiscan.com/AR/bill/HR1024/2021,https://www.arkleg.state.ar.us/Bills/Detail?tbType=&id=hr1024&ddBienniumSession=2021%2F2021R
1490277,1781,HR1025,1,Introduced,2021-03-31,"To Encourage The United States Congress To Review Issues Related To Dairy Products And Make Changes To Improve Federal Milk Marketing Orders In Order To Better Support Dairy Farmers.","To Encourage The United States Congress To Review Issues Related To Dairy Products And Make Changes To Improve Federal Milk Marketing Orders In Order To Better Support Dairy Farmers.",0,,2021-04-08,"WITHDRAWN BY AUTHOR",https://legiscan.com/AR/bill/HR1025/2021,https://www.arkleg.state.ar.us/Bills/Detail?tbType=&id=hr1025&ddBienniumSession=2021%2F2021R
1490450,1781,HR1026,6,Failed,2021-10-15,"To Congratulate The University Of Arkansas At Fayetteville Men&#x27;s Arkansas Razorbacks Basketball Team For Qualifying For The Elite Eight Tournament For The First Time Since 1995 And For An Incredible Season.","To Congratulate The University Of Arkansas At Fayetteville Men&#x27;s Arkansas Razorbacks Basketball Team For Qualifying For The Elite Eight Tournament For The First Time Since 1995 And For An Incredible Season.",0,,2021-10-15,"Died in House at Sine Die Adjournment",https://legiscan.com/AR/bill/HR1026/2021,https://www.arkleg.state.ar.us/Bills/Detail?tbType=&id=hr1026&ddBienniumSession=2021%2F2021R
1490568,1781,HR1027,1,Introduced,2021-04-01,"To Recognize The Harrison Lady Goblins Basketball Team As The Class 4a State Champions.","To Recognize The Harrison Lady Goblins Basketball Team As The Class 4a State Champions.",0,,2021-04-12,"READ AND ADOPTED.",https://legiscan.com/AR/bill/HR1027/2021,https://www.arkleg.state.ar.us/Bills/Detail?tbType=&id=hr1027&ddBienniumSession=2021%2F2021R
1491425,1781,HR1028,1,Introduced,2021-04-05,"To Recognize The Tenth Anniversary Of The Glams Program.","To Recognize The Tenth Anniversary Of The Glams Program.",0,,2021-04-13,"READ AND ADOPTED.",https://legiscan.com/AR/bill/HR1028/2021,https://www.arkleg.state.ar.us/Bills/Detail?tbType=&id=hr1028&ddBienniumSession=2021%2F2021R
1491455,1781,HR1029,1,Introduced,2021-04-05,"To Recognize The Lee High School Boys Basketball Team As The Class 2a State Champions.","To Recognize The Lee High School Boys Basketball Team As The Class 2a State Champions.",0,,2021-04-08,"READ AND ADOPTED.",https://legiscan.com/AR/bill/HR1029/2021,https://www.arkleg.state.ar.us/Bills/Detail?tbType=&id=hr1029&ddBienniumSession=2021%2F2021R
1492130,1781,HR1030,1,Introduced,2021-04-07,"To Thank The Spouses, Families, And Friends Of The Members Of The House Of Representatives For Ongoing Support And To Proclaim The 2021 House Of Representatives Family Day.","To Thank The Spouses, Families, And Friends Of The Members Of The House Of Representatives For Ongoing Support And To Proclaim The 2021 House Of Representatives Family Day.",0,,2021-04-13,"READ AND ADOPTED.",https://legiscan.com/AR/bill/HR1030/2021,https://www.arkleg.state.ar.us/Bills/Detail?tbType=&id=hr1030&ddBienniumSession=2021%2F2021R
1492335,1781,HR1031,1,Introduced,2021-04-07,"To Congratulate The Melbourne High School Lady Bearkatz For Winning The Class 2a Basketball Championship. ","To Congratulate The Melbourne High School Lady Bearkatz For Winning The Class 2a Basketball Championship. ",0,,2021-04-21,"READ AND ADOPTED.",https://legiscan.com/AR/bill/HR1031/2021,https://www.arkleg.state.ar.us/Bills/Detail?tbType=&id=hr1031&ddBienniumSession=2021%2F2021R
