bill_id,session_id,bill_number,status,status_desc,status_date,title,description,committee_id,committee,last_action_date,last_action,url,state_link
1842887,2096,HB0001,4,Passed,2024-03-22,"General government appropriations.","AN ACT to make appropriations for the fiscal biennium commencing July 1, 2024 and ending June 30, 2026; providing definitions; providing for appropriations and transfers of funds for the period of the budget and for the remainder of the current biennium ending June 30, 2024 as specified; providing for carryover of certain funds beyond the biennium as specified; providing for employee positions as specified; providing for duties, terms and conditions and other requirements relating to appropriations for the remainder of the current biennium ending June 30, 2024 and the period of the budget as specified; providing for position and other budgetary limitations; authorizing rulemaking; authorizing a charter school; providing appropriations for purposes related to state funded capital construction; creating accounts; amending existing law by redirecting revenues for the period of the budget; making conforming amendments; amending and repealing prior appropriations; providing for reports related to appropriations; continuing an account; amending and repealing prior appropriations of COVID-19 relief funds; specifying conditions on the appropriation and expenditure of COVID-19 relief funds; and providing for effective dates.",0,,2024-03-22,"Assigned Chapter Number 118",https://legiscan.com/WY/bill/HB0001/2024,https://www.wyoleg.gov/Legislation/2024/HB0001
1785666,2096,HB0002,6,Failed,2024-02-12,"Nonresident fishing license fee increase.","AN ACT relating to game and fish; increasing nonresident fishing license fees; and providing for an effective date.",0,,2024-02-12,"Failed Introduction 39-22-1-0-0",https://legiscan.com/WY/bill/HB0002/2024,https://www.wyoleg.gov/Legislation/2024/HB0002
1785428,2096,HB0003,4,Passed,2024-03-21,"Property tax exemption for long-term homeowners.","AN ACT relating to taxation; establishing a tax exemption for long-term homeowners; providing a penalty for false claims; providing a sunset date; and providing for an effective date.",0,,2024-03-21,"Assigned Chapter Number 106",https://legiscan.com/WY/bill/HB0003/2024,https://www.wyoleg.gov/Legislation/2024/HB0003
1785706,2096,HB0004,4,Passed,2024-03-21,"Property tax refund program.","AN ACT relating to property tax; amending qualifications for the property tax refund program; amending qualifications for the county optional property tax refund program; amending the maximum refund under the property tax refund program; requiring audits; providing appropriations; and providing for an effective date.",0,,2024-03-21,"Assigned Chapter Number 109",https://legiscan.com/WY/bill/HB0004/2024,https://www.wyoleg.gov/Legislation/2024/HB0004
1785743,2096,HB0005,6,Failed,2024-02-12,"Behavioral health redesign amendments.","AN ACT relating to public health and safety; requiring the department of health to pay behavioral health services claims as specified; requiring the department of health to collect information regarding payment of behavioral health services claims; requiring a report; amending definitions; providing a sunset date; and providing for an effective date.",0,,2024-02-12,"Failed Introduction 40-21-1-0-0",https://legiscan.com/WY/bill/HB0005/2024,https://www.wyoleg.gov/Legislation/2024/HB0005
1789498,2096,HB0006,6,Failed,2024-02-12,"Light and high profile vehicle closures. ","AN ACT relating to highways; creating a penalty for violating signs and markers for closures to light and high profile vehicles; requiring fines imposed to be paid by the driver of the vehicle at the time of the violation; specifying that a violation of a closure to light and high profile vehicles disqualifies a person from driving a commercial vehicle as specified; providing that a violation of a closure to light and high profile vehicles may result in a mandatory revocation or suspension of a license or nonresident operating privilege as specified; and providing for an effective date.",0,,2024-02-12,"Failed Introduction 41-20-1-0-0",https://legiscan.com/WY/bill/HB0006/2024,https://www.wyoleg.gov/Legislation/2024/HB0006
1789492,2096,HB0007,6,Failed,2024-02-12,"Alternative fuel tax-electricity amendments.","AN ACT relating to taxation and revenue; amending the collection of and process for alternative fuel taxes; providing a per kilowatt hour license tax on electricity used to propel an electric vehicle; amending the taxation method for alternative fuel tax; amending and providing definitions; imposing an annual decal fee for plug-in hybrid vehicles; making conforming amendments; repealing obsolete provisions; requiring rulemaking; and providing for effective dates.",0,,2024-02-12,"Failed Introduction 40-20-1-0-1",https://legiscan.com/WY/bill/HB0007/2024,https://www.wyoleg.gov/Legislation/2024/HB0007
1789494,2096,HB0008,4,Passed,2024-03-04,"Commercial driver license-hazardous materials endorsement. ","AN ACT relating to motor vehicles; specifying that a driver who has attained eighteen (18) years of age may receive a hazardous materials endorsement for a commercial driver's license; requiring rulemaking; and providing for effective dates. ",0,,2024-03-04,"Assigned Chapter Number 21",https://legiscan.com/WY/bill/HB0008/2024,https://www.wyoleg.gov/Legislation/2024/HB0008
1789495,2096,HB0009,4,Passed,2024-03-07,"Fuel tax-licensee information deadline.","AN ACT relating to taxation and revenue; amending the deadline for providing fuel tax return and license information when requested by the department of transportation; specifying applicability; and providing for an effective date.",0,,2024-03-07,"Assigned Chapter Number 40",https://legiscan.com/WY/bill/HB0009/2024,https://www.wyoleg.gov/Legislation/2024/HB0009
1789490,2096,HB0010,4,Passed,2024-03-04,"Grace period-state land lease renewals.","AN ACT relating to state lands; authorizing the director of the office of state lands and investments to grant state land lessees additional time to renew their leases; and providing for an effective date.",0,,2024-03-04,"Assigned Chapter Number 13",https://legiscan.com/WY/bill/HB0010/2024,https://www.wyoleg.gov/Legislation/2024/HB0010
1789500,2096,HB0011,4,Passed,2024-03-04,"State land lease amendments.","AN ACT relating to state lands; removing specific types of payments for land lease payments; amending the process for how state land lease payments are made; providing that state land lease renewals and rental payments are considered filed on the date the renewal or rental is postmarked; and providing for an effective date.",0,,2024-03-04,"Assigned Chapter Number 14",https://legiscan.com/WY/bill/HB0011/2024,https://www.wyoleg.gov/Legislation/2024/HB0011
1789491,2096,HB0012,4,Passed,2024-03-05,"Wyoming dairy marketing act-repeal. ","AN ACT relating to agriculture, livestock and other animals; repealing the Wyoming Dairy Marketing Act of 1971; and providing for an effective date.",0,,2024-03-05,"Assigned Chapter Number 26",https://legiscan.com/WY/bill/HB0012/2024,https://www.wyoleg.gov/Legislation/2024/HB0012
1789497,2096,HB0013,4,Passed,2024-03-05,"Flow-through pools-exemption. ","AN ACT relating to public health and safety; exempting flow-through pools from the public pool and spa health and safety act; providing definitions; and providing for an effective date.",0,,2024-03-05,"Assigned Chapter Number 25",https://legiscan.com/WY/bill/HB0013/2024,https://www.wyoleg.gov/Legislation/2024/HB0013
1791054,2096,HB0014,4,Passed,2024-03-04,"Prior authorization regulations.","AN ACT relating to the insurance code; requiring health insurers and contracted utilization review entities to follow prior authorization regulations as specified; providing definitions; requiring rulemaking; and providing for effective dates.",0,,2024-03-04,"Assigned Chapter Number 19",https://legiscan.com/WY/bill/HB0014/2024,https://www.wyoleg.gov/Legislation/2024/HB0014
1791040,2096,HB0015,4,Passed,2024-03-05,"Health insurance-reimbursement of overpayments.","AN ACT relating to health insurance; specifying a time limit to seek reimbursement for health insurance overpayments; and providing for an effective date.",0,,2024-03-05,"Assigned Chapter Number 30",https://legiscan.com/WY/bill/HB0015/2024,https://www.wyoleg.gov/Legislation/2024/HB0015
1791334,2096,HB0016,4,Passed,2024-03-04,"Sutton state archaeological site-legal description.","AN ACT relating to state lands; removing an inconsistent legal description of the Sutton state archaeological site; and providing for an effective date.",0,,2024-03-04,"Assigned Chapter Number 12",https://legiscan.com/WY/bill/HB0016/2024,https://www.wyoleg.gov/Legislation/2024/HB0016
1791341,2096,HB0017,6,Failed,2024-02-12,"Fishing outfitters and guides-registration of fishing boats.","AN ACT relating to game and fish; authorizing the Wyoming game and fish commission to regulate commercially guided fishing boats; providing for registration of commercially guided fishing boats, vehicles and trailers operated by outfitters and professional fishing guides; providing definitions; providing rulemaking authority; and providing for an effective date.",0,,2024-02-12,"Failed Introduction 38-22-2-0-0",https://legiscan.com/WY/bill/HB0017/2024,https://www.wyoleg.gov/Legislation/2024/HB0017
1791446,2096,HB0018,6,Failed,2024-03-05,"Property tax-inflation cap.","AN ACT relating to ad valorem taxation; limiting the maximum annual taxable value increase for residential property; striking obsolete language; and providing for a contingent effective date.",0,,2024-03-05,"H:Died in Committee Returned Bill Pursuant to HR 5-4",https://legiscan.com/WY/bill/HB0018/2024,https://www.wyoleg.gov/Legislation/2024/HB0018
1791609,2096,HB0019,6,Failed,2024-02-12,"Education savings accounts.","AN ACT relating to education; authorizing education savings accounts; creating the Wyoming education savings accounts expenditure account; providing for a transfer of funds to the Wyoming education savings accounts expenditure account; providing for the use and administration of education savings accounts for education; specifying duties of the state superintendent of public instruction; providing rulemaking authority; making conforming amendments; providing appropriations; authorizing full-time positions; and providing for effective dates.",0,,2024-02-12,"Failed Introduction 41-19-2-0-0",https://legiscan.com/WY/bill/HB0019/2024,https://www.wyoleg.gov/Legislation/2024/HB0019
1791584,2096,HB0020,4,Passed,2024-03-08,"School finance-regional cost adjustment study.","AN ACT relating to school finance; requiring reporting and data collection to study the regional cost adjustments utilized in the education resource block grant model during recalibration; and providing for an effective date.",0,,2024-03-08,"Assigned Chapter Number 66",https://legiscan.com/WY/bill/HB0020/2024,https://www.wyoleg.gov/Legislation/2024/HB0020
1792059,2096,HB0021,4,Passed,2024-03-04,"Charter school leasing.","AN ACT relating to K-12 school facilities; repealing the requirement that charter schools operate successfully for three (3) years to receive reimbursement for leasing expenses; and providing for an effective date.",0,,2024-03-04,"Assigned Chapter Number 11",https://legiscan.com/WY/bill/HB0021/2024,https://www.wyoleg.gov/Legislation/2024/HB0021
1792367,2096,HB0022,6,Failed,2024-02-12,"Sales tax revisions.","AN ACT relating to sales tax; revising provisions related to administration of the sales tax; clarifying a definition; clarifying the imposition of the tax; amending exemptions; revising reporting requirements; clarifying licensing and compliance provisions; repealing obsolete and other provisions; and providing for an effective date.",0,,2024-02-12,"Failed Introduction 1-59-2-0-0",https://legiscan.com/WY/bill/HB0022/2024,https://www.wyoleg.gov/Legislation/2024/HB0022
1794244,2096,HB0023,4,Passed,2024-03-04,"Vehicle registration e-certificate and grace period.","AN ACT relating to motor vehicles; confirming the ability of county treasurers to provide vehicle certificates of registration in electronic form as specified; amending requirements for the display of vehicle registrations, license plates, validation stickers and permits as specified; and providing for an effective date.",0,,2024-03-04,"Assigned Chapter Number 20",https://legiscan.com/WY/bill/HB0023/2024,https://www.wyoleg.gov/Legislation/2024/HB0023
1794221,2096,HB0024,6,Failed,2024-03-05,"Certificate of need repeal.","AN ACT relating to public health and safety; authorizing the department of health to approve alterations or additions to health care facilities as specified; repealing bed expansion limitations for nursing care facilities and hospitals as specified; making conforming amendments; and providing for an effective date.",0,,2024-03-05,"S:Died in Committee Returned Bill Pursuant to SR 5-4",https://legiscan.com/WY/bill/HB0024/2024,https://www.wyoleg.gov/Legislation/2024/HB0024
1794201,2096,HB0025,4,Passed,2024-03-05,"Medicaid-third party payor conditions.","AN ACT relating to the Wyoming Medical Assistance and Services Act; requiring health insurers to respond to state inquiries within sixty (60) days; prohibiting health insurers from denying Medicaid payments as specified; and providing for an effective date.",0,,2024-03-05,"Assigned Chapter Number 24",https://legiscan.com/WY/bill/HB0025/2024,https://www.wyoleg.gov/Legislation/2024/HB0025
1794172,2096,HB0026,4,Passed,2024-03-04,"Emergency protective services-effective period.","AN ACT relating to adult protective services; extending the effective period of emergency protective services; and providing for an effective date.",0,,2024-03-04,"Assigned Chapter Number 10",https://legiscan.com/WY/bill/HB0026/2024,https://www.wyoleg.gov/Legislation/2024/HB0026
1794211,2096,HB0027,4,Passed,2024-03-04,"DFS and law enforcement-cross reporting.","AN ACT relating to adult protective services; requiring law enforcement to notify the department of family services upon receiving a report of a vulnerable adult in need of potential protective services; and providing for an effective date.",0,,2024-03-04,"Assigned Chapter Number 9",https://legiscan.com/WY/bill/HB0027/2024,https://www.wyoleg.gov/Legislation/2024/HB0027
1794182,2096,HB0028,6,Failed,2024-02-12,"Interference with parent-child contact.","AN ACT relating to crimes and offenses; establishing the offense of interference with parent-child contact; specifying affirmative defenses; specifying penalties; providing definitions; and providing for an effective date.",0,,2024-02-12,"Failed Introduction 41-19-2-0-0",https://legiscan.com/WY/bill/HB0028/2024,https://www.wyoleg.gov/Legislation/2024/HB0028
1794192,2096,HB0029,4,Passed,2024-03-15,"Cold case database and investigations.","AN ACT relating to the attorney general; requiring the division of criminal investigation to develop and maintain a cold case database; requiring law enforcement agencies in the state to provide cold case information to the division as specified; requiring rulemaking; requiring a report; authorizing funds for cold case investigations; providing an appropriation; and providing for an effective date.",0,,2024-03-15,"Assigned Chapter Number 86",https://legiscan.com/WY/bill/HB0029/2024,https://www.wyoleg.gov/Legislation/2024/HB0029
1794233,2096,HB0030,2,Engrossed,2024-02-23,"Controlled Substances Act-possession amendments.","AN ACT relating to controlled substances; eliminating the form of a controlled substance as an element of the misdemeanor offense of unlawful possession of a controlled substance; amending prohibitions on the possession of controlled substances as specified; specifying and amending penalties based on the amount of controlled substances; repealing obsolete provisions; and providing for an effective date.",0,,2024-02-28,"COW:Failed 13-18-0-0-0",https://legiscan.com/WY/bill/HB0030/2024,https://www.wyoleg.gov/Legislation/2024/HB0030
1794252,2096,HB0031,4,Passed,2024-03-07,"Peace officers-records and reporting.","AN ACT relating to the administration of government; requiring personnel files of peace officers, detention officers, corrections officers and dispatchers to be available to the peace officer standards and training commission as specified; making conforming amendments; and providing for an effective date.",0,,2024-03-07,"Assigned Chapter Number 41",https://legiscan.com/WY/bill/HB0031/2024,https://www.wyoleg.gov/Legislation/2024/HB0031
1796318,2096,HB0032,4,Passed,2024-03-05,"Geologic sequestration-unitization amendments.","AN ACT relating to environmental quality; specifying that pore space utilization is a purpose of geologic sequestration unitization; providing definitions; amending permit types related to geologic sequestration; amending application requirements for the unitization of interests in pore space in a unit area; amending the findings required by the oil and gas conservation commission before entry of a unitization order; amending notice requirements for unitization applications; clarifying that a unitization order may provide for the use of directional wells; making conforming amendments; specifying applicability; requiring rulemaking; and providing for an effective date.",0,,2024-03-05,"Assigned Chapter Number 31",https://legiscan.com/WY/bill/HB0032/2024,https://www.wyoleg.gov/Legislation/2024/HB0032
1796531,2096,HB0033,4,Passed,2024-03-05,"Mining operations-blasting requirements.","AN ACT relating to environmental quality; specifying requirements for the use of explosives in noncoal surface mining operations; requiring a blasting plan for specified mining operations; requiring rulemaking; making conforming amendments; authorizing positions; providing an appropriation; and providing for effective dates.",0,,2024-03-05,"Assigned Chapter Number 23",https://legiscan.com/WY/bill/HB0033/2024,https://www.wyoleg.gov/Legislation/2024/HB0033
1796420,2096,HB0034,4,Passed,2024-03-05,"Solid waste municipal cease and transfer funding.","AN ACT relating to the prioritization of municipal solid waste facilities cease and transfer projects; authorizing expenditure of previously appropriated funds; establishing a prioritized list of projects; establishing a maximum amount to be expended on projects; granting the department of environmental quality limited discretionary authority to modify the prioritized list; specifying expenditures for a carcass management project; providing definitions; requiring reports; repealing a prior list of priority cease and transfer projects; and providing for an effective date.",0,,2024-03-05,"Assigned Chapter Number 32",https://legiscan.com/WY/bill/HB0034/2024,https://www.wyoleg.gov/Legislation/2024/HB0034
1796266,2096,HB0035,4,Passed,2024-03-05,"Limitation on environmental rulemaking. ","AN ACT relating to environmental quality; requiring the environmental quality council to promulgate rules no more stringent than federal law, rules or regulations; providing exceptions; specifying applicability; requiring rulemaking; requiring reporting; and providing for an effective date. ",0,,2024-03-05,"Assigned Chapter Number 22",https://legiscan.com/WY/bill/HB0035/2024,https://www.wyoleg.gov/Legislation/2024/HB0035
1796370,2096,HB0036,4,Passed,2024-03-08,"Natural Resource Protection Act. ","AN ACT relating to protection of constitutional rights; providing a declaration of authority and policy; prohibiting the enforcement of federal rules or regulations regarding federal land management as specified; providing an exception; and providing for an effective date.",0,,2024-03-08,"Assigned Chapter Number 69",https://legiscan.com/WY/bill/HB0036/2024,https://www.wyoleg.gov/Legislation/2024/HB0036
1796478,2096,HB0037,6,Failed,2024-02-12,"Election offenses-intimidation.","AN ACT relating to elections; creating the misdemeanor offense of election intimidation; creating the felony offense of aggravated election intimidation; providing for penalties; repealing an inconsistent provision; and providing for an effective date.",0,,2024-02-12,"Failed Introduction 36-24-2-0-0",https://legiscan.com/WY/bill/HB0037/2024,https://www.wyoleg.gov/Legislation/2024/HB0037
1796555,2096,HB0038,6,Failed,2024-02-23,"Voter qualifications-durational residency requirement.","AN ACT relating to elections; requiring a qualified elector to be a bona fide resident of the state of Wyoming for not less than thirty (30) days before the date of the election in which they offer to vote; providing an exception for electors otherwise qualified to vote for president and vice president of the United States; making conforming changes; and providing for an effective date.",0,,2024-02-23,"COW:H Did not consider for COW",https://legiscan.com/WY/bill/HB0038/2024,https://www.wyoleg.gov/Legislation/2024/HB0038
1796584,2096,HB0039,6,Failed,2024-02-12,"Campaign reporting.","AN ACT relating to campaign practices; clarifying when groups are required to file as an organization for purposes of campaign reporting; and providing for an effective date.",0,,2024-02-12,"Failed Introduction 37-23-2-0-0",https://legiscan.com/WY/bill/HB0039/2024,https://www.wyoleg.gov/Legislation/2024/HB0039
1796564,2096,HB0040,4,Passed,2024-03-04,"School district trustee oath of office.","AN ACT relating to school district trustees; clarifying when school district trustees are required to take the oath of office; and providing for an effective date.",0,,2024-03-04,"Assigned Chapter Number 7",https://legiscan.com/WY/bill/HB0040/2024,https://www.wyoleg.gov/Legislation/2024/HB0040
1796536,2096,HB0041,6,Failed,2024-02-12,"Candidates for state legislature-residency requirement.","AN ACT relating to elections; clarifying the residency requirement for candidates for the state legislature; and providing for an effective date.",0,,2024-02-12,"Failed Introduction 40-20-2-0-0",https://legiscan.com/WY/bill/HB0041/2024,https://www.wyoleg.gov/Legislation/2024/HB0041
1796595,2096,HB0042,6,Failed,2024-03-05,"Prohibition on private funds for conducting elections.","AN ACT relating to elections; prohibiting government officials and election officials from soliciting, taking or otherwise accepting private funds to conduct elections as specified; providing for an exception for special districts; creating a new misdemeanor offense; and providing for an effective date.",0,,2024-03-05,"H:Died in Committee Returned Bill Pursuant to HR 5-4",https://legiscan.com/WY/bill/HB0042/2024,https://www.wyoleg.gov/Legislation/2024/HB0042
1796574,2096,HB0043,4,Passed,2024-03-08,"State forestry good neighbor-positions.","AN ACT relating to state lands; authorizing additional employees funded through the Wyoming state forestry good neighbor authority revolving account; and providing for an effective date.",0,,2024-03-08,"Assigned Chapter Number 68",https://legiscan.com/WY/bill/HB0043/2024,https://www.wyoleg.gov/Legislation/2024/HB0043
1796825,2096,HB0044,6,Failed,2024-03-05," Parental rights in minor child’s health care.","AN ACT relating to children; repealing a provision authorizing specified minors to consent to tobacco cessation treatment; repealing a provision authorizing vaccination or medical treatment of a minor child without parental consent as specified; and providing for an effective date.",0,,2024-03-05,"H:Died in Committee Returned Bill Pursuant to HR 5-4",https://legiscan.com/WY/bill/HB0044/2024,https://www.wyoleg.gov/Legislation/2024/HB0044
1798614,2096,HB0045,4,Passed,2024-03-21,"Property tax exemption-residential structures and land.","AN ACT relating to taxation; establishing a property tax exemption for single family residential structures based on the prior year assessed value; establishing a property tax exemption for land associated with a single family residential structure based on the prior year assessed value; providing definitions; requiring information related to the tax exemption to be included on the tax assessment schedule and tax notice; providing rulemaking authority; specifying applicability; and providing for an effective date.",0,,2024-03-21,"Assigned Chapter Number 107",https://legiscan.com/WY/bill/HB0045/2024,https://www.wyoleg.gov/Legislation/2024/HB0045
1799685,2096,HB0046,4,Passed,2024-03-04,"Chancery court-timeline for resolution of disputes.","AN ACT relating to courts; amending the timeline for the effective and expeditious resolution of disputes filed in the chancery court; specifying applicability; and providing for an effective date.",0,,2024-03-04,"Assigned Chapter Number 8",https://legiscan.com/WY/bill/HB0046/2024,https://www.wyoleg.gov/Legislation/2024/HB0046
1799619,2096,HB0047,6,Failed,2024-02-14,"Solid waste-illegal dumping remediation grants.","AN ACT relating to environmental quality; establishing an illegal dumping remediation grant program; specifying requirements for the program; requiring the department of environmental quality to manage the program; creating an account; requiring reports; providing for the transfer of funds; making conforming amendments; requiring rulemaking; and providing for an effective date.",0,,2024-02-14,"Failed Introduction 28-33-1-0-0",https://legiscan.com/WY/bill/HB0047/2024,https://www.wyoleg.gov/Legislation/2024/HB0047
1800605,2096,HB0048,6,Failed,2024-02-23,"Renaming the deaf, dumb and blind account.","AN ACT relating to public funds; renaming the deaf, dumb and blind account; and providing for an effective date.",0,,2024-02-23,"COW:H Did not consider for COW",https://legiscan.com/WY/bill/HB0048/2024,https://www.wyoleg.gov/Legislation/2024/HB0048
