bill_id,session_id,bill_number,status,status_desc,status_date,title,description,committee_id,committee,last_action_date,last_action,url,state_link
1785931,2096,SF0009,4,Passed,2024-03-05,"Parental rights in education-1.","AN ACT relating to education; specifying procedures and requirements for school districts to provide parents and guardians notice of information regarding students and the rights of parents and guardians to make decisions regarding their children; specifying that school districts cannot prohibit parental or guardian notifications and involvement in critical decisions involving students; specifying procedures for resolving parent or guardian concerns and complaints; specifying duties for school districts; requiring adoption of necessary policies, rules and procedures; and providing for effective dates.",0,,2024-03-05,"Assigned Chapter Number 34",https://legiscan.com/WY/bill/SF0009/2024,https://www.wyoleg.gov/Legislation/2024/SF0009
1785969,2096,SF0010,6,Failed,2024-02-16,"Eminent domain-energy collector systems.","AN ACT relating to eminent domain; limiting the exercise of the power of condemnation for energy collector systems; providing compensation standards for condemned property as specified; requiring proof of compliance; providing definitions; making conforming amendments; repealing an existing provision; specifying applicability; and providing for an effective date.",0,,2024-02-16,"Did not Consider for Introduction",https://legiscan.com/WY/bill/SF0010/2024,https://www.wyoleg.gov/Legislation/2024/SF0010
1786871,2096,SF0011,6,Failed,2024-02-16,"Eminent domain energy collector systems amendments.","AN ACT relating to eminent domain; removing the ability of entities who are not public utilities to use the right of condemnation for electric generation collector systems; specifying applicability; and providing for an effective date.",0,,2024-02-16,"Did not Consider for Introduction",https://legiscan.com/WY/bill/SF0011/2024,https://www.wyoleg.gov/Legislation/2024/SF0011
1787710,2096,SF0012,4,Passed,2024-03-07,"Meat processing plants-hides and carcasses.","AN ACT relating to hides and carcasses; requiring hide buyers to keep records of hides or pelts purchased as specified; making a conforming amendment; repealing existing provisions relating to the inspection of hides; and providing for an effective date.",0,,2024-03-07,"Assigned Chapter Number 55",https://legiscan.com/WY/bill/SF0012/2024,https://www.wyoleg.gov/Legislation/2024/SF0012
1788454,2096,SF0013,5,Vetoed,2024-03-15,"Federal land use plans-legal actions authorized.","AN ACT relating to the legislature; authorizing the legislature to prosecute actions involving the proper administration and interpretation of federal acts; making conforming amendments; providing legislative findings; authorizing loans as specified; authorizing the legislature to provide funding to counties as specified; specifying a sunset date for authorization for the legislature to provide funding to counties; specifying repayment of loans; and providing for an effective date.",0,,2024-03-15,"Governor Vetoed SEA No. 0067 ",https://legiscan.com/WY/bill/SF0013/2024,https://www.wyoleg.gov/Legislation/2024/SF0013
1789186,2096,SF0014,4,Passed,2024-03-15,"State fair board-powers and responsibilities.","AN ACT relating to agriculture, livestock and other animals; authorizing the state fair board to make disbursements from its budget; authorizing the state fair board to make and execute contracts; removing the requirement that the director of the department of agriculture be the chairman of any subcommittee created to execute the annual state fair; allowing the director of the department of agriculture to assign a designee to serve on the state fair board; authorizing rulemaking; and providing for effective dates.",0,,2024-03-15,"Assigned Chapter Number 77",https://legiscan.com/WY/bill/SF0014/2024,https://www.wyoleg.gov/Legislation/2024/SF0014
1790900,2096,SF0015,4,Passed,2024-03-01,"Acceptance of retrocession-federal military installations.","AN ACT relating to defense forces and affairs; authorizing the governor to accept retrocession over military reservations and lands as specified; correcting obsolete references; and providing for an effective date.",0,,2024-03-01,"Assigned Chapter Number 2",https://legiscan.com/WY/bill/SF0015/2024,https://www.wyoleg.gov/Legislation/2024/SF0015
1790924,2096,SF0016,6,Failed,2024-02-23,"Military department emergency fire suppression account. ","AN ACT relating to the military department; creating an account for emergency fire suppression costs on all state lands managed by the military department; authorizing the adjutant general to expend monies for emergency fire suppression; requiring rulemaking; providing an appropriation; and providing for an effective date.",0,,2024-02-23,"S:Died in Committee Returned Bill Pursuant to SR 5-4",https://legiscan.com/WY/bill/SF0016/2024,https://www.wyoleg.gov/Legislation/2024/SF0016
1790911,2096,SF0017,4,Passed,2024-03-01,"Plane coordinates system-amendments. ","AN ACT relating to the plane coordinates system; updating the plane coordinates system for Wyoming; providing for the use of other datums, systems and networks for the system; providing definitions; making conforming amendments; repealing provisions related to obsolete coordinate standards; and providing for an effective date. ",0,,2024-03-01,"Assigned Chapter Number 3",https://legiscan.com/WY/bill/SF0017/2024,https://www.wyoleg.gov/Legislation/2024/SF0017
1792244,2096,SF0018,4,Passed,2024-03-07,"Indian child welfare act-safe haven amendments.","AN ACT relating to children; amending the safe haven statutes to require compliance with the Wyoming Indian Child Welfare Act as specified; requiring rulemaking; and providing for effective dates.",0,,2024-03-07,"Assigned Chapter Number 57",https://legiscan.com/WY/bill/SF0018/2024,https://www.wyoleg.gov/Legislation/2024/SF0018
1792235,2096,SF0019,4,Passed,2024-03-20,"Developmental preschool funding.","AN ACT relating to developmental preschool funding; modifying the per child amounts used to calculate payments to service providers; modifying requirements for the department of health's budget request for developmental preschool services as specified; modifying the date utilized to count the number of children that participate in the program; providing an appropriation; and providing for an effective date.",0,,2024-03-20,"Assigned Chapter Number 95",https://legiscan.com/WY/bill/SF0019/2024,https://www.wyoleg.gov/Legislation/2024/SF0019
1793651,2096,SF0020,4,Passed,2024-03-08,"Electricity rates for costs that do not benefit Wyoming.","AN ACT relating to public utilities; specifying that costs of interstate electric public utilities that do not benefit Wyoming ratepayers shall be excluded from costs apportioned to Wyoming; and providing for an effective date.",0,,2024-03-08,"Assigned Chapter Number 70",https://legiscan.com/WY/bill/SF0020/2024,https://www.wyoleg.gov/Legislation/2024/SF0020
1793647,2096,SF0021,4,Passed,2024-03-04,"Public utilities-net power cost sharing ratio.","AN ACT relating to public utilities; specifying the sharing of electric supply costs between a public utility and its customers in specified cost-tracking mechanisms; and providing for an effective date.",0,,2024-03-04,"Assigned Chapter Number 16",https://legiscan.com/WY/bill/SF0021/2024,https://www.wyoleg.gov/Legislation/2024/SF0021
1793644,2096,SF0022,4,Passed,2024-03-07,"Public service commission-electricity reliability.","AN ACT relating to public utilities; requiring the public service commission to establish standards related to electricity reliability; specifying that failing to comply with standards is subject to penalties; providing that the public service commission shall not allow for rate recovery for new or modified facilities that are likely to result in failure to comply with reliability standards; specifying that public utilities may enter into individualized energy contracts and may utilize customer-specific energy portfolios; and providing for an effective date.",0,,2024-03-07,"Assigned Chapter Number 58",https://legiscan.com/WY/bill/SF0022/2024,https://www.wyoleg.gov/Legislation/2024/SF0022
1793656,2096,SF0023,4,Passed,2024-03-15,"Public utilities-energy resource procurement.","AN ACT relating to public utilities; establishing a solicitation process for specified electrical utilities acquiring or constructing significant energy resources; providing a waiver process; providing for the use of independent evaluators; providing rulemaking authority; authorizing a full time position; providing an appropriation; and providing for an effective date.",0,,2024-03-15,"Assigned Chapter Number 76",https://legiscan.com/WY/bill/SF0023/2024,https://www.wyoleg.gov/Legislation/2024/SF0023
1793638,2096,SF0024,4,Passed,2024-03-20,"Public service commission-integrated resource plans.","AN ACT relating to public utilities; providing for the review of integrated resource plan action plans by the public service commission; providing rulemaking authority; authorizing a position; providing an appropriation; and providing for an effective date.",0,,2024-03-20,"Assigned Chapter Number 97",https://legiscan.com/WY/bill/SF0024/2024,https://www.wyoleg.gov/Legislation/2024/SF0024
1793658,2096,SF0025,6,Failed,2024-03-05,"Reclamation and decommissioning costs.","AN ACT relating to public utilities; requiring a study identify already incurred liabilities for the decommissioning and cleanup of coal fired electric generation facilities as specified; requiring a study and reports; and providing for an effective date.",0,,2024-03-05,"H:Died in Committee Returned Bill Pursuant to HR 5-4",https://legiscan.com/WY/bill/SF0025/2024,https://www.wyoleg.gov/Legislation/2024/SF0025
1793640,2096,SF0026,4,Passed,2024-03-15,"Special district vacancies.","AN ACT relating to special districts; clarifying the term of office for members of a special district governing body that filled a vacancy; and providing for an effective date.",0,,2024-03-15,"Assigned Chapter Number 81",https://legiscan.com/WY/bill/SF0026/2024,https://www.wyoleg.gov/Legislation/2024/SF0026
1793653,2096,SF0027,4,Passed,2024-03-18,"Special districts bond elections exception.","AN ACT relating to special districts; providing an exception to special district bond elections for improvement and service districts and water and sewer districts as specified; specifying applicability; and providing for an effective date.",0,,2024-03-18,"Assigned Chapter Number 93",https://legiscan.com/WY/bill/SF0027/2024,https://www.wyoleg.gov/Legislation/2024/SF0027
1793642,2096,SF0028,6,Failed,2024-02-13,"Federal natural resource management coordinator. ","AN ACT relating to administration of the government; authorizing a position within the governor's office; specifying duties for the newly authorized position; repealing the existing coordinator of state-federal relations position; providing an appropriation; and providing for an effective date. ",0,,2024-02-13,"Failed Introduction 10-21-0-0-0",https://legiscan.com/WY/bill/SF0028/2024,https://www.wyoleg.gov/Legislation/2024/SF0028
1793662,2096,SF0029,6,Failed,2024-02-13,"Major political parties-state central party voting members.","AN ACT relating to political parties; clarifying voting requirements for members of the state central committee of major political parties; and providing for an effective date.",0,,2024-02-13,"Failed Introduction 8-23-0-0-0",https://legiscan.com/WY/bill/SF0029/2024,https://www.wyoleg.gov/Legislation/2024/SF0029
1793771,2096,SF0030,4,Passed,2024-03-04,"Influencing jurors and witnesses-judges amendment.","AN ACT relating to crimes and offenses; clarifying that judges are covered under the offense of influencing, intimidating or impeding jurors, witnesses and officers; amending the penalty for intimidating or impeding jurors, judges, witnesses and officers; and providing for an effective date.",0,,2024-03-04,"Assigned Chapter Number 15",https://legiscan.com/WY/bill/SF0030/2024,https://www.wyoleg.gov/Legislation/2024/SF0030
1793746,2096,SF0031,1,Introduced,2024-02-12,"Sex offender registration-promoting obscenity.","AN ACT relating to criminal procedure; specifying offenses of promoting obscenity as offenses for which convicted offenders shall register as a sex offender; and providing for an effective date.",0,,2024-02-21,"3rd Reading:Failed 13-17-0-0-1",https://legiscan.com/WY/bill/SF0031/2024,https://www.wyoleg.gov/Legislation/2024/SF0031
1793761,2096,SF0032,4,Passed,2024-03-07,"Hemp-limitations on psychoactive substances.","AN ACT relating to hemp production and controlled substances; prohibiting the addition of synthetic substances or other additives to hemp; prohibiting the sale of hemp with THC or psychoactive substances as specified; providing and amending definitions; including naturally occurring THC as a scheduled substance in the Controlled Substances Act; making conforming amendments; requiring rulemaking; and providing for effective dates.",0,,2024-03-07,"Assigned Chapter Number 56",https://legiscan.com/WY/bill/SF0032/2024,https://www.wyoleg.gov/Legislation/2024/SF0032
1793742,2096,SF0033,6,Failed,2024-02-12,"Wyoming rural attorney recruitment program.","AN ACT relating to attorneys-at-law; establishing the rural attorney recruitment pilot program; specifying eligibility requirements for counties and attorneys to participate in the program; specifying administration, oversight and payment obligations for the program; requiring reports; providing a sunset date for the program; authorizing the adoption of rules, policies and procedures; providing an appropriation; and providing for an effective date.",0,,2024-02-12,"Failed Introduction 16-15-0-0-0",https://legiscan.com/WY/bill/SF0033/2024,https://www.wyoleg.gov/Legislation/2024/SF0033
1793750,2096,SF0034,4,Passed,2024-03-21,"Sex offender registration-registerable offenses.","AN ACT relating to criminal procedure; inserting and amending offenses for which convicted offenders must register as a sex offender; repealing a definition associated with sex offender registration; and providing for an effective date.",0,,2024-03-21,"Assigned Chapter Number 102",https://legiscan.com/WY/bill/SF0034/2024,https://www.wyoleg.gov/Legislation/2024/SF0034
1793756,2096,SF0035,4,Passed,2024-03-15,"Public records-DOC investigations.","AN ACT relating to public records; applying the investigatory records disclosure exception to department of corrections records as specified; and providing for an effective date.",0,,2024-03-15,"Assigned Chapter Number 88",https://legiscan.com/WY/bill/SF0035/2024,https://www.wyoleg.gov/Legislation/2024/SF0035
1793766,2096,SF0036,4,Passed,2024-03-18,"Uniform Child Abduction Prevention Act.","AN ACT relating to domestic relations; adopting the Uniform Child Abduction Prevention Act; authorizing a district court to order child abduction prevention measures when the evidence establishes a credible risk of abduction; providing definitions; and providing for an effective date.",0,,2024-03-18,"Assigned Chapter Number 90",https://legiscan.com/WY/bill/SF0036/2024,https://www.wyoleg.gov/Legislation/2024/SF0036
1794599,2096,SF0037,4,Passed,2024-03-07,"Indian child welfare act-delinquency amendments.","AN ACT relating to domestic relations; providing that the Wyoming Indian Child Welfare Act does not apply to delinquency petitions; repealing a provision; making conforming amendments; and providing for an effective date.",0,,2024-03-07,"Assigned Chapter Number 52",https://legiscan.com/WY/bill/SF0037/2024,https://www.wyoleg.gov/Legislation/2024/SF0037
1797005,2096,SF0038,4,Passed,2024-03-07,"Financial reporting amendments-2.","AN ACT relating to financial reporting to the department of audit; amending enforcement of financial reporting requirements through limiting disbursement of certain tax revenues; clarifying good cause for extending reporting deadline; and providing for an effective date.",0,,2024-03-07,"Assigned Chapter Number 48",https://legiscan.com/WY/bill/SF0038/2024,https://www.wyoleg.gov/Legislation/2024/SF0038
1798540,2096,SF0039,6,Failed,2024-02-12,"Firefighters recruitment film.","AN ACT relating to volunteer firefighters; authorizing the state fire marshal and the department of workforce services to produce a film related to the recruitment of volunteer firefighters; providing an appropriation; and providing for an effective date.",0,,2024-02-12,"Failed Introduction 19-12-0-0-0",https://legiscan.com/WY/bill/SF0039/2024,https://www.wyoleg.gov/Legislation/2024/SF0039
1800072,2096,SF0040,6,Failed,2024-02-12,"Outdoor Recreation and Tourism Trust Fund Administration.","AN ACT relating to state lands; providing for the administration of the Wyoming outdoor recreation and tourism trust fund; creating the Wyoming outdoor recreation and tourism trust fund income account; establishing new duties for the select natural resource funding committee; providing for the distribution of funds; requiring audits and reports; providing for rulemaking; providing  appropriations; and providing for an effective date.",0,,2024-02-12,"Failed Introduction 18-13-0-0-0",https://legiscan.com/WY/bill/SF0040/2024,https://www.wyoleg.gov/Legislation/2024/SF0040
1800823,2096,SF0041,4,Passed,2024-03-20,"Banking division-classification and salary exemptions.","AN ACT relating to banks, banking and finance; generally exempting employees of the division of banking from state personnel classification and compensation provisions; requiring the state banking commissioner with the approval of the governor to establish personnel classifications and salaries for positions within the division of banking as specified; requiring reports; providing an appropriation; and providing for an effective date.",0,,2024-03-20,"Assigned Chapter Number 100",https://legiscan.com/WY/bill/SF0041/2024,https://www.wyoleg.gov/Legislation/2024/SF0041
1801037,2096,SF0042,4,Passed,2024-03-15,"Low-carbon reliable energy standards-amendments.","AN ACT relating to public utilities; amending requirements and deadlines for low-carbon energy generation standards; amending reporting requirements for meeting the low-carbon energy standards; amending rate recovery mechanisms associated with low-carbon energy standards; requiring rulemaking; and providing for an effective date.",0,,2024-03-15,"Assigned Chapter Number 75",https://legiscan.com/WY/bill/SF0042/2024,https://www.wyoleg.gov/Legislation/2024/SF0042
1800932,2096,SF0043,6,Failed,2024-02-12,"Pore space-severances and separate conveyances prohibited.","AN ACT relating to property; specifying that ownership interests in pore space shall not be severed and separately conveyed as specified; making conforming amendments; specifying applicability; and providing for an effective date.",0,,2024-02-12,"Failed Introduction 10-21-0-0-0",https://legiscan.com/WY/bill/SF0043/2024,https://www.wyoleg.gov/Legislation/2024/SF0043
1800713,2096,SF0044,5,Vetoed,2024-03-19,"Limited mining operations-amendments.","AN ACT relating to environmental quality; amending requirements for the commencement of limited mining operations; amending bonding, notice and reporting requirements for limited mining operations; limiting overburden surface mining operations as specified; amending requirements for extending limited mining operations; requiring approval of limited mining operations on state or school lands by the county and the state board of land commissioners as specified; authorizing rulemaking; amending bond release provisions for limited mining operations; and providing for effective dates.",0,,2024-03-19,"Governor Vetoed SEA No. 0062 ",https://legiscan.com/WY/bill/SF0044/2024,https://www.wyoleg.gov/Legislation/2024/SF0044
1811533,2096,SF0045,4,Passed,2024-03-07,"Vulnerable adults-civil cause of action-2.","AN ACT relating to adult protective services; providing a civil cause of action for the exploitation of vulnerable adults as specified; and providing for an effective date.",0,,2024-03-07,"Assigned Chapter Number 53",https://legiscan.com/WY/bill/SF0045/2024,https://www.wyoleg.gov/Legislation/2024/SF0045
1813043,2096,SF0046,6,Failed,2024-02-13,"Compulsory school attendance-minimum age.","AN ACT relating to education; amending the minimum age when school attendance is required; repealing a related provision; specifying applicability; and providing for an effective date.",0,,2024-02-13,"Failed Introduction 7-24-0-0-0",https://legiscan.com/WY/bill/SF0046/2024,https://www.wyoleg.gov/Legislation/2024/SF0046
1813730,2096,SF0047,4,Passed,2024-03-20,"Law enforcement retirement-contributions.","AN ACT relating to compensation and benefits; increasing employee and employer contributions for law enforcement officers under the Wyoming Retirement Act; providing a monthly death benefit for officers killed in the line of duty; providing appropriations; and providing for an effective date.",0,,2024-03-20,"Assigned Chapter Number 96",https://legiscan.com/WY/bill/SF0047/2024,https://www.wyoleg.gov/Legislation/2024/SF0047
1813775,2096,SF0048,4,Passed,2024-03-07,"Patrol, warden and investigator retirement-contributions.","AN ACT relating to compensation and benefits; increasing employee contributions under the Wyoming State Highway Patrol, Game and Fish Warden and Criminal Investigator Retirement Act; striking archaic provisions; providing appropriations; and providing for an effective date.",0,,2024-03-07,"Assigned Chapter Number 47",https://legiscan.com/WY/bill/SF0048/2024,https://www.wyoleg.gov/Legislation/2024/SF0048
1813859,2096,SF0049,4,Passed,2024-03-07,"Judicial retirement program-contributions.","AN ACT relating to compensation and benefits; increasing the employee contribution required for employees under the Wyoming Judicial Retirement Act; providing an appropriation; and providing for an effective date.",0,,2024-03-07,"Assigned Chapter Number 46",https://legiscan.com/WY/bill/SF0049/2024,https://www.wyoleg.gov/Legislation/2024/SF0049
1814421,2096,SF0050,4,Passed,2024-03-07,"Unincorporated nonprofit DAO's.","AN ACT relating to corporations, partnerships and associations; providing for the formation and management of decentralized unincorporated nonprofit associations; providing definitions; and providing for an effective date.",0,,2024-03-07,"Assigned Chapter Number 50",https://legiscan.com/WY/bill/SF0050/2024,https://www.wyoleg.gov/Legislation/2024/SF0050
1814311,2096,SF0051,6,Failed,2024-03-05,"Unlawful dissemination of misleading synthetic media.","AN ACT relating to consumer protection; prohibiting the dissemination of synthetic media as specified; providing definitions; providing remedies; providing penalties; and providing for an effective date.",0,,2024-03-05,"H:Died in Committee Returned Bill Pursuant to HR 5-4",https://legiscan.com/WY/bill/SF0051/2024,https://www.wyoleg.gov/Legislation/2024/SF0051
1814528,2096,SF0052,4,Passed,2024-03-18,"Wyoming Stable Token Act-amendments.","AN ACT relating to trade and commerce; amending the Wyoming Stable Token Act to allow for investments in cash and government securities as specified; authorizing the Wyoming stable token commission to issue different types and amounts of stable tokens and to contract with financial service providers; requiring reporting only for fully reserved stable tokens as specified; providing for a competitive bidding and procurement process; making conforming amendments to criminal history records statutes; and providing for an effective date.",0,,2024-03-18,"Assigned Chapter Number 92",https://legiscan.com/WY/bill/SF0052/2024,https://www.wyoleg.gov/Legislation/2024/SF0052
1818233,2096,SF0053,4,Passed,2024-03-15,"Sixth judicial district-number of judges.","AN ACT relating to the judiciary; providing for an additional district judge for the sixth judicial district; specifying requirements for suitable facilities; providing an appropriation; authorizing positions; and providing for an effective date.",0,,2024-03-15,"Assigned Chapter Number 79",https://legiscan.com/WY/bill/SF0053/2024,https://www.wyoleg.gov/Legislation/2024/SF0053
1818914,2096,SF0054,5,Vetoed,2024-03-22,"Homeowner tax exemption.","AN ACT relating to taxation; establishing a homeowner property tax exemption; providing a sunset date; providing an appropriation; and providing for an effective date.",0,,2024-03-22,"Governor Vetoed SEA No. 0070 ",https://legiscan.com/WY/bill/SF0054/2024,https://www.wyoleg.gov/Legislation/2024/SF0054
1819252,2096,SF0055,2,Engrossed,2024-02-16,"Board of equalization-questions before the board.","AN ACT relating to the state board of equalization; specifying the power of the board to decide questions; and providing for an effective date.",0,,2024-03-01,"3rd Reading:Failed 30-28-4-0-0",https://legiscan.com/WY/bill/SF0055/2024,https://www.wyoleg.gov/Legislation/2024/SF0055
1820668,2096,SF0056,6,Failed,2024-02-12,"Special districts-limit on tax levy.","AN ACT relating to taxation; authorizing the restriction of tax levies for special districts based upon accumulated reserves; and providing for an effective date.",0,,2024-02-12,"Failed Introduction 9-22-0-0-0",https://legiscan.com/WY/bill/SF0056/2024,https://www.wyoleg.gov/Legislation/2024/SF0056
1820381,2096,SF0057,4,Passed,2024-03-20,"Wyoming adult hearing aid program.","AN ACT relating to public health and safety; creating a hearing aid program for hearing impaired adults as specified; requiring rulemaking; providing appropriations; and providing for effective dates.",0,,2024-03-20,"Assigned Chapter Number 94",https://legiscan.com/WY/bill/SF0057/2024,https://www.wyoleg.gov/Legislation/2024/SF0057
