bill_number,session_num,session,bill_id_num,title,intro_sponsor,primary_sponsors,cosponsors,keywords,summary,bill_json
SB1013,127,2023_2024_First_Regular,78056,colleges; universities; free speech zones,,KAVANAGH,,COLLEGES; EDUCATION - TITLE 15; EXPRESSIVE ACTIVITY; FREE SPEECH; FREE SPEECH ZONE (H); FREE SPEECH ZONES; POSTSECONDARY INSTITUTIONS (H); PROHIBITION; PROTESTS AND DEMONSTRATIONS; PUBLIC FORUM; RETROACTIVITY (H); STUDENTS RIGHTS; UNIVERSITIES,SB1013 - colleges; universities; free speech zones,https://apps.azleg.gov/api/Bill/?billNumber=SB1013&sessionId=127
SB1014,127,2023_2024_First_Regular,78057,eyeglasses; prescriptions,,KAVANAGH,,EYEGLASSES; OPHTHALMIC LENS PRESCRIPTIONS; OPHTHALMIC LENSES; PRESCRIPTIONS; PROFESSIONS AND OCCUPATIONS - TITLE 32,SB1014 - eyeglasses; prescriptions,https://apps.azleg.gov/api/Bill/?billNumber=SB1014&sessionId=127
SB1015,127,2023_2024_First_Regular,78059,unlawful public sale of animals,,KAVANAGH,,ANIMALS; CIVIL PENALTY; DEFINITIONS; PUBLIC SALE OF ANIMALS; TRADE AND COMMERCE - TITLE 44; UNLAWFUL PUBLIC SALE OF ANIMALS,SB1015 - unlawful public sale of animals,https://apps.azleg.gov/api/Bill/?billNumber=SB1015&sessionId=127
SB1016,127,2023_2024_First_Regular,78060,AHCCCS; speech therapy,,SHOPE,BLISS; SHAH,AHCCCS (SEE ALSO: ARIZONA HEALTH CARE COST CONTAINMENT SYSTEM); ARIZONA HEALTH CARE COST CONTAINMENT SYSTEM (AHCCCS); COVERED HEALTH AND MEDICAL SERVICES; DEFINITION; MODIFICATIONS; PUBLIC HEALTH AND SAFETY - TITLE 36; RELATED DELIVERY OF SERVICE REQUIREMENTS; RULES; SPEECH THERAPY,SB1016 - AHCCCS; speech therapy,https://apps.azleg.gov/api/Bill/?billNumber=SB1016&sessionId=127
SB1017,127,2023_2024_First_Regular,78061,AHCCCS; cochlear implants,,SHOPE,BLISS,AHCCCS (SEE ALSO: ARIZONA HEALTH CARE COST CONTAINMENT SYSTEM); ARIZONA HEALTH CARE COST CONTAINMENT SYSTEM (AHCCCS); COCHLEAR IMPLANTS; COVERED HEALTH AND MEDICAL SERVICES; DEFINITION; MODIFICATIONS; PUBLIC HEALTH AND SAFETY - TITLE 36; RELATED DELIVERY OF SERVICE REQUIREMENTS; RULES,SB1017 - AHCCCS; cochlear implants,https://apps.azleg.gov/api/Bill/?billNumber=SB1017&sessionId=127
SB1018,127,2023_2024_First_Regular,78062,mental health coverage; collaborative care,,SHOPE,SHAMP,ACCOUNTABLE HEALTH PLANS; ADMINISTRATION; APPROPRIATING MONIES; APPROPRIATION; COLLABORATIVE CARE; COLLABORATIVE CARE TECHNICAL ASSISTANCE CENTER; COLLABORATIVE CARE UPTAKE FUND; DEFINITIONS; EXEMPTION; GRANTS; INSURANCE - TITLE 20; MENTAL HEALTH BENEFITS; MENTAL HEALTH COVERAGE; MENTAL HEALTH SERVICES; MENTAL HEALTH SERVICES AND BENEFITS; PRIMARY CARE PHYSICIAN GRANTS; PUBLIC HEALTH AND SAFETY - TITLE 36; PURPOSES; STRIKE EVERYTHING AMENDMENT,SB1018 - (NOW: collaborative care; appropriation),https://apps.azleg.gov/api/Bill/?billNumber=SB1018&sessionId=127
SB1019,127,2023_2024_First_Regular,78063,Gila River Indian Community plates,,SHOPE,,AUTHORIZED USES; GILA RIVER INDIAN COMMUNITY PLATES; HIGHWAY USER REVENUES; SOURCES; SPECIAL PLATES; STATE HIGHWAY FUND; TRANSPORTATION - TITLE 28,SB1019 - Gila River Indian Community plates,https://apps.azleg.gov/api/Bill/?billNumber=SB1019&sessionId=127
SB1020,127,2023_2024_First_Regular,78064,open meetings; capacity; posting,,KAVANAGH,,CAPACITY; MINUTES; NOTICE OF MEETINGS; OPEN MEETINGS; POSTING; PUBLIC MEETINGS AND PROCEEDINGS; PUBLIC OFFICERS AND EMPLOYEES - TITLE 38; RECORDINGS; SEATING,SB1020 - open meetings; capacity; posting,https://apps.azleg.gov/api/Bill/?billNumber=SB1020&sessionId=127
SB1021,127,2023_2024_First_Regular,78065,attorney general; legislature; legal challenges,,KAVANAGH,,ATTORNEY GENERAL; COMPROMISE AND SETTLEMENT MONIES; COURTS AND CIVIL PROCEEDINGS - TITLE 12 (H); DEPARTMENT OF LAW; EXCEPTIONS; LEGAL CHALLENGES; LEGAL COUNSEL; LEGISLATURE; POWERS AND DUTIES OF ATTORNEY GENERAL; RESTRICTIONS ON STATE AGENCIES; STATE GOVERNMENT - TITLE 41,SB1021 - attorney general; legislature; legal challenges,https://apps.azleg.gov/api/Bill/?billNumber=SB1021&sessionId=127
SB1022,127,2023_2024_First_Regular,78069,pedestrians; selling goods; begging; medians,,KAVANAGH,,BEGGING; CIVIL TRAFFIC VIOLATION; CLASSIFICATION; MEDIANS; PEDESTRIANS; PROHIBITION; SELLING GOODS; SOLICITING DONATIONS; TRAFFIC ISLAND OR MEDIAN; TRANSPORTATION - TITLE 28; VIOLATION; WARNING,SB1022 - pedestrians; selling goods; begging; medians,https://apps.azleg.gov/api/Bill/?billNumber=SB1022&sessionId=127
SB1023,127,2023_2024_First_Regular,78070,residential picketing; offense,,KAVANAGH,,CLASSIFICATION; CRIMINAL CODE - TITLE 13; OFFENSE; OFFENSES (H); RESIDENTIAL PICKETING,SB1023 - residential picketing; offense,https://apps.azleg.gov/api/Bill/?billNumber=SB1023&sessionId=127
SB1024,127,2023_2024_First_Regular,78071,public rights-of-way; unlawful acts,,KAVANAGH,,CLASSIFICATION; CRIMINAL CODE - TITLE 13; EXCEPTION; OFFENSES AGAINST PUBLIC ORDER; PROHIBITED USE; PUBLIC RIGHTS-OF-WAY; TRANSPORTATION - TITLE 28; UNLAWFUL ACTS; UNLAWFUL USE OF PUBLIC RIGHTS-OF-WAY,SB1024 - public rights-of-way; unlawful acts,https://apps.azleg.gov/api/Bill/?billNumber=SB1024&sessionId=127
SB1025,127,2023_2024_First_Regular,78072,political signs; tourism zones,,KAVANAGH,,CLASSIFICATION; ELECTIONS AND ELECTORS - TITLE 16; POLITICAL SIGNS; PRINTED MATERIALS; TAMPERING; TOURISM ZONES; VIOLATION,SB1025 - political signs; tourism zones,https://apps.azleg.gov/api/Bill/?billNumber=SB1025&sessionId=127
SB1026,127,2023_2024_First_Regular,78075,state monies; drag shows; minors,,KAVANAGH,,CLASSIFICATION; DEFINITION; DRAG SHOWS; DRAG SHOWS TARGETING MINORS; MINORS; PROHIBITED USE OF STATE MONIES; PROHIBITION ON STATE MONIES; PUBLIC FINANCES - TITLE 35; STATE MONIES; USE OF STATE MONIES PROHIBITED; VIOLATION (H); VIOLATIONS,SB1026 - state monies; drag shows; minors,https://apps.azleg.gov/api/Bill/?billNumber=SB1026&sessionId=127
SB1027,127,2023_2024_First_Regular,78079,carfentanil; fentanyl; threshold amount; minors,,KERN,,ACQUISITION; ADMINISTRATION; CARFENTANIL; CLASSIFICATION; CRIMINAL CODE - TITLE 13; DANGEROUS CRIMES AGAINST CHILDREN; DEFINITIONS; FENTANYL; FENTANYL MIMETIC SUBSTANCE; MANUFACTURE; MINORS; NARCOTIC DRUGS; PENALTIES (H); PHYSICAL INJURY TO A MINOR; POSSESSION; SALE; SENTENCES; THRESHOLD AMOUNT; TRANSPORTATION; USE,SB1027 - (NOW: carfentanil; fentanyl; minors; penalties),https://apps.azleg.gov/api/Bill/?billNumber=SB1027&sessionId=127
SB1028,127,2023_2024_First_Regular,78081,adult cabaret performances; prohibited locations,,KERN,,ADULT CABARET PERFORMANCES; CLASSIFICATION; CRIMINAL CODE - TITLE 13; DEFINITIONS; LOCATION; PROHIBITED LOCATIONS; SEXUAL OFFENSES,SB1028 - adult cabaret performances; prohibited locations,https://apps.azleg.gov/api/Bill/?billNumber=SB1028&sessionId=127
SB1029,127,2023_2024_First_Regular,78082,felony murder; fentanyl; sentencing,,KERN,,CLASSIFICATION; COLLECTION (H); CRIMINAL CODE - TITLE 13; DEPARTMENT OF HEALTH SERVICES (DHS) (H); DEPARTMENT OF REVENUE (DOR) (H); DHS (SEE ALSO: DEPARTMENT OF HEALTH SERVICES) (H); DOR (SEE ALSO: DEPARTMENT OF REVENUE) (H); ENFORCEMENT (H); FELONY MURDER; FENTANYL; FIRST DEGREE MURDER; HOMICIDE; MARIJUANA (H); MARIJUANA TAX (H); PUBLIC HEALTH AND SAFETY - TITLE 36 (H); REPORT (H); SENTENCING,SB1029 - (NOW: marijuana tax; collection; report; enforcement),https://apps.azleg.gov/api/Bill/?billNumber=SB1029&sessionId=127
SB1030,127,2023_2024_First_Regular,78083,drag performers; drag shows; regulation,,KERN,,ADULT ORIENTED BUSINESSES; CIVIL ACTION; CLASSIFICATION; CONFIDENTIAL INFORMATION FORM; COUNTIES - TITLE 11; COURTS AND CIVIL PROCEEDINGS - TITLE 12; CRIMINAL CODE - TITLE 13; DEFINITIONS; DRAG PERFORMERS; DRAG SHOWS; EXCEPTIONS; HOURS OF OPERATION; INJUNCTION; LOCATION; REGULATION; REMEDIES; SEXUALLY EXPLICIT PERFORMANCES; STATUTE OF LIMITATIONS; UNAUTHORIZED DISCLOSURE OF INTIMATE IMAGES; ZONING DISTRICTS; ZONING ORDINANCE,SB1030 - (NOW: sexually explicit performances; regulation),https://apps.azleg.gov/api/Bill/?billNumber=SB1030&sessionId=127
SB1031,127,2023_2024_First_Regular,78084,public employees; employment; termination,,KERN,,CIVIL PENALTY; EMPLOYMENT; EMPLOYMENT TERMINATION; POLITICAL AFFILIATIONS; POLITICAL SUBDIVISIONS; PUBLIC EMPLOYEES; STATE AGENCIES; STATE GOVERNMENT - TITLE 41; TERMINATION; VACCINATION STATUS,SB1031 - public employees; employment; termination,https://apps.azleg.gov/api/Bill/?billNumber=SB1031&sessionId=127
SB1032,127,2023_2024_First_Regular,78086,developmental disabilities; spina bifida.,,KAVANAGH,LONGDON,DEFINITIONS; DEVELOPMENTAL DISABILITIES; PUBLIC HEALTH AND SAFETY - TITLE 36; SPINA BIFIDA,SB1032 - developmental disabilities; spina bifida.,https://apps.azleg.gov/api/Bill/?billNumber=SB1032&sessionId=127
SB1033,127,2023_2024_First_Regular,78089,TPT; diapers; feminine hygiene; exemption.,,SHOPE,,APPLICABILITY; DEFINITIONS; DIAPERS; EXEMPTION; EXEMPTIONS; FEMININE HYGIENE; GENERAL EFFECTIVE DATE; INCONTINENCE; RETAIL CLASSIFICATION; TAX EXEMPTIONS; TAXATION - TITLE 42; TPT (SEE ALSO: TRANSACTION PRIVILEGE TAX); TRANSACTION PRIVILEGE TAX (TPT),SB1033 - TPT; diapers; feminine hygiene; exemption.,https://apps.azleg.gov/api/Bill/?billNumber=SB1033&sessionId=127
SB1034,127,2023_2024_First_Regular,78097,homeowners' associations; flag ban; prohibition,,KAVANAGH,,2022 ELECTION CYCLE; APPLICABILITY; CAUTION SIGNS; CONDOMINIUMS; DEFINITIONS; FLAG BAN; FLAG DISPLAY; FOR SALE; HOA (SEE ALSO: HOMEOWNERS' ASSOCIATION); HOMEOWNERS' ASSOCIATIONS (HOA); LEASE; PLANNED COMMUNITIES; POLITICAL AND COMMUNITY ACTIVITIES; POLITICAL SIGNS; PROPERTY - TITLE 33; RENT,SB1034 - homeowners' associations; flag ban; prohibition,https://apps.azleg.gov/api/Bill/?billNumber=SB1034&sessionId=127
SB1035,127,2023_2024_First_Regular,78098,sidewalks; scooters; bicycles; fifteen mph,,KAVANAGH,,BICYCLES; DEVICES; DRIVING ON SIDEWALK; FIFTEEN MPH; OPERATING BICYCLES; SCOOTERS; SIDEWALKS; TRANSPORTATION; TRANSPORTATION - TITLE 28,SB1035 - sidewalks; scooters; bicycles; fifteen mph,https://apps.azleg.gov/api/Bill/?billNumber=SB1035&sessionId=127
SB1036,127,2023_2024_First_Regular,78099,setting aside conviction; certificate eligibility,,KAVANAGH,,APPLICATION; CERTIFICATE ELIGIBILITY; CERTIFICATE OF SECOND CHANCE; CONVICTED PERSON ON DISCHARGE; CRIMINAL CODE - TITLE 13; EXCEPTIONS; FIREARM POSSESSION; RELEASE FROM DISABILITIES; RESTORATION OF CIVIL RIGHTS; SETTING ASIDE CONVICTION; SETTING ASIDE JUDGMENT,SB1036 - setting aside conviction; certificate eligibility,https://apps.azleg.gov/api/Bill/?billNumber=SB1036&sessionId=127
SB1037,127,2023_2024_First_Regular,78100,superior court commissioner; appointment; qualifications,,KAVANAGH,,APPOINTMENT; COMMISSIONERS; COMMISSIONERS ASSIGNED TO THE TAX COURT; COURT COMMISSIONERS; COURTS AND CIVIL PROCEEDINGS - TITLE 12; JUDGES PRO TEMPORE; POWERS AND DUTIES; QUALIFICATIONS; QUALIFICATIONS AND APPOINTMENTS; QUALIFICATIONS AND ASSIGNMENT; SALARY; SUPERIOR COURT COMMISSIONER; TAX JUDGE,SB1037 - superior court commissioner; appointment; qualifications,https://apps.azleg.gov/api/Bill/?billNumber=SB1037&sessionId=127
SB1038,127,2023_2024_First_Regular,78101,probate advisory panel; establishment,,KAVANAGH,,"ANNUAL REPORT; DELAYED REPEAL (H); DUTIES; ESTABLISHMENT; INITIAL TERMS; MEMBERSHIP; PROBATE ADVISORY PANEL; PROBATE PROVISIONS; TRUSTS, ESTATES AND PROTECTIVE PROCEEDINGS - TITLE 14",SB1038 - probate advisory panel; establishment,https://apps.azleg.gov/api/Bill/?billNumber=SB1038&sessionId=127
SB1039,127,2023_2024_First_Regular,78106,Don Bolles memorial,,SHOPE,ALSTON; LONGDON,DELAYED REPEAL; DON BOLLES; DON BOLLES MEMORIAL; MEMORIAL; PROCEDURES,SB1039 - Don Bolles memorial,https://apps.azleg.gov/api/Bill/?billNumber=SB1039&sessionId=127
SB1040,127,2023_2024_First_Regular,78110,public schools; restrooms; reasonable accommodations,,KAVANAGH,,ARIZONA ACCOMMODATIONS FOR ALL CHILDREN ACT; CAUSE OF ACTION; CHANGING FACILITIES; DEFINITIONS; EDUCATION - TITLE 15; PUBLIC SCHOOLS; REASONABLE ACCOMMODATIONS; RESTROOMS; SLEEPING QUARTERS,SB1040 - public schools; restrooms; reasonable accommodations,https://apps.azleg.gov/api/Bill/?billNumber=SB1040&sessionId=127
SB1041,127,2023_2024_First_Regular,78111,chiropractic care; nutritional supplements,,KAVANAGH,,APPROPRIATING MONIES; APPROPRIATION; ARIZONA DEPARTMENT OF HOMELAND SECURITY (AZDOHS); AZDOHS (SEE ALSO: ARIZONA DEPARTMENT OF HOMELAND SECURITY); CHIROPRACTIC CARE; CYBERSECURITY; CYBERSECURITY SOFTWARE; CYBERSECURITY SOFTWARE BIDS; EXEMPTION; HIGHWAYS AND BRIDGES - TITLE 18 (H); INFORMATION TECHNOLOGY - TITLE 18; LIMITATIONS; NUTRITIONAL SUPPLEMENTS; PRACTICE; PROFESSIONS AND OCCUPATIONS - TITLE 32; STATE BOARD OF CHIROPRACTIC EXAMINERS; STRIKE EVERYTHING AMENDMENT,SB1041 - (NOW: cybersecurity software; appropriation),https://apps.azleg.gov/api/Bill/?billNumber=SB1041&sessionId=127
SB1042,127,2023_2024_First_Regular,78149,school districts; aggregate expenditure limitation,,MARSH,ALSTON; BURCH; DIAZ; EPSTEIN; FERNANDEZ; GABALDÓN; GONZALES; MIRANDA; TERÁN; AGUILAR; BRAVO; HERNANDEZ A; HERNANDEZ C; HERNANDEZ M; ORTIZ; PAWLIK; SCHWIEBERT; SEAMAN; STAHL HAMILTON; TERECH,AGGREGATE EXPENDITURE LIMITATION; APPLICABILITY; CONDITIONAL ENACTMENT; DEFINITIONS; ECONOMIC ESTIMATES COMMISSION; EXPENDITURE LIMITATIONS; OFFICE OF ECONOMIC OPPORTUNITY; SCHOOL DISTRICTS; STATE GOVERNMENT - TITLE 41,SB1042 - school districts; aggregate expenditure limitation,https://apps.azleg.gov/api/Bill/?billNumber=SB1042&sessionId=127
SB1043,127,2023_2024_First_Regular,78150,expenditure limitation; school districts; repeal,,MARSH,ALSTON; BURCH; DIAZ; EPSTEIN; FERNANDEZ; GABALDÓN; GONZALES; HERNANDEZ; MIRANDA; SUNDARESHAN; TERÁN; BLATTMAN; BRAVO; HERNANDEZ A; HERNANDEZ C; HERNANDEZ M; ORTIZ; PAWLIK; SCHWIEBERT; SEAMAN; STAHL HAMILTON; TERECH,"APPLICABILITY; CONDITIONAL ENACTMENT; COURTS AND CIVIL PROCEEDINGS - TITLE 12; EDUCATION - TITLE 15; EXPENDITURE LIMITATION; EXPENDITURE LIMITATIONS; GAME AND FISH - TITLE 17; JUSTICE AND MUNICIPAL COURTS - TITLE 22; OFFICE OF ECONOMIC OPPORTUNITY; REPEAL; REPORT; REQUIREMENTS FOR ENACTMENT; REQUIREMENTS FOR ENACTMENT, INITIATIVE OR REFERENDUM (RFEIR); REQUIREMENTS FOR ENACTMENT; THREE-FOURTHS VOTE; RFEIR (SEE ALSO: REQUIREMENTS FOR ENACTMENT, INITIATIVE OR REFERENDUM); SCHOOL DISTRICTS; STATE GOVERNMENT - TITLE 41; TAXATION - TITLE 42; TPT (SEE ALSO: TRANSACTION PRIVILEGE TAX); TRANSACTION PRIVILEGE TAX (TPT); USE OF MONIES",SB1043 - expenditure limitation; school districts; repeal,https://apps.azleg.gov/api/Bill/?billNumber=SB1043&sessionId=127
SB1044,127,2023_2024_First_Regular,78163,student discipline; nonattendance; suspension; requirements,,KAVANAGH,,DEFINITION; EDUCATION - TITLE 15; NONATTENDANCE; PUPIL DISCIPLINARY PROCEDURES; REQUIREMENTS; STUDENT DISCIPLINE; SUSPENSION; SUSPENSION AND EXPULSION OF PUPILS,SB1044 - student discipline; nonattendance; suspension; requirements,https://apps.azleg.gov/api/Bill/?billNumber=SB1044&sessionId=127
SB1045,127,2023_2024_First_Regular,78166,Arizona professional soccer plates,,SHOPE,WILMETH,ARIZONA PROFESSIONAL SOCCER CLUB; HIGHWAY USER REVENUES; LICENSE PLATES (H); PROFESSIONAL SOCCER (H); SPECIAL PLATES; STATE HIGHWAY FUND; TRANSPORTATION - TITLE 28,SB1045 - (NOW: license plates; professional soccer ),https://apps.azleg.gov/api/Bill/?billNumber=SB1045&sessionId=127
SB1046,127,2023_2024_First_Regular,78173,arbitrators; appointment requirements,,KERN,,APPOINTMENT REQUIREMENTS; ARBITRATORS; COMPENSATION; COURT ARBITRATION; COURTS AND CIVIL PROCEEDINGS - TITLE 12; CREDENTIALS; EXPERIENCE; POWERS; TRAINING; VOLUNTEER,SB1046 - arbitrators; appointment requirements,https://apps.azleg.gov/api/Bill/?billNumber=SB1046&sessionId=127
SB1047,127,2023_2024_First_Regular,78230,interfering with law enforcement; offense,,KAVANAGH,,AIDING PEACE OFFICER; BARRICADE; BARRIER; CLASSIFICATION; CRIME SCENE INVESTIGATIONS; CRIMINAL CODE - TITLE 13; CRIMINAL TRESPASS; DEFINITIONS; INTERFERING; LAW ENFORCEMENT; OFFENSE; STRIKE EVERYTHING AMENDMENT; THIRD DEGREE; VERBAL ORDER,SB1047 - (NOW: criminal trespass; aiding peace officer),https://apps.azleg.gov/api/Bill/?billNumber=SB1047&sessionId=127
SB1048,127,2023_2024_First_Regular,78395,campaign finance; reporting threshold; lobbyists,,KAVANAGH,,CAMPAIGN CONTRIBUTIONS; CAMPAIGN CONTRIBUTIONS AND EXPENSES (H); CAMPAIGN EXPENSES; CAMPAIGN FINANCE; CAMPAIGN FINANCE REPORTS; ELECTIONS AND ELECTORS - TITLE 16 (H); INDEPENDENT EXPENDITURES; INDIVIDUAL CONTRIBUTIONS; LOBBYISTS; POLITICAL ACTION COMMITTEES; REPORTING THRESHOLD,SB1048 - campaign finance; reporting threshold; lobbyists,https://apps.azleg.gov/api/Bill/?billNumber=SB1048&sessionId=127
SB1049,127,2023_2024_First_Regular,78396,homeowners' associations; Betsy Ross flag,,KAVANAGH,,APPLICABILITY; BETSY ROSS FLAG; CONDOMINIUMS; CONDOMINIUMS AND PLANNED COMMUNITIES (H); DEFINITIONS; FLAG DISPLAY; HISTORIC AMERICAN FLAG; HOA (SEE ALSO: HOMEOWNERS' ASSOCIATION); HOMEOWNERS' ASSOCIATIONS (HOA); PLANNED COMMUNITIES; POLITICAL SIGNS; PROPERTY - TITLE 33,SB1049 - homeowners' associations; Betsy Ross flag,https://apps.azleg.gov/api/Bill/?billNumber=SB1049&sessionId=127
SB1050,127,2023_2024_First_Regular,78400,appropriation; DUI; data collection,,KAVANAGH,,ACJC (SEE ALSO: ARIZONA CRIMINAL JUSTICE COMMISSION); APPROPRIATING MONIES; APPROPRIATION; ARIZONA CRIMINAL JUSTICE COMMISSION (ACJC); DATA COLLECTION; DRIVING UNDER THE INFLUENCE; DUI; FISCAL YEAR 2023-2024; STATE GENERAL FUND,SB1050 - appropriation; DUI; data collection,https://apps.azleg.gov/api/Bill/?billNumber=SB1050&sessionId=127
SB1051,127,2023_2024_First_Regular,78431,census adjustment; population threshold,,SHOPE,,CENSUS ADJUSTMENT; COUNTIES - TITLE 11; COUNTY REGIONAL AREA ROAD FUND; DIESEL EQUIPMENT RETROFIT PROGRAM; DISTRIBUTION; FORMATION; OFFICE OF ECONOMIC OPPORTUNITY; POPULATION THRESHOLD; PUBLIC HEALTH AND SAFETY - TITLE 36; RURAL PLANNING AREAS; RURAL PLANNING ZONES; THE ENVIRONMENT - TITLE 49; TRANSPORTATION - TITLE 28; TRANSPORTATION EXCISE TAX,SB1051 - census adjustment; population threshold,https://apps.azleg.gov/api/Bill/?billNumber=SB1051&sessionId=127
SB1052,127,2023_2024_First_Regular,78432,biomarker testing; insurance coverage; definitions,,SHOPE,,BIOMARKER; BIOMARKER TESTING; COVERAGE; DEFINITIONS; INSURANCE - TITLE 20; INSURANCE COVERAGE; STRIKE EVERYTHING AMENDMENT,SB1052 - (NOW: insurance coverage; biomarker testing),https://apps.azleg.gov/api/Bill/?billNumber=SB1052&sessionId=127
SB1053,127,2023_2024_First_Regular,78433,veterinary medicine; electronic means,,SHOPE,,CLIENT PATIENT RELATIONSHIP; CONSENT; DEFINITIONS; ELECTRONIC MEANS; PRESCRIPTIONS; PROFESSIONS AND OCCUPATIONS - TITLE 32; SCOPE OF PRACTICE; VETERINARIANS; VETERINARY MEDICINE,SB1053 - veterinary medicine; electronic means,https://apps.azleg.gov/api/Bill/?billNumber=SB1053&sessionId=127
SB1054,127,2023_2024_First_Regular,78635,middle school students; civics; instruction,,GOWAN,,ADE (SEE ALSO: DEPARTMENT OF EDUCATION); ANNUAL REPORTS; APPROPRIATING MONIES (H); APPROPRIATION; ARIZONA CIVICS EDUCATION AND LEADERSHIP DEVELOPMENT FUND; ARIZONA CIVICS EDUCATION AND LEADERSHIP DEVELOPMENT PROGRAM; CIVICS; CIVICS EDUCATION; DEPARTMENT OF EDUCATION (ADE); DEVELOPMENT; DEVELOPMENT PROGRAM (H); EDUCATION - TITLE 15; EXEMPTION; FUND; INSTRUCTION; INSTRUCTIONAL SERVICE PROVIDERS; MIDDLE SCHOOL STUDENTS; PROGRAM; REQUIREMENTS; SCHOOL INSTRUCTION; STUDENTS,SB1054 - (NOW: students; civics education; development program),https://apps.azleg.gov/api/Bill/?billNumber=SB1054&sessionId=127
SB1055,127,2023_2024_First_Regular,78634,full-service crime labs; funding,,GOWAN,,APPROPRIATION; CRIME LAB; CRIMINAL JUSTICE AGENCY; DEFINITION; DEPARTMENT OF PUBLIC SAFETY (DPS); DEPARTMENT OF PUBLIC SAFETY FORENSICS FUND; DISTRIBUTION (H); DISTRIBUTIONS; DPS (SEE ALSO: DEPARTMENT OF PUBLIC SAFETY); EXEMPTION; FORENSIC; FULL-SERVICE CRIME LABORATORY; FULL-SERVICE CRIME LABS; FUND; FUNDING; INTERNATIONAL LABORATORY ACCREDITATION; OFFICE OF ECONOMIC OPPORTUNITY; PURPOSE (H); PURPOSES; STATE GOVERNMENT - TITLE 41,SB1055 - (NOW: funding; full-service crime labs),https://apps.azleg.gov/api/Bill/?billNumber=SB1055&sessionId=127
SB1056,127,2023_2024_First_Regular,78633,information return of sales; report,,GOWAN,,ESCROW AGENTS; INFORMATION RETURN OF SALES; NONRESIDENT REAL ESTATE TRANSACTIONS; REPORT; REPORTS; TAXATION OF INCOME - TITLE 43; TAXPAYER RETURNS,SB1056 - information return of sales; report,https://apps.azleg.gov/api/Bill/?billNumber=SB1056&sessionId=127
SB1057,127,2023_2024_First_Regular,78637,Alpine horse herd; management,,KAVANAGH,,AGRICULTURE - TITLE 3; ALPINE HORSE HERD; AUTHORIZATION; CLASSIFICATION; DEFINITIONS; HORSE; MANAGEMENT; NECESSARY INTERACTION; VIOLATION,SB1057 - Alpine horse herd; management,https://apps.azleg.gov/api/Bill/?billNumber=SB1057&sessionId=127
SB1058,127,2023_2024_First_Regular,78638,law enforcement; polygraph examinations; prohibition,,KAVANAGH,,APPLICANT; DELAYED REPEAL; DESTRUCTION OF DATA; EXCEPTION; LAW ENFORCEMENT; LAW ENFORCEMENT OFFICER; LAW ENFORCEMENT OFFICERS; POLYGRAPH EXAMINATIONS; PROHIBITION; PUBLIC OFFICERS AND EMPLOYEES - TITLE 38; VOLUNTEER,SB1058 - law enforcement; polygraph examinations; prohibition,https://apps.azleg.gov/api/Bill/?billNumber=SB1058&sessionId=127
SB1059,127,2023_2024_First_Regular,78639,animal shelter; definition,,KAVANAGH,,ADOPT; ANIMAL SHELTER; COUNTIES - TITLE 11; DEFINITION; DEFINITIONS; HANDLING OF ANIMALS; IMPOUNDED CATS; IMPOUNDED DOGS; ORGANIZATION; RESCUE; RESCUE ORGANIZATION (H); SELL; STERILIZATION,SB1059 - (NOW: animal shelter; rescue organization; definition),https://apps.azleg.gov/api/Bill/?billNumber=SB1059&sessionId=127
SB1060,127,2023_2024_First_Regular,78640,animal owners; definition,,KAVANAGH,,ANIMAL CONTROL; ANIMAL OWNERS; COUNTIES - TITLE 11; DEFINITION; DEFINITIONS,SB1060 - animal owners; definition,https://apps.azleg.gov/api/Bill/?billNumber=SB1060&sessionId=127
SB1061,127,2023_2024_First_Regular,78641,public officials; home addresses; confidentiality,,SHOPE,,"ADOT (SEE ALSO: DEPARTMENT OF TRANSPORTATION); CLASSIFICATION; CONFIDENTIALITY; CONGRESS; COUNTIES - TITLE 11; COUNTY ASSESSOR; COUNTY RECORDER; COUNTY TREASURER; CRIMINAL CODE - TITLE 13; DEFINITIONS; DEPARTMENT OF TRANSPORTATION (ADOT); ELECTION OFFICERS (H); ELECTIONS AND ELECTORS - TITLE 16; EXCEPTION; HOME ADDRESSES; INTERNET; LEGISLATURE; PERSONAL INFORMATION; PUBLIC OFFICIAL; PUBLIC OFFICIALS; PUBLIC RECORDS, PRINTING AND NOTICES - TITLE 39; RECORDS CONFIDENTIALITY; REDACTION; RELEASE OF INFORMATION; STATEWIDE OFFICE; TRANSPORTATION - TITLE 28; VOTER REGISTRATION",SB1061 - public officials; home addresses; confidentiality,https://apps.azleg.gov/api/Bill/?billNumber=SB1061&sessionId=127
SB1062,127,2023_2024_First_Regular,78642,minors; capacity to consent; shelter,,SHOPE,,CAPACITY TO CONSENT; CONSENT; CONTRACTS; DEFINITION; EMANCIPATED MINOR; HOMELESS MINOR; INDEPENDENT UNACCOMPANIED HOMELESS MINOR; LEGISLATIVE FINDINGS; MINORS; SHELTER; TRADE AND COMMERCE - TITLE 44; UNACCOMPANIED MINOR,SB1062 - minors; capacity to consent; shelter,https://apps.azleg.gov/api/Bill/?billNumber=SB1062&sessionId=127
SB1063,127,2023_2024_First_Regular,78643,food; municipal tax; exemption...,,BORRELLI,BENNETT; CARROLL; FARNSWORTH; GOWAN; HOFFMAN; KAISER; KAVANAGH; KERN; KERR; MESNARD; PETERSEN; ROGERS; SHAMP; SHOPE; WADSACK; BIASIUCCI; MONTENEGRO,APPLICABILITY; EFFECTIVE DATE; EXEMPTION; FOOD; MUNICIPAL TAX; MUNICIPAL TRANSACTION PRIVILEGE TAX; TAXATION - TITLE 42; TPT (SEE ALSO: TRANSACTION PRIVILEGE TAX); TRANSACTION PRIVILEGE TAX (TPT),SB1063 - food; municipal tax; exemption...,https://apps.azleg.gov/api/Bill/?billNumber=SB1063&sessionId=127
SB1064,127,2023_2024_First_Regular,78644,sentencing enhancements; drug-free zones,,KAVANAGH,,CLASSIFICATION; CRIMINAL CODE - TITLE 13; DANGEROUS DRUGS; DEFINITIONS; DRUG-FREE SCHOOL ZONE; DRUG-FREE ZONES; MARIJUANA; NARCOTIC DRUGS; PEYOTE; SENTENCING; SENTENCING ENHANCEMENTS,SB1064 - sentencing enhancements; drug-free zones,https://apps.azleg.gov/api/Bill/?billNumber=SB1064&sessionId=127
SB1065,127,2023_2024_First_Regular,78649,appropriation; widening; I-10,,SHOPE,BORRELLI; TERÁN,2023-2024; ADOT (SEE ALSO: DEPARTMENT OF TRANSPORTATION); APPROPRIATING MONIES; APPROPRIATION; DEPARTMENT OF TRANSPORTATION (ADOT); EXEMPTION; I-10; INTERSTATE 10; WIDENING,SB1065 - appropriation; widening; I-10,https://apps.azleg.gov/api/Bill/?billNumber=SB1065&sessionId=127
SB1066,127,2023_2024_First_Regular,78660,election mailings; third-party disclosures,,KAVANAGH,,DISCLOSURE; ELECTION MAILINGS; ELECTIONS AND ELECTORS - TITLE 16; REGISTRATION OFFICERS; REGISTRATION OFFICERS AND PROCEDURES (H); REGISTRATION PROCEDURES; THIRD PARTY DISCLOSURES; THIRD-PARTY DISCLOSURES (H),SB1066 - election mailings; third-party disclosures,https://apps.azleg.gov/api/Bill/?billNumber=SB1066&sessionId=127
SB1067,127,2023_2024_First_Regular,78661,study committee; animal control standards,,KAVANAGH,,ANIMAL CONTROL; ANIMAL CONTROL STANDARDS (H); DELAYED REPEAL; DUTIES; JOINT STUDY COMMITTEE ON STATEWIDE ANIMAL CONTROL STANDARDS; MEMBERSHIP; REPORT; STANDARDS; STUDY COMMITTEE,SB1067 - study committee; animal control standards,https://apps.azleg.gov/api/Bill/?billNumber=SB1067&sessionId=127
SB1068,127,2023_2024_First_Regular,78662,election board workers; political party,,KAVANAGH,,AMBULANCE SERVICES (H); APPOINTMENT; BILLING (H); EFFECTIVE DATE (H); ELECTED BOARD; ELECTION BOARD WORKERS; ELECTIONS AND ELECTORS - TITLE 16; EMERGENCY TREATMENT (H); IMMUNITY (H); POLICE DOGS (H); POLICIES AND PROCEDURES (H); POLITICAL PARTIES; POLITICAL PARTY; PROFESSIONS AND OCCUPATIONS - TITLE 32 (H); PUBLIC HEALTH AND SAFETY - TITLE 36 (H); QUALIFICATION; QUALIFICATIONS,SB1068 - (NOW: police dogs; emergency treatment),https://apps.azleg.gov/api/Bill/?billNumber=SB1068&sessionId=127
