bill_number,session_num,session,bill_id_num,title,intro_sponsor,primary_sponsors,cosponsors,keywords,summary,bill_json
SB1384,127,2023_2024_First_Regular,79038,homeowners' associations; annual meeting,,KAVANAGH,,APPLICABILITY; BALLOT REQUIREMENTS; CONDOMINIUMS AND PLANNED COMMUNITIES; DEFINITION; DIRECTORS' ELECTIONS; EXCEPTIONS; HOA (SEE ALSO: HOMEOWNERS' ASSOCIATION); HOMEOWNERS' ASSOCIATIONS (HOA); NOTICE; OPEN MEETINGS; POLICY STATEMENT; PROPERTY - TITLE 33; PROXIES; VOTING,SB1384 - homeowners' associations; annual meeting,https://apps.azleg.gov/api/Bill/?billNumber=SB1384&sessionId=127
SB1385,127,2023_2024_First_Regular,79039,student discipline profiles; school achievement,,KAVANAGH,,ADE (SEE ALSO: DEPARTMENT OF EDUCATION); ANNUAL ACHIEVEMENT PROFILES; APPEALS PROCESS; CHARTER SCHOOL ACCOUNTABILITY; CLASSIFICATION; DEFINITIONS; DEPARTMENT OF EDUCATION (ADE); EDUCATION - TITLE 15; FAILING SCHOOLS TUTORING FUND; LETTER GRADE SYSTEM; PROFILES; SCHOOL ACCOUNTABILITY; SCHOOL ACHIEVEMENT; SCHOOL DISTRICT ACCOUNTABILITY; STUDENT DISCIPLINE PROFILES,SB1385 - student discipline profiles; school achievement,https://apps.azleg.gov/api/Bill/?billNumber=SB1385&sessionId=127
SB1386,127,2023_2024_First_Regular,79040,occupational licensure; fee waiver; appropriation,,KAVANAGH,,APPROPRIATING MONIES; APPROPRIATION; DEFINITIONS; DELAYED REPEAL; EXEMPTION; FEE WAIVER; NOTIFICATION; OCCUPATIONAL LICENSURE; OCCUPATIONAL LICENSURE FEE WAIVER FUND; OCCUPATIONS; PROFESSIONS; PROFESSIONS AND OCCUPATIONS; PROFESSIONS AND OCCUPATIONS - TITLE 32; PURPOSE; REVERSION,SB1386 - occupational licensure; fee waiver; appropriation,https://apps.azleg.gov/api/Bill/?billNumber=SB1386&sessionId=127
SB1387,127,2023_2024_First_Regular,79041,homeowner's associations; board duties; indemnification,,KAVANAGH,,ANNUAL AUDIT; APPLICABILITY; BOARD DUTIES; BOARD OF DIRECTORS; BOARD OF DIRECTORS AND OFFICERS; CLARIFYING CHANGES; CONDOMINIUMS AND PLANNED COMMUNITIES; CONFLICT; CONTRACTS; DEFINITIONS; DUTIES; DUTY TO MEMBERS; HOA (SEE ALSO: HOMEOWNER'S ASSOCIATION); HOMEOWNER'S ASSOCIATIONS (HOA); INDEMNIFICATION; LEASES OF DECLARANT; LEGISLATIVE INTENT; LIMITATIONS; POWERS; PROPERTY - TITLE 33; REMOVAL; TERMINATION OF CONTRACTS; TERMINATION OF LEASES,SB1387 - homeowner's associations; board duties; indemnification,https://apps.azleg.gov/api/Bill/?billNumber=SB1387&sessionId=127
SB1388,127,2023_2024_First_Regular,79043,transportation funding; pilot program; appropriation,,BENNETT,,ADE (SEE ALSO: DEPARTMENT OF EDUCATION); APPROPRIATING MONIES; APPROPRIATION; DELAYED REPEAL; DEPARTMENT OF EDUCATION (ADE); ESTABLISHING; EXEMPTION; PILOT PROGRAM; TRANSPORTATION FUNDING; TRANSPORTATION FUNDING PILOT PROGRAM,SB1388 - transportation funding; pilot program; appropriation,https://apps.azleg.gov/api/Bill/?billNumber=SB1388&sessionId=127
SB1389,127,2023_2024_First_Regular,79044,ballots; pollbooks; instructions; tabulating; storage,,BENNETT,,ACTIVE MANAGEMENT AREA; ADDITIONAL PROCEDURES; BALLOTS; CIVIL PENALTIES; CLASSIFICATION; CONTENTS OF BALLOT; CUSTODY OF BALLOTS; DELIVERY DEADLINE; DISPOSITION; EARLY BALLOTING; ELECTIONS; ELECTIONS AND ELECTORS - TITLE 16; ELECTRONIC POLLBOOKS; FORM; INACTIVE ELECTORS; INSTRUCTIONS; LOCAL INITIATION; OFFICIAL RETURNS; POLLBOOKS; PRECINCT REGISTERS; PROCEDURE; PROCEDURES; QUALIFIED ELECTORS; RECORDER'S CERTIFICATE; REQUEST FOR BALLOT; SATELLITE LOCATIONS; STORAGE; TABULATING; VERIFIED BALLOT; VIOLATION,SB1389 - ballots; pollbooks; instructions; tabulating; storage,https://apps.azleg.gov/api/Bill/?billNumber=SB1389&sessionId=127
SB1390,127,2023_2024_First_Regular,79047,water infrastructure finance authority; amendments,,KERR,,AMENDMENT (H); AMENDMENTS; AUTHORITY; CONDUCT OF OFFICE; DEFINITION; EMERGENCY; EMERGENCY CLAUSE; EXEMPTION FROM LIABILITY; FEDERAL WATER PROGRAMS COMMITTEE; FINANCE AUTHORITY; FINGERPRINTING; INITIAL TERMS; LAWS 2022; LONG-TERM WATER AUGMENTATION FUND; MEMBERSHIP; POWERS AND DUTIES; PROCEDURES; RECOMMENDATIONS; REQUIREMENTS; TERMS; THE ENVIRONMENT - TITLE 49; WATER CONSERVATION GRANT FUND; WATER INFRASTRUCTURE; WATER INFRASTRUCTURE FINANCE AUTHORITY (H); WATER INFRASTRUCTURE FINANCE AUTHORITY (WIFA); WATERS - TITLE 45,SB1390 - water infrastructure finance authority; amendments,https://apps.azleg.gov/api/Bill/?billNumber=SB1390&sessionId=127
SB1391,127,2023_2024_First_Regular,79048,department of environmental quality; counsel,,KERR,,ADEQ (SEE ALSO: DEPARTMENT OF ENVIRONMENTAL QUALITY); ATTORNEY GENERAL (H); COMPROMISE AND SETTLEMENT MONIES; COUNSEL; DEPARTMENT EMPLOYEES; DEPARTMENT OF ENVIRONMENTAL QUALITY (ADEQ); EXEMPTIONS; LEGAL COUNSEL; POWERS AND DUTIES OF ATTORNEY GENERAL; RESTRICTIONS; STATE GOVERNMENT - TITLE 41; THE ENVIRONMENT - TITLE 49,SB1391 - department of environmental quality; counsel,https://apps.azleg.gov/api/Bill/?billNumber=SB1391&sessionId=127
SB1392,127,2023_2024_First_Regular,79049,appropriation; state park; Verde River,,KERR,,APPROPRIATION; ARIZONA STATE PARKS BOARD; EXEMPTION; STATE PARKS; VERDE RIVER,SB1392 - appropriation; state park; Verde River,https://apps.azleg.gov/api/Bill/?billNumber=SB1392&sessionId=127
SB1393,127,2023_2024_First_Regular,79050,off-highway vehicle user fees,,KERR,,DEFINITION; EXCEPTION; INDICIA; OFF-HIGHWAY VEHICLE USER FEE; OFF-HIGHWAY VEHICLES; REGISTRATION; STATE TRUST LAND RECREATIONAL PERMIT; TRANSPORTATION - TITLE 28,SB1393 - off-highway vehicle user fees,https://apps.azleg.gov/api/Bill/?billNumber=SB1393&sessionId=127
SB1394,127,2023_2024_First_Regular,79051,veterinarian board membership,,KAVANAGH,,APPOINTMENT; BOARD MEMBERS; COMPENSATION; COMPLAINTS; OFFICERS; PROFESSIONS AND OCCUPATIONS - TITLE 32; QUALIFICATIONS; RETENTION OF MEMBERS; TERMS; VETERINARIAN BOARD MEMBERSHIP; VETERINARIANS,SB1394 - veterinarian board membership,https://apps.azleg.gov/api/Bill/?billNumber=SB1394&sessionId=127
SB1395,127,2023_2024_First_Regular,79052,indigenous peoples; civil rights holidays,,HATATHLIE,DIAZ; FERNANDEZ; GONZALES; HERNANDEZ; TERÁN,CIVIL RIGHTS HOLIDAYS; GENERAL PROVISIONS - TITLE 1; HOLIDAYS; HOLIDAYS ENUMERATED; INDIGENOUS PEOPLES,SB1395 - indigenous peoples; civil rights holidays,https://apps.azleg.gov/api/Bill/?billNumber=SB1395&sessionId=127
SB1396,127,2023_2024_First_Regular,79053,appropriation; Diné college multipurpose center,,HATATHLIE,DIAZ; FERNANDEZ; GABALDÓN; GONZALES; MENDEZ; TERÁN; PESHLAKAI; TSOSIE,APPROPRIATION; DINE COLLEGE MULTIPURPOSE CENTER; GOVERNOR'S OFFICE OF TRIBAL RELATIONS,SB1396 - appropriation; Diné college multipurpose center,https://apps.azleg.gov/api/Bill/?billNumber=SB1396&sessionId=127
SB1397,127,2023_2024_First_Regular,79054,appropriation; flooding and water control,,HATATHLIE,DIAZ; EPSTEIN; FERNANDEZ; GONZALES; MIRANDA; TERÁN,APPROPRIATION; EXEMPTIONS; FLOODING AND WATER CONTROL; GOVERNOR; GOVERNOR'S OFFICE ON TRIBAL RELATIONS,SB1397 - appropriation; flooding and water control,https://apps.azleg.gov/api/Bill/?billNumber=SB1397&sessionId=127
SB1398,127,2023_2024_First_Regular,79055,DES; waiver of overpayment,,HATATHLIE,DIAZ; FERNANDEZ; GONZALES; HERNANDEZ; TERÁN,CHANGE IN STATUS; CLASSIFICATION; DEPARTMENT OF ECONOMIC SECURITY (DES); DES (SEE ALSO: DEPARTMENT OF ECONOMIC SECURITY); DUTY; EXCESS ASSISTANCE PAID; PUBLIC ASSISTANCE; VIOLATION; WAIVER OF OVERPAYMENT; WELFARE - TITLE 46,SB1398 - DES; waiver of overpayment,https://apps.azleg.gov/api/Bill/?billNumber=SB1398&sessionId=127
SB1399,127,2023_2024_First_Regular,79056,appropriation; coal plant closure; transition,,HATATHLIE,PESHLAKAI,ADOA (SEE ALSO: DEPARTMENT OF ADMINISTRATION); APPROPRIATION; COAL PLANT CLOSURE; DEPARTMENT OF ADMINISTRATION (ADOA); EXEMPTION; MONIES; TRANSITION,SB1399 - appropriation; coal plant closure; transition,https://apps.azleg.gov/api/Bill/?billNumber=SB1399&sessionId=127
SB1400,127,2023_2024_First_Regular,79060,technical correction; child hearing programs,,WADSACK,,CALCULATION; CHILD HEARING PROGRAMS; COMMUNITY COLLEGES; CREDIT COURSES; DEFINITION; EDUCATION - TITLE 15; ENROLLMENT; FULL-TIME EQUIVALENT STUDENT; NONCREDIT COURSES; NONCREDIT WORKFORCE TRAINING; PUBLIC HEALTH; PUBLIC HEALTH AND SAFETY - TITLE 36; REPORT; RULES; STRIKE EVERYTHING AMENDMENT; TECHNICAL CORRECTION,SB1400 - (NOW: community colleges; noncredit workforce training),https://apps.azleg.gov/api/Bill/?billNumber=SB1400&sessionId=127
SB1401,127,2023_2024_First_Regular,79061,technical correction; malpractice claim review,,WADSACK,,ANIMAL ACUPUNCTURE; CERTIFICATION; DEFINITION; DEFINITIONS; EXCEPTIONS; MALPRACTICE CLAIM REVIEW; MALPRACTICE CLAIMS; PROFESSIONS AND OCCUPATIONS - TITLE 32; REQUIREMENTS; STRIKE EVERYTHING AMENDMENT; TECHNICAL CORRECTION; VETERINARY MEDICINE,SB1401 - (NOW: animal acupuncture; certification; requirements),https://apps.azleg.gov/api/Bill/?billNumber=SB1401&sessionId=127
SB1402,127,2023_2024_First_Regular,79062,child care; licensing; technical correction,,WADSACK,,ADMISSIONS; APPLICANTS; ARIZONA STATE SCHOOLS FOR THE DEAF AND THE BLIND (ASDB); ASDB (SEE ALSO: ARIZONA STATE SCHOOLS FOR THE DEAF AND BLIND); AUTHORITY FOR ENROLLMENT; CHILD CARE; CHILD CARE PROGRAMS; CHILDREN UNDER THREE YEARS OF AGE; CONTROLLING PERSONS; DEFINITION; DEFINITIONS; EDUCATION; EDUCATION - TITLE 15; INSTRUCTION OF PUPILS; LICENSEES; LICENSING; PERSONS ENTITLED TO EDUCATION; PROVISION OF SERVICES; PUBLIC HEALTH AND SAFETY - TITLE 36; REQUIREMENTS; RESIDENCY; STRIKE EVERYTHING AMENDMENT; TECHNICAL CORRECTION,SB1402 - (NOW: ASDB; children with disabilities),https://apps.azleg.gov/api/Bill/?billNumber=SB1402&sessionId=127
SB1403,127,2023_2024_First_Regular,79063,estates; technical correction,,WADSACK,,"DECEDENT'S ESTATE; DEMAND FOR NOTICE OF ORDER; ESTATES; FILING; TECHNICAL CORRECTION; TRUSTS, ESTATES AND PROTECTIVE PROCEEDINGS - TITLE 14; VENUE FOR PROBATE AND ADMINISTRATION",SB1403 - estates; technical correction,https://apps.azleg.gov/api/Bill/?billNumber=SB1403&sessionId=127
SB1404,127,2023_2024_First_Regular,79064,ALTCS insurance; exemption; technical correction,,WADSACK,,ALTCS (SEE ALSO: ARIZONA LONG-TERM CARE SYSTEM); ALTCS INSURANCE; ARIZONA LONG-TERM CARE SYSTEM (ALTCS); EXEMPTION; EXEMPTION FROM INSURANCE LAW; PUBLIC HEALTH AND SAFETY - TITLE 36; TECHNICAL CORRECTION,SB1404 - ALTCS insurance; exemption; technical correction,https://apps.azleg.gov/api/Bill/?billNumber=SB1404&sessionId=127
SB1405,127,2023_2024_First_Regular,79065,home health agencies; technical correction,,WADSACK,,DEFINITION; HEALTH CARE INSTITUTIONS; HOME HEALTH AGENCIES; LICENSURE; PUBLIC HEALTH AND SAFETY - TITLE 36; TECHNICAL CORRECTION,SB1405 - home health agencies; technical correction,https://apps.azleg.gov/api/Bill/?billNumber=SB1405&sessionId=127
SB1406,127,2023_2024_First_Regular,79066,public health; technical correction,,WADSACK,,CLASSIFICATION; COMMON DRINKING CUP; COMMON TOWEL; HEALTH MENACES; PROVIDED IN PUBLIC PLACE; PUBLIC HEALTH; PUBLIC HEALTH AND SAFETY - TITLE 36; TECHNICAL CORRECTION,SB1406 - public health; technical correction,https://apps.azleg.gov/api/Bill/?billNumber=SB1406&sessionId=127
SB1407,127,2023_2024_First_Regular,79067,health services; monitoring; technical correction,,WADSACK,,ALCOHOL AND DRUG ABUSE; DEPARTMENT OF HEALTH SERVICES (DHS); DHS (SEE ALSO: DEPARTMENT OF HEALTH SERVICES); EDUCATION; HEALTH SERVICES; MONITORING; PUBLIC HEALTH AND SAFETY - TITLE 36; SCREENING; TECHNICAL CORRECTION; TREATMENT PROGRAMS,SB1407 - health services; monitoring; technical correction,https://apps.azleg.gov/api/Bill/?billNumber=SB1407&sessionId=127
SB1408,127,2023_2024_First_Regular,79068,human smuggling; electronic applications,,WADSACK,,CLASSIFICATION; CRIMINAL CODE - TITLE 13; DEFINITIONS; ELECTRONIC APPLICATIONS; HUMAN SMUGGLING; SMUGGLING; USING ELECTRONIC DEVICE TO SMUGGLE,SB1408 - (NOW: electronic applications; human smuggling),https://apps.azleg.gov/api/Bill/?billNumber=SB1408&sessionId=127
SB1409,127,2023_2024_First_Regular,79069,DCS; abuse; neglect; reporter identity,,WADSACK,JONES,ABUSE; CHILD SAFETY - TITLE 8; CHILD WELFARE; CLASSIFICATION; CONTINUING EDUCATION; CRIMINAL CODE - TITLE 13; DCS (SEE ALSO: DEPARTMENT OF CHILD SAFETY); DEFINITIONS; DENIAL; DENIAL OF MEDICAL CARE; DEPARTMENT OF CHILD SAFETY (DCS); DEPRIVATION; DUTY TO INFORM; DUTY TO REPORT; EXCEPTION; LIMITATION OF AUTHORITY; MEDICAL RECORDS; MINORS; NEGLECT; NOURISHMENT; PHYSICAL INJURY; REPORTER IDENTITY; SURGICAL CARE; VIOLATION,SB1409 - DCS; abuse; neglect; reporter identity,https://apps.azleg.gov/api/Bill/?billNumber=SB1409&sessionId=127
SB1410,127,2023_2024_First_Regular,79070,violations of state law; schools,,WADSACK,HEAP; JONES,ANNUAL REPORT (H); ATTORNEY GENERAL; ATTORNEY GENERAL INVESTIGATION; CITIES; CLASSROOM SITE FUND MONIES; COUNTIES; EDUCATION - TITLE 15 (H); PARENT COMPLAINTS (H); PARENTS RIGHTS (H); REPEAL; REPORT; REPORTING (H); SCHOOL DISTRICTS; SCHOOLS; STATE GOVERNMENT - TITLE 41; STATE SHARED REVENUES; STUDENTS RIGHTS (H); TOWNS; VIOLATIONS OF STATE LAW; WITHHOLDING,SB1410 - (NOW: school districts; parent complaints; reporting),https://apps.azleg.gov/api/Bill/?billNumber=SB1410&sessionId=127
SB1411,127,2023_2024_First_Regular,79071,developmental disabilities; parents; guardianship,,WADSACK,JONES,"APPOINTMENT (H); AUTOMATIC APPOINTMENT; CHILD PREFERENCE; DEPARTMENT OF ECONOMIC SECURITY (DES); DES (SEE ALSO: DEPARTMENT OF ECONOMIC SECURITY); DEVELOPMENTAL DISABILITIES; GUARDIANSHIP; PARENTS; PRIMARY CAREGIVER; TRUSTS, ESTATES AND PROTECTIVE PROCEEDINGS - TITLE 14",SB1411 - developmental disabilities; parents; guardianship,https://apps.azleg.gov/api/Bill/?billNumber=SB1411&sessionId=127
SB1412,127,2023_2024_First_Regular,79072,motorcycle lane splitting repeal,,WADSACK,JONES,DRIVING; EXCEPTIONS; LANED ROADWAY; MOTORCYCLE LANE SPLITTING REPEAL; OPERATION OF MOTORCYCLE; OPERATION OF MOTORCYCLES; ROADWAYS LANED FOR TRAFFIC; TRANSPORTATION - TITLE 28,SB1412 - motorcycle lane splitting repeal,https://apps.azleg.gov/api/Bill/?billNumber=SB1412&sessionId=127
SB1413,127,2023_2024_First_Regular,79073,homeless encampment; removal,,WADSACK,JONES,CITIES AND TOWNS - TITLE 9; COUNTIES - TITLE 11; DEFINITION; HOMELESS ENCAMPMENT; LOCAL REGULATIONS; REMOVAL,SB1413 - homeless encampment; removal,https://apps.azleg.gov/api/Bill/?billNumber=SB1413&sessionId=127
SB1414,127,2023_2024_First_Regular,79074,self-donation; blood; patient notification,,WADSACK,JONES,BLOOD; DEFINITION; HEALTH PROFESSIONALS; PATIENT NOTIFICATION; PATIENT NOTIFICATION BEFORE SURGERY; PHYSICIANS; PROFESSIONS AND OCCUPATIONS - TITLE 32; SELF-DONATION; SELF-DONATION OF BLOOD,SB1414 - self-donation; blood; patient notification,https://apps.azleg.gov/api/Bill/?billNumber=SB1414&sessionId=127
SB1415,127,2023_2024_First_Regular,79075,parents' rights; violation; felony,,WADSACK,,BURDEN OF PROOF; CLASSIFICATION; DEFINITION; FELONY; GENERAL PROVISIONS - TITLE 1; GOVERNMENTAL INTERFERENCE RESTRICTED; PARENTS' BILL OF RIGHTS; PARENTS' RIGHTS; PARENTS' RIGHTS PROTECTED; VIOLATION,SB1415 - parents' rights; violation; felony,https://apps.azleg.gov/api/Bill/?billNumber=SB1415&sessionId=127
SB1416,127,2023_2024_First_Regular,79076,county excise tax; rate reduction,,WADSACK,,APPLICABILITY; COUNTY EXCISE TAX; COUNTY EXCISE TAXES; COUNTY TRANSPORTATION EXCISE TAX; RATE REDUCTION; TAXATION - TITLE 42,SB1416 - county excise tax; rate reduction,https://apps.azleg.gov/api/Bill/?billNumber=SB1416&sessionId=127
SB1417,127,2023_2024_First_Regular,79077,students with disabilities; diaper changes,,WADSACK,,DIAPER CHANGES; EDUCATION (H); EDUCATION - TITLE 15; SPECIAL EDUCATION FOR EXCEPTIONAL CHILDREN; STUDENTS WITH DISABILITIES,SB1417 - students with disabilities; diaper changes,https://apps.azleg.gov/api/Bill/?billNumber=SB1417&sessionId=127
SB1418,127,2023_2024_First_Regular,79080,attorneys; court professionals; discipline; juries,,WADSACK,JONES,ADVERSE ACTIONS; ATTORNEYS; CIVIL ACTION; COMPLAINTS; COURT PROFESSIONALS; COURTS AND CIVIL PROCEEDINGS - TITLE 12; DEFINITIONS; DISCIPLINE; FIRST AMENDMENT PROTECTION ACT; GOVERNMENT; HEARINGS; JURIES; JURISDICTION; LEGISLATIVE FINDINGS; LEGISLATIVE INTENT; LICENSED PROFESSIONALS; PERJURY; POLITICAL BELIEFS; PROFESSIONS AND OCCUPATIONS - TITLE 32; PROHIBITED ACTIONS; PROHIBITED ADVERSE ACTIONS (H); PROHIBITIONS; RELIGIOUS; RIGHT TO JURY HEARINGS; SHORT TITLE (H); STRIKE EVERYTHING AMENDMENT; SUPREME COURT,SB1418 - (NOW: religious; political beliefs; adverse actions),https://apps.azleg.gov/api/Bill/?billNumber=SB1418&sessionId=127
SB1419,127,2023_2024_First_Regular,79078,court opinions; searchable database,,WADSACK,JONES,COURT OPINIONS (H); COURTS AND CIVIL PROCEEDINGS - TITLE 12; PUBLICATION OF OPINIONS; SEARCHABLE DATABASE; SEARCHABLE ONLINE DATABASE (H); SUPREME COURT; WEBSITE LINK,SB1419 - court opinions; searchable database,https://apps.azleg.gov/api/Bill/?billNumber=SB1419&sessionId=127
SB1420,127,2023_2024_First_Regular,79079,foster homes; inactive licenses,,WADSACK,JONES,CHILD SAFETY - TITLE 8; CHILD WELFARE AND PLACEMENT; FOSTER HOMES; INACTIVE LICENSES,SB1420 - foster homes; inactive licenses,https://apps.azleg.gov/api/Bill/?billNumber=SB1420&sessionId=127
SB1421,127,2023_2024_First_Regular,79081,developmental disabilities; Prader-Willi syndrome.,,WADSACK,HEAP; JONES,DEFINITIONS; DEVELOPMENTAL DISABILITIES; PRADER-WILLI SYNDROME; PUBLIC HEALTH AND SAFETY - TITLE 36,SB1421 - developmental disabilities; Prader-Willi syndrome.,https://apps.azleg.gov/api/Bill/?billNumber=SB1421&sessionId=127
SB1422,127,2023_2024_First_Regular,79082,voting; elections; tally; prohibition..,,WADSACK,,ELECTIONS; ELECTIONS AND ELECTORS - TITLE 16; PROHIBITED VOTING METHODS; PROHIBITION; TALLY; VOTING,SB1422 - voting; elections; tally; prohibition..,https://apps.azleg.gov/api/Bill/?billNumber=SB1422&sessionId=127
SB1423,127,2023_2024_First_Regular,79083,DCS; team decision meeting; prohibition,,WADSACK,JONES,ABUSE ALLEGATION; CHILD REMOVAL; CHILD SAFETY - TITLE 8; CHILD WELFARE; DCS (SEE ALSO: DEPARTMENT OF CHILD SAFETY); DEFINITION; DEPARTMENT OF CHILD SAFETY (DCS); LEGISLATIVE FINDINGS; OVERSIGHT HEARING; PEER REVIEW TEAM; PROHIBITION; RULES; TEAM DECISION MEETING,SB1423 - DCS; team decision meeting; prohibition,https://apps.azleg.gov/api/Bill/?billNumber=SB1423&sessionId=127
SB1424,127,2023_2024_First_Regular,79085,vaccines; masks; requirements; prohibition,,WADSACK,JONES; MCGARR,BUSINESSES; DEFINITION; GOVERNMENTAL ENTITIES; MASKS; PROHIBITION; PUBLIC HEALTH; PUBLIC HEALTH AND SAFETY - TITLE 36; REQUIREMENTS; VACCINATIONS; VACCINES,SB1424 - vaccines; masks; requirements; prohibition,https://apps.azleg.gov/api/Bill/?billNumber=SB1424&sessionId=127
SB1425,127,2023_2024_First_Regular,79086,high schools; graduation requirements,,WADSACK,JONES,ACADEMIC CREDIT; CIVICS INSTRUCTION; COMMUNITY COLLEGE; EDUCATION - TITLE 15; GRADUATION; GRADUATION REQUIREMENTS; HIGH SCHOOLS; INSTRUCTION; PROHIBITED COURSES; REPORT; REQUIREMENTS; SCHOOL CURRICULA; SCHOOLS (H),SB1425 - (NOW: instruction; schools; graduation requirements),https://apps.azleg.gov/api/Bill/?billNumber=SB1425&sessionId=127
SB1426,127,2023_2024_First_Regular,79089,right to redeem; lien; sale,,WADSACK,,CLAIMANT; DEED FORM; DISPOSITION OF PROCEEDS; EFFECT; EMERGENCY; EMERGENCY CLAUSE; EQUITY THEFT PREVENTION ACT; FORECLOSURE OF THE RIGHT TO REDEEM; HEADING CHANGE; IDENTIFIERS; JUDGMENT; LIEN; NOTICE OF SALE; PARTIAL PAYMENT REFUND; RIGHT TO REDEEM; SALE; TAXATION - TITLE 42; TIME LIEN,SB1426 - right to redeem; lien; sale,https://apps.azleg.gov/api/Bill/?billNumber=SB1426&sessionId=127
SB1427,127,2023_2024_First_Regular,79091,carrying of firearms; exceptions,,WADSACK,JONES,ALCOHOLIC BEVERAGES - TITLE 4; AMUSEMENTS AND SPORTS - TITLE 5; APPLICABILITY; APPLICATION; CARRYING OF FIREARMS; CIVIL PENALTY; CLASSIFICATION; CONCEALED WEAPON; CRIMINAL CODE - TITLE 13; DEFINITION; EXCEPTIONS; FINE; FIREARMS; PERMIT; PERMIT TO CARRY; QUALIFICATION; REPEAL; REPORT; TRANSPORTATION - TITLE 28; UNLAWFUL ACTS; VIOLATION,SB1427 - carrying of firearms; exceptions,https://apps.azleg.gov/api/Bill/?billNumber=SB1427&sessionId=127
SB1428,127,2023_2024_First_Regular,79084,political subdivisions; gun shows; preemption,,WADSACK,HEAP; JONES,CAUSE OF ACTION; CIVIL PENALTY; CLASSIFICATIONS; CRIMINAL CODE - TITLE 13; DEFINITION; FIREARMS; GUN SHOWS; INJUNCTION; POLITICAL SUBDIVISIONS; PREEMPTION; STATE PREEMPTION; VIOLATION,SB1428 - political subdivisions; gun shows; preemption,https://apps.azleg.gov/api/Bill/?billNumber=SB1428&sessionId=127
SB1429,127,2023_2024_First_Regular,79087,civil action; preliminary hearing,,WADSACK,JONES,CIVIL ACTION; CIVIL ACTIONS; CIVIL PROCEEDINGS; COURTS AND CIVIL PROCEEDINGS - TITLE 12; DETERMINATION; PRELIMINARY HEARING,SB1429 - civil action; preliminary hearing,https://apps.azleg.gov/api/Bill/?billNumber=SB1429&sessionId=127
SB1430,127,2023_2024_First_Regular,79088,DCS; federal benefits; dependent children,,WADSACK,JONES,ACCOUNTING; ANNUAL REVIEW; APPLICATION; CHILD SAFETY - TITLE 8; CHILD WELFARE; CHILDREN - TITLE 8 (H); DCS (SEE ALSO: DEPARTMENT OF CHILD SAFETY); DEPARTMENT OF CHILD SAFETY (DCS); DEPENDENT CHILDREN; FEDERAL BENEFITS; NOTICE; POWERS AND DUTIES; PROHIBITION,SB1430 - DCS; federal benefits; dependent children,https://apps.azleg.gov/api/Bill/?billNumber=SB1430&sessionId=127
SB1431,127,2023_2024_First_Regular,79090,right to jury; parent-child relationship,,WADSACK,JONES,APPLICABILITY; CHILD SAFETY - TITLE 8; CHILDREN - TITLE 8 (H); EFFECTIVE DATE; JURY DEMAND AND HEARING; PARENT-CHILD RELATIONSHIP; RIGHT TO A JURY (H); RIGHT TO JURY,SB1431 - right to jury; parent-child relationship,https://apps.azleg.gov/api/Bill/?billNumber=SB1431&sessionId=127
SB1432,127,2023_2024_First_Regular,79092,assured water; small residential developments..,,WADSACK,JONES,ASSURED WATER; ASSURED WATER SUPPLY (H); CERTIFICATES OF ASSURED WATER SUPPLY; CITIES AND TOWNS - TITLE 9 (H); DEFINITION; EXEMPTIONS; REQUIREMENTS (H); SMALL RESIDENTIAL DEVELOPMENTS; STANDPIPE DISRICT (H); WATER SERVICE OUTSIDE CITY OR TOWN (H); WATERS - TITLE 45,SB1432 - assured water; small residential developments..,https://apps.azleg.gov/api/Bill/?billNumber=SB1432&sessionId=127
SB1433,127,2023_2024_First_Regular,79093,employer liability; COVID-19 vaccine requirement,,WADSACK,HEAP; JONES,CIVIL ACTION; CIVIL LIABILITY; COURTS AND CIVIL PROCEEDINGS - TITLE 12; COVID-19 VACCINE REQUIREMENT; DAMAGES; EMPLOYER LIABILITY,SB1433 - employer liability; COVID-19 vaccine requirement,https://apps.azleg.gov/api/Bill/?billNumber=SB1433&sessionId=127
SB1434,127,2023_2024_First_Regular,79094,businesses; masks; biohazard waste disposal,,WADSACK,JONES,BIOHAZARD WASTE DISPOSAL; BUSINESSES; HEADING CHANGE; MASK REQUIREMENT; MASKS; TRADE AND COMMERCE - TITLE 44,SB1434 - businesses; masks; biohazard waste disposal,https://apps.azleg.gov/api/Bill/?billNumber=SB1434&sessionId=127
SB1435,127,2023_2024_First_Regular,79095,attorney licensing; supreme court,,WADSACK,,ADMINISTRATIVE LAW JUDGES; ADMINISTRATIVE ORDERS; ADOPTION OF VOTE TABULATING EQUIPMENT; ADVISORY BOARD; AGRICULTURE - TITLE 3; APPEAL; APPOINTMENTS; ARBITRATION; ARIZONA UNIFORM LAWS COMMISSION; ATTORNEY LICENSING; AUDITS; CHILD SAFETY - TITLE 8; CHILDREN - TITLE 8 (H); COMMITTEE APPROVAL; COMPENSATION; CONDUCT OF HEARINGS; COUNTIES - TITLE 11; COUNTY FORMATION COMMISSION; COURTS AND CIVIL PROCEEDINGS - TITLE 12; CRIMINAL CODE - TITLE 13; DEFINITION; DEFINITIONS; DISTRIBUTION; DUTIES; ELECTIONS AND ELECTORS - TITLE 16; ELECTRONIC SIGNATURES; EMERGENCY CERTIFICATION; EMPLOYEE REPRESENTATION; EMPLOYER; EXCEPTIONS; EXPERIMENTAL USE; FEE OF COUNSEL; HEARING ON OBJECTION; HEARINGS; IDENTIFICATION; INSURANCE - TITLE 20; JUVENILE COURT COMMISSIONERS; KEEPING RECORDS; LABOR - TITLE 23; LOCATION; MEMBERS; MEMBERSHIP; MILITARY AFFAIRS AND EMERGENCY MANAGEMENT - TITLE 26; OBJECTIONS TO RULES; POWERS AND DUTIES; PRODUCT LIABILITY; PROFESSIONS AND OCCUPATIONS - TITLE 32; PROPERTY - TITLE 33; PUBLIC UTILITIES AND CARRIERS - TITLE 40; QUALIFICATION; QUALIFICATIONS; RECORDING INSTRUMENTS; REFERRALS; REHEARING; REIMBURSEMENT; REPRESENTATION; REQUIREMENTS; RIGHTS AND PROCEDURES; RULES; SOCIAL SECURITY NUMBERS; STAFF JUDGE ADVOCATES; STATE GOVERNMENT - TITLE 41; STATE JUDGE ADVOCATE; SUPREME COURT; TAXATION - TITLE 42; TRADE AND COMMERCE - TITLE 44; TRANSPORTATION - TITLE 28; TRUSTEE OF TRUST DEED; USED VEHICLE RECALL OBLIGATIONS; VEHICLE EXPORTS; WARRANTY OBLIGATIONS,SB1435 - attorney licensing; supreme court,https://apps.azleg.gov/api/Bill/?billNumber=SB1435&sessionId=127
SB1436,127,2023_2024_First_Regular,79103,permanent early voting list.,,SUNDARESHAN,DIAZ; HERNANDEZ; MENDEZ; TERÁN; TRAVERS,BALLOT; CIVIL PENALTIES; CIVIL PENALTY; CLASSIFICATION; DESIGNATION; DISTRIBUTION; ELECTION PRECINCTS; ELECTIONEERING; ELECTIONS; ELECTIONS AND ELECTORS - TITLE 16; FORM AND CONTENT OF BALLOT; PERMANENT EARLY VOTING LIST; POLLING PLACES; PREPARATION; PRINTING; REQUEST FOR BALLOT; SAMPLE BALLOTS; SAMPLE PRIMARY ELECTION BALLOTS; SUBMISSION TO PARTY CHAIRMEN; VIOLATION; VOTING CENTERS; WAIT TIMES,SB1436 - permanent early voting list.,https://apps.azleg.gov/api/Bill/?billNumber=SB1436&sessionId=127
SB1437,127,2023_2024_First_Regular,79104,ballot delivery; collection,,SUNDARESHAN,DIAZ; HERNANDEZ; MENDEZ; TERÁN; TRAVERS,BALLOT ABUSE; BALLOT DELIVERY; CLASSIFICATION; COLLECTION; DEFINITIONS; ELECTIONS AND ELECTORS - TITLE 16; VIOLATION,SB1437 - ballot delivery; collection,https://apps.azleg.gov/api/Bill/?billNumber=SB1437&sessionId=127
SB1438,127,2023_2024_First_Regular,79105,active management; non-expansion area; fees,,SUNDARESHAN,BORRELLI,ACTIVE MANAGEMENT; ACTIVE MANAGEMENT AREA; ADWR (SEE ALSO: DEPARTMENT OF WATER RESOURCES); DELAYED REPEAL; DEPARTMENT OF WATER RESOURCES (ADWR); EMERGENCY; EMERGENCY CLAUSE; EXEMPTION; FEES; IRRIGATION NON-EXPANSION AREA; NON-EXPANSION AREA; PROVIDING; RULEMAKING EXEMPTION,SB1438 - active management; non-expansion area; fees,https://apps.azleg.gov/api/Bill/?billNumber=SB1438&sessionId=127
