bill_number,session_num,session,bill_id_num,title,intro_sponsor,primary_sponsors,cosponsors,keywords,summary,bill_json
HCM2001,127,2023_2024_First_Regular,78219,postal service; urging continued independence,,SALMAN,DE LOS SANTOS; STAHL HAMILTON,POSTAL SERVICE; UNITED STATES POSTAL SERVICE; URGING CONGRESS; URGING CONTINUED INDEPENDENCE,HCM2001 - postal service; urging continued independence,https://apps.azleg.gov/api/Bill/?billNumber=HCM2001&sessionId=127
HCM2002,127,2023_2024_First_Regular,78317,federal lands; housing shortage,,GRIFFIN,,FEDERAL LANDS; HOUSING SHORTAGE; RESIDENTIAL HOUSING; UNITED STATES GOVERNMENT,HCM2002 - federal lands; housing shortage,https://apps.azleg.gov/api/Bill/?billNumber=HCM2002&sessionId=127
HCM2003,127,2023_2024_First_Regular,78322,technical correction; urging the president,,GRIFFIN,,TECHNICAL CORRECTION; URGING THE PRESIDENT,HCM2003 - (NOW: critical minerals; copper; urging inclusion),https://apps.azleg.gov/api/Bill/?billNumber=HCM2003&sessionId=127
HCM2004,127,2023_2024_First_Regular,78623,urging Congress; national forest health,,GRIFFIN,,FOREST MANAGEMENT; NATIONAL FOREST HEALTH; URGING CONGRESS,HCM2004 - urging Congress; national forest health,https://apps.azleg.gov/api/Bill/?billNumber=HCM2004&sessionId=127
HCM2005,127,2023_2024_First_Regular,78626,hunting; angling; wildlife conservation,,GRIFFIN,,ANGLING; HUNTING; URGING CONGRESS; WILDLIFE CONSERVATION,HCM2005 - hunting; angling; wildlife conservation,https://apps.azleg.gov/api/Bill/?billNumber=HCM2005&sessionId=127
HCM2006,127,2023_2024_First_Regular,78627,urging eradication; salt cedars; waterways,,GRIFFIN,,SALT CEDAR; URGING ERADICATION; WATERWAYS,HCM2006 - urging eradication; salt cedars; waterways,https://apps.azleg.gov/api/Bill/?billNumber=HCM2006&sessionId=127
HCM2007,127,2023_2024_First_Regular,78953,state immigration enforcement; urging Congress,,GRIFFIN,CARROLL,STATE IMMIGRATION ENFORCEMENT; URGING CONGRESS,HCM2007 - state immigration enforcement; urging Congress,https://apps.azleg.gov/api/Bill/?billNumber=HCM2007&sessionId=127
HCM2008,127,2023_2024_First_Regular,79662,air quality; ozone standards; opposing,,CARBONE,,AIR QUALITY; CONCURRENT MEMORIAL; OPPOSING; OZONE STANDARDS; URGING CONGRESS; URGING THE PRESIDENT,HCM2008 - air quality; ozone standards; opposing,https://apps.azleg.gov/api/Bill/?billNumber=HCM2008&sessionId=127
HCR2001,127,2023_2024_First_Regular,78066,school district expenditures; authorization.,,COOK,,AUTHORIZATION; CONSTITUTIONAL EXPENDITURE LIMITATION; LOCAL REVENUES; SCHOOL DISTRICT EXPENDITURES,HCR2001 - school district expenditures; authorization.,https://apps.azleg.gov/api/Bill/?billNumber=HCR2001&sessionId=127
HCR2002,127,2023_2024_First_Regular,78085,school district expenditures; authorization,,GRESS,DUNN,AUTHORIZATION; CONSTITUTIONAL EXPENDITURE LIMITATION; LOCAL REVENUES; SCHOOL DISTRICT EXPENDITURES; SCHOOL DISTRICTS,HCR2002 - school district expenditures; authorization,https://apps.azleg.gov/api/Bill/?billNumber=HCR2002&sessionId=127
HCR2003,127,2023_2024_First_Regular,78094,elections; bonds; technical correction,,PARKER J,,BOND ELECTIONS; BONDS; CONSTITUTION OF ARIZONA; ELECTIONS; TECHNICAL CORRECTION,HCR2003 - elections; bonds; technical correction,https://apps.azleg.gov/api/Bill/?billNumber=HCR2003&sessionId=127
HCR2004,127,2023_2024_First_Regular,78142,legislators; minimum age of eighteen,,GRESS,AGUILAR; AUSTIN; MARSHALL; MIRANDA; ORTIZ; SCHWIEBERT; SMITH; TERECH; KAISER,CONSTITUTION OF ARIZONA; LEGISLATORS; MINIMUM AGE; QUALIFICATIONS,HCR2004 - legislators; minimum age of eighteen,https://apps.azleg.gov/api/Bill/?billNumber=HCR2004&sessionId=127
HCR2005,127,2023_2024_First_Regular,78162,school districts; expenditure limitation; repeal...,,GUTIERREZ,BRAVO; CANO; CONTRERAS P; DE LOS SANTOS; HERNANDEZ M; MATHIS; ORTIZ; PAWLIK; QUIÑONEZ; SANDOVAL; SCHWIEBERT; SEAMAN; STAHL HAMILTON; TERECH; TRAVERS,CONSTITUTION OF ARIZONA; EXPENDITURE LIMITATION; REPEAL; SCHOOL DISTRICTS,HCR2005 - school districts; expenditure limitation; repeal...,https://apps.azleg.gov/api/Bill/?billNumber=HCR2005&sessionId=127
HCR2006,127,2023_2024_First_Regular,78170,bonds; elections; technical correction,,HEAP,HARRIS; JONES; SMITH,BOND ELECTIONS; BONDS; CONSTITUTION OF ARIZONA; ELECTIONS; TECHNICAL CORRECTION,HCR2006 - (NOW: sessions of legislature; repeal sessions),https://apps.azleg.gov/api/Bill/?billNumber=HCR2006&sessionId=127
HCR2007,127,2023_2024_First_Regular,78217,slavery; indentured servitude; prohibition,,SALMAN,AGUILAR; DE LOS SANTOS; GUTIERREZ; ORTIZ; STAHL HAMILTON,CONSTITUTION OF ARIZONA; DECLARATION OF RIGHTS; INDENTURED SERVITUDE; PROHIBITION; SLAVERY,HCR2007 - slavery; indentured servitude; prohibition,https://apps.azleg.gov/api/Bill/?billNumber=HCR2007&sessionId=127
HCR2008,127,2023_2024_First_Regular,78218,right to work; repeal,,SALMAN,DE LOS SANTOS; STAHL HAMILTON,CONSTITUTION OF ARIZONA; REPEAL; RIGHT TO WORK,HCR2008 - right to work; repeal,https://apps.azleg.gov/api/Bill/?billNumber=HCR2008&sessionId=127
HCR2009,127,2023_2024_First_Regular,78209,constitutional right to vote,,SALMAN,DE LOS SANTOS,CONSTITUTION OF ARIZONA; CONSTITUTIONAL RIGHT TO VOTE; QUALIFICATION OF VOTERS; VOTING RIGHTS,HCR2009 - constitutional right to vote,https://apps.azleg.gov/api/Bill/?billNumber=HCR2009&sessionId=127
HCR2010,127,2023_2024_First_Regular,78250,expenditure limitation; school districts,,PAWLIK,GUTIERREZ; LONGDON; MATHIS; SALMAN; TERECH,CONSTITUTION OF ARIZONA; EXPENDITURE LIMITATIONS; SCHOOL DISTRICTS,HCR2010 - expenditure limitation; school districts,https://apps.azleg.gov/api/Bill/?billNumber=HCR2010&sessionId=127
HCR2011,127,2023_2024_First_Regular,78264,vacation rentals; short-term rentals,,SCHWIEBERT,AGUILAR; BLATTMAN; CANO; CONTRERAS L; CONTRERAS P; GUTIERREZ; HERNANDEZ M; LONGDON; MATHIS; ORTIZ; PESHLAKAI; QUIÑONEZ; SEAMAN; SHAH; STAHL HAMILTON; TERECH; EPSTEIN; MARSH,SHORT-TERM RENTALS; VACATION RENTALS,HCR2011 - vacation rentals; short-term rentals,https://apps.azleg.gov/api/Bill/?billNumber=HCR2011&sessionId=127
HCR2012,127,2023_2024_First_Regular,78318,support; water management policies,,GRIFFIN,,SUPPORT; WATER MANAGEMENT POLICIES; WATER MANAGEMENT PRACTICES,HCR2012 - (NOW: water management policies; support),https://apps.azleg.gov/api/Bill/?billNumber=HCR2012&sessionId=127
HCR2013,127,2023_2024_First_Regular,78348,clean and healthy environment,,DE LOS SANTOS,AGUILAR; GUTIERREZ; MATHIS; ORTIZ; SANDOVAL; TERECH; TRAVERS,CLEAN AND HEALTHY ENVIRONMENT; CONSTITUTION OF ARIZONA; NATURAL RESOURCES,HCR2013 - clean and healthy environment,https://apps.azleg.gov/api/Bill/?billNumber=HCR2013&sessionId=127
HCR2014,127,2023_2024_First_Regular,78349,same-sex marriage; constitutional right,,DE LOS SANTOS,AGUILAR; GUTIERREZ; MATHIS; ORTIZ; SANDOVAL; STAHL HAMILTON; TERECH; TRAVERS,CONSTITUTION OF ARIZONA; CONSTITUTIONAL RIGHTS; MARRIAGE; SAME-SEX MARRIAGE,HCR2014 - same-sex marriage; constitutional right,https://apps.azleg.gov/api/Bill/?billNumber=HCR2014&sessionId=127
HCR2015,127,2023_2024_First_Regular,78399,school districts; expenditure limitation; repeal..,,COOK,BRAVO; CONTRERAS L; GUTIERREZ; HERNANDEZ A; HERNANDEZ L; PAWLIK; SCHWIEBERT; SEAMAN; STAHL HAMILTON; TERECH; TRAVERS; MARSH,CONSTITUTION OF ARIZONA; EXPENDITURE LIMITATIONS; REPEAL; SCHOOL DISTRICTS,HCR2015 - school districts; expenditure limitation; repeal..,https://apps.azleg.gov/api/Bill/?billNumber=HCR2015&sessionId=127
HCR2016,127,2023_2024_First_Regular,78401,article V convention; term limits,,COOK,CARTER; HERNANDEZ A; SEAMAN; SMITH,ARTICLE V CONVENTION; CONGRESS; TERM LIMITS,HCR2016 - article V convention; term limits,https://apps.azleg.gov/api/Bill/?billNumber=HCR2016&sessionId=127
HCR2017,127,2023_2024_First_Regular,78416,property tax; exemption; primary residence,,JONES,DIAZ; MCGARR; WADSACK,CONSTITUTION OF ARIZONA; EXEMPTION; PRIMARY RESIDENCE; PROPERTY TAX; PROPERTY TAX EXEMPTION,HCR2017 - property tax; exemption; primary residence,https://apps.azleg.gov/api/Bill/?billNumber=HCR2017&sessionId=127
HCR2018,127,2023_2024_First_Regular,78448,Maricopa county; division; new counties,,KOLODIN,CHAPLIK; MARSHALL; PARKER B,DIVISION; LOCATION OF COUNTIES; MARICOPA COUNTY; NEW COUNTIES,HCR2018 - Maricopa county; division; new counties,https://apps.azleg.gov/api/Bill/?billNumber=HCR2018&sessionId=127
HCR2019,127,2023_2024_First_Regular,78449,trial by jury; administrative proceedings,,KOLODIN,CARTER; CHAPLIK; HEAP; JONES; MARSHALL; MCGARR; MONTENEGRO; PARKER B; PARKER J; WILMETH; WADSACK,ADMINISTRATIVE PROCEEDINGS; JURY; TRIAL BY JURY,HCR2019 - trial by jury; administrative proceedings,https://apps.azleg.gov/api/Bill/?billNumber=HCR2019&sessionId=127
HCR2020,127,2023_2024_First_Regular,78450,technical correction; bond elections,,KOLODIN,HARRIS; HEAP; JONES; SMITH,BOND ELECTIONS; CONSTITUTION OF ARIZONA; TECHNICAL CORRECTION,HCR2020 - technical correction; bond elections,https://apps.azleg.gov/api/Bill/?billNumber=HCR2020&sessionId=127
HCR2021,127,2023_2024_First_Regular,78461,ratification; equal rights amendment.,,SHAH,,CONSTITUTION OF THE UNITED STATES; EQUAL RIGHTS; EQUAL RIGHTS AMENDMENT (ERA); ERA (SEE ALSO: EQUAL RIGHTS AMENDMENT); RATIFICATION,HCR2021 - ratification; equal rights amendment.,https://apps.azleg.gov/api/Bill/?billNumber=HCR2021&sessionId=127
HCR2022,127,2023_2024_First_Regular,78462,school districts; expenditure limitation; repeal.,,SHAH,,CONSTITUTION OF ARIZONA; EXPENDITURE LIMITATIONS; REPEAL; SCHOOL DISTRICTS,HCR2022 - school districts; expenditure limitation; repeal.,https://apps.azleg.gov/api/Bill/?billNumber=HCR2022&sessionId=127
HCR2023,127,2023_2024_First_Regular,78471,death penalty; prohibition.,,CONTRERAS P,AGUILAR; AUSTIN; BRAVO; CANO; GUTIERREZ; ORTIZ; SANDOVAL; SEAMAN; SUN; TERECH; TRAVERS,CONSTITUTION OF ARIZONA; DEATH PENALTY; PROHIBITION; SENTENCE OF DEATH,HCR2023 - death penalty; prohibition.,https://apps.azleg.gov/api/Bill/?billNumber=HCR2023&sessionId=127
HCR2024,127,2023_2024_First_Regular,78622,Bartlett Dam; height increase,,GRIFFIN,,BARTLETT DAM; HEIGHT INCREASE,HCR2024 - Bartlett Dam; height increase,https://apps.azleg.gov/api/Bill/?billNumber=HCR2024&sessionId=127
HCR2025,127,2023_2024_First_Regular,78624,death benefit; assault; first responders,,PAYNE,,ASSAULT; CONCURRENT RESOLUTION; DEATH BENEFIT; FIRST RESPONDERS,HCR2025 - death benefit; assault; first responders,https://apps.azleg.gov/api/Bill/?billNumber=HCR2025&sessionId=127
HCR2026,127,2023_2024_First_Regular,78625,schools; English language learners; requirements,,SANDOVAL,AGUILAR; BLATTMAN; DE LOS SANTOS; HERNANDEZ L; ORTIZ; SUN; TRAVERS,ENGLISH LANGUAGE EDUCATION; ENGLISH LANGUAGE LEARNERS; PUBLIC SCHOOLS; REQUIREMENTS; SCHOOLS,HCR2026 - schools; English language learners; requirements,https://apps.azleg.gov/api/Bill/?billNumber=HCR2026&sessionId=127
HCR2027,127,2023_2024_First_Regular,78632,Russell Pearce; death resolution,,PARKER B,,DEATH RESOLUTION; RUSSELL PEARCE,HCR2027 - Russell Pearce; death resolution,https://apps.azleg.gov/api/Bill/?billNumber=HCR2027&sessionId=127
HCR2028,127,2023_2024_First_Regular,78657,marijuana; unincorporated areas; reservations; prohibition.,,PESHLAKAI,,MARIJUANA; PROHIBITION; RESERVATIONS; UNINCORPORATED AREAS,HCR2028 - marijuana; unincorporated areas; reservations; prohibition.,https://apps.azleg.gov/api/Bill/?billNumber=HCR2028&sessionId=127
HCR2029,127,2023_2024_First_Regular,78664,income tax; individuals; repeal,,KOLODIN,JONES; MARSHALL; MCGARR; BORRELLI; HOFFMAN; WADSACK,INCOME TAX; INDIVIDUAL INCOME TAX; INDIVIDUALS; REPEAL,HCR2029 - income tax; individuals; repeal,https://apps.azleg.gov/api/Bill/?billNumber=HCR2029&sessionId=127
HCR2030,127,2023_2024_First_Regular,78924,ratification; equal rights amendment..,,TERECH,AGUILAR; AUSTIN; BLATTMAN; BRAVO; CANO; CONTRERAS L; CONTRERAS P; DE LOS SANTOS; GUTIERREZ; HERNANDEZ A; HERNANDEZ C; HERNANDEZ L; HERNANDEZ M; LONGDON; MATHIS; ORTIZ; PAWLIK; PESHLAKAI; QUIÑONEZ; SALMAN; SANDOVAL; SCHWIEBERT; SEAMAN; STAHL HAMILTON; SUN; TRAVERS; TSOSIE,EQUAL RIGHTS AMENDMENT (ERA); ERA (SEE ALSO: EQUAL RIGHTS AMENDMENT); RATIFICATION,HCR2030 - ratification; equal rights amendment..,https://apps.azleg.gov/api/Bill/?billNumber=HCR2030&sessionId=127
HCR2031,127,2023_2024_First_Regular,78926,income tax; subtraction; law enforcement,,JONES,GILLETTE; HARRIS; MARSHALL; MCGARR; PARKER B; SMITH; WADSACK,INCOME TAX; INDIVIDUAL INCOME TAX; LAW ENFORCEMENT; SUBTRACTIONS,HCR2031 - income tax; subtraction; law enforcement,https://apps.azleg.gov/api/Bill/?billNumber=HCR2031&sessionId=127
HCR2032,127,2023_2024_First_Regular,78929,international money transfer; requirements; tax,,GILLETTE,BIASIUCCI; CHAPLIK; HARRIS; HEAP; MARSHALL; PARKER B,INTERNATIONAL MONEY TRANSFER; MONEY TRANSFER; REQUIREMENTS; TAX; WIRE TRANSFERS OF MONEY,HCR2032 - international money transfer; requirements; tax,https://apps.azleg.gov/api/Bill/?billNumber=HCR2032&sessionId=127
HCR2033,127,2023_2024_First_Regular,79137,primary elections; eligible candidates,,SMITH,CHAPLIK; HEAP; HENDRIX; JONES; KOLODIN; MCGARR; MONTENEGRO; PARKER B; PARKER J; HOFFMAN; KERN; SHAMP; WADSACK,AMENDMENT; CONSTITUTION OF ARIZONA; DIRECT PRIMARY ELECTION LAW; ELIGIBLE CANDIDATES; PRIMARY ELECTIONS,HCR2033 - primary elections; eligible candidates,https://apps.azleg.gov/api/Bill/?billNumber=HCR2033&sessionId=127
HCR2034,127,2023_2024_First_Regular,79416,supporting statehood; Washington D.C.,,SALMAN,AGUILAR; AUSTIN; BRAVO; CANO; CONTRERAS L; CONTRERAS P; DE LOS SANTOS; GUTIERREZ; HERNANDEZ A; HERNANDEZ C; HERNANDEZ L; HERNANDEZ M; LONGDON; MATHIS; ORTIZ; PESHLAKAI; QUIÑONEZ; SANDOVAL; SCHWIEBERT; SEAMAN; SHAH; STAHL HAMILTON; SUN; TRAVERS; TSOSIE; ALSTON; DIAZ; EPSTEIN; GABALDÓN; HERNANDEZ; MENDEZ; MIRANDA; TERÁN,"SUPPORTING STATEHOOD; WASHINGTON, D.C.",HCR2034 - supporting statehood; Washington D.C.,https://apps.azleg.gov/api/Bill/?billNumber=HCR2034&sessionId=127
HCR2035,127,2023_2024_First_Regular,79417,death penalty; prohibition,,SALMAN,AGUILAR; AUSTIN; BLATTMAN; BRAVO; CANO; CONTRERAS L; DE LOS SANTOS; HERNANDEZ L; HERNANDEZ M; LONGDON; ORTIZ; QUIÑONEZ; SANDOVAL; SHAH; STAHL HAMILTON; SUN; TSOSIE; ALSTON; DIAZ; FERNANDEZ; GABALDÓN; HERNANDEZ; MENDEZ; MIRANDA; TERÁN,AMENDMENT; CONSTITUTION OF ARIZONA; DEATH PENALTY; PROHIBITION,HCR2035 - death penalty; prohibition,https://apps.azleg.gov/api/Bill/?billNumber=HCR2035&sessionId=127
HCR2036,127,2023_2024_First_Regular,79441,MS awareness week,,BLISS,,MS AWARENESS WEEK; MULTIPLE SCLEROSIS,HCR2036 - MS awareness week,https://apps.azleg.gov/api/Bill/?billNumber=HCR2036&sessionId=127
HCR2037,127,2023_2024_First_Regular,79461,Assyrian New Year; recognizing,,SCHWIEBERT,AGUILAR; AUSTIN; BLATTMAN; BRAVO; CANO; CARBONE; CONTRERAS L; CONTRERAS P; DE LOS SANTOS; GRANTHAM; GRESS; GUTIERREZ; HENDRIX; HERNANDEZ A; HERNANDEZ L; HERNANDEZ M; KOLODIN; LIVINGSTON; LONGDON; MATHIS; ORTIZ; PAWLIK; PAYNE; PESHLAKAI; QUIÑONEZ; SEAMAN; SHAH; STAHL HAMILTON; SUN; TERECH; TOMA; TRAVERS; WILMETH; ALSTON; BENNETT; BURCH; CARROLL; EPSTEIN; FERNANDEZ; HATATHLIE; KAISER; MARSH; MENDEZ; MIRANDA,ASSYRIAN NEW YEAR; RECOGNIZING,HCR2037 - Assyrian New Year; recognizing,https://apps.azleg.gov/api/Bill/?billNumber=HCR2037&sessionId=127
HCR2038,127,2023_2024_First_Regular,79475,continuing appropriation budget; enactment; timeframe,,LIVINGSTON,,AMENDMENT; APPROPRIATION BILLS; CONSTITUTION OF ARIZONA; CONTINUING APPROPRIATION BUDGET; ENACTMENT; TIMEFRAME,HCR2038 - continuing appropriation budget; enactment; timeframe,https://apps.azleg.gov/api/Bill/?billNumber=HCR2038&sessionId=127
HCR2039,127,2023_2024_First_Regular,79493,governor; state of emergency,,CHAPLIK,KOLODIN,AMENDMENT; CONGRESSIONAL BOUNDARIES (S); CONSTITUTION OF ARIZONA; CONSTITUTIONAL AMENDMENTS (ARIZONA) (S); GOVERNOR; HOUSE OF REPRESENTATIVES (S); INDEPENDENT REDISTRICTING COMMISSION (S); LEGISLATIVE BOUNDARIES (S); MEMBERS (S); POWERS AND DUTIES; SENATE (S); SPECIAL SESSION (S); STATE OF EMERGENCY,HCR2039 - (NOW: governor; emergency powers),https://apps.azleg.gov/api/Bill/?billNumber=HCR2039&sessionId=127
HCR2040,127,2023_2024_First_Regular,79532,in-person precinct voting; absentee voters,,JONES,HARRIS; HEAP; PARKER J; SMITH,ABSENTEE VOTERS; IN-PERSON PRECINCT VOTING; VOTER ELIGIBILITY,HCR2040 - in-person precinct voting; absentee voters,https://apps.azleg.gov/api/Bill/?billNumber=HCR2040&sessionId=127
HCR2041,127,2023_2024_First_Regular,79597,initiative; referendum; signatures; legislative districts...,,MARSHALL,DIAZ; GILLETTE; HARRIS; HENDRIX; JONES; SMITH,AMENDMENT; CONSTITUTION OF ARIZONA; INITIATIVE; LEGISLATIVE DISTRICTS; REFERENDA; REFERENDUM; SIGNATURES,HCR2041 - initiative; referendum; signatures; legislative districts...,https://apps.azleg.gov/api/Bill/?billNumber=HCR2041&sessionId=127
HCR2042,127,2023_2024_First_Regular,79658,English language education; requirements,,AUSTIN,AGUILAR; BLATTMAN; BRAVO; CANO; CONTRERAS L; CONTRERAS P; DE LOS SANTOS; GUTIERREZ; HERNANDEZ M; LONGDON; ORTIZ; PAWLIK; PESHLAKAI; QUIÑONEZ; SALMAN; SANDOVAL; SCHWIEBERT; STAHL HAMILTON; SUN,ENGLISH LANGUAGE EDUCATION; PUBLIC SCHOOLS; REQUIREMENTS; RESOLUTION,HCR2042 - English language education; requirements,https://apps.azleg.gov/api/Bill/?billNumber=HCR2042&sessionId=127
HCR2043,127,2023_2024_First_Regular,79663,compensation; state preemption; limitation,,GRESS,MARSHALL; NGUYEN; WILMETH,AMENDMENT; COMPENSATION; CONSTITUTION OF ARIZONA; EMPLOYEE BENEFITS; LIMITATION; STATE PREEMPTION,HCR2043 - compensation; state preemption; limitation,https://apps.azleg.gov/api/Bill/?billNumber=HCR2043&sessionId=127
HCR2044,127,2023_2024_First_Regular,79670,Assyrian Genocide; recognition,,TOMA,,ASSYRIAN GENOCIDE; CONCURRENT RESOLUTION; RECOGNITION,HCR2044 - Assyrian Genocide; recognition,https://apps.azleg.gov/api/Bill/?billNumber=HCR2044&sessionId=127
HCR2045,127,2023_2024_First_Regular,79672,"Jack Jackson, Sr.; death resolution",,PESHLAKAI,AUSTIN; BLATTMAN; BRAVO; CONTRERAS L; CONTRERAS P; HERNANDEZ A; HERNANDEZ L; LONGDON; NGUYEN; PAWLIK; QUIÑONEZ; SCHWIEBERT; SEAMAN; SHAH; TRAVERS,CONCURRENT RESOLUTION; DEATH RESOLUTION; JACK JACKSON SR,"HCR2045 - Jack Jackson, Sr.; death resolution",https://apps.azleg.gov/api/Bill/?billNumber=HCR2045&sessionId=127
HCR2046,127,2023_2024_First_Regular,79673,Peterson Zah; death resolution,,PESHLAKAI,AUSTIN; BLATTMAN; BRAVO; CONTRERAS L; CONTRERAS P; HERNANDEZ A; HERNANDEZ L; LONGDON; PAWLIK; QUIÑONEZ; SCHWIEBERT; SEAMAN; SHAH; TRAVERS,CONCURRENT RESOLUTION; DEATH RESOLUTION; PETERSON ZAH,HCR2046 - Peterson Zah; death resolution,https://apps.azleg.gov/api/Bill/?billNumber=HCR2046&sessionId=127
HCR2047,127,2023_2024_First_Regular,79676,twentieth anniversary; death; Lori Piestewa,,PESHLAKAI,AUSTIN; BLISS; CANO; CARBONE; CONTRERAS P; GILLETTE; GRANTHAM; GRIFFIN; GUTIERREZ; LIVINGSTON; ORTIZ; PAWLIK; QUIÑONEZ; SEAMAN; SUN; TERECH; TRAVERS,DEATH; LORI PIESTEWA; RESOLUTION; TWENTIETH ANNIVERSARY,HCR2047 - twentieth anniversary; death; Lori Piestewa,https://apps.azleg.gov/api/Bill/?billNumber=HCR2047&sessionId=127
HCR2048,127,2023_2024_First_Regular,79677,Joe Hart; death resolution,,GRIFFIN,AGUILAR; AUSTIN; BIASIUCCI; BLATTMAN; BLISS; BRAVO; CANO; CARBONE; CARTER; CHAPLIK; CONTRERAS L; CONTRERAS P; COOK; DE LOS SANTOS; DIAZ; DUNN; GILLETTE; GRANTHAM; GRESS; HARRIS; HEAP; HENDRIX; HERNANDEZ A; HERNANDEZ C; HERNANDEZ L; HERNANDEZ M; JONES; KOLODIN; LIVINGSTON; LONGDON; MARSHALL; MARTINEZ; MATHIS; MCGARR; MONTENEGRO; NGUYEN; PARKER B; PARKER J; PAWLIK; PAYNE; PEÑA; PESHLAKAI; PINGERELLI; QUIÑONEZ; SCHWIEBERT; SEAMAN; SHAH; SMITH; STAHL HAMILTON; SUN; TERECH; TOMA; TRAVERS; TSOSIE; WILMETH; ALSTON; BENNETT; BORRELLI; CARROLL; DIAZ; EPSTEIN; FARNSWORTH; FERNANDEZ; GABALDÓN; GOWAN; HATATHLIE; HERNANDEZ; KAVANAGH; KERN; KERR; MARSH; MENDEZ; MESNARD; MIRANDA; PETERSEN; ROGERS; SHOPE; SUNDARESHAN; TERÁN; WADSACK,CONCURRENT RESOLUTION; DEATH RESOLUTION; JOE HART,HCR2048 - Joe Hart; death resolution,https://apps.azleg.gov/api/Bill/?billNumber=HCR2048&sessionId=127
HCR2049,127,2023_2024_First_Regular,79686,Ann Nichols; death resolution,,LONGDON,CONTRERAS L; CONTRERAS P; PAWLIK,ANN NICHOLS; CONCURRENT RESOLUTION; DEATH RESOLUTION,HCR2049 - Ann Nichols; death resolution,https://apps.azleg.gov/api/Bill/?billNumber=HCR2049&sessionId=127
HCR2050,127,2023_2024_First_Regular,79703,school districts; expenditure limit; authorization,,GRESS,,AUTHORIZATION; CONCURRENT RESOLUTION; EXPENDITURE LIMIT; SCHOOL DISTRICT,HCR2050 - school districts; expenditure limit; authorization,https://apps.azleg.gov/api/Bill/?billNumber=HCR2050&sessionId=127
HCR2051,127,2023_2024_First_Regular,79725,Ben Shelly; death resolution,,TSOSIE,AGUILAR; CONTRERAS L; DE LOS SANTOS; GUTIERREZ; HERNANDEZ M; LONGDON; MATHIS; PAWLIK; PESHLAKAI; QUIÑONEZ; SALMAN; TERECH; TRAVERS,BEN SHELLY; CONCURRENT RESOLUTION; DEATH RESOLUTION,HCR2051 - Ben Shelly; death resolution,https://apps.azleg.gov/api/Bill/?billNumber=HCR2051&sessionId=127
HR2001,127,2023_2024_First_Regular,78628,technical correction; Grand Canyon day,,GRIFFIN,,GRAND CANYON DAY; GRAND CANYON NATIONAL PARK DAY; TECHNICAL CORRECTION,HR2001 - technical correction; Grand Canyon day,https://apps.azleg.gov/api/Bill/?billNumber=HR2001&sessionId=127
HR2002,127,2023_2024_First_Regular,78629,securing America's lands; foreign interference,,GRIFFIN,,FOREIGN INTERFERENCE; SECURING AMERICA'S LANDS,HR2002 - securing America's lands; foreign interference,https://apps.azleg.gov/api/Bill/?billNumber=HR2002&sessionId=127
HR2003,127,2023_2024_First_Regular,79682,Liz Harris; expulsion,,HOUSE OF REPRESENTATIVES,,EXPULSION; LEGISLATURE; RESOLUTION,HR2003 - Liz Harris; expulsion,https://apps.azleg.gov/api/Bill/?billNumber=HR2003&sessionId=127
HR2004,127,2023_2024_First_Regular,79743,death resolution; Ruben T. Castro,,COOK,,DEATH RESOLUTION; RUBEN T. CASTRO,HR2004 - death resolution; Ruben T. Castro,https://apps.azleg.gov/api/Bill/?billNumber=HR2004&sessionId=127
HB2001,127,2023_2024_First_Regular,78027,department of health services; rulemaking,,COOK,,ADMINISTRATIVE PROCEDURES; DEPARTMENT OF HEALTH SERVICES (DHS); DHS (SEE ALSO: DEPARTMENT OF HEALTH SERVICES); RULEMAKING; STATE GOVERNMENT - TITLE 41,HB2001 - department of health services; rulemaking,https://apps.azleg.gov/api/Bill/?billNumber=HB2001&sessionId=127
HB2002,127,2023_2024_First_Regular,78032,DOC officers; personnel system; covered,,COOK,,COVERAGE; DOC (SEE ALSO: STATE DEPARTMENT OF CORRECTIONS); OFFICERS; STATE DEPARTMENT OF CORRECTIONS (DOC); STATE GOVERNMENT - TITLE 41; STATE PERSONNEL SYSTEM,HB2002 - DOC officers; personnel system; covered,https://apps.azleg.gov/api/Bill/?billNumber=HB2002&sessionId=127
HB2003,127,2023_2024_First_Regular,78034,corporate income tax; rates,,LIVINGSTON,,CORPORATE INCOME TAX; RATES; RETROACTIVITY; TAXATION OF INCOME - TITLE 43,HB2003 - corporate income tax; rates,https://apps.azleg.gov/api/Bill/?billNumber=HB2003&sessionId=127
HB2004,127,2023_2024_First_Regular,78035,vehicle accidents; financial responsibility,,LIVINGSTON,,FINANCIAL RESPONSIBILITY; FINANCIAL RESPONSIBILITY VERIFICATION; TRANSPORTATION - TITLE 28; VEHICLE ACCIDENTS,HB2004 - vehicle accidents; financial responsibility,https://apps.azleg.gov/api/Bill/?billNumber=HB2004&sessionId=127
HB2005,127,2023_2024_First_Regular,78036,foreign captive insurers; definition,,LIVINGSTON,,ALIEN CAPTIVE INSURER; DEFINITION; FOREIGN CAPTIVE INSURERS; INSURANCE - TITLE 20,HB2005 - foreign captive insurers; definition,https://apps.azleg.gov/api/Bill/?billNumber=HB2005&sessionId=127
HB2006,127,2023_2024_First_Regular,78037,insurance; liquidity; financial assessment,,LIVINGSTON,,FINANCIAL ASSESSMENT; INSURANCE - TITLE 20; LIQUIDITY,HB2006 - insurance; liquidity; financial assessment,https://apps.azleg.gov/api/Bill/?billNumber=HB2006&sessionId=127
HB2007,127,2023_2024_First_Regular,78038,group excess liability insurance,,LIVINGSTON,,GROUP EXCESS LIABILITY INSURANCE; INSURANCE - TITLE 20,HB2007 - (NOW: insurance; group excess liability),https://apps.azleg.gov/api/Bill/?billNumber=HB2007&sessionId=127
HB2008,127,2023_2024_First_Regular,78039,ASRS; contribution prepayment,,LIVINGSTON,,ARIZONA STATE RETIREMENT SYSTEM (ASRS); ASRS (SEE ALSO: ARIZONA STATE RETIREMENT SYSTEM); CONTRIBUTION PREPAYMENT; EMPLOYER CONTRIBUTIONS; PUBLIC OFFICERS AND EMPLOYEES - TITLE 38,HB2008 - ASRS; contribution prepayment,https://apps.azleg.gov/api/Bill/?billNumber=HB2008&sessionId=127
HB2009,127,2023_2024_First_Regular,78040,ASRS; retirement application; changes,,LIVINGSTON,,ARIZONA STATE RETIREMENT SYSTEM (ASRS); ASRS (SEE ALSO: ARIZONA STATE RETIREMENT SYSTEM); PUBLIC OFFICERS AND EMPLOYEES - TITLE 38; RETIREMENT APPLICATION,HB2009 - ASRS; retirement application; changes,https://apps.azleg.gov/api/Bill/?billNumber=HB2009&sessionId=127
HB2010,127,2023_2024_First_Regular,78041,banking; licensing; fees,,LIVINGSTON,,ANNUAL DENTAL LOSS RATIO REPORT (S); BANKING; BANKS AND FINANCIAL INSTITUTIONS - TITLE 6; DEFINITIONS (S); FEES; INSURANCE (S); INSURANCE - TITLE 20 (S); INSURER REPORTING (S); LICENSING; POSTING (S); PROFESSIONS AND OCCUPATIONS - TITLE 32; REGISTRATION,HB2010 - (NOW: banking; licensing; fees; insurer reporting),https://apps.azleg.gov/api/Bill/?billNumber=HB2010&sessionId=127
HB2011,127,2023_2024_First_Regular,78042,state board of accountancy; continuation,,LIVINGSTON,,CONTINUATION; PROFESSIONS AND OCCUPATIONS - TITLE 32; RETROACTIVITY; STATE BOARD OF ACCOUNTANCY; STATE GOVERNMENT - TITLE 41,HB2011 - state board of accountancy; continuation,https://apps.azleg.gov/api/Bill/?billNumber=HB2011&sessionId=127
