bill_number,session,summary,keywords,authors,coauthors,sponsors,cosponsors,house_committee,hc_status,senate_committee,sc_status,bill_url
SB 25,871,Relating to procedures for early voting by mail or voting by mail.,Disaster Preparedness & Relief (I0211); Elections--Administration (I0277); Elections--Early Voting (I0260); Governor (I0375); Political Subdivisions (I0588),Campbell,,,,,,,,http://capitol.texas.gov/BillLookup/History.aspx?LegSess=871&Bill=SB25
SB 59,871,Relating to installment payments of ad valorem taxes imposed on residence homesteads in certain counties.,Property Interests--Homestead (I0616); Taxation--Property-Assessment & Collection (I0798); Taxation--Property-Exemptions (I0793),Campbell,,,,,,,,http://capitol.texas.gov/BillLookup/History.aspx?LegSess=871&Bill=SB59
SB 60,871,Relating to prohibited logistical support by a governmental entity for procurement of an abortion or the services of an abortion provider.,Abortion (I0005); HEALTH & HUMAN SERVICES COMMISSION (V0177),Campbell,,,,,,,,http://capitol.texas.gov/BillLookup/History.aspx?LegSess=871&Bill=SB60
SR 9,871,In memory of Robert Ramirez.,"Resolutions--Memorial (I0710); RAMIREZ, ROBERT (NL3TK)",Springer; Campbell; Nelson,,,,,,,,http://capitol.texas.gov/BillLookup/History.aspx?LegSess=871&Bill=SR9
SCR 3,871,"Designating the city of Florence, home of the Gault Archaeological Site, as the oldest community in Texas for a 10-year period beginning in 2021.","FLORENCE, CITY OF (GZ4WG); Resolutions--Official Designations--Miscellaneous (I0719); OLDEST COMMUNITY IN TEXAS (ND6CG)",Schwertner,,,,,,,,http://capitol.texas.gov/BillLookup/History.aspx?LegSess=871&Bill=SCR3
SR 5,871,Recognizing James Leman for his interest in Texas history.,"Resolutions--Congratulatory & Honorary (I0705); LEMAN, JAMES (NL5TU)",Schwertner,,,,,,,,http://capitol.texas.gov/BillLookup/History.aspx?LegSess=871&Bill=SR5
SR 16,871,Recognizing Grimes County Republican Women on the occasion of its 10th anniversary.,Resolutions--Congratulatory & Honorary (I0705); GRIMES COUNTY REPUBLICAN WOMEN (NB182),Schwertner,,,,,,,,http://capitol.texas.gov/BillLookup/History.aspx?LegSess=871&Bill=SR16
SR 40,871,Recognizing Grover Wist Trytten on the occasion of his 100th birthday.,"Resolutions--Congratulatory & Honorary (I0705); TRYTTEN, GROVER WIST (N62V8)",Schwertner,,,,,,,,http://capitol.texas.gov/BillLookup/History.aspx?LegSess=871&Bill=SR40
SR 41,871,Recognizing Joseph Carney for receiving the Reliever Airport Manager of the Year Award.,"Resolutions--Congratulatory & Honorary (I0705); CARNEY, JOSEPH (NN3HL)",Schwertner,,,,,,,,http://capitol.texas.gov/BillLookup/History.aspx?LegSess=871&Bill=SR41
SB 21,871,Relating to a border operations training program for peace officers employed by local law enforcement agencies.,"Fire Fighters & Police--General (I0370); Law Enforcement (I0510); BORDER (S0045); PEACE OFFICERS (S0007); PUBLIC SAFETY, DEPARTMENT OF (V0251)",Creighton,,,,,,,,http://capitol.texas.gov/BillLookup/History.aspx?LegSess=871&Bill=SB21
SB 22,871,Relating to identification requirements for early voting by mail.,Elections--Administration (I0277); Elections--Early Voting (I0260); Elections--Registration & Suffrage (I0265); Vehicles & Traffic--Driver's Licenses (I0840); IDENTIFICATION CARDS (S0074),Creighton,,,,,,,,http://capitol.texas.gov/BillLookup/History.aspx?LegSess=871&Bill=SB22
SR 43,871,Recognizing Jefferson County employees for their service to the community during the COVID-19 pandemic.,JEFFERSON COUNTY (G0897); Resolutions--Congratulatory & Honorary (I0705),Creighton,,,,,,,,http://capitol.texas.gov/BillLookup/History.aspx?LegSess=871&Bill=SR43
SB 2,871,Relating to requiring public school and public institution of higher education students to compete in interscholastic athletic competitions based on biological sex.,Education--Higher--Athletics (I0256); Education--Primary & Secondary--Extracurricular Activities (I0247); BIRTH & DEATH CERTIFICATES (S6418); UNIVERSITY INTERSCHOLASTIC LEAGUE (S0337),Perry,Bettencourt; Buckingham; Campbell; Creighton; Hughes; Kolkhorst; Paxton; Schwertner; Springer,,,,,Health & Human Services,Out of committee,http://capitol.texas.gov/BillLookup/History.aspx?LegSess=871&Bill=SB2
SB 31,871,Relating to the use of certain information regarding voter qualification.,"Elections--Registration & Suffrage (I0265); Open Records (I0548); ATTORNEY GENERAL (V2811); PUBLIC SAFETY, DEPARTMENT OF (V0251); SECRETARY OF STATE (V0042)",Perry,Birdwell; Creighton; Schwertner,,,,,State Affairs,In committee,http://capitol.texas.gov/BillLookup/History.aspx?LegSess=871&Bill=SB31
SB 32,871,Relating to requiring public school students to compete in interscholastic athletic competitions based on biological sex.,"Amusements, Games, Sports (I0034); Education--Primary & Secondary--Extracurricular Activities (I0247); BIRTH & DEATH CERTIFICATES (S6418); UNIVERSITY INTERSCHOLASTIC LEAGUE (S0337)",Perry,Buckingham; Campbell; Creighton; Hall; Kolkhorst; Paxton; Schwertner; Springer,,,,,Health & Human Services,Out of committee,http://capitol.texas.gov/BillLookup/History.aspx?LegSess=871&Bill=SB32
SB 33,871,Relating to abortion reporting and exemptions to abortion facility licensing; creating a criminal offense.,Abortion (I0005); Electronic Information Systems (I0311); PHYSICIANS (S1282); HEALTH & HUMAN SERVICES COMMISSION (V0177),Perry,Creighton; Paxton; Schwertner; Springer,,,,,Health & Human Services,In committee,http://capitol.texas.gov/BillLookup/History.aspx?LegSess=871&Bill=SB33
SB 70,871,Relating to the definition of abuse of a child.,Family--Child Protection (I0351); Minors--Crimes Against (I0532); Minors--Health & Safety (I0533); CHILD ABUSE (S4256); GENDER IDENTITY & EXPRESSION (S0767); MEDICINE & PRESCRIPTION DRUGS (S7338),Perry,,,,,,,,http://capitol.texas.gov/BillLookup/History.aspx?LegSess=871&Bill=SB70
SB 73,871,Relating to universal service fund assistance to high cost rural areas and the uniform charge that funds the universal service fund.,Fees & Other Nontax Revenue--State (I0362); Utilities--Telecommunications (I0828); Utilities--Telecommunications--Rural (I0829); RURAL (S0467); PUBLIC UTILITY COMMISSION (V0023),Perry,,,,,,,,http://capitol.texas.gov/BillLookup/History.aspx?LegSess=871&Bill=SB73
SCR 1,871,Urging the federal government to immediately declare violent foreign drug cartels as foreign terrorist organizations.,Crimes--Drugs (I0185); Resolutions--Legislative Policy (I0685),Perry,,,,,,,,http://capitol.texas.gov/BillLookup/History.aspx?LegSess=871&Bill=SCR1
SB 76,871,Relating to athletic conference membership by institutions of higher education.,Education--Higher--Athletics (I0256); Education--Higher--Institutions & Programs (I0223); Legislature (I0520),Birdwell; Kolkhorst; Perry; Powell,,,,,,,,http://capitol.texas.gov/BillLookup/History.aspx?LegSess=871&Bill=SB76
SB 16,871,Relating to an interstate compact on border security and immigration enforcement.,Aliens (I0032); Congress (I0085); Governor (I0375); Intergovernmental Relations (I0447); Law Enforcement (I0510); BORDER (S0045); IMMIGRATION LAW (S0674),Hall,,,,,,,,http://capitol.texas.gov/BillLookup/History.aspx?LegSess=871&Bill=SB16
SB 17,871,Relating to protection of individuals from participation in a health care service for reasons of conscience; providing a civil remedy; authorizing disciplinary action.,Health Care Providers (I0387); Religion (I0646); TEXAS HEALTH CARE CONSCIENCE PROTECTION ACT (PW11N); PHYSICIANS (S1282),Hall,,,,,,,,http://capitol.texas.gov/BillLookup/History.aspx?LegSess=871&Bill=SB17
SB 18,871,Relating to the provision of and professional liability insurance coverage for gender transitioning or gender reassignment medical procedures and treatments for certain children.,"Health--Other Diseases & Medical Conditions (I0383); Insurance--General (I0445); Minors--Health & Safety (I0533); PHYSICIANS (S1282); MEDICAL BOARD, TEXAS (V0644)",Hall,,,,,,,,http://capitol.texas.gov/BillLookup/History.aspx?LegSess=871&Bill=SB18
SB 19,871,Relating to requiring the disclosure of certain information regarding public school teaching materials and activities.,Education--Primary & Secondary--Charter Schools (I0245); Education--Primary & Secondary--Curriculum (I0228); Education--School Districts (I0220); INTERNET (S0130),Hall,,,,,,,,http://capitol.texas.gov/BillLookup/History.aspx?LegSess=871&Bill=SB19
SB 27,871,Relating to the management of polling place locations during a continuous period for voting.,Elections--Administration (I0277); Elections--Early Voting (I0260); Elections--Election Officers (I0305); Elections--Voting Systems (I0270),Hall,,,,,,,,http://capitol.texas.gov/BillLookup/History.aspx?LegSess=871&Bill=SB27
SB 28,871,Relating to the resilience of the electric grid and certain municipalities.,"Disaster Preparedness & Relief (I0211); Energy--General (I0315); State Agencies, Boards & Commissions--Newly Proposed (I0773); Utilities--Electric (I0831); ADJUTANT GENERAL (V8820); ELECTRIC RELIABILITY COUNCIL OF TEXAS (ERCOT) (V0167); EMERGENCY MANAGEMENT, TEXAS DIVISION OF (VP6FW); GRID SECURITY COMMISSION, TEXAS (V1197); INFORMATION RESOURCES, DEPARTMENT OF (V9827); MILITARY DEPARTMENT, TEXAS (V0971); MILITARY PREPAREDNESS COMMISSION, TEXAS (V0442); RISK MANAGEMENT, STATE OFFICE OF (V0530); STATE-FEDERAL RELATIONS, OFFICE OF (V0431)",Hall,,,,,,,,http://capitol.texas.gov/BillLookup/History.aspx?LegSess=871&Bill=SB28
SB 29,871,Relating to establishment of the immigration authority delegation training grant program for local law enforcement agencies.,"City Government--Employees/Officers (I0061); County Government--Employees/Officers (I0095); Governor (I0375); Law Enforcement (I0510); IMMIGRATION LAW (S0674); STAFF DEVELOPMENT & TRAINING (S0317); IMMIGRATION & CUSTOMS ENFORCEMENT, US (V0863)",Hall,,,,,,,,http://capitol.texas.gov/BillLookup/History.aspx?LegSess=871&Bill=SB29
SB 64,871,Relating to protecting the bodily autonomy of individuals with respect to exemptions from required immunizations or vaccinations in the workplace.,Health--General (I0385); Labor--General (I0500); Labor--Health & Safety (I0490); DISCRIMINATION (S0052); IMMUNIZATIONS (S4341),Hall,,,,,,,,http://capitol.texas.gov/BillLookup/History.aspx?LegSess=871&Bill=SB64
SB 65,871,Relating to protecting the medical freedom and bodily autonomy of employees with respect to immunization or vaccination status.,Health--Other Diseases & Medical Conditions (I0383); Labor--General (I0500); DISCRIMINATION (S0052); IMMUNIZATIONS (S4341),Hall,,,,,,,,http://capitol.texas.gov/BillLookup/History.aspx?LegSess=871&Bill=SB65
SB 66,871,Relating to the provision of certain gender-affirming therapy and counseling to children.,Health--Other Diseases & Medical Conditions (I0383); Mental Health & Substance Abuse (I0019); Minors--Health & Safety (I0533); GENDER IDENTITY & EXPRESSION (S0767),Hall,,,,,,,,http://capitol.texas.gov/BillLookup/History.aspx?LegSess=871&Bill=SB66
SB 69,871,Relating to the use by a political subdivision of public funds for lobbying activities.,County Government--Employees/Officers (I0095); Ethics (I0345); Political Subdivisions (I0588); LOBBYISTS & LOBBYING (S3141),Hall,,,,,,,,http://capitol.texas.gov/BillLookup/History.aspx?LegSess=871&Bill=SB69
SB 8,871,"Relating to the authority of a person who acquires a residence homestead to receive an ad valorem tax exemption for the homestead in the year in which the property is acquired, and the protection of school districts against the resulting loss in revenue.",Property Interests--Homestead (I0616); Taxation--Property-Appraisals & Appraisal Districts (I0792); Taxation--Property-Assessment & Collection (I0798); Taxation--Property-Exemptions (I0793); COUNTY TAX ASSESSOR-COLLECTORS (S0310),Bettencourt,Birdwell; Buckingham; Campbell; Creighton; Hall; Hancock; Hinojosa; Huffman; Hughes; Kolkhorst; Lucio; Nelson; Nichols; Paxton; Perry; Schwertner; Seliger; Springer; Taylor; Whitmire,,,,,Local Government,Out of committee,http://capitol.texas.gov/BillLookup/History.aspx?LegSess=871&Bill=SB8
SB 12,871,Relating to the reduction of the amount of a limitation on the total amount of ad valorem taxes that may be imposed by a school district on the residence homestead of an individual who is elderly or disabled to reflect any reduction from the preceding tax year in the district's maximum compressed rate.,"Aging (I0015); Disabilities, Persons with (I0380); Property Interests--Homestead (I0616); Taxation--Property-Assessment & Collection (I0798); Taxation--Property-Exemptions (I0793); Taxation--Property-Tax Rate (I0794); Taxation--School District (I0785)",Bettencourt; Kolkhorst,Birdwell; Buckingham; Campbell; Creighton; Hall; Hancock; Hinojosa; Huffman; Hughes; Lucio; Nelson; Nichols; Paxton; Perry; Seliger; Taylor,,,,,Local Government,Out of committee,http://capitol.texas.gov/BillLookup/History.aspx?LegSess=871&Bill=SB12
SB 67,871,Relating to a training manual for election watchers.,Elections--General (I0310); STAFF DEVELOPMENT & TRAINING (S0317); SECRETARY OF STATE (V0042),Bettencourt,,,,,,,,http://capitol.texas.gov/BillLookup/History.aspx?LegSess=871&Bill=SB67
SJR 4,871,Proposing a constitutional amendment authorizing the legislature to provide for the reduction of the amount of a limitation on the total amount of ad valorem taxes that may be imposed for general elementary and secondary public school purposes on the residence homestead of a person who is elderly or disabled to reflect any statutory reduction from the preceding tax year in the maximum compressed rate of the maintenance and operations taxes imposed for those purposes on the homestead.,"Aging (I0015); Disabilities, Persons with (I0380); Property Interests--Homestead (I0616); Resolutions--Constitutional Amendments (I0661); Taxation--Property-Assessment & Collection (I0798); Taxation--Property-Exemptions (I0793); Taxation--Property-Tax Rate (I0794); Taxation--School District (I0785)",Bettencourt; Kolkhorst,Birdwell; Buckingham; Campbell; Creighton; Hall; Hancock; Hinojosa; Huffman; Lucio; Nelson; Nichols; Paxton; Seliger; Taylor,,,,,Local Government,Out of committee,http://capitol.texas.gov/BillLookup/History.aspx?LegSess=871&Bill=SJR4
SR 6,871,Recognizing the McLennan Community College baseball team for winning a national championship.,Resolutions--Congratulatory & Honorary (I0705); MCLENNAN COMMUNITY COLLEGE (U0230),Birdwell,,,,,,,,http://capitol.texas.gov/BillLookup/History.aspx?LegSess=871&Bill=SR6
SR 42,871,Recognizing the Cenikor Foundation for its 55 years of service.,Resolutions--Congratulatory & Honorary (I0705); CENIKOR FOUNDATION (NQ76V),Birdwell,,,,,,,,http://capitol.texas.gov/BillLookup/History.aspx?LegSess=871&Bill=SR42
SB 20,871,Relating to the reduction of the amount of a limitation on the total amount of ad valorem taxes that may be imposed by a school district on the residence homestead of an individual who is elderly or disabled to reflect any reduction from the preceding tax year in the district's maximum compressed rate.,"Aging (I0015); Disabilities, Persons with (I0380); Property Interests--Homestead (I0616); Taxation--Property-Assessment & Collection (I0798); Taxation--Property-Exemptions (I0793); Taxation--Property-Tax Rate (I0794); Taxation--School District (I0785)",Kolkhorst,,,,,,,,http://capitol.texas.gov/BillLookup/History.aspx?LegSess=871&Bill=SB20
SB 24,871,Relating to state investments in social media companies that censor political speech.,"Business & Commerce--General (I0050); Electronic Information Systems (I0311); Purchasing--State (I0643); State Agencies, Boards & Commissions (I0749); COMPUTERS & SOFTWARE (S2425); INTERNET (S0130); ATTORNEY GENERAL (V2811)",Kolkhorst,Creighton; Schwertner,,,,,State Affairs,In committee,http://capitol.texas.gov/BillLookup/History.aspx?LegSess=871&Bill=SB24
SB 74,871,Relating to the release or disclosure of vaccination or immunization information to certain persons; providing a civil penalty.,"Health--General (I0385); Health--Other Diseases & Medical Conditions (I0383); IMMUNIZATIONS (S4341); HEALTH & HUMAN SERVICES COMMISSION (V0177); STATE HEALTH SERVICES, DEPARTMENT OF (V0463)",Kolkhorst,,,,,,,,http://capitol.texas.gov/BillLookup/History.aspx?LegSess=871&Bill=SB74
SJR 1,871,Proposing a constitutional amendment authorizing the legislature to provide for the reduction of the amount of a limitation on the total amount of ad valorem taxes that may be imposed for general elementary and secondary public school purposes on the residence homestead of a person who is elderly or disabled to reflect any statutory reduction from the preceding tax year in the maximum compressed rate of the maintenance and operations taxes imposed for those purposes on the homestead.,"Aging (I0015); Disabilities, Persons with (I0380); Property Interests--Homestead (I0616); Resolutions--Constitutional Amendments (I0661); Taxation--Property-Assessment & Collection (I0798); Taxation--Property-Exemptions (I0793); Taxation--Property-Tax Rate (I0794); Taxation--School District (I0785)",Kolkhorst,,,,,,,,http://capitol.texas.gov/BillLookup/History.aspx?LegSess=871&Bill=SJR1
SR 26,871,"Commemorating Indian Independence Day on August 15, 2021.",INDIAN INDEPENDENCE DAY (HF7XD); Resolutions--Official Designations--Special Dates (I0721),Kolkhorst,,,,,,,,http://capitol.texas.gov/BillLookup/History.aspx?LegSess=871&Bill=SR26
SR 27,871,In memory of Brent Paul Marceaux.,"Resolutions--Memorial (I0710); MARCEAUX, BRENT PAUL (N38TC)",Kolkhorst,,,,,,,,http://capitol.texas.gov/BillLookup/History.aspx?LegSess=871&Bill=SR27
SR 28,871,Recognizing Saint John Evangelical Lutheran Church in Meyersville on the occasion of its 100th anniversary.,Resolutions--Congratulatory & Honorary (I0705); SAINT JOHN EVANGELICAL LUTHERAN CHURCH (N01P0),Kolkhorst,,,,,,,,http://capitol.texas.gov/BillLookup/History.aspx?LegSess=871&Bill=SR28
SB 39,871,Relating to the voter registration of naturalized United States citizens.,Aliens (I0032); Elections--Registration & Suffrage (I0265),Menéndez; Alvarado; Blanco; Eckhardt; Johnson; Lucio; Miles; Powell; Zaffirini,,,,,,,,http://capitol.texas.gov/BillLookup/History.aspx?LegSess=871&Bill=SB39
SB 40,871,Relating to early voting by mail by any qualified voter.,Aging (I0015); Corrections--Jails & Prisons (I0092); Elections--Early Voting (I0260); Elections--Registration & Suffrage (I0265),Menéndez; Alvarado; Blanco; Eckhardt; Gutierrez; Hinojosa; Johnson; Lucio; Miles; Powell; West; Whitmire; Zaffirini,,,,,,,,http://capitol.texas.gov/BillLookup/History.aspx?LegSess=871&Bill=SB40
SB 41,871,Relating to registration powers of volunteer deputy registrars.,Elections--Administration (I0277); Elections--Registration & Suffrage (I0265); SECRETARY OF STATE (V0042),Menéndez; Alvarado; Blanco; Eckhardt; Gutierrez; Hinojosa; Johnson; Lucio; Miles; Powell; West; Whitmire; Zaffirini,,,,,,,,http://capitol.texas.gov/BillLookup/History.aspx?LegSess=871&Bill=SB41
SB 42,871,Relating to participation in the countywide polling place program.,County Government--General (I0096); Elections--Early Voting (I0260),Menéndez; Alvarado; Blanco; Eckhardt; Gutierrez; Hinojosa; Johnson; Lucio; Miles; Powell; West; Whitmire; Zaffirini,,,,,,,,http://capitol.texas.gov/BillLookup/History.aspx?LegSess=871&Bill=SB42
SB 43,871,Relating to automatic voter registration on issuance or change of a driver's license or identification card by the Department of Public Safety.,"Elections--Registration & Suffrage (I0265); Vehicles & Traffic--Driver's Licenses (I0840); IDENTIFICATION CARDS (S0074); PUBLIC SAFETY, DEPARTMENT OF (V0251); SECRETARY OF STATE (V0042)",Menéndez; Alvarado; Blanco; Eckhardt; Gutierrez; Hinojosa; Johnson; Lucio; Miles; Powell; West; Whitmire; Zaffirini,,,,,,,,http://capitol.texas.gov/BillLookup/History.aspx?LegSess=871&Bill=SB43
SB 44,871,Relating to the designation of polling place locations on the campuses of public institutions of higher education.,Education--Higher--Institutions & Programs (I0223); Elections--Administration (I0277); Elections--General (I0310),Menéndez; Alvarado; Blanco; Eckhardt; Gutierrez; Hinojosa; Johnson; Lucio; Miles; Powell; West; Whitmire; Zaffirini,,,,,,,,http://capitol.texas.gov/BillLookup/History.aspx?LegSess=871&Bill=SB44
SB 45,871,Relating to requiring a voter to present proof of identification.,Elections--Administration (I0277); Elections--Election Officers (I0305); Elections--Registration & Suffrage (I0265); IDENTIFICATION CARDS (S0074); SECRETARY OF STATE (V0042),Menéndez; Alvarado; Blanco; Eckhardt; Gutierrez; Hinojosa; Johnson; Lucio; Miles; Powell; West; Whitmire; Zaffirini,,,,,,,,http://capitol.texas.gov/BillLookup/History.aspx?LegSess=871&Bill=SB45
SB 46,871,Relating to electronic voter registration and electronic submission of an application for an early voting ballot by mail.,Elections--Early Voting (I0260); Elections--Registration & Suffrage (I0265); Electronic Information Systems (I0311); INTERNET (S0130); SECRETARY OF STATE (V0042),Alvarado; Blanco; Eckhardt; Gutierrez; Hinojosa; Johnson; Lucio; Menéndez; Miles; Powell; West; Zaffirini,,,,,,,,http://capitol.texas.gov/BillLookup/History.aspx?LegSess=871&Bill=SB46
SB 47,871,Relating to the criminal offense of unlawfully prohibiting an employee from voting.,Crimes--Miscellaneous (I0200); Elections--Early Voting (I0260); Labor--General (I0500); Labor--Management Relations (I0465),Miles; Alvarado; Blanco; Eckhardt; Gutierrez; Hinojosa; Johnson; Lucio; Menéndez; Powell; West; Whitmire; Zaffirini,,,,,,,,http://capitol.texas.gov/BillLookup/History.aspx?LegSess=871&Bill=SB47
SB 48,871,Relating to voter registration application forms in high schools.,"Education--Primary & Secondary--General (I0230); Elections--Registration & Suffrage (I0265); EDUCATION AGENCY, TEXAS (V9941); SECRETARY OF STATE (V0042)",Miles; Alvarado; Blanco; Eckhardt; Gutierrez; Hinojosa; Johnson; Lucio; Menéndez; Powell; West; Whitmire; Zaffirini,,,,,,,,http://capitol.texas.gov/BillLookup/History.aspx?LegSess=871&Bill=SB48
SB 49,871,Relating to the return of certain ballots.,Elections--Early Voting (I0260),Miles; Alvarado; Blanco; Eckhardt; Gutierrez; Hinojosa; Johnson; Lucio; Menéndez; Powell; West; Whitmire; Zaffirini,,,,,,,,http://capitol.texas.gov/BillLookup/History.aspx?LegSess=871&Bill=SB49
SB 50,871,Relating to an exception to the application of the offense of illegal voting.,Crimes--Miscellaneous (I0200); Elections--Registration & Suffrage (I0265),Hinojosa; Alvarado; Blanco; Eckhardt; Gutierrez; Johnson; Menéndez; Miles; Powell; West; Whitmire; Zaffirini,,,,,,,,http://capitol.texas.gov/BillLookup/History.aspx?LegSess=871&Bill=SB50
SB 51,871,Relating to qualifications and registration of certain voters convicted of a felony.,"Corrections--Parole, Probation & Pardons (I0093); Elections--Registration & Suffrage (I0265)",Eckhardt; Alvarado; Blanco; Gutierrez; Hinojosa; Johnson; Menéndez; Miles; Powell; West; Whitmire; Zaffirini,,,,,,,,http://capitol.texas.gov/BillLookup/History.aspx?LegSess=871&Bill=SB51
SB 53,871,Relating to an application for an early voting ballot by mail.,Elections--Early Voting (I0260); Elections--Primaries (I0285),Eckhardt; Alvarado; Blanco; Gutierrez; Hinojosa; Johnson; Lucio; Menéndez; Miles; Powell; West; Whitmire; Zaffirini,,,,,,,,http://capitol.texas.gov/BillLookup/History.aspx?LegSess=871&Bill=SB53
SB 54,871,Relating to the eligibility to sign certain petitions in connection with certain applications for placement on a general election ballot.,Elections--Candidates (I0280),Eckhardt; Blanco; Gutierrez; Hinojosa; Johnson; Menéndez; Powell; Whitmire,,,,,,,,http://capitol.texas.gov/BillLookup/History.aspx?LegSess=871&Bill=SB54
SB 55,871,Relating to the use of preferential voting in certain elections.,Elections--Administration (I0277); Elections--General (I0310); Elections--Voting Systems (I0270); SECRETARY OF STATE (V0042),Eckhardt; Gutierrez; Hinojosa; Johnson; Menéndez; Powell; Whitmire,,,,,,,,http://capitol.texas.gov/BillLookup/History.aspx?LegSess=871&Bill=SB55
SB 56,871,Relating to nonpartisan election watchers.,Elections--Administration (I0277); Elections--General (I0310); SECRETARY OF STATE (V0042),Eckhardt; Alvarado; Blanco; Gutierrez; Hinojosa; Johnson; Lucio; Menéndez; Miles; Powell; West; Whitmire; Zaffirini,,,,,,,,http://capitol.texas.gov/BillLookup/History.aspx?LegSess=871&Bill=SB56
SB 57,871,Relating to depository boxes for ballots to be voted by mail.,Elections--Administration (I0277); Elections--Early Voting (I0260),Eckhardt; Alvarado; Blanco; Gutierrez; Hinojosa; Johnson; Lucio; Menéndez; Miles; Powell; West; Whitmire; Zaffirini,,,,,,,,http://capitol.texas.gov/BillLookup/History.aspx?LegSess=871&Bill=SB57
SB 58,871,Relating to allowing a person who will be 18 years of age on the date of the general election for state and county officers to vote in the preceding primary elections.,Elections--General (I0310); Elections--Primaries (I0285); Elections--Registration & Suffrage (I0265); SECRETARY OF STATE (V0042),Zaffirini; Alvarado; Blanco; Eckhardt; Gutierrez; Hinojosa; Johnson; Lucio; Menéndez; Miles; Powell; West; Whitmire,,,,,,,,http://capitol.texas.gov/BillLookup/History.aspx?LegSess=871&Bill=SB58
SB 61,871,Relating to the Barbara Jordan Fair Elections Act.,"Elections--Administration (I0277); Elections--Early Voting (I0260); Elections--Election Officers (I0305); Elections--General (I0310); Elections--Registration & Suffrage (I0265); Elections--Voting Systems (I0270); Electronic Information Systems (I0311); BARBARA JORDAN FAIR ELECTIONS ACT (PX0ZL); IDENTIFICATION CARDS (S0074); INTERNET (S0130); OATHS (S0005); PUBLIC SAFETY, DEPARTMENT OF (V0251); SECRETARY OF STATE (V0042)",West; Alvarado; Blanco; Eckhardt; Gutierrez; Hinojosa; Johnson; Lucio; Menéndez; Miles; Powell; Whitmire; Zaffirini,,,,,,,,http://capitol.texas.gov/BillLookup/History.aspx?LegSess=871&Bill=SB61
